更新日,名称,業界(小分類),求人有無,所在地,設立,代表者,資本金,平均年齢,従業員数,企業URL,事業内容,上場市場名
2024-08-01,株式会社唐草,その他メーカー,求人なし,長崎県長崎市樺島町7-11,1968,代表取締役 江原 洋一,10 百万円,,,,,
2024-08-01,西海ゴム工業株式会社,機能性化学（無機・ガラス・カーボン・セラミック・セメント・窯業）メーカー,求人なし,埼玉県草加市稲荷2-22-20,1973,代表取締役 柴田 博之,20 百万円,,,,,
2024-08-01,江川刃物工業有限会社,その他メーカー,求人なし,広島県広島市西区商工センター7-5-10,1977,代表取締役 江川 雅典,8 百万円,,,,,
2024-08-01,株式会社クニヤスシール,文房具・事務・オフィス用品メーカー,求人なし,広島県広島市西区楠木町3-2-7,1980,代表取締役 國保 洋二,10 百万円,,,,,
2024-08-01,株式会社ティ・アンド・ケイパッケージ,製紙・パルプメーカー,求人なし,埼玉県草加市北谷3-40-7,1981,代表取締役 丹羽 寛人,10 百万円,,,,,
2024-08-01,北洋硝子株式会社,機能性化学（無機・ガラス・カーボン・セラミック・セメント・窯業）メーカー,求人なし,青森県青森市富田4-29-13,1949,代表取締役 壁屋 知則,50 百万円,,,,,
2024-08-01,共同紙器株式会社,製紙・パルプメーカー,求人なし,静岡県島田市阪本4293,1961,代表取締役 西田 政巳,15 百万円,,,,,
2024-08-01,株式会社エンスカイＰＬＵＳ,ファッション・アパレル・アクセサリーメーカー,求人なし,埼玉県草加市稲荷1-11-1,1989,代表取締役 麻生 巌,20 百万円,,,,,
2024-08-01,株式会社ティアンドエス,金属・製綱・鉱業・非鉄金属メーカー,求人なし,埼玉県草加市青柳1-5-5,1983,代表取締役 澤口 輝,10 百万円,,,,,
2024-08-01,有限会社マルダイ化成,その他メーカー,求人なし,静岡県島田市御仮屋町8750,1977,代表取締役 大石 洋一,3 百万円,,,,,
2024-08-01,有限会社津野田ゴム加工所,石油化学メーカー,求人なし,長崎県西彼杵郡長与町平木場郷609,1979,代表取締役 津野田 幹太,3 百万円,,,,,
2024-08-01,株式会社猪木製作所,金属・製綱・鉱業・非鉄金属メーカー,求人なし,埼玉県草加市弁天4-16-8,1986,代表取締役 猪野塚 弘樹,10 百万円,,,,,
2024-08-01,齋藤木材株式会社,住宅設備・建材メーカー,求人なし,青森県青森市沖館3-10-1,1974,代表取締役 齋藤 渉,20 百万円,,,,,
2024-08-01,株式会社甲賀,機能性化学（無機・ガラス・カーボン・セラミック・セメント・窯業）メーカー,求人なし,静岡県島田市阪本700-2,1992,代表取締役 甲賀 史章,10 百万円,,,,,
2024-08-01,増田製粉株式会社,食品・飲料メーカー（原料含む）,求人なし,広島県広島市西区商工センター7-3-23,1958,代表取締役 増田 裕典,20 百万円,,,,,
2024-08-01,株式会社エコパウダー,農薬メーカー,無,埼玉県草加市西町942-22日榮ハイツ 1Ｆ,1990,代表取締役社長 齋藤 武史,12 百万円,,,,情報が古い可能性があります。最新の情報を確認する場合はHP等をご覧ください。 木造住宅や社寺仏閣などを劣化（シロアリ・腐朽など）から守る、予防用薬剤に関する事業をおこなっております。 2021年10月doda掲載求人より引用,
2024-08-01,丸二鋼材株式会社,その他メーカー,求人なし,長崎県長崎市三京町646-51,1958,代表取締役 椎井 俊一,20 百万円,,,,,
2024-08-01,ペーパークラフト株式会社,製紙・パルプメーカー,求人なし,埼玉県草加市西町1105-5,1998,代表取締役 長森 純子,60 百万円,,,,,
2024-08-01,株式会社大塚,その他メーカー,求人なし,静岡県島田市阪本3272-2,1962,代表取締役 大塚 正浩,50 百万円,,,,,
2024-08-01,栗原建材産業株式会社,住宅設備・建材メーカー,求人なし,静岡県島田市阪本1800,1954,代表取締役 栗原 勝,10 百万円,,,,,
2024-08-01,株式会社スンエン,住宅設備・建材メーカー,求人なし,静岡県島田市御請229,1946,代表取締役 中居 幸博,90 百万円,,,,,
2024-08-01,株式会社横川木型製作所,その他メーカー,求人なし,長崎県長崎市琴海戸根町2694-2,1968,代表取締役 横川 栄,25 百万円,,,,,
2024-08-01,株式会社旭屋,製紙・パルプメーカー,求人なし,長崎県西彼杵郡時津町西時津郷1000-200,1976,代表取締役 吉岡 二朗,50 百万円,,,,,
2024-08-01,カネイ一言製茶株式会社,食品・飲料メーカー（原料含む）,求人なし,静岡県島田市道悦1-1-9,1981,代表取締役 一言 伊左夫,11 百万円,,,,,
2024-08-01,合資会社松野鋳造所,金属・製綱・鉱業・非鉄金属メーカー,求人なし,静岡県島田市阪本644-1,1940,代表社員 松野 一治,10 百万円,,,,,
2024-08-01,武川ゴム株式会社,繊維メーカー,求人なし,埼玉県草加市吉町5-4-16,1996,代表取締役 武川 和雄,30 百万円,,,,,
2024-08-01,森紙器株式会社,製紙・パルプメーカー,求人なし,東京都足立区中央本町4-3-2,1964,代表取締役 森 勇一,50 百万円,,,,,
2024-08-01,株式会社岡本正太郎商店,金属・製綱・鉱業・非鉄金属メーカー,求人なし,東京都墨田区吾妻橋1-13-11,1959,代表取締役 岡本 秀寿,10 百万円,,,,,
2024-08-01,有限会社蘇州林,食品・飲料メーカー（原料含む）,求人なし,長崎県西彼杵郡時津町左底郷79-5,1988,代表取締役 林 健治,8 百万円,,,,,
2024-08-01,トーエイライト株式会社,繊維メーカー,求人なし,東京都台東区入谷1-9-10,1968,代表取締役 大江 英樹,93 百万円,,,,,
2024-08-01,株式会社翁屋,食品・飲料メーカー（原料含む）,求人なし,青森県青森市南佃1-18-15,1976,代表取締役 阿部 淳之輔,36 百万円,,,,,
2024-08-01,株式会社カネキ,その他メーカー,求人なし,静岡県島田市宝来町9-52,1950,代表取締役 菊田 吉尚,6 百万円,,,,,
2024-08-01,川庄襖紙株式会社,家具・インテリア・生活雑貨メーカー,求人なし,埼玉県草加市新里町385（株）菊池襖紙工場社員寮 1Ｆ,1990,代表取締役 嶺田 隆,10 百万円,,,,,
2024-08-01,株式会社マルマンプロダクツ,文房具・事務・オフィス用品メーカー,求人なし,東京都台東区三ノ輪1-28-10,1976,代表取締役 郭 進欽,455 百万円,,,,,
2024-08-01,イヌイフュージョン株式会社,家具・インテリア・生活雑貨メーカー,求人なし,埼玉県草加市松江2-11-1,1968,代表取締役 小林 英生,10 百万円,,,,,
2024-08-01,サカイ・コンポジット株式会社,繊維メーカー,求人なし,静岡県島田市細島1349-1,1977,代表取締役 酒井 昌浩,70 百万円,,,,,
2024-08-01,株式会社井谷種苗園,肥料メーカー,求人なし,広島県広島市安佐南区緑井6-7-8,1967,代表取締役 井谷 陽一,10 百万円,,,,,
2024-08-01,瀬川工業株式会社,製紙・パルプメーカー,求人なし,広島県広島市安佐南区相田1-1-40,1940,代表取締役 瀬川 依邦,10 百万円,,,,,
2024-08-01,株式会社プレステージ,その他メーカー,求人なし,埼玉県草加市稲荷3-2-13,1993,代表取締役 伊能勢 良明,20 百万円,,,,,
2024-08-01,有限会社園田プラスチック,石油化学メーカー,求人なし,静岡県島田市岸町27-1,1984,代表取締役 園田 晃利,97 百万円,,,,,
2024-08-01,株式会社いけだ屋,食品・飲料メーカー（原料含む）,求人なし,埼玉県草加市吉町4-1-40,1994,代表取締役 池田 国雄,20 百万円,,,,,
2024-08-01,イデシギョー株式会社,製紙・パルプメーカー,無,静岡県富士市島田町2-198,1950,代表取締役社長 井出 芳則,50 百万円,,,,情報が古い可能性があります。最新の情報を確認する場合はHP等をご覧ください。 製紙業／1950年（昭和25年）の創立より、一貫して家庭紙を抄造しています。＜営業品目＞ティッシュペーパー、ポケットティッシュ、トイレットロール、タオルロール、ペーパータオル、紙ナプキン、紙おしぼり、コースター、天ぷら油処理パック、猫草、猫砂、原紙他 2021年10月doda掲載求人より引用,
2024-08-01,植田産業株式会社,製紙・パルプメーカー,求人なし,静岡県富士市依田橋174-1,1974,代表取締役 植田 眞晴,10 百万円,,,,,
2024-08-01,株式会社ふじ膳,食品・飲料メーカー（原料含む）,求人なし,静岡県富士市宮島614,1978,代表取締役 渡邉 智秋,10 百万円,,,,,
2024-08-01,岳南有機株式会社,機能性化学（無機・ガラス・カーボン・セラミック・セメント・窯業）メーカー,求人なし,静岡県富士市伝法1275-1,1960,代表取締役 佐藤 正晃,30 百万円,,,,,
2024-08-01,株式会社小長谷製紐所,繊維メーカー,求人なし,静岡県富士市神谷91-1,1953,代表取締役 小長谷 邦行,10 百万円,,,,,
2024-08-01,株式会社大昭和加工紙業,製紙・パルプメーカー,求人なし,静岡県富士市今泉3-16-13,1971,代表取締役 田中 博邦,100 百万円,,,,,
2024-08-01,齋藤食品工業株式会社,食品・飲料メーカー（原料含む）,求人なし,静岡県富士市五貫島155-1,1966,代表取締役 齋藤 泰章,10 百万円,,,,,
2024-08-01,新橋製紙株式会社,製紙・パルプメーカー,求人なし,静岡県富士市依田橋町1-5,1948,代表取締役 山﨑 清貴,10 百万円,,,,,
2024-08-01,株式会社サン文具製作所,文房具・事務・オフィス用品メーカー,求人なし,埼玉県越谷市大字平方3133,1964,代表取締役 鎌田 均,10 百万円,,,,,
2024-08-01,フタバペイント株式会社,その他メーカー,求人なし,東京都台東区竜泉3-15-2,1941,代表取締役 北林 隆一,16 百万円,,,,,
2024-08-01,吉野電化工業株式会社,金属・製綱・鉱業・非鉄金属メーカー,求人なし,埼玉県越谷市越ヶ谷5-1-19,1946,代表取締役 吉野 寛治,99 百万円,,,,,
2024-08-01,株式会社山本製線所,金属・製綱・鉱業・非鉄金属メーカー,求人なし,東京都板橋区前野町6-37-18,1958,代表取締役 山本 正,35 百万円,,,,,
2024-08-01,株式会社デリモ,食品・飲料メーカー（原料含む）,無,埼玉県草加市柿木町宝1338-15,1967,代表取締役 栗田 美和子,90 百万円,,,,そば、うどん、中華などの調理麺等の加工食品製造及び、自社デリモ商品の企画・製造、シェアダイニングサルーテの運営＜ 主要取引先・お得意先様 ＞ ※一部・順不同・合同会社西友・株式会社ライフコーポレーション・サミット株式会社・株式会社カスミ・株式会社日本アクセス・三菱食品株式会社・国分フードクリエイト株式会社 2024年4月doda掲載求人より引用,
2024-08-01,トッパンプラスチック株式会社,石油化学メーカー,求人なし,東京都台東区台東1-5-1凸版印刷（株）内,1961,代表取締役 宇佐美 迅一,100 百万円,,,,,
2024-08-01,武蔵野金属株式会社,金属・製綱・鉱業・非鉄金属メーカー,求人なし,埼玉県越谷市南越谷2-2817,1963,代表取締役 立花 晋哉,10 百万円,,,,,
2024-08-01,大三紙化工業株式会社,製紙・パルプメーカー,求人なし,大阪府八尾市老原6-88田中紙管（株） 八尾工場内,1967,代表取締役 田中 誠司,20 百万円,,,,,
2024-08-01,甲陵樹脂工業株式会社,石油化学メーカー,求人なし,埼玉県越谷市大字下間久里485,1961,代表取締役 住田 善彦,60 百万円,,,,,
2024-08-01,クリーンテック東京株式会社,その他メーカー,無,埼玉県越谷市大字大道478,2003,代表取締役 江藤 真吾,10 百万円,,,,■ディスポーザ排水処理システムの維持管理業者■排水管の高圧洗浄■修繕補修工事■ディスポーザ本体の修理・交換＜許可番号＞埼玉県知事許可一般建設業（管工事業／電気工事業）（般）第61852号 2024年5月doda掲載求人より引用,
2024-08-01,株式会社やまと石材,その他メーカー,求人なし,青森県青森市古館1-13-13,1989,代表取締役 八木 秀一,10 百万円,,,,,
2024-08-01,小田原紙業株式会社,石油化学メーカー,求人なし,埼玉県越谷市大字西方3128,1950,代表取締役 浅野 充芳,10 百万円,,,,,
2024-08-01,富士浦工業株式会社,金属・製綱・鉱業・非鉄金属メーカー,求人なし,静岡県富士市五貫島1343,1968,代表取締役 中村 泰介,50 百万円,,,,,
2024-08-01,福泉産業株式会社,食品・飲料メーカー（原料含む）,求人なし,静岡県富士市中里150-1,1940,代表取締役 佐藤 順仁,51 百万円,,,,,
2024-08-01,富士共和製紙株式会社,製紙・パルプメーカー,求人なし,静岡県富士市久沢1-1-2,1942,代表取締役 井出 篤志,27 百万円,,,,,
2024-08-01,富士木材株式会社,その他メーカー,1,静岡県富士市大渕3800-8,1914,,50百万円,,100,,■事業内容：包装運搬用資材の供給、倉庫、住宅部門等経営多角化による安定成長に努めている【営業所等】本社紙器工場、木材工場、流通センター、港湾センター、住宅ショールーム（全て富士市内）【営業品目】段ボール箱、仕組木箱・パレット、住宅建築、倉庫、不動産,
2024-08-01,富士紙管株式会社,製紙・パルプメーカー,求人なし,静岡県富士市津田211,1956,代表取締役 齋藤 規夫,15 百万円,,,,,
2024-08-01,富士ダイカスト株式会社,金属・製綱・鉱業・非鉄金属メーカー,求人なし,埼玉県越谷市大成町2-244-2,1968,代表取締役 櫛田 雄基,10 百万円,,,,,
2024-08-01,町田食品株式会社,食品・飲料メーカー（原料含む）,求人なし,静岡県富士市久沢269-1,1969,代表取締役 町田 壮史,25 百万円,,,,,
2024-08-01,有限会社増田製作所,金属・製綱・鉱業・非鉄金属メーカー,求人なし,静岡県富士市大淵3800-1,1964,代表取締役 増田 榮一,10 百万円,,,,,
2024-08-01,丸富製紙株式会社,製紙・パルプメーカー,求人なし,静岡県富士市比奈678,1955,代表取締役 佐野 武男,492 百万円,,,,,
2024-08-01,西海陶器株式会社,メーカー（素材・化学・食品・化粧品・その他）業界,求人なし,長崎県東彼杵郡波佐見町折敷瀬郷2124,1957,代表取締役 児玉 賢太郎,100 百万円,,,,,
2024-08-01,アスタック株式会社,製紙・パルプメーカー,求人なし,広島県広島市安佐南区伴南2-5-36,1961,代表取締役 数田 健,30 百万円,,,,,
2024-08-01,白山陶器株式会社,機能性化学（無機・ガラス・カーボン・セラミック・セメント・窯業）メーカー,求人なし,長崎県東彼杵郡波佐見町湯無田郷1334,1951,代表取締役 松尾 慶一,48 百万円,,,,,
2024-08-01,特種東海エコロジー株式会社,製紙・パルプメーカー,求人なし,静岡県富士市厚原167-1,1948,代表取締役 影山 正樹,200 百万円,,,,,
2024-08-01,望月加工紙株式会社,繊維メーカー,求人なし,静岡県富士市伝法1697,1973,代表取締役 望月 良太,10 百万円,,,,,
2024-08-01,梅沢鋳工株式会社,金属・製綱・鉱業・非鉄金属メーカー,求人なし,静岡県富士市中里2608-48,1962,代表取締役 梅澤 伸英,10 百万円,,,,,
2024-08-01,株式会社ワタナベ,ファッション・アパレル・アクセサリーメーカー,求人なし,埼玉県越谷市大字大竹139-1,1979,代表取締役 渡邉 雅弘,12 百万円,,,,,
2024-08-01,東和合成工業株式会社,機能性化学（有機・高分子）メーカー,求人なし,埼玉県越谷市大間野町4-224,1978,代表取締役 岩城 啓至,100 百万円,,,,,
2024-08-01,株式会社西山,機能性化学（無機・ガラス・カーボン・セラミック・セメント・窯業）メーカー,求人なし,長崎県東彼杵郡波佐見町折敷瀬郷1087,1942,代表取締役 太田 聖,46 百万円,,,,,
2024-08-01,駿広産業株式会社,機能性化学（無機・ガラス・カーボン・セラミック・セメント・窯業）メーカー,求人なし,静岡県富士市中里2563-5,1963,代表取締役 長谷川 勝,10 百万円,,,,,
2024-08-01,株式会社和山,機能性化学（無機・ガラス・カーボン・セラミック・セメント・窯業）メーカー,求人なし,長崎県東彼杵郡波佐見町折敷瀬郷2200-1,1967,代表取締役 廣田 和樹,20 百万円,,,,,
2024-08-01,青山鋼業株式会社,金属・製綱・鉱業・非鉄金属メーカー,求人なし,埼玉県越谷市千間台東2-17-9,1979,代表取締役 青山 久志,10 百万円,,,,,
2024-08-01,レイホー株式会社,その他メーカー,求人なし,静岡県富士市比奈1243,1995,代表取締役 安藤隆将,10 百万円,,,,,
2024-08-01,株式会社富士宇部,その他メーカー,求人なし,静岡県富士市木島258,1976,代表取締役 宮地 隆次,37 百万円,,,,,
2024-08-01,櫻井化学興業株式会社,石油化学メーカー,求人なし,静岡県富士市神谷954-1,1947,代表取締役 櫻井 公暢,12 百万円,,,,,
2024-08-01,株式会社高橋スプリング,金属・製綱・鉱業・非鉄金属メーカー,求人なし,埼玉県越谷市七左町5-153,1963,代表取締役 髙橋 良彰,30 百万円,,,,,
2024-08-01,有限会社三田製麺所,食品・飲料メーカー（原料含む）,求人なし,広島県広島市安佐南区祇園1-3-20,1969,代表取締役 縄田 耕平,13 百万円,,,,,
2024-08-01,鈴川化学工業株式会社,総合化学メーカー,求人なし,静岡県富士市依田橋町7-40,1967,代表取締役 上杉充泰,30 百万円,,,,,
2024-08-01,富士スパイラル工業株式会社,製紙・パルプメーカー,求人なし,静岡県富士市五貫島1415-1,1981,代表取締役 望月 政光,20 百万円,,,,,
2024-08-01,大洋工業株式会社,その他メーカー,求人なし,静岡県富士市五貫島1040,1973,代表取締役 山下 英紀,10 百万円,,,,,
2024-08-01,株式会社クロサカ,ファッション・アパレル・アクセサリーメーカー,求人なし,埼玉県越谷市瓦曽根1-19-24,1980,代表取締役 黒坂 均,10 百万円,,,,,
2024-08-01,株式会社三協,その他メーカー,求人なし,静岡県富士市伝法573-13,1969,代表取締役 石川 俊光,30 百万円,,,,,
2024-08-01,富士サンフード株式会社,食品・飲料メーカー（原料含む）,求人なし,静岡県富士市大淵3800-50,1978,代表取締役 町田 壮史,38 百万円,,,,,
2024-08-01,株式会社齊藤商会,製紙・パルプメーカー,求人なし,静岡県富士市鈴川本町9-1齊藤ビル 1Ｆ,1982,代表取締役 齊藤 了介,100 百万円,,,,,
2024-08-01,日本サカス株式会社,その他メーカー,求人なし,広島県広島市安佐南区八木1-14-26,1979,代表取締役 蓼 正成,10 百万円,,,,,
2024-08-01,株式会社田子の月,食品・飲料メーカー（原料含む）,求人なし,静岡県富士市今泉380-1,1974,代表取締役 牧田 桂輔,30 百万円,,,,,
2024-08-01,タカシマホールディングス株式会社,住宅設備・建材メーカー,求人なし,長崎県諫早市小野島町2223-1,1952,代表取締役 髙島 正嗣,45 百万円,,,,,
2024-08-01,株式会社昭和金属,金属・製綱・鉱業・非鉄金属メーカー,求人なし,東京都千代田区六番町13-1アセット六番町 3Ｆ,1986,代表取締役 吉田 大樹,52 百万円,,,,,
2024-08-01,川島株式会社,石油化学メーカー,求人なし,静岡県富士市島田町1-137,1979,代表取締役 林 美咲,10 百万円,,,,,
2024-08-01,丸王明王商事株式会社,繊維メーカー,求人なし,東京都千代田区飯田橋4-4-7オービットビル 2Ｆ,1981,代表取締役 渡邊 典正,20 百万円,,,,,
2024-08-01,株式会社フレッシュセブン,食品・飲料メーカー（原料含む）,求人なし,広島県広島市安佐南区緑井5-18-12,1984,代表取締役 宗兼 陽一,40 百万円,,,,,
2024-08-01,株式会社フィル・エ・クチーレ,家具・インテリア・生活雑貨メーカー,求人なし,広島県広島市安佐南区毘沙門台2-42-25,1986,代表取締役 宍戸 俊文,18 百万円,,,,,
2024-08-01,岡崎ウレタン株式会社,石油化学メーカー,求人なし,静岡県富士市蓼原107,1983,代表取締役 小野田 勝優,10 百万円,,,,,
2024-08-01,旭産業株式会社,製紙・パルプメーカー,求人なし,静岡県富士市依田橋403-2,1970,代表取締役 永森 武,15 百万円,,,,,
2024-08-01,株式会社丸政水産,食品・飲料メーカー（原料含む）,求人なし,長崎県島原市有明町湯江甲444-2,1976,代表取締役 坂田 政浩,95 百万円,,,,,
2024-08-01,三和商工株式会社,製紙・パルプメーカー,求人なし,静岡県富士市新橋町8-19,1940,代表取締役 齋藤 知治,80 百万円,,,,,
2024-08-01,横井パッケージ株式会社,製紙・パルプメーカー,求人なし,埼玉県北葛飾郡松伏町大字松伏4726,1984,代表取締役 横井 丈士,10 百万円,,,,,
2024-08-01,ピィシーシステム株式会社,食品・飲料メーカー（原料含む）,求人なし,静岡県富士市今泉2-13-12,1989,代表取締役 羽根 博史,10 百万円,,,,,
2024-08-01,株式会社ユニティー,その他メーカー,求人なし,静岡県富士市依田橋241-1,1992,代表取締役 茂 元昭,10 百万円,,,,,
2024-08-01,株式会社エース・フーズ,食品・飲料メーカー（原料含む）,求人なし,長崎県雲仙市瑞穂町古部乙10-4,1986,代表取締役 山中 数浩,10 百万円,,,,,
2024-08-01,ケーアイ工業株式会社,住宅設備・建材メーカー,求人なし,静岡県富士市久沢84-1,1985,代表取締役 稲葉 健次,10 百万円,,,,,
2024-08-01,株式会社八木繊維,ファッション・アパレル・アクセサリーメーカー,求人なし,静岡県富士市依田橋426-1,1990,代表取締役 八木 和男,10 百万円,,,,,
2024-08-01,エフ・シー・アイ株式会社,機能性化学（無機・ガラス・カーボン・セラミック・セメント・窯業）メーカー,求人なし,静岡県富士市大淵3800-12,1992,代表取締役 遠又 達郎,50 百万円,,,,,
2024-08-01,株式会社ワイエス管材,住宅設備・建材メーカー,求人なし,青森県青森市松原3-4-19,1999,代表取締役 吉田 誠夫,30 百万円,,,,,
2024-08-01,小浜食糧株式会社,食品・飲料メーカー（原料含む）,求人なし,長崎県雲仙市小浜町北本町14-15,1989,代表取締役 金澤 昌江,21 百万円,,,,,
2024-08-01,株式会社樫の木製作所,製紙・パルプメーカー,求人なし,埼玉県越谷市川柳町1-1-3,2000,代表取締役 大隈 航大,10 百万円,,,,,
2024-08-01,株式会社ナナツカ,食品・飲料メーカー（原料含む）,求人なし,広島県広島市安佐南区中須1-8-8エヌ・エフビル 2Ｆ,1998,代表取締役 本田 尚彦,10 百万円,,,,,
2024-08-01,株式会社新田鉄工所,金属・製綱・鉱業・非鉄金属メーカー,求人なし,長崎県南島原市口之津町丁5376,1946,代表取締役 松尾 良弘,10 百万円,,,,,
2024-08-01,太陽化学塗料株式会社,その他メーカー,求人なし,埼玉県越谷市大間野町3-55,1957,代表取締役 本間 尚幸,10 百万円,,,,,
2024-08-01,株式会社ディアー・カンパニー,食品・飲料メーカー（原料含む）,求人なし,長崎県南島原市口之津町甲2351,1989,代表取締役 八木 紀子,50 百万円,,,,,
2024-08-01,株式会社新光化学工業所,その他メーカー,求人なし,埼玉県越谷市大字増森1544-19,1990,代表取締役 国上 秀樹,50 百万円,,,,,
2024-08-01,エステー産業株式会社,石油化学メーカー,求人なし,東京都中央区新川1-3-21ＢＩＺＳＭＡＲＴ茅場町,1976,代表取締役 田口 哲也,30 百万円,,,,,
2024-08-01,第一線材鋼業株式会社,金属・製綱・鉱業・非鉄金属メーカー,求人なし,埼玉県幸手市大字上宇和田字流作572-13,1961,代表取締役 松田 良明,30 百万円,,,,,
2024-08-01,オカヤス株式会社,食品・飲料メーカー（原料含む）,求人なし,埼玉県越谷市大字平方1004-2,1954,代表取締役 岡安 武藏,50 百万円,,,,,
2024-08-01,中央圧延株式会社,金属・製綱・鉱業・非鉄金属メーカー,求人なし,埼玉県越谷市南越谷4-11-3ヴィラコート 503,1952,代表取締役 内藤 清子,33 百万円,,,,,
2024-08-01,有限会社鎌田屋商店,食品・飲料メーカー（原料含む）,求人なし,青森県弘前市大字和徳町6,1950,代表取締役 鎌田 陽子,30 百万円,,,,,
2024-08-01,株式会社篠崎屋,食品・飲料メーカー（原料含む）,求人なし,埼玉県越谷市千間台西1-13-5第一千間台ビル 4Ｆ,1987,代表取締役社長 関根 雅之,"1,000 百万円",,,,,スタンダード
