更新日,名称,業界(小分類),求人有無,所在地,設立,代表者,資本金,平均年齢,従業員数,企業URL,事業内容,上場市場名
2024-08-01,医療法人昭和会,病院・大学病院・クリニック,求人なし,長崎県長崎市東山手町6-51,1980,理事長 南 宣行,"5,158 百万円",,,Error accessing nan: Invalid URL 'nan': No scheme supplied. Perhaps you meant https://nan?,,
2024-08-01,医療法人光晴会,病院・大学病院・クリニック,求人なし,長崎県長崎市葉山1-3-12,1978,理事長 大坪 俊夫,712 百万円,,,Error accessing nan: Invalid URL 'nan': No scheme supplied. Perhaps you meant https://nan?,,
2024-08-01,医療法人社団おると会,病院・大学病院・クリニック,求人なし,広島県広島市中区大手町4-6-6,1979,理事長 今井 澄伊,"4,292 百万円",,,Error accessing nan: Invalid URL 'nan': No scheme supplied. Perhaps you meant https://nan?,,
2024-08-01,医療法人社団弘人会,病院・大学病院・クリニック,求人なし,埼玉県加須市元町6-8,1966,理事長 中田 代助,"1,330 百万円",,,Error accessing nan: Invalid URL 'nan': No scheme supplied. Perhaps you meant https://nan?,,
2024-08-01,医療法人社団みずほ会,病院・大学病院・クリニック,求人なし,広島県広島市中区袋町5-13,1979,理事長 清水 肇,"1,339 百万円",,,Error accessing nan: Invalid URL 'nan': No scheme supplied. Perhaps you meant https://nan?,,
2024-08-01,医療法人社団曙会,病院・大学病院・クリニック,求人なし,広島県広島市中区舟入町3-13,1980,理事長 種村 一磨,"1,033 百万円",,,Error accessing nan: Invalid URL 'nan': No scheme supplied. Perhaps you meant https://nan?,,
2024-08-01,有限会社いそや,福祉・介護関連サービス,求人なし,長崎県長崎市中園町11-1,1964,代表取締役 磯田 博文,10 百万円,,,Error accessing nan: Invalid URL 'nan': No scheme supplied. Perhaps you meant https://nan?,,
2024-08-01,社会福祉法人愛の泉,福祉・介護関連サービス,求人なし,埼玉県加須市土手2-15-57,1953,理事長 潮田 花枝,"3,096 百万円",,,Error accessing nan: Invalid URL 'nan': No scheme supplied. Perhaps you meant https://nan?,,
2024-08-01,医療法人社団心志会,病院・大学病院・クリニック,求人なし,埼玉県本庄市駅南1-2-32,1984,理事長 千代反田 滋,290 百万円,,,Error accessing nan: Invalid URL 'nan': No scheme supplied. Perhaps you meant https://nan?,,
2024-08-01,有限会社アサギ動物病院,病院・大学病院・クリニック,求人なし,静岡県浜松市中央区和田町451-1,1999,代表取締役 淺木 直人,3 百万円,,,Error accessing nan: Invalid URL 'nan': No scheme supplied. Perhaps you meant https://nan?,,
2024-08-01,医療法人福島会,病院・大学病院・クリニック,求人なし,埼玉県本庄市小島5-6-1,1957,理事長 泉 洋一,"2,140 百万円",,,Error accessing nan: Invalid URL 'nan': No scheme supplied. Perhaps you meant https://nan?,,
2024-08-01,医療法人本庄福島病院,病院・大学病院・クリニック,求人なし,埼玉県本庄市千代田1-1-18,1984,理事長 福島 正人,311 百万円,,,Error accessing nan: Invalid URL 'nan': No scheme supplied. Perhaps you meant https://nan?,,
2024-08-01,日本ビー・エム・エス株式会社,医薬品卸,求人なし,埼玉県東松山市五領町11-36,1994,代表取締役 鈴木 保,10 百万円,,,Error accessing nan: Invalid URL 'nan': No scheme supplied. Perhaps you meant https://nan?,,
2024-08-01,公益財団法人浜松市医療公社,病院・大学病院・クリニック,求人なし,静岡県浜松市中央区富塚町328,1972,代表理事 海野 直樹,,,,Error accessing nan: Invalid URL 'nan': No scheme supplied. Perhaps you meant https://nan?,,
2024-08-01,株式会社福祉の街,福祉・介護関連サービス,求人なし,埼玉県さいたま市大宮区桜木町1-12-5沢田ビル 4Ｆ,1980,代表取締役 大島 亮作,45 百万円,,,Error accessing nan: Invalid URL 'nan': No scheme supplied. Perhaps you meant https://nan?,,
2024-08-01,株式会社ヤマックス,その他医療関連,求人なし,長崎県長崎市小江町2734-75,1986,代表取締役 山田 吉盛,20 百万円,,,Error accessing nan: Invalid URL 'nan': No scheme supplied. Perhaps you meant https://nan?,,
2024-08-01,株式会社アスト,医療機器メーカー業界,求人なし,埼玉県東松山市元宿2-36-20,1984,代表取締役 波多江 正治,50 百万円,,,Error accessing nan: Invalid URL 'nan': No scheme supplied. Perhaps you meant https://nan?,,
2024-08-01,株式会社さくら介護グループ,福祉・介護関連サービス,求人なし,広島県広島市中区大手町3-13-18松村ビル 3Ｆ,1983,代表取締役会長兼ＣＥＯ 田本 慎二,50 百万円,,,Error accessing nan: Invalid URL 'nan': No scheme supplied. Perhaps you meant https://nan?,,
2024-08-01,医療法人霞会,病院・大学病院・クリニック,求人なし,埼玉県東松山市松葉町1-9-8,1989,理事長 霞澤 篤,466 百万円,,,Error accessing nan: Invalid URL 'nan': No scheme supplied. Perhaps you meant https://nan?,,
2024-08-01,社会福祉法人十善会,病院・大学病院・クリニック,求人なし,長崎県長崎市淵町20-5,1958,理事長 小川 繁晴,779 百万円,,,Error accessing nan: Invalid URL 'nan': No scheme supplied. Perhaps you meant https://nan?,,
2024-08-01,医療法人社団種光会,病院・大学病院・クリニック,求人なし,静岡県浜松市中央区東三方町476-1,1999,理事長 朝山 令次郎,402 百万円,,,Error accessing nan: Invalid URL 'nan': No scheme supplied. Perhaps you meant https://nan?,,
2024-08-01,株式会社飛鳥調剤薬局,調剤薬局・ドラッグストア業界,求人なし,長崎県長崎市葉山1-5-2第一浜福ビル 4Ｆ,1993,代表取締役 野田 真幸,30 百万円,,,Error accessing nan: Invalid URL 'nan': No scheme supplied. Perhaps you meant https://nan?,,
2024-08-01,医療法人好生会,病院・大学病院・クリニック,求人なし,静岡県浜松市中央区小沢渡町2195-2,1963,理事長 渡邊実輝宏,"1,480 百万円",,,Error accessing nan: Invalid URL 'nan': No scheme supplied. Perhaps you meant https://nan?,,
2024-08-01,株式会社光電,医療機器卸,求人なし,広島県広島市中区鉄砲町8-6,1971,代表取締役 伊賀 洋文,30 百万円,,,Error accessing nan: Invalid URL 'nan': No scheme supplied. Perhaps you meant https://nan?,,
2024-08-01,有限会社田村義肢製作所,医療機器メーカー業界,求人なし,埼玉県東松山市大字石橋1598-3,1988,取締役 田村 直人,5 百万円,,,Error accessing nan: Invalid URL 'nan': No scheme supplied. Perhaps you meant https://nan?,,
2024-08-01,株式会社エスマイル,調剤薬局・ドラッグストア業界,求人なし,広島県広島市西区商工センター6-1-11,1982,代表取締役 大下 訓生,90 百万円,,,Error accessing nan: Invalid URL 'nan': No scheme supplied. Perhaps you meant https://nan?,,
2024-08-01,社会福祉法人あいわ会,福祉・介護関連サービス,求人なし,長崎県長崎市松原町728-2,1976,理事長 坂本 昌勝,806 百万円,,,Error accessing nan: Invalid URL 'nan': No scheme supplied. Perhaps you meant https://nan?,,
2024-08-01,医療法人梶田医院,病院・大学病院・クリニック,求人なし,長崎県佐世保市南風崎町133-2,1991,理事長 梶田 悟,"1,121 百万円",,,Error accessing nan: Invalid URL 'nan': No scheme supplied. Perhaps you meant https://nan?,,
2024-08-01,有限会社バンビ学園,福祉・介護関連サービス,求人なし,埼玉県さいたま市岩槻区大字増長112,1987,代表取締役 田中 達也,5 百万円,,,Error accessing nan: Invalid URL 'nan': No scheme supplied. Perhaps you meant https://nan?,,
2024-08-01,株式会社松広,福祉・介護関連サービス,求人なし,広島県広島市中区舟入川口町17-10マッコー第一ビル 1Ｆ,1983,代表取締役 松本 憲睦,10 百万円,,,Error accessing nan: Invalid URL 'nan': No scheme supplied. Perhaps you meant https://nan?,,
2024-08-01,メディカルスリー株式会社,調剤薬局・ドラッグストア業界,求人なし,埼玉県さいたま市岩槻区大字高曽根996-1,1998,代表取締役 落 芙沙子,15 百万円,,,Error accessing nan: Invalid URL 'nan': No scheme supplied. Perhaps you meant https://nan?,,
2024-08-01,医療法人産婦人科岡田医院,病院・大学病院・クリニック,求人なし,埼玉県さいたま市岩槻区城南5-6-10,1995,理事長 岡田 征史,,,,Error accessing nan: Invalid URL 'nan': No scheme supplied. Perhaps you meant https://nan?,,
2024-08-01,Ｔ＆Ｔネットワーク株式会社,調剤薬局・ドラッグストア業界,求人なし,広島県広島市中区八丁堀15-10セントラルビル 9Ｆ,1988,代表取締役 後藤 俊明,20 百万円,,,Error accessing nan: Invalid URL 'nan': No scheme supplied. Perhaps you meant https://nan?,,
2024-08-01,藤井医療器株式会社,医療機器卸,求人なし,広島県広島市東区光町1-3-22,1970,代表取締役 藤井 一裕,10 百万円,,,Error accessing nan: Invalid URL 'nan': No scheme supplied. Perhaps you meant https://nan?,,
2024-08-01,株式会社テクニカルセンター,医療機器メーカー業界,求人なし,埼玉県さいたま市岩槻区大字浮谷1000（株）テクニカルセンター,1989,代表取締役 野島 正美,30 百万円,,,Error accessing nan: Invalid URL 'nan': No scheme supplied. Perhaps you meant https://nan?,,
2024-08-01,有限会社ハギワラ,調剤薬局・ドラッグストア業界,求人なし,埼玉県さいたま市岩槻区本町4-3-2,1988,代表取締役 萩原 利一,3 百万円,,,Error accessing nan: Invalid URL 'nan': No scheme supplied. Perhaps you meant https://nan?,,
2024-08-01,医療法人社団真養会,病院・大学病院・クリニック,求人なし,静岡県沼津市大手町3-7-1,1983,理事長 田澤 穆,324 百万円,,,Error accessing nan: Invalid URL 'nan': No scheme supplied. Perhaps you meant https://nan?,,
2024-08-01,医療法人交雄会,病院・大学病院・クリニック,求人なし,北海道有珠郡壮瞥町字南久保内146-12,1985,理事長 三井 慎也,"1,475 百万円",,,Error accessing nan: Invalid URL 'nan': No scheme supplied. Perhaps you meant https://nan?,,
2024-08-01,株式会社東海医療器械,医療機器卸,求人なし,静岡県沼津市大岡901-3,1971,代表取締役 鈴木 憲介,15 百万円,,,Error accessing nan: Invalid URL 'nan': No scheme supplied. Perhaps you meant https://nan?,,
2024-08-01,医療法人社団慈整会,病院・大学病院・クリニック,求人なし,静岡県沼津市共栄町11-3,1985,理事長 芹澤 理浩,426 百万円,,,Error accessing nan: Invalid URL 'nan': No scheme supplied. Perhaps you meant https://nan?,,
2024-08-01,医療法人梅原病院,病院・大学病院・クリニック,求人なし,埼玉県春日部市小渕455-1,1955,理事長 梅原 松臣,472 百万円,,,Error accessing nan: Invalid URL 'nan': No scheme supplied. Perhaps you meant https://nan?,,
2024-08-01,一般財団法人芙蓉協会,病院・大学病院・クリニック,求人なし,静岡県沼津市本字下一丁田898-1,1949,代表理事 青木 善治,,,,Error accessing nan: Invalid URL 'nan': No scheme supplied. Perhaps you meant https://nan?,,
2024-08-01,医療法人たかまさ会,病院・大学病院・クリニック,求人なし,広島県広島市東区上温品1-24-9,1990,理事長 山﨑 正志,"1,914 百万円",,,Error accessing nan: Invalid URL 'nan': No scheme supplied. Perhaps you meant https://nan?,,
2024-08-01,医療法人秀和会,病院・大学病院・クリニック,求人なし,埼玉県春日部市谷原新田1200,1981,理事長 坂本 徹,896 百万円,,,Error accessing nan: Invalid URL 'nan': No scheme supplied. Perhaps you meant https://nan?,,
2024-08-01,医療法人社団賢仁会,病院・大学病院・クリニック,求人なし,静岡県沼津市錦町3-5,1973,理事長 中島 亮,310 百万円,,,Error accessing nan: Invalid URL 'nan': No scheme supplied. Perhaps you meant https://nan?,,
2024-08-01,株式会社晃立,医療機器卸,求人なし,埼玉県春日部市下蛭田344-4,1975,代表取締役 石田 武久,10 百万円,,,Error accessing nan: Invalid URL 'nan': No scheme supplied. Perhaps you meant https://nan?,,
2024-08-01,株式会社トップドラッグ,調剤薬局・ドラッグストア業界,求人なし,埼玉県春日部市中央1-16-2,1988,代表取締役 冨田 康夫,10 百万円,,,Error accessing nan: Invalid URL 'nan': No scheme supplied. Perhaps you meant https://nan?,,
2024-08-01,株式会社アイアム,調剤薬局・ドラッグストア業界,求人なし,埼玉県春日部市上蛭田51-1,1986,代表取締役 中村 弥生,10 百万円,,,Error accessing nan: Invalid URL 'nan': No scheme supplied. Perhaps you meant https://nan?,,
2024-08-01,有限会社春日部第一薬局,調剤薬局・ドラッグストア業界,求人なし,埼玉県春日部市谷原2-7-16,1980,代表取締役 矢野間 克成,3 百万円,,,Error accessing nan: Invalid URL 'nan': No scheme supplied. Perhaps you meant https://nan?,,
2024-08-01,医療法人心々和会,病院・大学病院・クリニック,求人なし,長崎県佐世保市浜田町1-6,1965,理事長 浅井 貞宏,2 百万円,,,Error accessing nan: Invalid URL 'nan': No scheme supplied. Perhaps you meant https://nan?,,
2024-08-01,社会医療法人財団白十字会,病院・大学病院・クリニック,求人なし,長崎県佐世保市大和町15,1951,理事長 富永 雅也,"7,217 百万円",,,Error accessing nan: Invalid URL 'nan': No scheme supplied. Perhaps you meant https://nan?,,
2024-08-01,有限会社セイエイ,医薬品メーカー業界,求人なし,静岡県沼津市東椎路1598-5,1985,取締役 大村 智紀,10 百万円,,,Error accessing nan: Invalid URL 'nan': No scheme supplied. Perhaps you meant https://nan?,,
2024-08-01,株式会社いた倉,福祉・介護関連サービス,求人なし,埼玉県春日部市栄町2-86-3,1977,代表取締役 板倉 大和,20 百万円,,,Error accessing nan: Invalid URL 'nan': No scheme supplied. Perhaps you meant https://nan?,,
2024-08-01,医療法人社団春明会,病院・大学病院・クリニック,求人なし,埼玉県春日部市下大増新田97-1,1989,理事長 三國 明,621 百万円,,,Error accessing nan: Invalid URL 'nan': No scheme supplied. Perhaps you meant https://nan?,,
2024-08-01,医療法人社団みどり会,病院・大学病院・クリニック,求人なし,埼玉県春日部市下大増新田9-3,2001,理事長 大野 智之,"1,134 百万円",,,Error accessing nan: Invalid URL 'nan': No scheme supplied. Perhaps you meant https://nan?,,
2024-08-01,エア・ウォーター・メディカル株式会社,医療機器メーカー業界,求人なし,埼玉県狭山市新狭山2-12-27,1963,代表取締役 中山 恵嗣,290 百万円,,,Error accessing nan: Invalid URL 'nan': No scheme supplied. Perhaps you meant https://nan?,,
2024-08-01,医療法人社団弘仁勝和会,病院・大学病院・クリニック,求人なし,東京都足立区竹の塚3-12-11,1989,理事長 小池 康,213 百万円,,,Error accessing nan: Invalid URL 'nan': No scheme supplied. Perhaps you meant https://nan?,,
2024-08-01,藪内薬品株式会社,調剤薬局・ドラッグストア業界,求人なし,長崎県佐世保市卸本町11-1,1966,代表取締役 藪内 拓也,10 百万円,,,Error accessing nan: Invalid URL 'nan': No scheme supplied. Perhaps you meant https://nan?,,
2024-08-01,社会医療法人入間川病院,病院・大学病院・クリニック,求人なし,埼玉県狭山市祇園17-2,1976,理事長 風間 浩美,,,,Error accessing nan: Invalid URL 'nan': No scheme supplied. Perhaps you meant https://nan?,,
2024-08-01,株式会社東歯科商店,医療機器卸,求人なし,広島県広島市南区堀越3-4-22,1970,代表取締役 上田 幸夫,40 百万円,,,Error accessing nan: Invalid URL 'nan': No scheme supplied. Perhaps you meant https://nan?,,
2024-08-01,医療法人誠愛会,病院・大学病院・クリニック,求人なし,長崎県佐世保市鹿子前町104,1986,理事長 佐藤 道彦,"1,063 百万円",,,Error accessing nan: Invalid URL 'nan': No scheme supplied. Perhaps you meant https://nan?,,
2024-08-01,医療法人健真会,病院・大学病院・クリニック,求人なし,広島県広島市南区青崎2-4-20,1999,理事長 山本 健之,390 百万円,,,Error accessing nan: Invalid URL 'nan': No scheme supplied. Perhaps you meant https://nan?,,
2024-08-01,東七株式会社,医薬品卸,求人なし,長崎県佐世保市瀬戸越4-1318-1,1990,代表取締役社長 東 幸三,30 百万円,,,Error accessing nan: Invalid URL 'nan': No scheme supplied. Perhaps you meant https://nan?,,
2024-08-01,株式会社富士精器,医療機器メーカー業界,求人なし,埼玉県狭山市大字加佐志539-1,1982,代表取締役 中田 利彦,10 百万円,,,Error accessing nan: Invalid URL 'nan': No scheme supplied. Perhaps you meant https://nan?,,
2024-08-01,有限会社川原ファーマシー,調剤薬局・ドラッグストア業界,求人なし,長崎県佐世保市権常寺1-10-32,1985,代表取締役 川原 利春,3 百万円,,,Error accessing nan: Invalid URL 'nan': No scheme supplied. Perhaps you meant https://nan?,,
2024-08-01,株式会社確信工業,医療機器メーカー業界,求人なし,静岡県御殿場市板妻734-5,1968,代表取締役 大沼 浩崇,15 百万円,,,Error accessing nan: Invalid URL 'nan': No scheme supplied. Perhaps you meant https://nan?,,
2024-08-01,有限会社みどり薬局,調剤薬局・ドラッグストア業界,求人なし,長崎県佐世保市下本山町570-1,1983,代表取締役 松本 良子,5 百万円,,,Error accessing nan: Invalid URL 'nan': No scheme supplied. Perhaps you meant https://nan?,,
2024-08-01,株式会社ひろし本店,福祉・介護関連サービス,求人なし,広島県広島市南区東雲1-5-20,1977,代表取締役 武田 将太,20 百万円,,,Error accessing nan: Invalid URL 'nan': No scheme supplied. Perhaps you meant https://nan?,,
2024-08-01,医療法人愛和会,病院・大学病院・クリニック,求人なし,長崎県佐世保市城山町3-21,1990,理事長 村上 英毅,299 百万円,,,Error accessing nan: Invalid URL 'nan': No scheme supplied. Perhaps you meant https://nan?,,
2024-08-01,株式会社カツマタ,医薬品卸,求人なし,静岡県沼津市大岡1975-33,1986,代表取締役 勝又 康充,20 百万円,,,Error accessing nan: Invalid URL 'nan': No scheme supplied. Perhaps you meant https://nan?,,
2024-08-01,株式会社ホリックス,医療機器メーカー業界,求人なし,静岡県沼津市足高294-46,1997,代表取締役 堀内 利雄,15 百万円,,,Error accessing nan: Invalid URL 'nan': No scheme supplied. Perhaps you meant https://nan?,,
2024-08-01,医療法人狭山中央病院,病院・大学病院・クリニック,求人なし,埼玉県狭山市富士見2-19-35,1984,理事長 楠本 春彦,,,,Error accessing nan: Invalid URL 'nan': No scheme supplied. Perhaps you meant https://nan?,,
2024-08-01,社会福祉法人厚生協会,福祉・介護関連サービス,求人なし,北海道上川郡新得町西三条北1-5-3,1955,理事長 鈴木 政輝,"6,186 百万円",,,Error accessing nan: Invalid URL 'nan': No scheme supplied. Perhaps you meant https://nan?,,
2024-08-01,有限会社ワイ・ケイ・エス,病院・大学病院・クリニック,求人なし,埼玉県狭山市大字下奥富1906-5,1988,代表取締役 山田 豊,8 百万円,,,Error accessing nan: Invalid URL 'nan': No scheme supplied. Perhaps you meant https://nan?,,
2024-08-01,セイコーＭＥＣ株式会社,医療機器メーカー業界,求人なし,埼玉県狭山市大字水野175-1,1970,代表取締役 志摩 清隆,10 百万円,,,Error accessing nan: Invalid URL 'nan': No scheme supplied. Perhaps you meant https://nan?,,
2024-08-01,医療法人社団広島厚生会,その他医療関連,求人なし,広島県広島市南区仁保新町1-5-13,1996,理事長 米川 智,"1,774 百万円",,,Error accessing nan: Invalid URL 'nan': No scheme supplied. Perhaps you meant https://nan?,,
2024-08-01,医療法人白水会,病院・大学病院・クリニック,求人なし,埼玉県羽生市大字下岩瀬289,1990,理事長 栗原 秀行,"1,621 百万円",,,Error accessing nan: Invalid URL 'nan': No scheme supplied. Perhaps you meant https://nan?,,
2024-08-01,医療法人秀翠会,病院・大学病院・クリニック,求人なし,埼玉県羽生市大字中岩瀬612,2001,理事長 中村 秀夫,416 百万円,,,Error accessing nan: Invalid URL 'nan': No scheme supplied. Perhaps you meant https://nan?,,
2024-08-01,医療法人仁寿会山田クリニック,病院・大学病院・クリニック,求人なし,埼玉県羽生市大字上新郷5939,1988,理事長 山田 孝文,121 百万円,,,Error accessing nan: Invalid URL 'nan': No scheme supplied. Perhaps you meant https://nan?,,
2024-08-01,医療法人社団正匡会,病院・大学病院・クリニック,求人なし,埼玉県羽生市中央2-7-10,1994,理事長 木村 匡司,,,,Error accessing nan: Invalid URL 'nan': No scheme supplied. Perhaps you meant https://nan?,,
2024-08-01,株式会社イービーエム,調剤薬局・ドラッグストア業界,求人なし,埼玉県羽生市西3-23-1,1995,代表取締役 田中 紗百合,10 百万円,,,Error accessing nan: Invalid URL 'nan': No scheme supplied. Perhaps you meant https://nan?,,
2024-08-01,有限会社一心堂,調剤薬局・ドラッグストア業界,求人なし,長崎県諫早市八坂町4-23堀ビル 5Ｆ,1984,代表取締役 堀 剛,13 百万円,,,Error accessing nan: Invalid URL 'nan': No scheme supplied. Perhaps you meant https://nan?,,
2024-08-01,医療法人社団尚整会,病院・大学病院・クリニック,求人なし,長崎県諫早市小野町332,1989,理事長 菅 尚義,,,,Error accessing nan: Invalid URL 'nan': No scheme supplied. Perhaps you meant https://nan?,,
2024-08-01,社会福祉法人光寿会,福祉・介護関連サービス,求人なし,北海道帯広市西十七条南3-24-24,1997,理事長 森光 弘,594 百万円,,,Error accessing nan: Invalid URL 'nan': No scheme supplied. Perhaps you meant https://nan?,,
2024-08-01,社会福祉法人宏和会,福祉・介護関連サービス,求人なし,埼玉県羽生市大字下村君1169,1989,理事長 鎗田 哲暢,"4,237 百万円",,,Error accessing nan: Invalid URL 'nan': No scheme supplied. Perhaps you meant https://nan?,,
2024-08-01,株式会社リガード,医療機器メーカー業界,求人なし,埼玉県羽生市大字北荻島145,1976,代表取締役 駒澤 信克,10 百万円,,,Error accessing nan: Invalid URL 'nan': No scheme supplied. Perhaps you meant https://nan?,,
2024-08-01,社会福祉法人似島学園,福祉・介護関連サービス,求人なし,広島県広島市南区似島町字長谷1487,1952,理事長 高井 竜司,"1,695 百万円",,,Error accessing nan: Invalid URL 'nan': No scheme supplied. Perhaps you meant https://nan?,,
2024-08-01,株式会社彩香らんど,福祉・介護関連サービス,求人なし,埼玉県鴻巣市箕田270-1,1996,代表取締役 藤村 孝志,10 百万円,,,Error accessing nan: Invalid URL 'nan': No scheme supplied. Perhaps you meant https://nan?,,
2024-08-01,医療法人社団清風会,病院・大学病院・クリニック,求人なし,静岡県三島市幸原町2-3-1,1969,理事長 中島 一彦,"1,173 百万円",,,Error accessing nan: Invalid URL 'nan': No scheme supplied. Perhaps you meant https://nan?,,
2024-08-01,有限会社岩佐製作所,医療機器メーカー業界,求人なし,埼玉県鴻巣市箕田3934-5,1973,代表取締役 岩佐 戰太郎,3 百万円,,,Error accessing nan: Invalid URL 'nan': No scheme supplied. Perhaps you meant https://nan?,,
2024-08-01,株式会社メディカルソリューション,その他医療関連,求人なし,東京都千代田区神田須田町1-3-27フヂハラビル 6Ｆ,2001,代表取締役 小林 一人,91 百万円,,,Error accessing nan: Invalid URL 'nan': No scheme supplied. Perhaps you meant https://nan?,,
2024-08-01,株式会社黒沢薬局,調剤薬局・ドラッグストア業界,求人なし,埼玉県鴻巣市本町1-5-22,1963,代表取締役 黒澤 章,10 百万円,,,Error accessing nan: Invalid URL 'nan': No scheme supplied. Perhaps you meant https://nan?,,
2024-08-01,医療法人社団わたまクリニック,病院・大学病院・クリニック,求人なし,埼玉県鴻巣市加美1-6-46,1989,理事長 渡辺 勝巳,,,,Error accessing nan: Invalid URL 'nan': No scheme supplied. Perhaps you meant https://nan?,,
2024-08-01,有限会社タカノ薬局,調剤薬局・ドラッグストア業界,求人なし,埼玉県鴻巣市本町4-6-21,1962,代表取締役 髙野 光昭,3 百万円,,,Error accessing nan: Invalid URL 'nan': No scheme supplied. Perhaps you meant https://nan?,,
2024-08-01,医療法人社団磯部クリニック,病院・大学病院・クリニック,求人なし,埼玉県深谷市新井926,1997,理事長 磯部 逸夫,142 百万円,,,Error accessing nan: Invalid URL 'nan': No scheme supplied. Perhaps you meant https://nan?,,
2024-08-01,有限会社プリムラ,調剤薬局・ドラッグストア業界,求人なし,埼玉県深谷市上柴町東4-13-5,1997,代表取締役 柴﨑 均,6 百万円,,,Error accessing nan: Invalid URL 'nan': No scheme supplied. Perhaps you meant https://nan?,,
