更新日,名称,業界(小分類),求人有無,事業内容,所在地,設立,代表者,従業員数,資本金,平均年齢,企業URL,上場市場名
2024-07-01,株式会社公文教育研究会,学習塾・予備校・専門学校,1,■国内フランチャイズ教室への指導、運営、普及に関するコンサルティングおよびサポート業務■指導者となる人材の募集および開設サポート業務■算数・数学、英語、国語、フランス語、ドイツ語、日本語、書写などのプログラム教材の研究開発、制作、指導法の研究、教室の設置、運営管理■児童書、絵本などの出版、教具、知育玩具など教育関連商品の開発・販売 など拠点：国内48カ所、海外67カ所（2023年12月）,大阪府大阪市淀川区西中島5丁目6番6号 公文教育会館,1962,代表取締役 田中 三教,3734,"44億1,800万円（2023年3月決算）",,http://www.kumon.ne.jp/inst/index.html,
2024-08-01,株式会社 ベネッセコーポレーション,その他・各種スクール,48,＜ベネッセコーポレーションについて＞■概要：ベネッセグループで『教育・生活』領域を担う中核事業会社です。幼児を対象にした『こどもちゃれんじ』、小学生から高校生までを対象にした『進研ゼミ』等のサービスを展開し、年齢や成長レベルに合わせた「学び」の機会を提供しています。,岡山県岡山市北区南方3-7-17,1955,,,"3,000百万円",,http://www.benesse.co.jp/,
2024-08-01,株式会社スプリックス,学習塾・予備校・専門学校,24,●個別指導事業部『森塾』森塾は「成績を上げることで生徒の人生に貢献する」という指導理念のもと、「先生1人に生徒2人まで」の形態で97年に創業された学習塾です。個別指導では珍しく「運営のホスピタリティーや便利さ」よりも「とことん成績を上げる」という想いと「指導のシステム化」にこだわり続け、日本で初めて学校成績で「1科目＋20点保証」の教務力を実現。お客様からの「ありがとうございます」の声を励みに急成長し、新潟から首都圏へ展開（創業からの成長率で業界トップクラス）、そして現在では生徒数４万人を超え、1教室当たりの生徒数でも「日本最大規模」の個別指導専門塾になりました。,新潟県長岡市東坂之上町2-2-1,1997,,531,"1,415百万円",29.7,https://sprix.inc/,スタンダード市場
2024-07-01,アートチャイルドケア株式会社,その他・各種スクール,1,■認可保育所の運営【認可保育所】首都圏（東京・神奈川・埼玉・千葉）・大阪・兵庫・奈良・岡山・愛知・北海道・宮城・福岡・山形でのアートチャイルドケア園■企業内及び病院内保育施設の運営受託企業様・病院様との委託契約により運営（それぞれの契約により、運営時間等異なります）■児童発達支援事業 アートチャイルドケアSEDスクールの運営,東京都品川区東品川1-3-10 アート引越センター東京オフィス3F,1989,代表取締役社長 村田 省三,,5000万円,,https://www.the0123child.com/,
2024-08-01,株式会社ＫｉｄｓＳｍｉｌｅＰｒｏｊｅｃｔ,その他・各種スクール,14,【事業内容】保育事業、幼児教育教材開発等,東京都品川区西五反田1-3-8,2008,,1622,27百万円,,http://www.kidsgarden.co.jp/,
2024-08-01,株式会社テノ．コーポレーション,その他・各種スクール,2,【事業内容】 認可保育所運営、認証保育所運営、小規模保育所運営、事業所内保育所の受託運営、学童保育所の受託運営、わいわい広場の受諾運営、保育士人材紹介・派遣、ベビーシッターサービス、ハウスサービス、教育事業等,福岡県福岡市博多区上呉服町10-10呉服町ビジネスセンター5F,1999,,1126,90百万円,36.0,http://www.teno.co.jp/,
2024-08-01,ヒューマンアカデミー株式会社,学習塾・予備校・専門学校,10,■ 事業内容：JASDAQ上場企業であるヒューマンホールディングス株式会社の100％子会社である同社は、教育機関と企業、地方自治体などの間をつなぐ実践教育を実現する「産官学協同」、学ぶ感動を社会に広める「教育ルネッサンス」、世界で活躍できる人材を育てる「国際人教育」を教育理念として、業界最先端の教育を提供しています。,東京都新宿区西新宿7-5-25西新宿プライムスクエアビル1F,2010,,724,10百万円,,https://manabu.athuman.com/,
2024-08-01,株式会社成学社,その他・各種スクール,16,■事業内容：大学進学までの小中高一貫教育を基本とする学習塾 ◎個別指導：「フリーステップ」他 約250教室、◎クラス指導：「開成教育セミナー」他 約80教室当社は、乳幼児から社会人までの教育および保育を基本とする教育企業として、「個別指導部門」、「クラス指導部門」、「保育部門」及び「その他の指導部門」に分けて学習指導等を行い、大阪府を中心とした近畿圏、東京都、埼玉県及び海外にて学習塾等を展開しております。（1）学習塾の経営…大学進学までの小中高一貫教育を基本とする学習塾 （2）教育に関するコンサルタント業 （3）FC事業 （4）保育事業 （5）日本語学校事業,大阪府大阪市北区中崎西3-1-2,1987,,706,235百万円,39.7,http://www.kaisei-group.co.jp/corporate/,スタンダード市場
2024-06-01,株式会社HOPPA　【京進グループ／東証二部上場】,その他・各種スクール,2,■事業内容：プレミアム（認可外保育園）、認可保育園、小規模認可保育園、その他特別なHOPPA園（学童保育園、横浜市認定横浜保育室・東京都認証保育所）の運営,京都府京都市下京区烏丸通五条下る大坂町382-1,2011,,475,60百万円,,https://hoppa.jp/,
2024-07-01,株式会社アップ,学習塾・予備校・専門学校,14,■事業概要：兵庫県西宮市を中心に幼児から社会人までを対象とした幅広い「生涯教育」サービスを提供しています。（1）学習塾・予備校部門（2）新規事業部門（3）教材、指導ツールの開発及び作成,兵庫県西宮市高松町4-8,1977,,434,100百万円,40.0,https://up-edu.com/,
2024-08-01,株式会社Ｚ会,学習塾・予備校・専門学校,16,～幼児から社会人まで、自前の通信教育、教室、出版、映像・ICT、アセスメントの５事業で「最高の教育」をお届けしています～■企業概要：大学受験を目指す受験生のための英語の通信添削指導からはじまったＺ会の通信教育サービスも、時代の変化に合わせ変わる顧客のニーズに応える中で、幼児から社会人向けコースまで広がり、下記５事業を幅広く手がけております。（１）通信事業（２）出版事業（３）教室事業（４）映像・ICT事業（５）アセスメント事業,静岡県三島市文教町1-9-11,1931,,650,100百万円,41.0,http://www.zkai.co.jp/,
2024-08-01,株式会社早稲田学習研究会,学習塾・予備校・専門学校,9,■事業内容：小・中学生、高校生対象の学習指導および受験指導◎集団授業の大型学習塾「Ｗ早稲田ゼミ」の運営 ◎個別指導教室「ファースト個別」の運営◎オリジナル学習教材の企画・制作 ◎ワセダ授業動画「WOVIE」の制作・配信,東京都中央区京橋1-6-11カンケン京橋ビル7F,1993,,383,183百万円,,http://www.wasedazemi.com/,スタンダード市場
2024-08-01,株式会社イトマンスイミングスクール,その他・各種スクール,2,"■事業内容： ・スイミングスクールの経営（営校33校／内強化校2校、提携校18校／内受託校2校）・フィットネスクラブの経営（直営8事業所）・ゴルフ練習場（1事業所）■売り上げ（直近3年）：2023年3月期：7,064百万円 2022年3月期：6,612百万円 2021年3月期：5,649百万円",東京都新宿区西新宿1-6-10ナガセ西新宿ビル1F,1972,,300,436百万円,,https://www.itoman.com/,
2024-07-01,株式会社スクールＴＯＭＡＳ,学習塾・予備校・専門学校,1,■学校内個別学習支援システム「スクールTOMAS」の企画・運営【リソー教育グループ】(株)リソー教育、(株)スクールTOMAS、(株)伸芽会、(株)名門会、(株)プラスワン教育、(株)リソーウェルフェア、(株)駿台TOMAS、(株)ココカラTチャーズ,東京都豊島区目白3-4-14 田中ビル3F,2000,代表取締役社長 上田 真也,230,1000万円,37.3,https://www.school-t.co.jp/,
2024-08-01,ビズメイツ株式会社,学習塾・予備校・専門学校,21,■当社についてビズメイツは、もっと多くのビジネスパーソンが世界で活躍するために、人と企業が成長しあう多様性のある豊かな社会の実現を目指しています。,東京都千代田区神田須田町1-7-9VORT秋葉原maxim10F,2012,,180,124百万円,35.0,http://www.bizmates.jp/,グロース市場
2024-06-01,株式会社ケーズデンキテクニカルサポート,その他・各種スクール,1,■ケーズデンキ店舗内でのサポートカウンター運営■パソコンおよび周辺機器、インターネット等の訪問設定サポート■パソコン教室「ひよこパソコン教室」の運営 など,茨城県水戸市城南2丁目7番5号,1997,代表取締役社長 鈴木 一義,407,"1,300万円",,https://technicalarts.co.jp/,
2024-08-01,株式会社プログリット,学習塾・予備校・専門学校,18,【事業内容】■個人向け英語学習のコーチングサービス ■法人向け英語学習研修プログラムの提供■サブスクリプション型英語学習サービス,東京都千代田区有楽町2-10-1東京交通会館ビル5F,2016,,175,250百万円,30.0,https://www.progrit.co.jp/,グロース市場
2024-08-01,株式会社 バンタン,学習塾・予備校・専門学校,23,【事業内容】ファッション、ヘアメイク、ビューティ、グラフィックデザイン、映画映像、フォト、ゲーム、アニメ、マンガ、サウンド、パティシエ、カフェ、フードコーディネーター、IT、プログラミング、エンターテインメント領域のクリエイター、インフルエンサー、プロデューサー等を育成するスクール運営事業、卒業生の支援事業等,東京都中央区銀座4-12-15歌舞伎座タワー13F,1965,,300,90百万円,31.9,http://www.vantan.jp/,
2024-07-01,株式会社ヒューマレッジ,学習塾・予備校・専門学校,9,■少子化の中、10％以上の生徒増加率を7年連続で達成！（業界平均約3％）木村塾ならではの教育方針で業績安定です。同社は小・中・高生を対象とした下記の学習塾を兵庫県尼崎市・伊丹市・西宮市を中心に34ヶ所展開しています。創業から30年を超える無借金経営の学習塾です。（1）木村塾…小・中学生の指導（小4～中3生）／ジュニアコースの運営（小1～小3生）（2）東進衛星予備校…東進衛星予備校の運営（高1～高3生）（3）SEED…国私立中学受験の指導（小4～小6生）（4）Harvest…個別指導塾の運営（小1～高3生）,大阪府大阪市北区曽根崎2-12-7清和梅田ビル11F,1986,,930,10百万円,32.1,https://www.kimurajuku.co.jp/,
2024-07-01,株式会社名門会,学習塾・予備校・専門学校,7,■事業概要：プロ家庭教師センター「名門会」と進学個別指導塾「TOMEIKAI」の運営,東京都豊島区目白1-4-25,2003,,276,10百万円,,https://www.meimonkai.co.jp/,
2024-06-01,株式会社名鉄スマイルプラス,その他・各種スクール,3,■事業内容：・学童保育＋プログラミング・英語教室「めいてつのアフタースクールTELACO（テラコ）」の設置・運営…6～12歳児対象／「仲間と共に未来を見つける場」をコンセプトに、学童保育に「習い事」の要素を付加したアフタースクール事業です。2020年度からの小学校の学習指導要領では、論理的思考力を養うためのプログラミング教育が必修になり、5年生から英語が教科化。TELACOでは、次世代型STEAM教育「STEMON（ステモン）」を導入したプログラミング教室と、英語教室を併設。未来を担う子 どもたちの“できる”を増やし、働くママやパパを応援します。,愛知県名古屋市中村区名駅1-2-4,2017,,377,100百万円,,https://meitetsu-sp.co.jp/,
2024-07-01,株式会社城南フェアリィー,その他・各種スクール,1,小規模保育園並びに企業主導型保育園の運営,埼玉県越谷市瓦曽根2-8-73 金田第2ビル 2A,2015,代表者 飯塚 健二,140,,,https://www.fairy-hoikuen.jp,
2024-06-01,エムスリーエデュケーション株式会社(東証プライム市場上場のエムスリーグループ),学習塾・予備校・専門学校,1,■事業内容 ・当社は40年以上にわたり、主に医療福祉系国家試験の対策と大学教育のアシストを行っている、医療福祉教育業界のリーティングカンパニーです。 ・東京・大阪を中心に、日本全国で医科・歯科の国家試験予備校をはじめとして、医科・歯科・看護・福祉領域の国家試験の動画教材や模擬試験、書籍の出版等を展開しています。 ・医師国家試験向けの模擬試験の受験者数は年間のべ3万人に上り、ほぼ全ての医師国家試験受験生が利用するサービスとなっています。 ・エムスリーグループの経営資源と当社の蓄積してきたノウハウを背景に、医科領域における次世代型オンライン学習プラットフォームを構築中です。,東京都中央区日本橋箱崎町24-1,1974,,100,50百万円,42.0,https://www.m3e.jp/corporate/,
2024-08-01,ＫＩＹＯラーニング株式会社,その他・各種スクール,11,【個人向けオンライン資格講座・法人向け社員教育クラウドサービスを展開し、5年間で売上17倍！2020年7月に東証マザーズに上場した成長企業】■企業概要：「人間の可能性を最大限に引き出す」をミッションにテクノロジーを活用した教育改革を行っております。※2014年経済産業省「がんばる中小企業300社」に選出されました。※マスコミ掲載実績：「プレジデント」「日経キャリア」「Big Tommorrow」「The21」「CAREERzine」「企業診断」「月刊コロンブス」「週刊全国賃貸住宅新聞」「BUAISO」他,東京都千代田区永田町2-10-1永田町山王森ビル4F,2010,,83,803百万円,38.9,https://www.kiyo-learning.com/,グロース市場
2024-06-01,株式会社ＪＡＬ　ＣＡＥ　ＦＬＩＧＨＴ　ＴＲＡＩＮＩＮＧ,その他・各種スクール,1,■事業内容：当社は、パイロットの育成を手がけており、主にフライトシミュレーターによる訓練ビジネスの提供を行っています。■事業内容詳細：・乗員用フライトシミュレーターによる訓練ビジネスの提供・シミュレーターのJCAB認定取得支援・パイロット及び航空整備員養成訓練用教材作成、ソフトウェア及び画像等の開発・航空事業従事者の育成訓練の提供に関わる業務,東京都大田区羽田空港3-6-8,2003,,79,"1,000百万円",,http://jcft.co.jp/,
2024-07-01,株式会社ピーエイケア,その他・各種スクール,3,■事業内容： ・保育所、託児所「ココカラ」の経営・各種コンサルタント業務・各種イベント企画運営・前各号に関連する一切の業務,福島県郡山市開成4-9-17,2015,,98,44百万円,,http://coco-color.com/,
2024-05-01,株式会社プロゴス,その他・各種スクール,2,株式会社プロゴスは、「世の中に必要とされるグローバルリーダーを輩出する」という日本企業のグローバル化の社会課題の解決をミッションとしています。一人ひとりが持っている素晴らしいポテンシャルを、国を超えて発揮できる——そんな未来図を描くための、人材育成パートナーです。◆グローバルリーダーの評価・育成・採用等関連事業グローバルリーダー育成に向け、顧客の目的によって組み合わせながら、グローバルマインドセット、グローバルビジネススキルなどの研修を設計、提供しています。,東京都渋谷区神宮前6-27-8京セラ原宿ビル2F,2021,,37,100百万円,36.9,https://www.progos.co.jp/company,
2024-07-01,株式会社チャイルド社,その他・各種スクール,2,■チャイルドブック、保育用教材・教具一式販売■園児服・職員服・学生服・事務服・マーチングユニフォーム等製造、卸、販売■幼稚園・保育園・福祉施設専用コンピュータ・システムの企画、製造、販売、保守■園舎の設計、施工、園児送迎用バスの設計・販売■遊園地設計、施工■介護用品及び機器の仕入・販売■園児向け食材・食育教材の販売■幼児教室［本社］東京［営業所］全国42カ所［関連会社］8社,【本社】東京都杉並区南荻窪4-39-11,1953,代表取締役社長 柴田 豊幸,405,5700万円,,http://www.child.co.jp/,
2024-08-01,株式会社早稲田アカデミー,その他・各種スクール,16,■企業概要：同社は小学生・中学生・高校生対象の進学塾を経営しており、グループ全体での直営校舎数は189校です。(2024年6月現在)創業以来変わらない「本気でやる子を育てる」という教育理念を徹底実践することで、”生徒の本気を引出し、成績向上と志望校合格を実現する。その結果顧客満足度を高めて地域の評判を獲得し拡充していく。”－この合格実績戦略を推進することで業績伸長と業容拡大を実現しています。（13年連続増収、過去最高益更新）創業は1975年。1999年に店頭登録し、2012年に東証１部上場（2022年にプライムへ移行）。,東京都豊島区南池袋1-16-15ダイヤゲート池袋9F,1974,,1090,"2,014百万円",37.9,https://www.waseda-ac.co.jp/,プライム市場
2024-08-01,株式会社リソー教育,学習塾・予備校・専門学校,3,■事業内容：首都圏を中心に進学個別指導塾「TOMAS」を103校展開。新規およびリニューアル開校を年間数校にあえて抑え、丁寧な教室作りをする事で、高品質な指導サービスを提供しています。また、医学部受験専門個別指導「メディックTOMAS」、ネイティブ＆バイリンガル講師が１対１で指導する英語専門個別指導「インターTOMAS」、難関校受験対策特化個別指導「spec. TOMAS」を運営しています。,東京都豊島区目白3-1-40,1985,,521,"2,890百万円",40.1,https://www.riso-kyoikugroup.com/,プライム市場
2024-08-01,株式会社明光ネットワークジャパン,学習塾・予備校・専門学校,26,■事業概要：個別指導塾（明光義塾）を中心に教育事業を展開しています。個別指導塾を中心に教育事業を展開し、明光義塾は、全国や海外にも教室を開校しております。少子化で競合が多い中でも、直営教室に加えフランチャイズシステムも活用し、成長を続けています。,東京都新宿区西新宿7-20-1,1984,,629,972百万円,37.0,http://www.meikonet.co.jp/,プライム市場
2024-08-01,株式会社城南進学研究社,学習塾・予備校・専門学校,7,■事業概要：同社は、「乳幼児から社会人まで」をキーワードに教育を軸とした多角的な事業展開を強みとしています。お客様に選ばれる総合教育企業として、これからも「生徒第一主義」を実践し、民間教育を牽引する存在となることを目指します。,神奈川県川崎市川崎区駅前本町22-2,1982,,1532,655百万円,41.1,http://www.johnan.co.jp/,スタンダード市場
2024-08-01,株式会社京進,学習塾・予備校・専門学校,20,■事業内容：幼児から小中高校生対象の学習塾、個別指導教室、英会話教室、ネット学習事業、個別指導教室のフランチャイズ事業、日本語教育事業、保育事業、フードサービス事業、介護事業,京都府京都市下京区烏丸通五条下る大坂町382-1,1981,,2180,327百万円,37.9,http://www.kyoshin.co.jp/,スタンダード市場
2024-06-01,ケニス株式会社,その他・各種スクール,2,■事業内容： ・理科学器械及び教材の製造並びに販売・試薬（一般毒物、劇薬を含む）の販売・度量衡器及び計量器の販売・医療機器及び材料の販売・不動産の賃貸・前各号に附帯関連する一切の業務,広島県広島市西区三篠町2-9-15,1948,,140,,,http://www.kenis.co.jp,
2024-08-01,株式会社ウィザス,その他・各種スクール,23,様々な顧客ニーズに対応し、将来設計指導を通じた事業を展開■学習塾事業「第一ゼミナール」・「ファロス個別指導学院」をはじめ、小学生から高校生までを対象とした学習指導を行っています。”目標は志望校合格、目的は社会で活躍できる人づくり”目指すべき生徒像を「いつでも、何事にも、前向きにチャレンジする自分」と定め、最新の脳科学に基づいた独自の「プラスサイクル学習法」を通じて、生徒の夢・目標に向けた支援を行っています。,大阪府大阪市中央区備後町3-6-2KFセンタービル,1976,,2851,"1,299百万円",41.2,http://www.with-us.co.jp/,スタンダード市場
2024-07-01,（学）福田学園　大阪工業技術専門学校/大阪保健医療大学/大阪リハビリテーション専,その他・各種スクール,1,福田学園は1895年の「製図夜学館」（現大阪工業技術専門学校）創立に端を発し、「専門知識（学問）、技術（実習）、そして人間尊重（心）を兼備し、社会に貢献する人材の育成」を建学の精神として、今日に至るまで127年の歴史がある。2000年に「大阪リハビリテーション専門学校」を開校、2009年には「大阪保健医療大学」を開学し、工業と医療・福祉の分野で21世紀にふさわしい人材の育成を通して社会に貢献している。,大阪府大阪市北区天満1-9-27,1895,,88,,,https://www.fukuda.ac.jp/,
2024-08-01,ワールド・ファミリー株式会社,その他・各種スクール,10,■事業内容： （1）英語教材販売（2）教育関連事業及びイベントに関する企画・後援・普及（3）その他の教材・出版物の販売,東京都中野区本町1-32-2ハーモニータワー4F,1977,,1201,480百万円,,https://world-family.co.jp/,
2024-08-01,株式会社ナガセ,その他・各種スクール,13,■企業概要：「独立自尊の社会・世界に貢献する人財を育成する」という企業理念の下、幼児から社会人の一貫教育を通して、人間力（＝心知体）を鍛え、日本を再興し、世界の発展に貢献する次代のリーダー育成に取り組む民間最大規模の教育機関です。「東進ハイスクール」、「東進衛星予備校」、四谷大塚、イトマンスイミングスクールなどを展開しています。,東京都武蔵野市吉祥寺南町1-29-2,1976,,1398,"2,138百万円",,http://www.toshin.com/nagase/,スタンダード市場
2024-05-01,株式会社昴,学習塾・予備校・専門学校,1,■年長児・小学生・中学生・高校生を 対象とした学習および受験指導 昴■受験ラサール■すばる個別指導■各種模試 (全九州模試/全九州学力テスト/附中模試 他)■昴合宿■各種検定,鹿児島県鹿児島市加治屋町9-1,,代表取締役社長 西村 秋,308,"9億9,075万円",43.9,https://www.subaru-net.com/,スタンダード市場
2024-08-01,学校法人電子学園,その他・各種スクール,16,■概要:学校法人電子学園 ・ 日本電子専門学校の運営（昼間部20学科・夜間部4学科 学生数約3000名） ・ iU情報経営イノベーション専門職大学 2020年4月開学 （学生定員800名）,東京都新宿区百人町1-25-4,1951,,227,,43.0,http://www.jec.ac.jp/,
2024-08-01,株式会社東音企画,その他・各種スクール,2,【事業内容】楽譜・音楽書の輸入、コンクール運営、各種ピアノ指導セミナー・イベントの運営、音楽教室向けアプリ・楽譜関連アプリの開発等,東京都豊島区巣鴨1-15-15F,1970,,11,20百万円,,https://www.to-on.com/,
