更新日,名称,業界(小分類),求人有無,事業内容,所在地,設立,代表者,従業員数,資本金,平均年齢,企業URL,上場市場名
2024-08-01,学校法人洗足学園,その他・各種スクール,求人なし,,神奈川県川崎市高津区久本2-3-1,1930,理事長 前田 壽一,,"48,084 百万円",,,
2024-08-01,学校法人谷岡学園,その他・各種スクール,求人なし,,大阪府東大阪市御厨栄町4-1-10,1946,理事長 谷岡 一郎,,"59,533 百万円",,,
2024-08-01,学校法人城南学園,その他・各種スクール,求人なし,,大阪府大阪市東住吉区湯里6-4-26,1944,理事長 中尾 博,,"22,668 百万円",,,
2024-08-01,学校法人奈良立正芸術学院,学習塾・予備校・専門学校,求人なし,,奈良県奈良市山陵町1179,1980,理事長 大橋 智,,"1,475 百万円",,,
2024-08-01,株式会社日本ライセンスバンク,その他・各種スクール,求人なし,,東京都新宿区新宿3-1-13京王新宿追分ビル 4Ｆ,1987,代表取締役 松田 直之,,75 百万円,,,
2024-08-01,株式会社滋慶,学習塾・予備校・専門学校,求人なし,,大阪府大阪市中央区島之内1-10-15滋慶ビル,1989,代表取締役 田仲 豊徳,,12 百万円,,,
2024-08-01,株式会社アイエスエイ,その他・各種スクール,求人なし,,東京都港区港南1-6-41芝浦クリスタル品川 10Ｆ,1970,代表取締役 倉橋 勝,,43 百万円,,,
2024-08-01,関西大学生活協同組合,その他・各種スクール,求人なし,,大阪府吹田市千里山東3-10-1,1962,代表理事 柴橋 圭介,,"1,226 百万円",,,
2024-08-01,株式会社ステップ,その他・各種スクール,求人なし,,神奈川県藤沢市藤沢602,1979,代表取締役社長 遠藤 陽介,,"1,778 百万円",,,プライム
2024-08-01,学校法人情報文化学園,学習塾・予備校・専門学校,無,情報が古い可能性があります。最新の情報を確認する場合はHP等をご覧ください。 ■事業概要：アーツカレッジヨコハマには「技術で未来を切り拓け」というコンセプトワードを基に学生を「教え育てる」ことをしています。学生一人ひとりの特性を把握し「職業人のプロを育てる」ことが本校の目指す教育です。 2023年8月doda掲載求人より引用,神奈川県横浜市西区浅間町2-105-8,1983,理事長 中村 麻美,,"2,208 百万円",,,
2024-08-01,学校法人鶴岡学園,その他・各種スクール,求人なし,,北海道恵庭市黄金中央5-196-1,1953,理事長 鈴木 武夫,,"11,360 百万円",,,
2024-08-01,学校法人日本芸術学園,その他・各種スクール,求人なし,,東京都大田区山王2-12-13,1978,理事長 武田 光弘,,"1,855 百万円",,,
2024-08-01,株式会社富士通ラーニングメディア,その他・各種スクール,求人なし,,神奈川県川崎市幸区大宮町1-5ＪＲ川崎タワー,1977,代表取締役 佐竹 秀彦,,300 百万円,,,
2024-08-01,学校法人山陽学園,学習塾・予備校・専門学校,求人なし,,岡山県岡山市中区門田屋敷2-2-16,1904,理事長 谷本 欣也,,"6,255 百万円",,,
2024-08-01,株式会社学秀館,その他・各種スクール,求人なし,,沖縄県中頭郡西原町字小那覇1499-1,1981,代表取締役 石川 幸一郎,,9 百万円,,,
2024-08-01,学校法人日本体育大学,その他・各種スクール,求人なし,,東京都世田谷区深沢7-1-1,1940,理事長 松浪 健四郎,,"53,664 百万円",,,
2024-08-01,学校法人甲南学園,その他・各種スクール,求人なし,,兵庫県神戸市東灘区岡本8-9-1,1918,理事長 長坂 悦敬,,"80,875 百万円",,,
2024-08-01,株式会社穴吹カレッジサービス,その他・各種スクール,求人なし,,香川県高松市西内町5-11アルカディア西内町 3Ｆ,1999,代表取締役 大平 康喜,,10 百万円,,,
2024-08-01,独立行政法人海技教育機構,その他・各種スクール,求人なし,,神奈川県横浜市中区北仲通5-57横浜第2合同庁舎 20Ｆ,2001,理事長 田島 哲明,,"19,263 百万円",,,
2024-08-01,株式会社塩屋自動車学校,その他・各種スクール,求人なし,,和歌山県和歌山市塩屋6-2-81,1972,代表取締役 山西 陵平,,10 百万円,,,
2024-08-01,株式会社門司自動車学校,その他・各種スクール,求人なし,,福岡県北九州市門司区大字畑120,1980,代表取締役 小森 敏弘,,10 百万円,,,
2024-08-01,株式会社大渡自動車学校,その他・各種スクール,求人なし,,群馬県前橋市総社町総社1164-2,1964,代表取締役 小倉 基宏,,10 百万円,,,
2024-08-01,株式会社ＫＡＴＥＫＹＯグループ,その他・各種スクール,求人なし,,長野県長野市南千歳2-8-6ＫＡＴＥＫＹＯビル,1984,代表取締役 瀧澤 邦雄,,10 百万円,,,
2024-08-01,学校法人未来学園,学習塾・予備校・専門学校,求人なし,,群馬県前橋市石関町122-6,1986,理事長 野口 智樹,,"6,783 百万円",,,
2024-08-01,学校法人ＮＩＰＰＯＮ　ＡＣＡＤＥＭＹ,学習塾・予備校・専門学校,求人なし,,群馬県前橋市大手町1-11-4,1986,理事長 清水 澄,,153 百万円,,,
2024-08-01,学校法人行学学園,その他・各種スクール,求人なし,,福岡県北九州市若松区大字乙丸770-1,1980,理事長 中田 俊澄,,24 百万円,,,
2024-08-01,学校法人桑園学園,学習塾・予備校・専門学校,求人なし,,北海道札幌市中央区北五条西13-1,1961,理事長 小松 妃呂美,,"1,191 百万円",,,
2024-08-01,学校法人有坂中央学園,学習塾・予備校・専門学校,求人なし,,群馬県前橋市古市町1-49-1,1966,理事長 中島 慎太郎,,"1,970 百万円",,,
2024-08-01,学校法人北海道安達学園,その他・各種スクール,求人なし,,北海道札幌市中央区大通西9-3-12,1989,理事長 安達 保敏,,"8,157 百万円",,,
2024-08-01,株式会社フレックスジャパン,その他・各種スクール,求人なし,,北海道札幌市中央区北一条西3-3札幌ＭＮビル 11Ｆ,1990,代表取締役 大塚 裕造,,50 百万円,,,
2024-08-01,株式会社道新文化センター,その他・各種スクール,求人なし,,北海道札幌市中央区大通西3-6道新ビル大通館 7Ｆ,1983,代表取締役 藤井 篤,,30 百万円,,,
2024-08-01,株式会社ニスコ,その他・各種スクール,求人なし,,北海道札幌市中央区大通西3-4,1988,代表取締役 山本 孝,,20 百万円,,,
2024-08-01,株式会社パステル,その他・各種スクール,求人なし,,北海道札幌市中央区大通西14-3-23札幌泉ビル 4Ｆ,1994,代表取締役 瀬戸 知也,,10 百万円,,,
2024-08-01,学校法人フェリカ学園,その他・各種スクール,無,,群馬県前橋市南町2-38-2,1996,理事長 仲川 孝道,,,,,
2024-08-01,株式会社城野自動車学校,学習塾・予備校・専門学校,無,,福岡県北九州市小倉北区霧ケ丘1-15-1,2010,代表取締役 野中 裕人,,3 百万円,,,
2024-08-01,株式会社エース産業,その他・各種スクール,求人なし,,和歌山県海南市且来1382-1,1977,代表取締役 堀川 直行,,10 百万円,,,
2024-08-01,有限会社小倉自動車学校,その他・各種スクール,無,,福岡県北九州市小倉北区霧ケ丘1-16-1,1965,代表取締役 辰本 誠一郎,,19 百万円,,,
2024-08-01,株式会社西港自動車学校,その他・各種スクール,求人なし,,福岡県北九州市小倉北区西港町15-5,1985,代表取締役 大村 芳彦,,10 百万円,,,
2024-08-01,株式会社エルム楽器,その他・各種スクール,求人なし,,北海道札幌市手稲区西宮の沢三条2-1-8,1974,代表取締役 渡邉 あゆみ,,90 百万円,,,
2024-08-01,株式会社東京アカデミー北九州,学習塾・予備校・専門学校,求人なし,,大阪府大阪市北区角田町8-1,1989,代表取締役 佐川 泰宏,,10 百万円,,,
2024-08-01,株式会社鴎プランニング,その他・各種スクール,求人なし,,北海道札幌市中央区南二条西2-Ｍーパークビルディング 5Ｆ,1990,代表取締役 岸 洋希,,10 百万円,,,
2024-08-01,社会福祉法人いづみ会,その他・各種スクール,求人なし,,群馬県高崎市下小鳥町286,1967,理事長 松岡 満雄,,92 百万円,,,
2024-08-01,株式会社麻生自動車センター,その他・各種スクール,求人なし,,北海道札幌市北区北三十六条西5-1-1,1964,代表取締役 菅 茂生,,50 百万円,,,
2024-08-01,学校法人宮島学園,学習塾・予備校・専門学校,求人なし,,北海道札幌市北区北十五条西4-1-7,1953,理事長 諏訪 雅英,,347 百万円,,,
2024-08-01,学校法人北海道武蔵女子学園,その他・各種スクール,求人なし,,北海道札幌市北区北二十二条西13-1-3,1967,理事長 篠田 泰伸,,"4,601 百万円",,,
2024-08-01,学校法人太田アカデミー,学習塾・予備校・専門学校,求人なし,,群馬県太田市東長岡町1361,1992,理事長 田鶴 志郎,,"10,040 百万円",,,
2024-08-01,学校法人東雲学園,その他・各種スクール,求人なし,,鳥取県鳥取市里仁97-1,1962,理事長 安住 学,,7 百万円,,,
2024-08-01,株式会社太田自動車教習所,その他・各種スクール,求人なし,,群馬県太田市由良町1193,1962,代表取締役 太刀川 智也,,15 百万円,,,
2024-08-01,株式会社Ｂｉｒｔｈ４７,学習塾・予備校・専門学校,無,◆住宅リフォーム事業◆スポーツ事業◆教育事業（学習塾の運営）◆行政協同事業◆ポータルサイト事業 2023年8月doda掲載求人より引用,東京都世田谷区三軒茶屋1-41-9朝日生命三軒茶屋ビル 7Ｆ,1985,代表取締役 高橋 宏幸,,49 百万円,,,
2024-08-01,株式会社伊那自動車教習所,その他・各種スクール,求人なし,,長野県伊那市美篶9623-2,1967,代表取締役 伊藤 哲雄,,16 百万円,,,
2024-08-01,学校法人立花学園,学習塾・予備校・専門学校,求人なし,,福岡県福岡市東区和白丘2-24-43,1957,理事長 水落 清十郎,,7 百万円,,,
2024-08-01,学校法人巨樹の会,学習塾・予備校・専門学校,求人なし,,福岡県福岡市東区和白丘2-1-12,1990,理事長 藤井 茂,,"9,200 百万円",,,
2024-08-01,株式会社駒ヶ根自動車学校,その他・各種スクール,求人なし,,長野県駒ヶ根市赤穂16398,1968,代表取締役 中畑 邦彦,,10 百万円,,,
2024-08-01,株式会社瑞穂,その他・各種スクール,求人なし,,福岡県福津市宮司6-12-11,1981,代表取締役 幣 款,,10 百万円,,,
2024-08-01,株式会社千曲自動車学校,その他・各種スクール,求人なし,,長野県千曲市大字桜堂180,1964,代表取締役 宮入 敬昌,,20 百万円,,,
2024-08-01,学校法人大藤学園,その他・各種スクール,求人なし,,北海道札幌市白石区南郷通18-北43,1969,理事長 大谷 和彦,,"4,322 百万円",,,
2024-08-01,ペガサス株式会社,学習塾・予備校・専門学校,求人なし,,福岡県福岡市博多区博多駅東2-17-5ＡＲＫビル 9Ｆ,1985,代表取締役 田中 俊英,,20 百万円,,,
2024-08-01,社会福祉法人あすなろ会,その他・各種スクール,求人なし,,島根県出雲市白枝町396-2,1971,理事長 竹内 一夫,,"1,373 百万円",,,
2024-08-01,有限会社信濃東部自動車学校,その他・各種スクール,無,,長野県東御市和1506,1962,代表取締役 片山 淳,,11 百万円,,,
2024-08-01,株式会社メディアプラッツ,その他・各種スクール,求人なし,,長野県東御市田中109-3,1996,代表取締役 佐藤 貴,,10 百万円,,,
2024-08-01,株式会社山利池上商店,その他・各種スクール,求人なし,,北海道札幌市豊平区豊平四条6-1-3,1952,代表取締役 池上 智彦,,10 百万円,,,
2024-08-01,株式会社赤城自動車教習所,その他・各種スクール,求人なし,,群馬県伊勢崎市赤堀今井町1-564,1963,代表取締役 小倉 基義,,13 百万円,,,
2024-08-01,株式会社啓隆社,その他・各種スクール,求人なし,,福岡県福岡市南区玉川町2-1大連ビル,1958,代表取締役 日野山 靖倫,,20 百万円,,,
2024-08-01,株式会社コガワ計画,その他・各種スクール,求人なし,,島根県益田市安富町3330-1,1963,代表取締役社長 小河 吉彦,,50 百万円,,,
2024-08-01,株式会社フクト,学習塾・予備校・専門学校,求人なし,,福岡県福岡市中央区薬院4-3-20,1952,代表取締役 安村 洋三,,10 百万円,,,
2024-08-01,株式会社学習受験社,その他・各種スクール,求人なし,,福岡県福岡市中央区唐人町1-3-4,1960,代表取締役 國吉 勝,,25 百万円,,,
2024-08-01,株式会社日本学術講師会,その他・各種スクール,求人なし,,福岡県福岡市中央区天神3-16-24ハーツ天神ビル 6Ｆ,1990,代表取締役 中村 信二,,26 百万円,,,
2024-08-01,株式会社アスクインターナショナル,その他・各種スクール,無,,北海道札幌市豊平区豊平四条13-1-25,1991,代表取締役 重松 三惠子,,10 百万円,,,
2024-08-01,学校法人高山学園,その他・各種スクール,求人なし,,福岡県福岡市中央区大濠2-8-13,1954,理事長 高山 項祐 サミユエル,,"1,866 百万円",,,
2024-08-01,株式会社美山,学習塾・予備校・専門学校,求人なし,,福岡県福岡市中央区白金2-5-20,1990,代表取締役 山口 俊夫,,10 百万円,,,
2024-08-01,学校法人伊東文化学園,学習塾・予備校・専門学校,求人なし,,福岡県福岡市中央区天神3-6-35,1958,理事長 伊東 隆昭,,"1,827 百万円",,,
2024-08-01,学校法人経専学園,その他・各種スクール,無,,北海道札幌市南区澄川四条4-1-1,1973,理事長 山本 清,,"6,375 百万円",,,
2024-08-01,学校法人大村文化学園,学習塾・予備校・専門学校,求人なし,,福岡県福岡市中央区黒門2-6,1992,理事長 大村 陽之介,,"1,911 百万円",,,
2024-08-01,ウエストジヤパン興業株式会社,その他・各種スクール,求人なし,,岡山県岡山市中区清水418,1962,代表取締役 吉村 充司,,26 百万円,,,
2024-08-01,株式会社ほていや,教育業界,求人なし,,埼玉県さいたま市大宮区桜木町2-403,1993,代表取締役 蓜島秀則,,13 百万円,,,
2024-08-01,学校法人第一平田学園,学習塾・予備校・専門学校,求人なし,,岡山県岡山市北区船頭町12,1977,理事長 平田 眞一,,723 百万円,,,
2024-08-01,株式会社彩,その他・各種スクール,無,,埼玉県さいたま市大宮区宮町2-65-3,1996,代表取締役 木村 智則,,10 百万円,,,
2024-08-01,株式会社リヌー,その他・各種スクール,求人なし,,埼玉県さいたま市見沼区東大宮5-34-2山田ビル1Ｆ,1991,代表取締役 松本 和男,,10 百万円,,,
2024-08-01,株式会社大宮教育センター,その他・各種スクール,求人なし,,埼玉県さいたま市見沼区東大宮6-8-1,1978,代表取締役 堤 好雄,,24 百万円,,,
2024-08-01,株式会社稲荷自動車教習所,その他・各種スクール,求人なし,,岡山県岡山市北区小山544,1968,代表取締役 安川 一恵,,10 百万円,,,
2024-08-01,株式会社和幸,その他・各種スクール,求人なし,,埼玉県さいたま市中央区大字下落合1079-2エール与野 2Ｆ,1966,代表取締役 吉村 義史,,38 百万円,,,
2024-08-01,株式会社さなる九州,学習塾・予備校・専門学校,求人なし,,福岡県福岡市博多区博多駅南1-4-10ＩＶＹＳＱＵＡＲＥ 1Ｆ,1982,代表取締役 小島 康介,,50 百万円,,,
2024-08-01,学校法人本山学園,学習塾・予備校・専門学校,求人なし,,岡山県岡山市北区大供3-2-18,1985,理事長 室山 義正,,"1,042 百万円",,,
2024-08-01,株式会社国大グループホールディングス,学習塾・予備校・専門学校,求人なし,,埼玉県さいたま市浦和区高砂2-3-19新高砂ビル 5Ｆ,1988,代表取締役 小倉 拓也,,40 百万円,,,
2024-08-01,株式会社ＵＤＳ,その他・各種スクール,求人なし,,埼玉県さいたま市南区文蔵3-11-9,1956,代表取締役 髙橋 仁美,,21 百万円,,,
2024-08-01,学校法人森教育学園,学習塾・予備校・専門学校,求人なし,,岡山県岡山市東区西大寺上1-19-19,1960,理事長 森 靖喜,,"1,605 百万円",,,
2024-08-01,学校法人華陽学園,公社・官公庁・学校・研究施設,求人なし,,岐阜県岐阜市太郎丸80,1965,理事長 杉山 博文,,"4,010 百万円",,,
2024-08-01,学校法人札幌国際大学,その他・各種スクール,求人なし,,北海道札幌市清田区清田四条1-4-1,1934,理事長 上野 八郎,,"26,925 百万円",,,
2024-08-01,学校法人朝日医療学園,学習塾・予備校・専門学校,求人なし,,岡山県岡山市北区奉還町2-7-1,1991,理事長 津島 伸章,,"2,937 百万円",,,
2024-08-01,学校法人久留米ゼミナール,学習塾・予備校・専門学校,求人なし,,福岡県久留米市天神町2-56,1977,理事長 今井 正雄,,"1,486 百万円",,,
2024-08-01,学校法人野又学園,その他・各種スクール,求人なし,,北海道函館市高丘町51-1,1941,理事長 野又 淳司,,"14,872 百万円",,,
2024-08-01,株式会社大垣自動車学校,その他・各種スクール,求人なし,,岐阜県大垣市旭町1-5,1953,代表取締役 岡田 正昭,,10 百万円,,,
2024-08-01,学校法人函館大谷学園,その他・各種スクール,求人なし,,北海道函館市鍛治1-2-3,1944,理事長 門間 佳一,,"2,841 百万円",,,
2024-08-01,学校法人医学アカデミー,学習塾・予備校・専門学校,無,,埼玉県川越市中台元町1-18-1,1977,理事長 穗坂 邦夫,,"5,838 百万円",,,
2024-08-01,株式会社日本総合音楽研究,その他・各種スクール,求人なし,,埼玉県川越市大字大仙波973-8,1978,代表取締役 畠山 寛,,48 百万円,,,
2024-08-01,学校法人久留米学園,学習塾・予備校・専門学校,求人なし,,福岡県久留米市東町272-4,1951,理事長 熊谷 智彦,,"1,789 百万円",,,
2024-08-01,社会福祉法人美希福祉会,その他・各種スクール,求人なし,,神奈川県横浜市南区宿町4-75-1,1972,理事長 原 弘毅,,"1,045 百万円",,,
2024-08-01,学校法人作陽学園,学習塾・予備校・専門学校,求人なし,,岡山県倉敷市玉島長尾3515,1946,理事長 松田 英毅,,"22,267 百万円",,,
2024-08-01,株式会社マグマ,学習塾・予備校・専門学校,求人なし,,埼玉県鶴ヶ島市大字藤金846-18,1985,代表取締役 大森 登希義,,10 百万円,,,
2024-08-01,埼玉自動車興業株式会社,その他・各種スクール,求人なし,,埼玉県熊谷市見晴町330,1962,代表取締役 柏俣 秀夫,,40 百万円,,,
2024-08-01,株式会社大原自動車学校,その他・各種スクール,求人なし,,岐阜県多治見市幸町7-29-1,1963,代表取締役 若尾 将成,,10 百万円,,,
2024-08-01,株式会社美坂自動車学校,学習塾・予備校・専門学校,求人なし,,岐阜県多治見市東町3-46,1980,代表取締役社長 齋藤 功武,,10 百万円,,,
2024-08-01,株式会社ネット,その他・各種スクール,求人なし,,岡山県倉敷市吉岡378,1991,代表取締役 桑岡 俊文,,20 百万円,,,
2024-08-01,岐阜県関自動車学校株式会社,その他・各種スクール,求人なし,,岐阜県関市十六所21-1,1964,代表取締役 安田 哲男,,33 百万円,,,
2024-08-01,学校法人郷学舎,その他・各種スクール,求人なし,,埼玉県熊谷市鎌倉町124,1988,理事長 新井 公一,,580 百万円,,,
2024-08-01,学校法人今昌学園,その他・各種スクール,求人なし,,埼玉県熊谷市籠原南2-149,1976,理事長 今井 明巨,,"1,251 百万円",,,
2024-08-01,株式会社メイト,その他・各種スクール,無,情報が古い可能性があります。最新の情報を確認する場合はHP等をご覧ください。 幼児関連図書・絵本・教材・保育用品・遊具・学校関連備品の開発並びに販売 2023年7月doda掲載求人より引用,東京都北区滝野川7-46-1明治滝野川ビル,1976,代表取締役 竹井 純,,20 百万円,,,
2024-08-01,有限会社山口酒店,学習塾・予備校・専門学校,求人なし,,岡山県津山市田町86-4,1958,代表取締役 山口 甲,,3 百万円,,,
2024-08-01,藤和土建工業株式会社,学習塾・予備校・専門学校,求人なし,,埼玉県川口市芝西1-25-3,1987,代表取締役 藤井 忠仁,,30 百万円,,,
2024-08-01,株式会社一二,その他・各種スクール,求人なし,,福岡県豊前市大字松江1381-1,1964,代表取締役 小森 敏弘,,10 百万円,,,
2024-08-01,株式会社那加自動車教習場,その他・各種スクール,求人なし,,岐阜県各務原市那加西那加町28,1960,代表取締役 小島 聡太郎,,48 百万円,,,
2024-08-01,株式会社螢雪ゼミナール,学習塾・予備校・専門学校,求人なし,,岐阜県羽島郡岐南町三宅9-123-1ＮＴビル 2Ｆ,1990,代表取締役 井上 憲氏,,10 百万円,,,
2024-08-01,株式会社俊英館,その他・各種スクール,無,教育や福祉に関わる事業を幅広く展開しています【学習塾】■俊英館Flex■鉄能会■Dreaven（ドリーブン）【語学教室】■西宮インターナショナルスクール【保育園】■すきっぷ保育園【児童発達支援施設】■Wapi■こと・える【介護事業】■俊英館ライフケア 2023年12月doda掲載求人より引用,東京都板橋区小茂根4-9-2セガミビル 3Ｆ,1984,代表取締役 田村 幸之,,45 百万円,,,
2024-08-01,ミナミホールディングス株式会社,その他・各種スクール,求人なし,,福岡県大野城市下大利3-2-20,1962,代表取締役 江上 喜朗,,10 百万円,,,
2024-08-01,株式会社学習塾あすなろ会,学習塾・予備校・専門学校,無,情報が古い可能性があります。最新の情報を確認する場合はHP等をご覧ください。 【学習塾の運営】■小学生、中学生、高校生向けの学習指導、テキスト・テストの作成■東進衛星予備校、看護公務員予備校の運営 2022年12月doda掲載求人より引用,北海道釧路市鶴ケ岱3-3-24,1981,代表取締役 種村 俊仁,,10 百万円,,,
2024-08-01,株式会社岐阜東自動車学校,その他・各種スクール,求人なし,,岐阜県羽島郡岐南町三宅8-31,1958,代表取締役 村上 宜隆,,15 百万円,,,
2024-08-01,株式会社第一自動車学校,その他・各種スクール,求人なし,,北海道帯広市稲田町東1線12,1964,代表取締役 内木 真紀衣,,25 百万円,,,
2024-08-01,学校法人九州学園,その他・各種スクール,求人なし,,福岡県太宰府市五条4-16-1,1922,理事長 大浦 隆陽,,"6,670 百万円",,,
2024-08-01,有限会社古賀自動車学校,その他・各種スクール,求人なし,,福岡県古賀市千鳥5-4-5,1965,代表取締役 阿部 健太郎,,42 百万円,,,
2024-08-01,株式会社勝英自動車学校,その他・各種スクール,求人なし,,岡山県勝田郡勝央町平1227-6,1965,代表取締役 吉村 武司,,47 百万円,,,
2024-08-01,株式会社古庄自動車学校,その他・各種スクール,求人なし,,静岡県静岡市葵区古庄3-11-15,1963,代表取締役 前田 兵衞,,10 百万円,,,
2024-08-01,学校法人電子開発学園,その他・各種スクール,求人なし,,北海道江別市西野幌59-2,1986,理事長 松尾 泰,,"11,633 百万円",,,
2024-08-01,千歳自動車総業株式会社,その他・各種スクール,求人なし,,北海道千歳市真々地2-5-2,1965,代表取締役 渡部 順大,,25 百万円,,,
2024-08-01,学校法人駿河学院,学習塾・予備校・専門学校,求人なし,,静岡県静岡市葵区音羽町19-22,1986,理事長 杉下 俊雄,,"1,337 百万円",,,
2024-08-01,学校法人ミズモト学園,学習塾・予備校・専門学校,求人なし,,静岡県浜松市中央区東田町36-8東田町ビル 3Ｆ,1985,理事長 水元 久人,,"2,705 百万円",,,
2024-08-01,株式会社東海美工,その他・各種スクール,求人なし,,静岡県浜松市中央区北寺島町211-8,1990,代表取締役 髙橋 志乃江,,10 百万円,,,
2024-08-01,株式会社浦上自動車学校,その他・各種スクール,求人なし,,長崎県長崎市赤迫3-19-1,1980,代表取締役 中ノ瀬 愛,,10 百万円,,,
2024-08-01,社会福祉法人桑の実会,その他・各種スクール,求人なし,,埼玉県所沢市東狭山ケ丘6-2835-2,1976,理事長 濱野 賢一,,"3,745 百万円",,,
2024-08-01,学校法人聖隷学園,学習塾・予備校・専門学校,求人なし,,静岡県浜松市中央区三方原町3453,1966,理事長 長谷川 了,,"13,477 百万円",,,
2024-08-01,株式会社あたご,その他・各種スクール,求人なし,,長崎県長崎市星取1-1-28,1960,代表取締役 井口 國雄,,10 百万円,,,
2024-08-01,株式会社フュージョン,その他・各種スクール,求人なし,,広島県広島市中区大手町3-1-3ＩＴ大手町ビル 5Ｆ,1993,代表取締役 友川純一,,20 百万円,,,
2024-08-01,株式会社ライトハウスエデュケーション,学習塾・予備校・専門学校,求人なし,,静岡県浜松市中央区佐鳴台5-28-2,1981,代表取締役 松下 一徳,,99 百万円,,,
2024-08-01,株式会社本原自動車学校,その他・各種スクール,求人なし,,長崎県長崎市高尾町8-41,1965,代表取締役 深堀 勝博,,3 百万円,,,
