更新日,名称,業界(小分類),求人有無,事業内容,所在地,設立,代表者,従業員数,資本金,平均年齢,企業URL,上場市場名
2024-07-01,学校法人三友学園,学習塾・予備校・専門学校,7,"■学校概要：岡山県を代表する日本カバヤ・オハヨーホールディングスが母体の専門学校で、工業専門課程、商業実務専門課程、教育・社会福祉専門課程を設置し、全14学科を擁する総合専門学校です。これまでの卒業生の総数は13,000人を超え、幅広い分野の最前線で卒業生一人ひとりが活躍を続け、岡山県内外の企業からの厚い信頼を得ています。",岡山県岡山市北区駅元町1-4ターミナルスクエア6F,1985,,62,"1,650百万円",44.0,http://www.oic-ok.ac.jp/,
2024-08-01,株式会社マジオネット春日井／マジオドライバーズスクール春日井校,その他・各種スクール,1,■自動車教習事業■作業系講習事業■安全教育事業■ドローン事業■保育事業■児童教育事業■アミューズメント事業■パルプランニング,愛知県春日井市明知町字西尾口230-1,1988,代表取締役社長 松本 義弘,60,"3,000万円",,"Failed to retrieve page, status code: 410",
2024-08-01,インターナショナルエジュケーションサービス株式会社,研修サービス,無,企業・官公庁向けグローバル人材のコミュニケーション研修事業・海外研修・英語コミュニケーション研修・異文化研修・中国語・その他外国語研修・コミュニケーションセミナー学校教育・学術支援事業・高校・大学・社会人教育センター・研究機関等向け語学・異文化研修・小・中学校における外国人語学指導員（ALT）による業務・小・中学校国際交流・理解教育の実施 2024年6月doda掲載求人より引用,東京都渋谷区東2-22-14ロビ氷川ビル,1969,代表取締役 松本 和久,,70 百万円,,"Failed to retrieve page, status code: 410",
2024-08-01,株式会社セレクティー,学習塾・予備校・専門学校,3,■事業内容：個別教室、家庭教師派遣を中心とする総合教育サービス事業を行っています。個別教室のアップル、家庭教師のアップルを展開しています。代表は公立学校での教員経験を持ち、一人ひとりのニーズに合わせた教育サービスの必要性を鑑み1996年に創業を開始しました。現状は仙台市内に個別教室を15教室展開しています。,宮城県仙台市青葉区中央3-1-24荘内銀行ビル5F,1996,,427,30百万円,30.0,"Failed to retrieve page, status code: 410",
2024-07-01,株式会社トヨタ中央自動車学校,学習塾・予備校・専門学校,1,■事業内容： 自動車教習所及び豊田市交通安全学習センターの受託運営,愛知県豊田市三軒町8-18,1964,,86,20百万円,,https://www.tcds.co.jp/,
2024-08-01,株式会社アオバインターナショナルエデュケイショナルシステムズ,学習塾・予備校・専門学校,3,当社は東京都内を中心に国際バカロレアの教育方針のもと「世界で活躍する国際人」の育成を目指し、インターナショナルスクール及びバイリンガルプリスクール（認可外保育施設）を11拠点展開。今後も積極的な事業展開を進めて参ります。,東京都練馬区光が丘7-5-1,2013,,177,722百万円,,https://www.japaninternationalschool.com/ja/,
2024-07-01,労働者協同組合ワーカーズコープ・センター事業団,その他・各種スクール,1,≪事業内容≫◆子育て関連事業(保育園・学童クラブ・児童館・児童デイサービスなどの運営)◆自立就労相談支援◆公共施設管理運営 など,東京都豊島区東池袋1-44-3 池袋ISPタマビル7F,2001,代表者 田嶋 羊子,500,,29.0,http://workers-coop.com/,
2024-07-01,学校法人都築学園,学習塾・予備校・専門学校,1,【学校法人都築学園】都築学園グループの関連校である都築学園は、大学・高等学校・専門学校・幼稚園まで、広く人々の教育におけるサービスを展開してきました。創設時より、都築学園グループは、「個性の伸展による人生練磨」を一貫して建学の精神とし、生徒の健やかな成長を見守りつづけます。,福岡県福岡市南区玉川町22-1,1956,,,,,http://www.tsuzukigakuengroup.com/affiliated_school/institute_1,
2024-08-01,学校法人吉田学園,学習塾・予備校・専門学校,7,■事業内容学校教育（大学・専門学校）■吉田学園の特徴：社会に貢献できる優れた職業人の育成を目的に、コンピュータ技術職、公務員、スポーツトレーナー、介護福祉士・保育士等の福祉職、理学療法士・作業療法士・救急救命士・臨床工学技士・視能訓練士・歯科衛生士等の医療職、動物看護師、自動車整備士等を養成する専門学校を開校しました。2013年には、教育理念「人間力教育を根幹とした医療人の育成」のもとに札幌保健医療大学を開学し、少子化による大学・専門学校等の高等教育機関間の競争が激化する中において、大学及び専門学校群の教育ネットワークを有する学校法人として、社会から一定の評価を得ています。,北海道札幌市中央区南三条西1-15,1956,,,,,http://www.yoshida-g.ac.jp/,
2024-07-01,学校法人美専学園,学習塾・予備校・専門学校,1,■事業内容：昭和36年創立で、学校教育法第82条8項の専門学校認可道内第1号。デザイン系と医療系の各専門学校を運営しております。,北海道札幌市北区北二十四条西8-1-12,1987,,60,,,https://bisen-g.ac.jp/,
2024-06-01,有限会社佐々木塾,学習塾・予備校・専門学校,1,■事業内容・小学生から高校生までを対象とした、進学、補習学習塾■会社の特長・少人数指導、個別指導学習塾。地域密着型の塾として、しっかりと面倒みるをモットーに仕事を行っています。,愛知県犬山市大字犬山字下時迫間14-3,1976,,15,3百万円,,http://www.sasakijuku.com/,
2024-07-01,株式会社いきいき舎（スクールIE足立舎人校・船橋本町校）,学習塾・予備校・専門学校,1,■指定居宅サービス事業（デイサービス）／サービス付き高齢者向け住宅の経営■学習塾の企画および運営■認可保育園および認可外保育施設の企画、運営、運営受託＜私たちの目指していること＞◎自立支援の「未来をデザイン」します。◎地域・自宅での活躍を目指し「最後まで主体的にいきる」ことを支援します。◎介護・保育・教育を通じ「生涯現役」の実現を目指します。,千葉県松戸市新松戸2-9 トレノ新松戸4F,1999,代表取締役会長 松井 秀文、代表取締役社長 草間 邦博,,2500万円,,http://www.ikiikisya.com/,
2024-05-01,株式会社飛鳥,学習塾・予備校・専門学校,8,■事業内容： 小学生・中学生・高校生を対象とした学習塾の運営,岡山県岡山市南区三浜町2-11-5,1987,,10,10百万円,,https://www.katogakushujuku.com/,
2024-08-01,学校法人日本教育財団,学習塾・予備校・専門学校,9,■事業内容：大学・専門学校の運営モード学園・ＨＡＬ・医校/医専など 大学/専門学校を運営する国内最大級の学校法人★国内／東京・大阪・名古屋★海外／ニューヨーク・パリ・ミラノ・上海・北京・台北,大阪府大阪市北区梅田3-3-1,1966,,2000,,,https://www.nkz.ac.jp/,
2024-07-01,株式会社浜教育研究所,学習塾・予備校・専門学校,2,■事業内容：幼児（年少下）から小学2年生までを対象とした能力開発型の幼児教室「はまキッズオルパスクラブ」を運営■浜学園グループにおける事業の特徴：浜学園は、1959年春、「英語・数学塾」という名称で創設以来、子どもたちの教育に携わってきました。これまでに蓄積した独自の指導ノウハウを活かし、日々よりよい授業を提供することが同グループの使命です。浜学園は一人ひとりの能力を最大限に伸ばすことを主眼に置いています。そして、志望校合格という夢の実現へ向けて、塾生や保護者の方々をサポートするさまざまな仕組みを実践しています。,兵庫県西宮市甲風園1-5-24,2006,,450,10百万円,,https://www.hamakids.jp/?gad_source=1&gclid=EAIaIQobChMIw52XjqfzhAMVn80WBR1z0gjEEAAYASAAEgKKRfD_BwE,
2024-08-01,株式会社アカデメイア・ビジョン,学習塾・予備校・専門学校,2,■業務内容：学校法人２１世紀アカデメイアへのコンサルティング機能およびシンクタンク機能として学園の運営支援を行っています。２１世紀アカデメイアは、創立から60年以上の歴史を有する学校法人Adachi学園が2023年4月に名称変更して誕生しました。東京、大阪、名古屋、福岡を拠点に17の専門学校と1つの日本語学校を展開し、2023年からは富士五湖にも拠点を開設しダイナミックな変革を遂げている学校法人です。ロサンゼルスを中心とする海外展開も推進しており、時代の変化に合わせた人材を輩出すべく、「大学も専門学校も超える新たな学びの場」を提供しています。,山梨県南都留郡富士河口湖町河口3077-20,1993,,76,100百万円,,https://www.akademeia21.com/affiliate/,
2024-07-01,株式会社ノーベル学習館,学習塾・予備校・専門学校,2,■事業内容：・当塾は1960年創業以来、地域の一員として子供たちの志の実現にむけて『学力の向上』と『社会性の育成』に取組んでいます。・当塾では、『学校と仕事に上下はない。自ら選択した行きたい学校に進学し、やりたい仕事で社会に貢献しよう！』『そのために何を・いつ・どのように行動するのか、自らの人生の選択をしよう』と生徒に伝えております。そのような生徒を育てていることから、お陰様で多くの合格実績を出すことが出来ており、『教育コーチング優良認定校』に指定されております。,広島県竹原市中央4-6-24,1995,,26,10百万円,,http://www.nobel-g.co.jp,
2024-07-01,株式会社ジョブインターナショナル,その他・各種スクール,2,■事業内容：・輸出、輸入、スポーツクラブの運営・輸入（スポーツサイクル及びサイクル用品、玩具、ギフト商品）・輸出（スポーツサイクル及びサイクル用品）・運営（サッカースクールの運営）,大阪府吹田市垂水町3-34-8,1994,,12,20百万円,29.0,http://www.job-cycles.com/,
2024-08-01,株式会社アカデミー,学習塾・予備校・専門学校,13,【事業内容】小学生、中学生、高校生の進学・受験指導、幼児の知能開発教育事業 栃木県を中心に76校舎を展開。0歳～18歳まで一貫教育を行い、 受験合格実績は県内NO1を誇る総合教育企業。【業態】〇幼児教育（堯舜国際幼稚舎、堯舜国際インターナショナル、アフタースクール進学塾）〇集団指導（進学塾QUALIER、進学塾ACADEMY）〇個別指導（個別指導満点の星、河合塾マナビス）,栃木県宇都宮市細谷町371-12,1980,,734,200百万円,35.0,http://www.academy.co.jp/,
2024-08-01,株式会社サンノウインターナショナル,学習塾・予備校・専門学校,3,■事業内容：山王学院は難関中学・高校・大学受験生を専門に指導する進学塾です。生徒一人ひとりの「学力」だけでなく、社会に出てからも活かせる「人間力」を育むことを目指し、知多半島地域を中心にハイレベルな教育サービスを提供しています。小中学部に加え、私立中学進学コース、公立中高一貫校受検コース、東進衛星予備校部門、英会話部門と子どもたちに幅広く学んでもらえる環境が整っており、あなたのスキルにあった部門で力を発揮していただけます。,愛知県半田市清水北町14,,,25,10百万円,,なし,
2024-07-01,株式会社アビタス,その他・各種スクール,3,当社は、国際資格取得の総合ビジネススクールで、教育を通して国際的に通じる人材を創出しています。世界基準の資格・学位・修了証の普及を通してグローバルキャリアの構築に貢献しております。世界を常に意識し、学び続け、変化に対応し続けることこそが、ビジネスパーソンに求められています。アビタスは挑戦し続ける一人ひとりに常に寄り添い、一人ひとりがキャリアオーナーシップを持てるよう、サポートし続けています。,東京都渋谷区代々木2-1-1新宿マインズタワー15階,1995,,85,70百万円,,https://www.abitus.co.jp,
2024-07-01,株式会社トモノカイ,その他・各種スクール,2,「教育の再設計」により、次の時代を拓き、未来に生きる人材を育むために、 学ぶ人と誠実に向き合い、学びを支援する人と一緒に成長しながら、 個々の可能性を広げる様々なコンテンツを創り提供したいと考えています。私たちは日本有数の大学生ネットワーク、 Web やIT技術の活用により多数のサービスを展開しています。＜扱うサービス＞・学生向けメディア事業・家庭教師事業・講師求人事業・留学生支援事業・学習デザイン事業,東京都渋谷区渋谷2-12-24東建・長井ビル5F,2000,,106,17百万円,32.0,http://www.tomonokai-corp.com/,
2024-08-01,株式会社教育測定研究所,その他・各種スクール,13,■事業概要：●テスティング&ラーニング事業「英語コミュニケーション能力判定テストCASEC」を始めとするコンピュータ適応型、かつ項目応答理論を利用したテストおよびe-ラーニング開発●テスト分析・コンサルティング事業次世代テスト研究・開発。コンサルティングおよびデータ解析業務●テスト・オペレーション事業テストの管理・運用・採点等に関するアウトソーシング事業,東京都港区港南1-8-15Wビル13F,2001,,170,73百万円,39.0,http://www.jiem.co.jp/,
2024-06-01,セイハネットワーク株式会社,学習塾・予備校・専門学校,1,【総合教育サービス業】■英会話教室事業■保育事業■ダンス教室事業■そろばん教室事業■カルチャー教室事業■プログラミング教室事業■オンライン英会話事業■留学事業■オリジナル英語教室教材の企画・製作■学校法人日本教育学園でのインターナショナル幼稚園の運営■KITAKYUSHU GLOBAL GATEWAY（KGG）の運営,福岡市博多区店屋町1-35 博多三井ビル2号館（本社）,1985,代表取締役 坂口 正美,2252,900万円,,https://www.seiha.com/company/,
2024-07-01,株式会社クレアール,学習塾・予備校・専門学校,3,■事業内容個人向け資格・検定試験・公務員試験対策等指導事業、法人（大学・企業等）向け資格取得・公務員試験対策支援教育事業■取扱講座公認会計士、簿記検定、税理士、公務員、司法書士、社会保険労務士、給与計算実務能力検定、行政書士、宅地建物取引士、中小企業診断士、ファイナンシャルプランナー 情報処理（ITパスポート・情報セキュリティマネジメント）,東京都千代田区神田三崎町1-1-17ハヤシビル,1998,,60,70百万円,,https://www.crear-ac.co.jp/,
2024-06-01,株式会社向ヶ丘自動車学校,その他・各種スクール,1,自動車学校の運営・普通自動車教習・自動二輪車教習・普通二種免許教習・ペーパードライバー教習 など,神奈川県川崎市宮前区菅生4-6-1,2006,代表取締役 後藤 博之,87,"1,000万円",38.8,https://booboo-school.com/mukogaoka/,
2024-06-01,株式会社マニア・マニア,その他・各種スクール,1,■芸能スクール運営★エンタメ業界を支える、新たな人材を発掘！次の未来へと向かっています！★＜運営校＞・ワタナベエンターテイメントカレッジ・ワタナベコメディスクール・ワタナベエンターテイメントスクール東京校/福岡校・渡辺高等学院 東京校/名古屋校/大阪校・渡辺大阪芸術学院・渡辺ミュージカル芸術学院,東京都渋谷区恵比寿南2-12-18,1973,代表取締役・理事長 渡辺 ミキ,50,1000万円,34.0,https://www.we-school.net/,
2024-08-01,株式会社神戸教育研究所,学習塾・予備校・専門学校,9,■事業内容：小中高生を対象とした進学塾の運営・個別指導塾の運営・映像予備校の運営をしています。神戸市を中心に24拠点を展開する創業49年の学習塾「久保田学園」を中心にした塾グループです。 公立トップ高校専門集団授業の「久保田学園」（高校部４教室、小中学部9教室）、成績アップにとことんこだわる「進学個別指導スリーアップ」（３教室）、現役大学受験予備校の「河合塾マナビス」（8校舎）を運営しています。,兵庫県神戸市兵庫区下沢通1-5-11湊川パークサイド,1989,,237,10百万円,,https://www.kubotag.com/,
2024-07-01,学校法人希望学園,その他・各種スクール,1,「札幌第一高等学校」、および「北嶺中・高等学校」の運営,北海道札幌市豊平区月寒西1条9-10-15,1958,理事長 丹田 貢,170,,30.0,https://www.kibou.ac.jp/,
2024-08-01,学校法人創志学園,その他・各種スクール,44,■事業内容：幼児・高等・専門学校・大学教育、公益活動を幅広く、全国各地に拠点を広げ、総合教育を行っています。,兵庫県神戸市中央区磯辺通4-1-5,1966,,2363,"37,300百万円",,https://seg.ac.jp/,
2024-08-01,株式会社ＮＳＧアカデミー,学習塾・予備校・専門学校,2,■企業概要：株式会社NSGアカデミーは、資格取得教育事業を運営管理する株式会社クレアール、パソコン教室を運営管理する株式会社チアリー、スイミングスクール事業を運営管理する株式会社中条スイミングスクール、ワンストップスクーリングの習い事教室を運営する株式会社DreamAdvanceと5社の持ち株会社である株式会社エヌエスジー教育ネットワークの6社で構成する教育事業グループを形成しております。,新潟県新潟市中央区東大通1-11-32,2003,,805,30百万円,,https://www.nsgac.co.jp/,
2024-07-01,株式会社ロボット科学教育,その他・各種スクール,9,■事業内容： ・ロボット製作を通じて科学を学ぶ教室「CREFUS」の運営／フランチャイズチェーンビジネスの展開 ・幼児向け「科学する心、クリエイトする力を養う教室／Kicks ジュニアエリート」の運営／教育用LEGO教材の１次販売代理店として、日本国内で教育教材の販売・1日ロボット製作教室等の科学教育イベントの企画／運営 ・科学を学ぶ教育プログラム、カリキュラム、テキスト、マニュアルの開発及び製作,神奈川県横浜市青葉区榎が丘1-6,2003,,144,40百万円,39.0,http://www.crefus.com/,
2024-07-01,NOVAホールディングス株式会社,学習塾・予備校・専門学校,1,英会話事業、学習塾事業、コンテンツ事業、出版事業、法人向け研修事業、通訳翻訳事業、スポーツ事業、留学事業、子ども事業など■英会話スクール・学習塾の運営■企業・団体向けの語学研修やビジネス研修を企画、提案、実施■通訳・翻訳サービス■学校向け外国人講師派遣■店舗開発・FC開発など■グループ会社の管理部門・人事・経理・システム,本社東京都品川区東品川2-3-12シーフォートスクエアセンタービルディング9F,1996,代表取締役社長 稲吉 正樹,3628,8000万円,,https://nova-holdings.jp/,
2024-08-01,株式会社創英コーポレーション,学習塾・予備校・専門学校,13,■事業内容： 個別指導学習塾 「創英ゼミナール」の運営 ※直営による教室数、生徒数において神奈川県最大オールイングリッシュプリスクール 「ノービルキッズ」の運営43ヶ国語対応の語学教室 「ワールド外語学院」,神奈川県平塚市日向岡2-2-10,1999,,200,10百万円,33.0,http://www.souei.net/,
2024-06-01,学校法人日建学園,学習塾・予備校・専門学校,2,■事業内容：教育・学習支援業のうち専修学校、各種学校を運営しています。,栃木県宇都宮市簗瀬4-3-13,,,,,,https://www.utsunomiyanikken.com/,
2024-07-01,学校法人駿河台学園,その他・各種スクール,40,■事業内容創立100年を超える駿河台学園は、大学受験予備校である「駿台予備学校」を中心に専門学校、小学校・中学校・高等学校、海外校等を展開する総合教育機関です。事業内容が幅広いため、業務内容も充実しています。例えば予備学校の校舎で勤務をする生徒・学生指導担当を始め、生徒募集戦略の立案をおこなう企画部署、ＩＣＴを活用した学習ツールの提供をおこなうEd Tech（エドテック）、授業テキストや参考書などの出版・編集をおこなう部署もあります。様々な業務があるため、自身の適性を活かした働き方ができることも駿台の強みの一つです。※教科指導は含みません。,東京都千代田区神田駿河台2-12,1918,,635,,,https://www.sundai.ac.jp/,
2024-08-01,学校法人実務学園,学習塾・予備校・専門学校,4,■事業内容：教育・学習支援業のうち専修学校、各種学校を運営しています。,東京都豊島区池袋2-55-10,1982,,21,,,https://www.tokyonikken.com/,
2024-07-01,学校法人信濃学園,学習塾・予備校・専門学校,2,専門学校の運営建築関連の基礎から実践までを体系的に教育。建築・建設分野でのスペシャリストの育成に尽力。【最年少2級建築士の輩出実績トップクラス】,新潟県新潟市中央区笹口1-21-1,1999,,,,,https://www.niigatanikken.com/,
2024-07-01,株式会社ふれ愛チャイルド,その他・各種スクール,2,・保育施設の企画・運営・コンサルティング,北海道札幌市東区東苗穂三条3-1-31,2003,,150,3百万円,,http://hureai-child.co.jp/index.html,
2024-07-01,株式会社ＷＩＴＳ,学習塾・予備校・専門学校,1,学習塾の運営英会話教室の運営体操教室の運営そろばん教室の運営上記に付帯する一切の業務,千葉県柏市豊四季1008-1-2F,2003,代表取締役社長 近藤 貴,1173,,,https://wits2003.com/,
2024-08-01,ワールドテニスアカデミー有限会社,その他・各種スクール,1,■事業内容： 四日市と鈴鹿市にてテニス、サッカー教室の運営を主に行う会社です。■特徴：当社は不動産建設業のマルエイハウス有限会社により開業した後に、ワールドテニスアカデミー有限会社として開業しました。テニス及びサッカースクールは4歳のジュニアから70代のシニアまで、レベルに合わせたさまざまなクラスを展開しています。また、レッスン体験会や各種イベントも開催しています。スポーツの楽しさをより多くの人に知っていただきたいと願っています。,三重県四日市市美里町2008,2003,,,,,"Failed to retrieve page, status code: 410",
2024-07-01,学校法人ふれ愛チャイルド,その他・各種スクール,1,■事業内容：・私立学校事業・保育事業■運営施設：・ときわみなみの幼稚園、西野ふれ愛保育園■日総グループについて：・当社は、北海道内において医療・福祉施設、学校・保育園、社員食堂等への給食サービスを提供している株式会社日総のグループ会社です。,北海道札幌市南区真駒内380-18,1991,,,,,https://fureai-child.net/,
2024-07-01,学校法人栗原学園,その他・各種スクール,4,■概要：学校法人栗原学園を中核とする私たちのグループは、次世代の育成を通じた地域社会への貢献を経営理念に掲げ、幼稚園と保育園を運営しています。横浜市都筑区でやまた幼稚園とやまた保育園を運営しています。川崎市幸区でひよし保育園を運営しています。,神奈川県横浜市都筑区東山田町351-1,1969,,240,,,https://kuriharagakuen.ac.jp/,
