更新日,名称,業界(小分類),求人有無,事業内容,所在地,設立,平均年齢,従業員数,資本金,企業URL,代表者,上場市場名
2024-08-01,株式会社日立医薬情報ソリューションズ,システムインテグレータ（SIer）,29,■事業内容：製薬業界のお客様向けにITソリューションを提供し、経営課題を解決。製薬業界の【研究開発システム】や【営業システム】を始め、【基幹システム】（品質管理・生産管理・会計管理・人事管理など）を含む製薬企業の全システムをトータルサポートしています。・情報システムの運用・保守に関するアウトソーシングの受託・情報システムに関するコンサルティング及び設計・導入と運用の受託・情報システムの開発業務の受託・コンピューターソフトウエアの製作、販売及び賃貸など,東京都千代田区神田須田町1-23-1住友不動産 神田ビル2号館,2005,43.0,300,250百万円,https://www.hitachi-pi.co.jp/,,
2024-06-01,エクシオ・システムマネジメント株式会社,ITアウトソーシング,1,ネットワークシステムのマネジメントやカスタマーセンターの運営、IT機器のリファービッシュなどICT分野におけるさまざまなシステム保守運用サービスの提供【認証規格】ISO27001（情報セキュリティ管理※東京本社のみ）プライバシーマーク（個人情報保護）【許認可等】有料職業紹介 13-ユ-305324労働者派遣 派13-305032,東京都港区三田3-5-27 住友不動産三田ツインビル西館7階,1986,,670,1億円,https://www.exeo-systemmanagement.co.jp/,代表取締役社長 深山 博文（みやま ひろふみ）,
2024-08-01,株式会社インタラクティブ・コミュニケーション・デザイン,システムインテグレータ（SIer）,5,■企業概要：同社はモバイルとインターネットに特化し、戦略・企画立案などのコンサルティングからシステム開発、政策、保守・運用に至るまでワンストップで課題を解決する「ソリューションサービス・プロバイダー」です。20年先を見据えた先見性のある企業であり、経営層が独立した97年からシステム開発とUI/UXデザインの融合した世界の未来を予測し、SEとデザイナーを融合させた企業を起ち上げました。両軸の融合により現在では他社との圧倒的な優位性となっています。,東京都港区赤坂1-12-32アークヒルズアーク森ビル17F,2000,35.0,139,54百万円,https://www.icd.co.jp,,
2024-07-01,株式会社カサレアル,システムインテグレータ（SIer）,7,■当社の特徴：東証プライム市場上場のテクマトリックス株式会社の100%子会社。プライム案件90％超の優良企業です。 カサレアルでは、DXを推進したいというお客様企業のニーズに応えて、Webアプリケーションの開発支援サービス、クラウドネイティブ技術を活用した生産性向上・品質向上のための支援サービス、実践的な先端技術研修サービスを提供しています。,東京都港区港南1-2-70,1999,37.0,90,50百万円,http://www.casareal.co.jp/,,
2024-06-01,株式会社アローズ・システムズ,システムインテグレータ（SIer）,5,■概要：web系のシステム開発とwebサイト構築に強みを持つ独立系のwebインテグレーターです。ぐるなび社や楽天社など、これまでの実績から直請でシステム開発を行っています。直受けと2次受けの比率は8:2で長期的なパートナーとしてクライアント企業の要望に応えています。。■事業内容：・Webインテグレーション事業・システムインテグレーション事業,神奈川県横浜市西区みなとみらい2-3-1クイーンズタワーA,1999,31.0,155,61百万円,"Failed to retrieve page, status code: 410",,
2024-06-01,株式会社コムエッジ,システムインテグレータ（SIer）,6,■企業概要：ソフトウェア開発という幅広い分野の中で、特に地理情報システムの開発に強みを持っております。同社設立の経営層がGIS・CADメーカ出身ということもあり、業務知識・クオリティには自信があります。,大阪府大阪市西区阿波座2-2-18,2005,34.4,37,10百万円,http://www.comedge.co.jp/,,
2024-08-01,プライムソリューションズ株式会社,システムインテグレータ（SIer）,7,■事業内容：プロジェクトマネジメント、Oracle EBSソリューション、Oracle データーベースを活用したシステム構築、エンタープライズ・システム全般の構築、Webアプリケーション開発、インターネットを活用したBtoB、BtoCシステム構築、モバイル端末向けの業務アプリケーション開発、Saleseforce導入支援・開発等を行っております。,東京都港区浜松町1-10-11浜松町OSビル6F,2005,38.0,47,30百万円,http://www.psol.co.jp,,
2024-08-01,株式会社トゥービーソフトジャパン,ベンダ（ハードウェア・ソフトウェア）,求人なし,,東京都千代田区外神田5-3-1秋葉原ＯＳビル 10Ｆ,2005,,,10 百万円,"Failed to retrieve page, status code: 410",代表取締役 崔 收華,
2024-08-01,株式会社フルマークス,システムインテグレータ（SIer）,4,■事業内容：システムの構築・クライアントサイドに立ったソリューションの提供／戦略からインテグレーションまでを支援するコンサルティング・既存システムの最適化・新規システムの構築提案、構築支援／各分野の専門技術スタッフの派遣,東京都千代田区神田神保町1-14-3,2005,32.8,27,30百万円,https://www.fullmarks.co.jp/,,
2024-07-01,株式会社センティリオンシステム,システムインテグレータ（SIer）,5,■事業内容：ソフトウェア開発、インターネットサービスプロバイダ、サーバホスティング、ネットワーク・サーバの運用、ハードウェアの輸入販売、ECサイトの運営,東京都品川区東五反田1-13-12いちご五反田ビル 9F,2005,36.0,40,25百万円,http://www.centsys.jp/,,
2024-07-01,株式会社アイテック,システムインテグレータ（SIer）,3,■事業概要教育事業本部：情報処理技術者試験対策を中心としたIT教育サービスの提供・通信教育事業・書籍の出版、販売事業・企業向け社員研修事業人材事業本部：企業へのITエンジニア派遣・ITエンジニアの派遣事業,東京都港区西新橋1-18-6クロスオフィス内幸町6F,2005,45.0,150,80百万円,https://www.itec.jp,,
2024-08-01,ＳＴＳＤ株式会社,システムインテグレータ（SIer）,1,■事業内容：企業向けCMSパッケージ「writeWired」を開発／運営しております。「writeWired」とは、コンテンツ管理、メール配信、WEBマーケティングに必要不可欠な高度なユーザー行動履歴分析など、あらゆる機能を統合したマーケティングプラットフォームです。効率的なWEBサイトの運営を助けるだけでなく、日々変化するWEBマーケティングへのニーズに柔軟に答えることができるのが同社「writeWired」の特徴です。,東京都渋谷区東2-24-6サワトビル5F,2005,30.0,2,10百万円,"Failed to retrieve page, status code: 410",,
2024-06-01,コンポーネントデザイン株式会社,システムインテグレータ（SIer）,1,■事業内容： ・受託システム開発・自社開発プロダクト、サービス運営※技術者派遣や客先常駐の業務は行っていません。■当社について：・当社は高品質なアプリやシステム開発サービスを適正価格かつ丁寧な対応で提供しています。・エンジニア派遣に類する業務を行っていません。開発チームは社内にいるためアプリやシステムの運用開始後も開発を担当したチームが対応しやすい体制です。・黒字かつ実質無借金経営です。多数のエンドユーザー企業と継続的に取引しており、特定の取引先への依存はありません。,東京都千代田区岩本町3-2-10,2005,,,20百万円,https://www.cmpd.jp/,,
2024-07-01,株式会社ビー・エス・エス,システムインテグレータ（SIer）,8,1992年の設立時より30年にわたり、三井物産グループのITコンサルティング会社として、三井物産グループ各社に対して、以下のITサービスを展開しています。【具体例】アプリケーションシステムの導入支援／ITインフラの導入支援／業務分析、改善提案／システムの開発・保守・運用／グループ各社の社内IT業務受託【主な取引先】三井物産、および三井物産グループ関係会社,東京都渋谷区渋谷2-2-10青山H&Aビル2F,1992,48.0,29,10百万円,http://bss-coltd.co.jp/,,
2024-07-01,株式会社トーク,システムインテグレータ（SIer）,2,■事業内容：あらゆるシーンにおいて、顧客のニーズに添った「トータルシステムソリューション」を提案します。,広島県広島市中区大手町3-8-1大手町中央ビル11F,1997,,36,34百万円,http://www.tohk.co.jp/,,
2024-06-01,株式会社フェイスポート,システムインテグレータ（SIer）,6,■概要：業務系システムやスマホ向けアプリの開発を行っています。大手上場企業の案件を直請けにて多数開発しております。,兵庫県神戸市中央区江戸町100高砂ビル5F,2005,30.0,20,10百万円,https://www.feissport.com/,,
2024-06-01,株式会社サンテクノス,システムインテグレータ（SIer）,1,■SI事業■SES事業■教育事業■DX事業■ホームページ・ECサイト制作,福岡県福岡市博多区博多駅東二丁目2-2 博多東ハニービル4F,2003,,40,,https://www.santechnos.com/index.html,代表取締役 林田 茂宏,
2024-06-01,株式会社ＷＲＩソリューション,システムインテグレータ（SIer）,1,■事業内容： 基盤・運用ソリューション設計・構築IT運用コンサルテーションサービスアプリケーション開発,東京都江東区木場2-5-7KHビル9F,2005,32.0,20,25百万円,http://www.wrisolution.co.jp/,,
2024-07-01,株式会社シティクラフト,システムインテグレータ（SIer）,3,■事業内容：システムアーキテクチャ設計や、フレームワーク開発、開発標準策定等の開発基盤構築といったコア分野を専門に担うシステムインテグレーターです。,愛知県名古屋市中区錦2-19-18,2005,36.0,24,10百万円,http://www.city-craft.co.jp/,,
2024-08-01,株式会社アール・エス・アール,ITアウトソーシング,6,■事業内容： ・ITエンジニア教育・派遣事業・ソリューション事業・Webアプリケーション開発・ECサイトの開発・運用保守,広島県広島市中区大手町2-7-7小松ビル,2001,,41,10百万円,"Failed to retrieve page, status code: 410",,
2024-08-01,ユーザーサイド株式会社,システムインテグレータ（SIer）,5,当社は、北海道に思い入れのあるITのプロフェッショナルが集い、設立した会社です。「お客様のお役に立ちたい」という私たちの熱い想いが、この社名に込められています。総合ITサービス企業として、ITを活用した企業の事業発展、ビジネス価値の創造をお手伝いしています。ITに関連することは何でも柔軟に対応し、全体最適からお客様の要望を実現するためのソリューションを提案、提供します。,北海道札幌市北区北九条西3-19-1ノルテプラザ,2005,34.0,40,67百万円,https://www.userside.co.jp/,,
2024-08-01,有限会社ホームニクス,ベンダ（ハードウェア・ソフトウェア）,4,■事業内容： ホームページ・WEBシステム開発・保守■企業概要：徹底した顧客目線でお客様の悩みを解決いたします。当社では、当たり前を当たり前だと思わない、常識を常識だと思わない精神で徹底して顧客目線にたって商品開発を行っております。,福岡県福岡市博多区石城町18-13グラン・ヨーロピアン1005,,,3,3百万円,https://homenix.jp/,,
2024-08-01,株式会社アール・シー・エス,システムインテグレータ（SIer）,3,■事業内容：電算機ソフトウェアの開発・ソフトウェア・パッケージの販売、電算機ならびに周辺機器・ソフトウェア・関連機材の販売及び賃貸業務、電算機ならびに周辺機器・ソフトウェアの保守サービス、事務計算及び科学技術計算の一般受託、人材派遣事業,香川県高松市錦町1-4-37,1990,44.0,94,75百万円,"Failed to retrieve page, status code: 410",,
2024-07-01,株式会社ネットコムBB,システムインテグレータ（SIer）,8,■概要：同社は、2005年3月にITベンチャー企業として設立して以来、ホームページ作成やECサイト出店、モバイルアプリ・Webシステムなど幅広い事業を展開しています。2007年には地元インターネットプロバイダの事業継承を行い、インターネット黎明期から蓄積されたノウハウという強みも加わっています。変化のスピードが早いIT業界において、今後も多様化する顧客のニーズに応えられるよう、幅広い分野での事業展開を行っています。今後はIPOを目指し、全国展開を図っていく予定です。,佐賀県佐賀市天神3-2-23,2005,32.0,53,69百万円,"Failed to retrieve page, status code: 410",,
2024-07-01,ＮＳＳＬＣサービス株式会社,システムインテグレータ（SIer）,4,■事業内容： NSSLCサービスは、日鉄ソリューションズグループの一員として、システムの運用設計から運用サービス・プロダクトサポートなどを行う会社です。2005年、日鉄ソリューションズグループ内に分散していたシステム運用・保守事業を統合一元化して誕生しました。現在は、日鉄ソリューションズ社ITインフラソリューション事業部門内の運用・保守を担当する部署として、NSSLCサービス株式会社が位置づけれられています。,東京都中央区新川2-27-1東京住友ツインビル東館,2005,42.0,428,250百万円,https://www.nssol.nipponsteel.com/nsslc/,,
2024-06-01,株式会社イグアス,ベンダ（ハードウェア・ソフトウェア）,1,■概要 IT商社として最先端のテクノロジーを駆使し高度なソリューションを全国のパートナーに提供しております。IBMやHUAWEIなどのディストリビューターとして豊富な実績を保有していることも 特徴です。 IBMディストリビューターとしては、すべてのIBMハードウェア製品、ソフトウェア製品を取り扱い、構成支援、テクニカルサポート、稼働検証など、高い技術力でパートナー様をサポートいたします。IBM製品以外にもパートナー様のニーズに合わせた特徴あるサーバー製品や PC、周辺機器等を幅広く取り扱っています。,神奈川県川崎市幸区堀川町580,2006,,340,90百万円,https://www.i-guazu.co.jp,,
2024-08-01,株式会社レコモット,システムインテグレータ（SIer）,7,【事業内容】■今いる場所がオフィスになるクラウドMAM「moconavi」https://moconavi.jp/moconaviとは、テレワークやBYODで仕事をする機会が増えている中、社外でも安全に業務ができるよう開発された高セキュリティのサービスです。moconaviを導入することで、日常業務で使用しているメール、電話帳、ストレージ、CRMなどの各ツールをどんな場所でも、かつ安全に操作することができます。■会社携帯不要！2台持ちから解放される、法人向け050番号の電話サービス「moconavi050」https://moconavi.jp/m050/,東京都千代田区麹町3-3-8麹町センタープレイス8F,2005,39.0,86,100百万円,https://recomot.co.jp/,,
2024-05-01,株式会社トリモ,システムインテグレータ（SIer）,2,■事業内容： 創業以来、金融系を中心としシステム開発支援をメイン事業として行います。また、Web系やAndroid開発のシステム開発支援も積極的に進めています。その活動の中で得た知識、経験を生かし、新しい技術に挑戦しながら、お取引のある企業様により信頼される技術の提供を目指します。,東京都台東区東上野1-9-7YTSビル2F,2005,36.0,41,10百万円,http://www.torimo.co.jp/,,
2024-06-01,株式会社コンテンツワン,ITアウトソーシング,1,★大手有名企業との取引がほぼ100％！安定性長を継続！【SES事業】SES/派遣/紹介事業一般労働者派遣事業許可番号派13-304349有料職業紹介事業許可番号13-ユ-304045,東京都新宿区四谷三栄町4-11 YSビル4階,2005,36.0,,1200万円,https://contents-one.co.jp/,代表取締役社長 関根 義幸,
2024-06-01,ｓｉｍｐｌｉｎｅ株式会社,システムインテグレータ（SIer）,3,■企業について： 「100年後もお客様、社員、社会から選ばれる企業であること」を企業理念と掲げています。■事業内容：・クラウドソリューション事業AWSによるITソリューションサービス（コンサルティング、システム要件定義・設計・構築・運用）を通してお客様（法人）の課題解決をご提供します。,東京都港区高輪2-14-17,2005,33.0,38,10百万円,http://www.simpline.co.jp/,,
2024-08-01,有限会社サクセスフュージョン,ITアウトソーシング,3,■事業内容： ・金融系システム開発支援オペレーティングシステム、ミドルウェア及びシステムインフラ等のサーバ・ネットワーク・システム構築、運用業務及び運用支援・保守維持管理。・物流系システム開発支援システム構築、システム運用業務設計、運用業務アプリケーションシステム設計開発。業務及びシステム運用支援・保守維持管理。・顧客業務システム開発支援メインフレームから分散システムまでプラットフォームに依存しない運用業務設計、顧客管理及び課金系業務アプリケーション設計開発。,神奈川県川崎市幸区古市場1-32-1河田ビル2F,2005,,7,1百万円,http://www.success-fusion.co.jp/,,
2024-07-01,株式会社ＩＴ働楽研究所,システムインテグレータ（SIer）,13,■概要:日立製作所および日立グループ各社を含む大手優良企業を取引先に多く持つ独立系SIです。グローバルな視野で最先端技術開発、ソフトウェア開発、ネットワーク・サーバシステム開発などオールラウンドに事業を展開しています。※会社紹介の30秒動画はこちらから → https://saiyou.doraku-holdings.co.jp/voice/,東京都千代田区内神田2-14-10,2003,37.1,250,42百万円,https://www.dorakuken.co.jp/,,
2024-07-01,株式会社コネクテッド,システムインテグレータ（SIer）,1,■ドキュメント管理システムの開発（パッケージ）・販売およびコンサルティング,大阪市淀川区宮原1-1-1新大阪阪急ビル7F,2003,45.0,12,2000万円,http://www.connected.co.jp/,代表取締役社長 森 吉弘,
2024-08-01,株式会社デジタルブロックス,システムインテグレータ（SIer）,9,【高い技術力は当然ですが、コミュニケーションを軸とした「ヒューマン力」が同社の大きな強みです】■事業概要：小売り・卸・流通関連企業からの1次請け案件の他、富士通を始めとした大手SIerと協力した案件も行うバランスのとれた関西地場のシステムベンダーです。中規模の受託案件の受注実績もあり、今後売り上げの3割程度まで受託案件を拡大していく方針です。,大阪府大阪市北区鶴野町1-9梅田ゲートタワー13F,1998,32.0,130,22百万円,http://www.digitalblocks.co.jp/,,
2024-07-01,株式会社iD,ITアウトソーシング,4,■事業内容：ネットワーク技術R&D、ネットワーク機器開発・販売■特徴私たちiDは、ネットワークの研究開発に取り組んでおり、様々な分野のテクノロジーを最新のネットワーク技術でつなぎます。(1)共同研究 先端的なネットワーク、IoT、AI技術を、メーカ研究所、通信キャリア研究所、 大学研究機関などと共同研究に取り組んでいます。(2)装置開発、システム開発 ソフトウェア、ハードウェア、LSI、FPGAの、設計、製造、評価まで一環した開発に対応しています。(3)自社製品 当社オリジナル製品の研究、開発、量産製造、販売を行っています。,北海道函館市本町6-10五稜郭ビル 2F,2005,38.7,96,90百万円,http://www.intelligent-design.co.jp/,,
2024-06-01,デジタルソリューション株式会社,ベンダ（ハードウェア・ソフトウェア）,3,■企業概要：完成車メーカーや家電、鉄道、防衛メーカーからの受託解析や、解析ソフトの開発、ITアプリ開発などを行う企業です。本社の広島県のみならず、インドにも開発拠点を設けており、グローバルな活動を行っています。主な事業内容は下記になります。（1）自動車・航空・宇宙・重工・家電・工業炉・プラント・医療業界向け、解析ソリューションの提供（2）AIソリューションの提供（AIアルゴリズムの開発）（3）IoTシステムの開発（4）AR等のアプリケーション受託開発（5）独自流体解析ソフトウェアの開発・販売（6）解析エンジニア・ソフトウェアエンジニアの派遣,広島県広島市東区矢賀新町4-5-11DSIビル,1999,38.0,63,11百万円,http://www.digital-sol.co.jp/,,
2024-08-01,株式会社エムテックス,通信キャリア・ISP・データセンター,2,【一般派遣、特定派遣、工程請負など柔軟な形態での技術支援のできるエムテックス】■概要：・通信インフラ・技術支援 ・無線システム・技術支援・宇宙開発関連・技術支援・治具開発・設計支援,神奈川県横浜市港北区新横浜2-15-1中村ビル 7F,1992,,80,25百万円,https://www.mtex-yh.co.jp/,,
2024-08-01,株式会社ABI,ITアウトソーシング,18,■企業概要：プロジェクトマネジメントのプロフェッショナル集団として、プロジ大手金融業界、通信業界、EC関連などの様々な業界の大手企業を中心としてクライアントに対して、プロジェクト管理業務から上流工程特化型の開発支援事業を展開しています。■事業内容：１．上流工程に特化したプロジェクト支援を行う『プロジェクト統括事業』２．クライアントの様々なシステム開発を行う『プロジェクト統合開発事業』３．自社サービス,東京都中央区日本橋室町4-1-6クアトロ室町ビル9F,2006,36.1,279,50百万円,https://www.abi-inc.co.jp/,,
2024-08-01,株式会社アッカ・インターナショナル,ITコンサルティング,2,アパレルブランド向けECサイトの運用管理(商品の受発注管理、商品撮影、画像加工、コピーライティング、カスタマーサービス、物流等)ECデータ一元管理システム「ALIS」の開発・運用/WMS(倉庫管理システム)「ONE」の開発・運用,東京都港区南青山6-3-9MAビル3F,2006,,600,20百万円,https://www.acca-int.jp/,,
2024-08-01,クリエーションライン株式会社,システムインテグレータ（SIer）,16,■事業内容： ・アジャイル開発支援サービス事業・サブスクリプション事業■ビジョン：当社のビジョンは、「IT技術によるイノベーションにより顧客と共に社会の進化を実現すること」です。クラウド、OSS、アジャイル、DevOps、データ解析・機械学習等の先端技術について多くの経験および知識を有するITプロフェッショナル企業として、弊社は弊社の顧客と共に様々な付加価値を社会に提供し、「社会」および「人々」の進化に貢献します。,東京都千代田区神田佐久間町3-6,2006,,102,365百万円,https://www.creationline.com/,,
2024-06-01,株式会社ＪＴＢビジネスイノベーターズ,システムインテグレータ（SIer）,3,当社は2006年にJTBグループ内の新規事業開発を担う会社として設立されました。社名にある「イノベーターズ」の由来も、「自らイノベーションを起こす者であれ！」という「志」を表したものです。現在では、「生み出した事業の推進・成長」と「新たな事業の創出」の2軸にて会社運営をしています。,東京都港区港南1-6-31品川東急ビル 7F,2006,,80,100百万円,https://www.jtb-jbi.co.jp/,,
