更新日,名称,業界(小分類),求人有無,事業内容,所在地,設立,平均年齢,従業員数,資本金,企業URL,代表者,上場市場名
2024-07-01,ＺＡＣソリューション株式会社,システムインテグレータ（SIer）,2,■事業内容： １．IT（情報技術）システムの構築およびコンサルティング２．労働者派遣事業３．通信販売用インターネットのショッピングモールの開設、企画、制作、運用,神奈川県川崎市麻生区万福寺1-2-2新百合トウェンティワン1F,2010,,47,10百万円,https://www.zac-sol.co.jp/,,
2024-08-01,株式会社SAKURUG,ITコンサルティング,11,＜事業内容＞■QDXコンサルティング事業（システム開発・WEB制作などのDX支援）■Sangoport事業（ダイバーシティを推進する採用サービス）,東京都渋谷区桜丘町1-2渋谷サクラステージ セントラルビル17F,2012,31.0,94,50百万円,https://sakurug.co.jp/,,
2024-08-01,株式会社ファンリード,ベンダ（ハードウェア・ソフトウェア）,25,■事業内容（1）開発ソリューション…さまざまな業種・規模の基幹業務システム、Webサービス開発を担っています。iPhone/Android対応スマートフォンアプリなどのソフトウェア開発にも対応しています。（2）インフラソリューション…サーバー／ネットワークのインフラの要件定義から設計・構築・運用までワンストップでご提供します。最適なユーザービリティとセキュリティ対策をご提案します。（3）RPAソリューション…業務効率化やコスト削減といった目的に合わせて、業務の整理やRPA製品の選定から一貫したサービスをご提供します。,東京都豊島区西池袋1-11-1メトロポリタンプラザビル15F,2013,39.8,210,80百万円,https://www.funlead.co.jp/,,
2024-07-01,ハンズラボ株式会社,ベンダ（ハードウェア・ソフトウェア）,3,★当社について親会社、株式会社ハンズのITソリューション事業部が独立をする形で設立。設立当初からAWSを活用した開発環境を構築。現在もAWS上に構築している開発環境にてシステムの開発、既存システムの保守運用を行っています。2022年にハンズがカインズの傘下に入り、売上高1兆円を超える小売り企業グループになりました。IT改革を推し進めているグループの一員として、ハンズもITによる業務効率化を加速させています。,東京都新宿区新宿6-27-30新宿イーストサイドスクエア3F,2013,,76,50百万円,https://www.hands-lab.com/,,
2024-07-01,株式会社アルテニカ,ITアウトソーシング,2,■企業概要：同社は2013年4月の設立以来、技術領域をネットワークやサーバーなどITインフラに特化し高度な専門技術を提供し続けています。ネットワークやサーバーはパソコンやインターネットに用いられている技術で、現代の情報化社会にとって欠かせない人々の生活を支えている技術です。同社ではそんなネットワークシステムとサーバーシステムの高い技術力を生かし、クライアントの技術パートナーとして事業を展開しています。リモートワークやスマートシティなどの推進により、IT業界の成長は止まることを知りません。,東京都品川区西五反田1-5-1A PLACE五反田駅前2F,2013,26.4,702,10百万円,https://artenica.jp/,,
2024-08-01,株式会社マクロビジョン,ITコンサルティング,7,■事業内容： （1）システムコンサルティング事業…ソフトウェア設計・開発などシステム関連のサポートをします。・ソフトウェア設計／開発・インフラ設計／構築・システム運用／保守・インフラ運用／保守・システムコンサルティング・システムエンジニアリングサービス（2）モバイル関連パートナー事業…通信関連の営業や販売スタッフの提供などパートナーとしての業務を行います。・通信関連企業各種営業スタッフの提供・通信関連企業各種販売スタッフの提供・モバイル関連製品のコンサルティング・通信関連各種請負業務,東京都渋谷区道玄坂1-18-2ノナカビル4F,2013,,15,12百万円,http://macro-vision.co.jp/,,
2024-07-01,株式会社デジタルトランスフォーメーション,ITアウトソーシング,4,■事業内容：新規事業立ち上げコンサルティング会社のプライマルホールディングスの一員として設立されました。企業の事業拡大を支援するなかで、フリーランス人材のマッチング、派遣・SESビジネス、業務受託案件の獲得・実行、BPOビジネス、研修ビジネスなどを展開しております。,東京都港区芝1-6-10芝SIAビル3F,2013,31.0,20,200百万円,https://dx-inc.co.jp/,,
2024-07-01,株式会社ライズ,ベンダ（ハードウェア・ソフトウェア）,2,■事業内容：ソフトウェア開発、システム基盤構築、システム運用・保守、システムコンサルティング,東京都品川区北品川1-23-21光和ビル1F,2013,,11,3百万円,http://rais.co.jp/,,
2024-07-01,スマートブルー株式会社,ITコンサルティング,2,■事業内容： 農地コンサルティング事業再生可能エネルギー事業発電所運営事業不動産コンサルティング事業（雑種地、山林、原野、池沼、遊休地の有効利用）農業用資材・種苗製造販売,静岡県静岡市葵区千代2-17-23,,,58,20百万円,https://smartblue.co.jp,,
2024-08-01,株式会社ｆｕｔｕｒｅｌａｂｏ,システムインテグレータ（SIer）,2,■事業内容：・インターンシップガイドの運営・大学生集客代行 ・アプリケーションソフトの企画、開発、受託、販売・ＳＩ事業・ハードウェアの企画、開発、受託、販売・前各号に附帯する一切の業務,東京都渋谷区渋谷3-5-16渋谷三丁目スクエアビル2F,2012,,30,,"Failed to retrieve page, status code: 410",,
2024-08-01,フラー株式会社,システムインテグレータ（SIer）,6,■事業内容フラーは、DX（デジタルトランスフォーメーション）が必要な全ての企業をアプリ開発を中心に支援するデジタルパートナー事業を行っています。戦略を考え、プロダクトを創り、事業を変革させる、そんなデジタル戦略をワンストップで提供しています。デジタルパートナー事業：事例紹介https://www.fuller-inc.com/works,新潟県新潟市中央区笹口1-2PLAKA2 NINNO,2011,32.0,151,37百万円,https://www.fuller-inc.com/,,
2024-08-01,ＫＤＤＩまとめてオフィス中部株式会社,通信キャリア・ISP・データセンター,6,■概要中小中堅企業様向け、KDDIサービスその他オフィス商材のコンサルティング事業・KDDIサービスの販売、通信機器・事務機器等の販売、その他システムエンジニアリング・ システムマネジメント,愛知県名古屋市西区名駅2-27-8名古屋プライムセントラルタワー,2013,,1600,150百万円,https://www.kddimatomete.com/,,
2024-08-01,株式会社ＬＴＶ－Ｘ,システムインテグレータ（SIer）,4,■事業内容について： ・CRMクラウドシステムの企画、開発、運営■主要サービスについて：・EC業界でトップクラスシェアを誇るCRMクラウド「LTV-Lab」：カートシステムと連動して顧客にメール配信/ステップメール配信できるCRMシステム。顧客の購入商品や金額、購入期間などから顧客をセグメントして、最適な顧客にメール配信やステップメール配信（無制限）できます。・その他、新規事業を続々企画、リリース中です。,東京都港区芝5-13-18いちご三田ビル2F,2010,32.5,16,10百万円,https://ltv-x.jp/,,
2024-07-01,株式会社Ｍｉｒａｉｅ,システムインテグレータ（SIer）,16,■事業内容： ・ITコンサル事業・webサービス事業・システム開発事業(受託)・webサイト制作,東京都渋谷区渋谷1-12-2クロスオフィス渋谷6F,2007,30.0,48,10百万円,https://miraie-group.jp/,,
2024-08-01,株式会社エミューズ,システムインテグレータ（SIer）,4,■企業概要：東日本大震災により世の中に不安と閉塞感が漂う中、現場のプログラマー、SE、プロジェクトリーダー、プロジェクトマネージャーの経験があった現社長の諸澤一隆が「このままでは人生がいつ終わりになるか分からない。自分の思うような形で仕事をしたい。」とシステム開発の仕事は『エンジニアファースト』であるべきだという想いで、当社を立ち上げました。,千葉県市川市相之川1-25-13パートナー相之川101,2011,30.0,22,5百万円,https://www.emyus.co.jp/,,
2024-06-01,株式会社シンプレクス・リスク・マネジメント,システムインテグレータ（SIer）,1,■事業内容防御と疑似攻撃、両側面のサービスを提供してきた経験を最大限に生かした、フルパッケージのサイバーセキュリティサービス。,東京都渋谷区渋谷1-12-2クロスオフィス渋谷 609,2012,43.0,8,48百万円,https://simplex-rm.com/,,
2024-06-01,株式会社エイムワールド,ベンダ（ハードウェア・ソフトウェア）,1,■事業概要：・IT関連…システム設計構築、ソフトウェア開発・システム開発…産業ソリューション（公共、官公庁）、金融ソリューション（金融、証券）・アプリケーション開発…スマホアプリケーション開発（流通）、Webアプリケーション開発（公共、流通）・オフショア事業…ブリッジSE支援,東京都多摩市落合1‐15‐2多摩センタートーセイビル4F,2013,27.0,33,50百万円,http://www.aimworld.co.jp/,,
2024-08-01,株式会社フィクシー,システムインテグレータ（SIer）,2,■システムエンジニアリングサービス■システム開発・ITコンサルティング■システム運用・保守・監視■労働者派遣事業(派13-307708)【福岡事業所】福岡県福岡市博多区博多駅東2-5-28 偕成ビル802号室【大阪事業所】大阪府大阪市東淀川区東中島2-5-28 新大阪末広第一ハイツ305号室■グループ会社・株式会社フィクシー沖縄・株式会社フィクシーシステムオペレーションズ,【東京本社】〒101-0047東京都千代田区内神田1-6-6 MIFビル2階,2013,32.0,146,2800万円,https://fixie.jp/,代表取締役社長 木下 英士,
2024-07-01,ＡＺＵＲＥ・ＰＬＵＳ株式会社,ITアウトソーシング,5,■事業内容：IT事業・メディア事業を主軸としたソリューションサービスを展開しています。（1）SES・ITアウトソーシング…インフラ基盤構築、システム・アプリ開発（労働者派遣事業：派13-306740）（2）イベントプロモーション…イベント運用、プロモーション、キャスティング、ツール制作、WEB制作（3）アプリ・WEB・広告制作…請負開発・アプリケーション開発、WEB制作、DTP製作（４）エンドポイントセキュリティ,東京都千代田区神田小川町1-6-1,2011,35.0,79,10百万円,https://www.azure-plus.co.jp/,,
2024-08-01,ＶｉｄｅｏＴｏｕｃｈ株式会社,Webマーケティング（広告代理店・コンサルティング・制作）,無,情報が古い可能性があります。最新の情報を確認する場合はHP等をご覧ください。 ■動画SaaS■ライバーサクセス■メディア・プラットフォーマー向けDX支援 2021年11月doda掲載求人より引用,東京都渋谷区渋谷1-15-12ＬＡＩＤＯＵＴ ＳＨＩＢＵＹＡ 202,2013,,,50 百万円,"Failed to retrieve page, status code: 410",代表取締役 上坂 優太,
2024-06-01,株式会社クライル,システムインテグレータ（SIer）,1,■事業内容： □インフラソリューション事業当社のインフラソリューションは、大手メーカ・システムインテグレータ企業と手を組み、ミッションクリティカルなシステムから小規模なシステムまで、幅広く設計・構築・維持を行っています。社会システムや個人情報を扱うシステム等、信頼性を求められるシステムをささえる事を使命とし、日々業務を遂行しています。大規模Unix・Linuxシステムのインフラ設計・構築・運用各種ITコンサルティングサーバ最適化診断情報システム部門のアウトソーシングクラウド移行・構築サービス,東京都千代田区内神田2-15-9The Kanda 282,2013,,,10百万円,https://www.crile.co.jp/,,
2024-06-01,ADAPTEX株式会社,ITコンサルティング,1,■事業内容：制御システムの開発販売及び制御に関するコンサルティング、福祉機器の開発販売、教材開発・教育及び教育に関するコンサルティング、その他関係する一切の業務※分野・領域…国内外を問わず、石油精製、石油化学、製鉄、セメント、紙パルプ、電力、船舶、自動車、学校等の分野,広島県東広島市鏡山3-13-60,2005,,,47百万円,http://www.adaptex.co.jp/,,
2024-07-01,ノアメディカルシステム株式会社,システムインテグレータ（SIer）,4,■事業内容： ・保険調剤薬局向けコンピュータシステムの開発及び販売・電子薬歴システム「SOAP.Q&S」（QualityAndSpeed）の開発及び販売・相互作用データベース等のコンテンツ配信事業・IDC（インターネットデータセンター）を利用した患者情報・薬歴情報の問い合わせサービス（iモード、PDA）・ASPサービス,福岡県福岡市博多区奈良屋町2-1博多蔵本太田ビル5F,1997,40.8,66,25百万円,https://www.noah-medical.jp/web/,,
2024-06-01,株式会社ハイテックス,システムインテグレータ（SIer）,9,■事業内容：システムのコンサルティングから設計・開発、検証、運用・サポートまで、情報システムに関するサービスを提供しています。■ハイテックスの特徴顧客からのご相談は無料、分かりやすく丁寧なご説明を行います。顧客の担当は、お打合せから、開発、納品、アフターサポートまで、同じスタッフが担当いたします。開発の際は「専任担当制度」を導入しております。営業担当と開発担当、サポート担当など分けていないため、 要望が分散されることが無く、ご要望通りのシステムを提供することが出来ます。納品後も同じスタッフがサポートします。オーダーメイドですので、コストパフォーマンスに優れたシステムが実現できています。,富山県黒部市岡146,1987,39.0,40,15百万円,http://hitechs.co.jp/,,
2024-07-01,株式会社ヒューマン・ネットワーク,ベンダ（ハードウェア・ソフトウェア）,1,■事業内容：（1）システム事業…導入済の企業にはコスト削減や業務効率化は勿論、売上アップの戦略的ツールとしても活用してもらっています。（2）ハードウェア事業…Iotは勿論、業務で使用するシステムをオーダーメイドで構築する事業に取り組んできました。（3）コンビニエンスストア事業…FCにてファミリーマートの店舗運営を行っております。現在宮城県にて4店舗を運営しており、今後も店舗展開していく予定です。,宮城県仙台市泉区泉中央1-7-1地下鉄泉中央駅ビル6F,1995,,60,7百万円,http://human-nw.jp/,,
2024-06-01,パレットクラウド株式会社,ベンダ（ハードウェア・ソフトウェア）,1,当社サービスの「パレット管理」( https://palette.cloud/management )は、不動産業界に特化した入居者管理システム（SaaS型のCRMプラットフォーム/B2B2C）です。実績としては、業界最大手の会社様をはじめ、大手賃貸管理会社様を中心に約300万戸以上に導入いただいており、大きなシェアを獲得しています。Daigasグループの一員となった2020年10月を第2創業期のスタートと位置づけ、コロナ禍でも安定した経営基盤で、事業も組織も成長を加速させています。,東京都渋谷区恵比寿南1-9-6恵比寿パークプラザ3F,2010,36.0,44,100百万円,"Failed to retrieve page, status code: 410",,
2024-07-01,株式会社ソフトガーデン,ベンダ（ハードウェア・ソフトウェア）,10,■事業内容：（1）ソフトウェア開発事業・ソフトウェア開発…移動体通信制御の各種機能の開発、各種デバイス機器のソフトウェア開発、さらにWindows系アプリケーションを用いた業務支援ツールの開発、運用管理／保守ツールの開発を行います。・Webアプリケーション開発…Webのサイト構築から保守まで、クライアントが必要とする機能へのアプローチを行います。・システムテスト…クライアントの製品特徴をいち早く見極め、効率的なテストを実施します。数多くのデータやアプリケーションを含んだシステムや、様々なシナリオからの洗い出しが可能です。,北海道札幌市中央区南一条東3-10-13アイパスビル3F,2001,38.0,93,50百万円,http://www.soft-garden.co.jp/,,
2024-06-01,株式会社サイバーブレーン,通信キャリア・ISP・データセンター,1,■事業内容： WEB制作、社内システム開発、保守、SEO対策。車両販売管理システムサービスの運営,東京都中央区入船2-8-8林田ビル3F,2004,,6,10百万円,https://www.cyberbrain.co.jp/,,
2024-08-01,株式会社ＩＳＳ,システムインテグレータ（SIer）,1,【設立以来16期連続黒字経営の安定性】◆ITシステムコンサルティング◆ITシステムソリューション◆アプリケーション開発◆ITインフラソリューション◆ITネットワークソリューションなど【主要取引先】◆株式会社みずほ銀行◆みずほ信託銀行株式会社◆みずほリサーチ＆テクノロジーズ株式会社◆ソニーネットワークコミュニケーションズ株式会社◆株式会社テラ など,東京都品川区西五反田1-24-4 タキゲンビル 5F,2008,,30,3000万円,"Failed to retrieve page, status code: 410",代表取締役 社長 菊地 英順,
2024-08-01,株式会社サイバーネーション,ITアウトソーシング,1,■サイバービジネスに関するコンサルティング■ネットワークシステム基盤の設計、構築、運用およびヘルプデスク■基幹業務システムの提案・設計・開発・導入■特定顧客を対象とする、IT系技術者の要員派遣業務※特定労働者派遣事業番号 特13-308013,〒169-0075東京都新宿区高田馬場3-23-3 ORビル,2000,28.0,150,1600万円,"Failed to retrieve page, status code: 410",代表取締役 石野 秀樹 、長尾 光洋,
2024-07-01,株式会社ＢＬＵＥ,ITアウトソーシング,1,■企業理念：「四方よしの経営…売り手よし（働き手よし）・買い手よし・世間よし・未来よし」中小企業向けDX事業として、サーバーリプレイスや、Webサイトの集客についてのご提案・ホームページ制作などを行っております。そして、総合請負サービス会社としてより「現場第一」で取り組んでます。人材育成として経験や資格取得だけではなく、仕事の進め方や同僚との距離感のとりかたなど、現場での実績を重視した人材育成を目指しています。,大阪府大阪市西区土佐堀1-1-21マキセビル3F-A,2013,38.0,20,5百万円,https://bl-ocean.net/,,
2024-08-01,デマンドリンク株式会社,ITアウトソーシング,6,■事業内容：人材業務全般、システム開発業、各種代理店業■同社の主要サービス：同社では、主軸2つのサービスを提供しています。（1）人材ソリューション事業…人材ソリューション事業を行っており、現在の案件先は様々です。TVショッピングメディアへの出演、SE業務、アウトソーシング事業、HP作成事業と様々です。顧客のニーズに併せて御希望の人材を提案します。（2）受託開発事業…お客様の課題解決に対し、フロントエンドからバックエンドまで フルスクラッチでアプリケーション開発及び保守・運用をする オールインワンの受託開発サービスをご提供いたします。,東京都千代田区岩本町2-2-10日鉄岩本町ビルディング4F,2013,33.0,41,,http://www.demand-link.jp,,
2024-05-01,レイシス・ワークスタイルクリエイション株式会社,システムインテグレータ（SIer）,1,■システムエンジニアリングサービス■企業向けシステム開発■自社製品・ＩＴサービス提供,大阪府大阪市北区梅田3丁目3-20明治安田生命大阪梅田ビル16F,2013,38.5,,,https://rasis-soft.co.jp/kigyou/index02.html,代表取締役社長 小野 明日香,
2024-08-01,株式会社リゾーム,システムインテグレータ（SIer）,10,"株式会社リゾームは、社員の80％以上をエンジニア経験者が占める「エンジニア企業」です。2001年の設立以来、大手事業会社・プライムベンダーを中心に幅広い業種・業界のクライアントのWebサービス・モバイルアプリの開発を手掛けてきました。2015年には社員発信の新規事業として新卒・未経験エンジニアに特化したエンジニア研修サービス「ITCOLLEGE」をスタートさせ、年間1,000名以上の若手エンジニアを育成することで、IT業界のエンジニア不足という課題解決に取り組んでいます。",東京都中央区日本橋箱崎町17-1箱崎リージェントビル6F,2001,33.0,98,10百万円,https://www.rhizo-me.com/,,
2024-07-01,ＫＤＤＩまとめてオフィス西日本株式会社,通信キャリア・ISP・データセンター,1,■事業内容：中小中堅大手企業様向け、KDDIの各種通信サービスに加え、IT、クラウド、その他オフィス商材のコンサルティング営業を行っています。・KDDIサービスの販売、通信機器・事務機器等の販売、その他システムエンジニアリング・ システムマネジメント,広島県広島市中区八丁堀16-11スタートラム広島,2013,,252,50百万円,https://www.kddimatomete.com/nishi/,,
2024-07-01,株式会社ＳＮＳソフト,システムインテグレータ（SIer）,1,■事業内容： ・ITソリューションズ事業・中国でのオフショア開発事業・金融システム事業・WEBサイト企画事業・監視カメラシステム事業,東京都千代田区東神田1-11-14TQ東神田ビル2F,2013,,107,20百万円,https://www.snssoft.co.jp/,,
2024-07-01,株式会社ロボマインド,システムインテグレータ（SIer）,1,■事業内容：・自社サービス（AIとビッグデータを使ってアマゾン出品者を支援するツール）の開発・運営,兵庫県神戸市中央区宮本通5-5-20,2009,39.0,5,10百万円,https://robomind.co.jp/,,
2024-08-01,株式会社アイティーシー,システムインテグレータ（SIer）,1,■事業内容：・システムコンサルティング・データ分析、人工知能の製品開発・ソフトウェア開発,岡山県岡山市北区本町3-13イトーピア岡山本町ビル2F,2002,29.8,14,10百万円,https://www.itccorp.co.jp/,,
2024-08-01,株式会社きしだ,システムインテグレータ（SIer）,2,■事業内容：（1）システム開発・情報サービス…コンピューター・ソフトウェアの開発、製造、販売、コンサルティングおよび輸出入／コンピューターの販売および輸出入／コンピューター通信システムの技術開発、設計および運用／インターネット関連業務およびホームページ開設のためのサポートおよび保守／労働者派遣業務（2）出版・マルチメディア…書籍・雑誌の出版、販売および輸出入／レコード、録音テープ、ビデオテープ、光学式ディスク、映画の企画、制作、販売および輸出入／外国語の翻訳、通訳／インターネットによる情報の提供／電子出版・ソフトの企画・制作 など,北海道旭川市九条通18-95-8,1997,,30,3百万円,"Failed to retrieve page, status code: 410",,
