更新日,名称,業界(小分類),求人有無,事業内容,所在地,設立,平均年齢,従業員数,資本金,企業URL,代表者,上場市場名
2024-08-01,コダワリ・ビジネス・コンサルティング株式会社,ITコンサルティング,6,社員数や規模拡大を探求するのではなく、顧客への貢献と事業･個人の成長に強い「こだわり」をもっております。代表は経営理念を軸に、本質的にどうあるべきか、何が遣り甲斐なのか、会社として日々探求しており、社員がやりたいことをやれる会社・人創りによる会社創りが実現できる会社・コンサルティングを極め、経営者の苦労を理解し、それを踏まえた活動ができる会社を実現したいと考えています。創業時はITコンサルのみでしたが、以降コンサルティングを基盤に、新規事業(教育・人材紹介)を展開しております。今現在も、新規事業タスクフォースの活動を週次で行い、積極的に議論を交わしております。,東京都中央区銀座7-16-15清月堂本店ビル3F,2009,33.0,27,50百万円,https://www.codawari.co.jp/,,
2024-08-01,シンキングリード株式会社,システムインテグレータ（SIer）,無,■DX支援・既存業務の効率化支援（コンサルティング）■統合顧客管理システムの開発■営業支援システムの開発■コールセンター（お問い合わせ管理システム）の開発など 2024年6月doda掲載求人より引用,東京都中央区日本橋人形町1-11-2川商ビル 8Ｆ,2008,,,12 百万円,"Failed to retrieve page, status code: 410",代表取締役 金丸 隆,
2024-08-01,株式会社グローウィズ,システムインテグレータ（SIer）,1,■事業内容：（1）Web・オープン系システム開発事業…公共系Webシステム、物流／生産管理系Web・クラウドシステム 等（2）制御・通信系システム開発事業…医療／家電系組み込みマイコン、カーナビ／複合機 等（3）システム保守事業…システム運用保守、電話オペレーター 等,大阪府大阪市北区西天満3-5-18第3新興ビル,2010,,7,5百万円,https://growis.co.jp/,,
2024-06-01,株式会社スカイダイニング,ITアウトソーシング,4,■事業内容：POSレジシステムの企画、開発、販売POSレジシステムならワンレジ：https://one-regi.com/,東京都文京区小日向4-6-19共立会館9F,2003,,22,10百万円,https://sky-dining.co.jp/,,
2024-08-01,株式会社ｉＰＸ,システムインテグレータ（SIer）,無,◆お客様の現場における課題やアイデアを解決するソフトウェアをハードウェアに実装するための開発支援・共同開発・シミュレーション◆上記の研究開発実績を活かした自社製品の開発・販売【主要取引先】※法人名略SUBARU、トヨタ自動車、日産自動車、スズキ、マツダ、アイシン、ヤマト運輸、日本通運、コベルコ建機、パナソニックほか 2024年8月doda掲載求人より引用,東京都品川区上大崎2-25-2新目黒東急ビル 13Ｆ,2008,,,2 百万円,"Failed to retrieve page, status code: 410",代表取締役 幸田 高人,
2024-07-01,株式会社フォリウム,システムインテグレータ（SIer）,4,■会社概要foliumは八戸・山口に大規模オペレーションセンターを持つITサービスの企業です。都市部の企業では長期慢性的な人手不足や定着の課題があります。地方の中核都市規模での優秀な人材を採用・育成しサービスを提供する事業は、この課題に対する一つの効果的な解法です。foliumは経営理念（ビジョン）に「すべての人が暮らしたい場所で輝く未来」を掲げており、まずは青森県八戸市と山口県山口市に拠点を構築することで、各地域で活躍する場を求める人々の受け皿であろうとしています。,東京都港区浜松町1-12-4第二長谷川ビル3F,2010,34.0,392,50百万円,https://www.folium.co.jp/,,
2024-07-01,株式会社エヴァーグリーン,システムインテグレータ（SIer）,1,■事業内容：・ソフトウェア開発業務…Web関連システムの設計／製作、通信システムの設計／製作、各種ホームページの提案／作成・システム基盤構築業務…Linux、UNIX、Windows各種OSのサーバ設計／構築、ミドルウェア導入／設計、DB設計／構築、システム運用・その他…各種ハードウェアの販売、各種パッケージソフトウェアの販売,神奈川県横浜市中区花咲町2-65-6コウノビル MM21 6-A,2010,,25,10百万円,http://www.ever-g.co.jp/index.html,,
2024-06-01,みんなの未来株式会社,ベンダ（ハードウェア・ソフトウェア）,1,■ソフトウェア受託開発、請負開発及び販売業務■システムエンジニアリングサービス事業■オフショア開発・管理事業■IoT、ビッグデータ、顔認識、VRなど製品開発及び販売業務■ERP開発・導入サービス■クラウド構築・導入サービス■インフラ構築・保守サービス,東京都中央区日本橋小伝馬町15番17号 ASK日本橋ビル5階,2011,38.0,150,3100万円,http://www.yourfuture.jp/index,代表取締役社長 李 遠軍,
2024-07-01,ネクストギアーズ株式会社,通信キャリア・ISP・データセンター,2,■事業内容：通信機器のレンタルおよび販売、総合リース業,東京都足立区保木間4-25-4,2011,35.0,20,10百万円,https://www.next-gears.net/,,
2024-08-01,株式会社ネットソニック,システムインテグレータ（SIer）,2,■企業概要： ERP、OAソフトウェア及びLA導入、ネットワークシステム・セキュリティの専門家として、企業に最適なコンサルティングとメンテナンスを提供しています。,東京都新宿区西早稲田3-15-3鈴木ビル 3F,2011,,12,8百万円,http://www.netsonic.biz/profile.html,,
2024-06-01,株式会社デザインシステムサービス,システムインテグレータ（SIer）,1,■企業情報：Webシステムを得意分野とするソフトウェア開発会社です。およそ100年の歴史を持つ電力機器メーカーや大手家電メーカーなどエンタープライズ向けの大規模な業務管理システムをメインに、開発から運用保守まで総合的な技術者支援サービスを提供しています。近年は海外生産拠点における、旧システムからWebシステムへのマイグレーションで順調に業績を伸ばしています。,大阪府大阪市西区土佐堀1-6-10,1988,32.0,30,21百万円,http://www.design-ss.co.jp/,,
2024-08-01,KDDIまとめてオフィス株式会社,通信キャリア・ISP・データセンター,67,■事業内容：KDDI法人向けサービスの販売、KDDIまとめてオフィスサービスの販売等,東京都渋谷区代々木3-22-7新宿文化クイントビル4F,2011,34.0,1857,"1,000百万円",http://www.kddimatomete.com/,,
2024-08-01,株式会社FUSIONIA,ITアウトソーシング,2,■オンサイトサービス事業■Webソリューション事業,東京都新宿区西新宿7-4-7 イマス浜田ビル7F／8F（受付7F）,1989,29.4,165,"1,300万円",https://www.fusionia.jp/,代表取締役 細井 伸浩,
2024-08-01,株式会社アルファニーズ,通信キャリア・ISP・データセンター,2,■事業内容：auショップの運営業務、移動体通信機器の販売業務,北海道札幌市北区麻生町3-10-13麻生ハヤシビル5F,2005,,,10百万円,http://www.alphaneeds.jp/profile/,,
2024-07-01,omeroid株式会社,システムインテグレータ（SIer）,3,■事業内容・ITコンサルティング業務：要件定義・設計・開発・テスト・運用等のシステム開発の全フェーズをサポートいたします。・業務コンサルティング業務：戦略・経営のサポートをいたします。特に新規事業創出領域における経験が豊富です。・プロダクト：自社プロダクトとしてリモート化でのOJTを助ける進捗報告ツール「dac」、ラベルプリントシステムを保有しております。,東京都中央区八丁堀3-1-7永井ビル2F,2019,28.0,14,9百万円,https://www.omeroid.com,,
2024-08-01,株式会社セーフマスター,ベンダ（ハードウェア・ソフトウェア）,5,■当社の使命医療の質と効率の向上にITを活用して貢献する。,福岡県福岡市博多区東比恵3-1-2東比恵ビジネスセンタービル11F,2011,41.0,50,50百万円,http://www.safemaster.jp/,,
2024-08-01,株式会社アドカン,システムインテグレータ（SIer）,8,■事業内容：・システム開発・インフラ構築業務・客先常駐型開発・運用支援業務・その他コンピューターに附帯する業務■事業詳細：オープン系、制御系、WEB系問わず幅広い分野での各種コンピュータシステムの企画、設計、開発。自社もしくは取引先にて、通信、金融、交通、製造業など幅広い業種のシステム開発を手がけていただきます。上場企業や大手メーカーの商品開発に携わる機会は豊富。要件定義から設計、開発、評価、テストまで、各フェーズでクライアント様のフォローします。,大阪府大阪市中央区平野町2-6-13平野町ラガービル3F,2011,,20,10百万円,http://adokan.co.jp/about.html,,
2024-06-01,エコスフィア株式会社,システムインテグレータ（SIer）,1,■テクノロジーコンサルティングサービス■アプリケーション開発支援サービス■システムアウトソーシングサービス■サイバーセキュリティサービス■BCPサービス,東京都千代田区岩本町3-4-3 リードシー秋葉原ビル5階,2011,35.0,480,2000万円,https://ecosphere.xyz/,代表取締役 中井 貴大,
2024-08-01,株式会社情報技術社,システムインテグレータ（SIer）,9,■企業概要：金融機関様、官公庁様、一般企業様向けのシステム開発、インフラシステム構築、ERP、AI、データサイエンス等、幅広い事業を展開する当社は2004年に創業しました。 事業の主軸ともいえるソフトウエア開発を通じ、社員、お客様、社会、当社とかかわりのあるすべての方を幸せな気持ちにしたいと思っております。,東京都港区三田3-11-36,2004,36.7,138,50百万円,http://www.ict-co.co.jp/,,
2024-08-01,株式会社アキュートシスコム,システムインテグレータ（SIer）,3,■事業内容：ソフトウェア開発、機器販売、コンピュータ導入に関するコンサルティング、コンタクトレンズ販売管理システム（TASCOL）提供,島根県松江市乃白町334-6,2005,39.0,54,8百万円,http://acute-sc.co.jp/,,
2024-07-01,株式会社タイムズソリューション,ITアウトソーシング,2,■事業内容： ⇒高知県にて、ハードウェアやソフトウェアの開発を行う会社です,高知県高知市愛宕町3-4-1,2005,,16,22百万円,なし,,
2024-08-01,株式会社パシフィックメディカル,ベンダ（ハードウェア・ソフトウェア）,37,"【オンライン診療などの医療プラットフォーム事業を展開する株式会社メドレーグループ】■クラウド型EHRシステムの開発及び販売■電子カルテシステムの開発及び販売＜＜同社では主に2つの製品を開発・販売しています＞＞(1)中小規模病院・有床診療所向け電子カルテ「MALL」。弊社の調べでは、100床未満の中小規模病院のうち、1,000施設ほどは紙で患者様の情報を管理しています。(2)クラウド型地域包括ケアシステム「MINET」。本製品は、医療・介護・調剤の施設間で患者様の情報を連携するシステムで、「地域包括ケアシステム」を2025年に完成させる、という国全体の目標を支えるものです。",高知県宿毛市幸町5-12,1997,37.1,80,32百万円,https://pcmed.jp/,,
2024-07-01,株式会社イードクトル,システムインテグレータ（SIer）,3,≪電子カルテ・認証・受付システムなど医療分野特化の独立系SIer/日本各地の総合病院と取引多数≫■事業内容：医療情報関連のソフトウェア開発からハードまで、「医療現場」に必要な支援を充実させるべく幅広いサービスを提供しております。電子カルテなどの医療システムは短いスパンでの取り換えはそれほどなく、年1回のバージョンアップを除けば5年～10年は同社のシステムをご利用いただいております。そのため、一度開発すれば後は外注に運用・保守は任せ、緊急対応など窓口相談だけ受け持つなどの仕組みが出来上がるため、開発受注以外にもランニングコストによって恒常的な利益創出が可能となっております。,大阪府大阪市東淀川区西淡路1-1-35幹線東ビル 6F,2009,35.0,31,10百万円,https://edokt.com/,,
2024-06-01,株式会社未来工房亞主,システムインテグレータ（SIer）,1,■事業内容：お客様が欲するシステムを技術者が心を込めて創りあげ、お客様と技術者の心が通じ合い、お客様も技術者も満足する仕事を目指すソフトウェア総合サービス 1.システム受託開発 2.ITエンジニアの提供 3.ソリマチ製品販売 4.Zenlogicレンタルサーバ導入支援,福岡県福岡市博多区博多駅東3-14-1,1996,,15,24百万円,https://mirai-asu.co.jp/,,
2024-07-01,Ｚｅｒｏ－Ｅｎｇｉｎｅｅｒｉｎｇ株式会社,システムインテグレータ（SIer）,1,■事業内容： 業務に関わる各種コンサルティングやプロジェクトのコアとなる管理手法の立案や体制管理のサポート、及びシステム開発の各工程についての受託・支援サービスを軸とし、幅広いサービスをご提供させていただきます。,北海道札幌市中央区大通東3-1-1トルチュビル1F,2007,,26,20百万円,https://www.zero-engineering.co.jp/company/profile/,,
2024-05-01,株式会社ユー・エス・ケイ,ベンダ（ハードウェア・ソフトウェア）,1,■事業内容：（1）中小病院、診療所向け医事会計システムの販売・導入・保守（2）中小病院、診療所向け電子カルテシステムの販売・導入・保守（3）看護勤務作成システムの開発・販売・導入・保守（4）リハビリテーション支援システムの販売・導入・保守（5）その他、院内情報システム全般の販売（6）コンピュータのハードウェア販売・導入・保守（7）サプライ・消耗品の販売（8）ネットワーク 設計・工事・保守（9）LED等の設備品販売,福岡県福岡市博多区博多駅東2-17-5,2010,,24,10百万円,https://www.usk-i.com/index.html,,
2024-08-01,株式会社ＧＦＤ,システムインテグレータ（SIer）,4,【ITインフラ領域の技術に特化した会社です】GFDはセキュリティにフォーカスしたSI事業を展開している横浜の会社です。プロダクトをどのように導入するかという上流工程の設計から、導入したものをお客さまが最大限に使えるよう教育サポートまで提供していることが特徴です。,神奈川県横浜市神奈川区金港町5-14クアドリフォリオ3F,2008,31.3,45,30百万円,http://www.gf-design.jp/,,
2024-07-01,株式会社ジェイシーエス,システムインテグレータ（SIer）,1,◆2004年の設立以来20年、黒字経営を続ける安定企業です。【事業内容】■システムインテグレーション事業■ブロードバンド事業■ネットワークソリューション事業■通信回線コンサルティング事業■ISP事業■ホスティング事業■セキュリティ事業■オフィスコーディネート事業■モバイル事業■電気事業,東京都渋谷区代々木1-22-1 JRE代々木一丁目ビル13階,2004,,94,3000万円,https://www.japan-cs.info/,代表取締役 平井 雅也,
2024-07-01,日本ウェブサービス株式会社,システムインテグレータ（SIer）,11,★平均残業時間8.3時間 ＆ 平均年齢31.8歳(男女比7:3) ＆ 年間休日129日 ＆ テレワークOK★大企業にステップアップする当社の仕事は、取引実績のあるメーカー系会社様から頂くプロジェクトになります。成長企業で働く喜びを感じながら成長できる環境があります。社内管理職への道も充実しています。★プライム企業取引多数、上流工程OKでキャリア形成★上場・大手企業の取引割合が高い当社では上流工程からしっかり経験できます。また、よくみかける孫請け会社ではありませんのでご安心ください。しっかりキャリア形成して正しい方向にステップアップできます。,大阪府大阪市北区梅田1-1-3大阪駅前第3ビル11F,2010,31.8,360,100百万円,https://jpn-web.co.jp/,,
2024-08-01,株式会社Meisin,通信キャリア・ISP・データセンター,7,■企業について：本社のある千葉をはじめ、福岡・名古屋・神戸をはじめとした全国へ拠点を構え、主にオフィスインフラを扱っている総合商社です。2024年3月に東証スタンダード市場の株式会社フォーバルの完全子会社となりました。■事業内容：通信機器、販売事業／セキュリティ機器および製造／販売事業／不動産事業／SIM事業／電気エネルギー事業,千葉県千葉市中央区新宿2-3-5新宿ミハマビル3F,2001,32.0,60,10百万円,http://meisin.ne.jp/,,
2024-08-01,株式会社湘南ネットワークス,ベンダ（ハードウェア・ソフトウェア）,1,■具体的事業内容・運送・電子機器の運送・設置 ほか【業務内容詳細】 ・運送部門：精密機器（コピー機等）の設置、商品の保管、発送代行業務、事務所の移転作業・IT部門：パソコン等の情報通信機器のカスタマイズ及びソフトのインストール作業、設置業務、LAN工事、オフィスサプライ用品の販売,神奈川県横浜市中区尾上町5-75-2,,41.0,80,35百万円,http://www.s-networks.co.jp/,,
2024-08-01,グルーヴィウェア株式会社,ITアウトソーシング,1,■事業内容：・受託システム開発 ・自社サービス開発 ・技術者派遣,愛媛県松山市富久町422,,,10,19百万円,"Failed to retrieve page, status code: 410",,
2024-08-01,ＮＣＤＣ株式会社,ITコンサルティング,8,【先端テクノロジーとデザインの融合でイノベーションを届けるDXコンサルファーム】■事業内容：・ビジネスコンサルティング・UI/UXコンサルティング・システム・インテグレーション・クラウドサービスの開発■同社の特長：特長的なのは、コンサルタント、エンジニア、デザイナーが専門分化することなく、一つのプロジェクトチームを構成し互いの領域をコラボレートしながら一体となって進めている点です。また、コンサルティングサービスで得られた知見を活かした自社クラウドサービスの開発も行っています。,東京都千代田区丸の内2-2-1岸本ビルヂング6F,2011,32.0,49,33百万円,https://ncdc.co.jp/,,
2024-08-01,システム・エボリューション株式会社,システムインテグレータ（SIer）,15,■■事業内容■■ 官公庁、金融、製造・流通、通信、医療等と幅広い業種に向けてソフトウェアの開発を行っています。同社ではシステム導入に向けたコンサルティングから開発・保守、ソリューション導入やキッティングに至るまでトータル的なITコーディネートが可能です。またWeb系の技術者を中心に金融系システムから通信ネットワーク分野、組込系開発に至るまで幅広い分野の経験を持った優秀なエンジニアが多数在籍しています。,東京都中央区日本橋本石町4-6-7日本橋日銀通りビル7F,2011,34.0,391,10百万円,https://sys-evo.co.jp,,
2024-08-01,株式会社ライトマークス,ベンダ（ハードウェア・ソフトウェア）,16,■同社概要：同社は、LINEで手軽に高級ハイヤーを呼べる「VIPハイヤー配車」を運営しております。「VIPハイヤー配車」は、コロナ禍で需要が低迷したハイヤーを助け、かつ、密を避けての移動手段をお客様に提供すべく始まりました。ユーザー側はアプリダウンロードなしでLINEで簡単にハイヤーを呼べるように設計、ハイヤー会社側は効率よく車両の運行ができる仕組みを目指し、オペレーションの効率化・自動化をすることで無駄のないプラットフォーム構築しております。,神奈川県横浜市港北区日吉本町1-24-20,2011,,30,110百万円,https://lightmarks.co.jp/,,
2024-06-01,株式会社アッシュビー,システムインテグレータ（SIer）,6,■事業内容： ・当社はビッグデータを入力としたデータ分析基盤のためのデータベースシステム（DWH・DM）開発に特化・注力している会社になります。「ETL/BIツール、DBA、PMO」を中心とした技術者集団として、今後世界のデータ量の増加に対応していく企業様のベストパートナーを目指しています。・10年に渡りビッグデータを入力としたデータ分析基盤のためのデータベースシステム（DWH・DM）に携わってきましたが、需要に応じて右肩上がりの成長を続けています。,東京都中央区銀座6-13-16銀座WallビルUCF5F,2011,36.0,25,10百万円,http://ashbey.jp,,
2024-07-01,株式会社セブンピース・イノベーション,システムインテグレータ（SIer）,3,■企業概要：当社は、ソフトウェア（画像、WEB・オープン系、ATM端末、カーナビなどの車載機器）・ハードウェア（アナログ回路、デジタル回路、LSI、FPGA）・システム（FA、プラント、ネットワーク）などの要素技術をベースに、家電・自動車・半導体・プラント・ネットワーク・システム会社および公共団体に対して研究開発・設計・評価解析・生産技術などの技術支援を行っています。■事業内容： ・研究開発（医療・介護の研究、要素研究など）・ソフトウェア事業（画像、WEB・オープン系、ATM端末、カーナビなど）・ハードウェア事業（アナログ回路、デジタル回路、LSI、FPGAなど）,福岡県福岡市博多区博多駅前2-19-29博多相互ビル5F,2011,,,50百万円,https://spico.biz/,,
2024-08-01,住宅ソリューションズ株式会社,システムインテグレータ（SIer）,2,■事業内容： CONSTRUCTION FARM 生活をおもしろく良質に。・HS共同仕入：全国工務店・ビルダーに対する建材・設備資材などの販売・オリジナル商材：オリジナルキッチンなどの企画と販売・設計支援事業：確認申請図書など作図代行業務・IT企画開発事業：ハウスメーカーなどへのITソリューションサービスの推進、建設・不動産業界へのシステム化コンサルティング,東京都武蔵野市吉祥寺本町2-4-14メディ・コープビル8 7F,2011,41.0,26,78百万円,https://housol.com/,,
2024-06-01,株式会社ＳｃｅｎｅＬｉｖｅ,ベンダ（ハードウェア・ソフトウェア）,6,■事業内容： セールステック領域におけるSaaSプロダクトの開発・運営セールステック領域で主に音声通信/解析技術を強みに、直近は3年連続で130％成長を遂げています。累計導入社数もコールセンターや営業所を中心に2500社を超え、急成長中の企業です。,大阪府大阪市中央区備後町3-4-1備後町山口玄ビル 9F,2011,30.0,66,13百万円,https://scene-live.com/?utm_medium=recruit,,
2024-07-01,株式会社ジョインフォース,システムインテグレータ（SIer）,3,■事業内容：◇アプリケーション開発領域：お客様のビジネス展開の根幹を支える業務システムの構築を、要件定義の段階から保守工程まで全工程に渡って対応致します。 ◇システム基盤領域：サーバ構築時の対応はもとより、業務アプリケーションの処理能力向上への施策や、運用開始後の障害対応等、システム基盤の構築から維持まで幅広い分野に渡って対応致します。◇SE支援サービス：システム開発における各工程に対する作業支援や、プロジェクトマネジメント業務の支援を致します。,東京都千代田区岩本町2-15-10ニュー山本ビル3F,2011,39.8,60,30百万円,https://www.joinforce.co.jp/,,
