更新日,名称,業界(小分類),求人有無,事業内容,所在地,設立,平均年齢,従業員数,資本金,企業URL,代表者,上場市場名
2024-08-01,株式会社フェアウェイソリューションズ,ベンダ（ハードウェア・ソフトウェア）,2,■事業概要：コンピュータソフトウェアの開発・販売、システムコンサルティング・自社開発のソフトウェア“Φ-Conductorシリーズ”、“Φ-Pilotシリーズ”を通じて、顧客企業の業務改革を支援しています。・顧客企業は、主に、中堅規模の消費財（食品・日用品・医薬品等）の製造業、及び商社、卸売業で、受発注業務の自動化・効率化、在庫の可視化や適正化に寄与するソリューションを提供しています。,東京都千代田区岩本町2-1-18,2000,47.0,25,96百万円,https://www.fw-solutions.com/,,
2024-08-01,日本ＮｏｎＳｔｏｐイノベーション株式会社,通信キャリア・ISP・データセンター,8,■事業内容：・NonStopサーバ事業・システム開発、インフラ構築事業・クラウド事業・製品販売事業,東京都港区海岸1-4-8,2008,,78,251百万円,https://www.jnsi.co.jp/,,
2024-07-01,ＯＳＳＴｅｃｈ株式会社,システムインテグレータ（SIer）,1,■事業内容： 2006年設立、OSSをベースとした認証基盤の自社製品開発を行い、付随したコンサルティングやサポートサービスを提供しています。OpenAMを使ったシングルサインオンや統合ID管理、Smaba、OpenLDAP等による統合認証ソリューションや等を提供しております。◎エンジニア優先の経営社長がエンジニア出身のため、エンジニアを中心に優遇しています。・広い机と長時間座っても疲れない椅子・1人２台の好きなPCを支給・資格支援や書籍購入支援制度・社員旅行やスポーツクラブなど充実した福利厚生,東京都品川区西五反田1-29-1コイズミビル8F,2006,36.0,21,15百万円,https://www.osstech.co.jp/,,
2024-06-01,株式会社シーエスコミュニケーション,通信キャリア・ISP・データセンター,4,■事業内容： コンピュータのネットワークシステム及び通信システムの企画、設計、開発、保守、及びコンサルティング、電気工事業,大阪府大阪市淀川区西中島7-1-8WINビル8F,2000,,100,20百万円,https://www.cs-com.co.jp/index.html,,
2024-06-01,株式会社ナチュラル・エボリューション・ワールド,ITコンサルティング,3,■事業内容： （1）コンサルティング事業…業務コンサルティング／情報システム導入コンサルティング（2）システム事業…各種情報システムの企画、設計、開発、運用／インターネットを使ったWebコンテンツ等の開発／パッケージ導入支援サポート,山口県宇部市鵜の島町7-23,2002,,9,10百万円,http://www.n-e-w.jp/,,
2024-08-01,プラチナゲームズ株式会社,ベンダ（ハードウェア・ソフトウェア）,80,■組織・風土： プラチナゲームズには、大きな組織にありがちな、セクショナリズムやヒエラルキーは存在しません。ゲームデザイナーやアーティスト、プログラマーといった各セクションを区切るパーテーションもありません。新人からベテランまで、開発チームの全員がフラットな立ち位置で、「最高のゲーム」という一つの目標を目指して積極的に意見を交換し合いながら開発に取り組みたい、という考えからです。「最高のゲームを生み出す」という信念と野心を持ったゲームクリエイターたちが、それぞれの職能をパワフルに発揮しながら、“チーム”として一つのゲームづくりに邁進する。それがプラチナゲームズの開発スタイルです。,大阪府大阪市北区大淀中1-1-30梅田スカイビルタワーウエスト8F,2006,34.6,345,"1,505百万円",https://www.platinumgames.co.jp/,,
2024-06-01,株式会社ＣＡＥソリューションズ（大塚商会グループ）,ベンダ（ハードウェア・ソフトウェア）,1,■事業詳細以下のような事業を展開しております。・営業部（CAE製品販売、販売促進活動）及びFOCUS テクニカルセンター（関西拠点）（SOLIDWORKS/Siemens/Autodesk/Dassault Systemes/Engys等）・技術部（CAE製品の技術サポート・トレーニング・流体解析ならびに信号処理解析のコンサルティングと受託解析）（熱・流体受託解析、専用化、コンサルおよびOpenFOAMR、DADiSP、PyroSim/FDS等のサポート業務）,東京都千代田区飯田橋1-3-2,2006,45.0,45,60百万円,http://www.cae-sc.com/,,
2024-08-01,インターナショナルシステムズ株式会社,システムインテグレータ（SIer）,5,■事業内容： 大手企業との大規模な製品やシステムの開発に特化しており、世界を相手に活躍できる仕事です。Webシステムから、医療機器、制御やロボットの機器のソフト開発または、メカ設計を得意としています。■業務の3つの柱：大きく柱を分けて、3つあり、請負開発~派遣まで行っています。(1)組込系・制御系ソフトウェア開発(2)Webシステム開発・運用・保守(3)基幹系システム開発・運用・保守,静岡県静岡市葵区紺屋町11-1浮月ビル5F,1999,34.0,20,10百万円,http://www.international-systems.jp,,
2024-07-01,アントラス株式会社,システムインテグレータ（SIer）,6,■事業内容当社の主力事業はITのインフラ(NW・サーバー・セキュリティ)に特化したエンジニアにて、お客様の業務を丸ごと請け負い、安心・安全・安定稼働のため、お客様先に常駐し、技術力を提供しております。請け負った案件の8割以上はプライム案件です。■代表取締役の想い城田氏は、自身がエンジニアであり、「エンジニアのエンジニアによるエンジニアの為の会社」を設立すべく、日本オラクル社の情報システム部門をスピンアウトして当社を設立しました。「技術力だけでなく人としても魅力的な社員であふれる会社であること」という想いを持っています。,東京都渋谷区道玄坂1-16-7ハイウェービル8F,2000,31.4,170,16百万円,http://www.antrus.co.jp/,,
2024-06-01,サイファー株式会社,システムインテグレータ（SIer）,3,■企業概要：1999年の設立以来、ITコンサルティング、システム設計・開発・運用まで幅広く高度情報化社会に貢献するITシステムを構築してきています。また現在ではプロダクトソリューション事業の一つとしてRPA（Robotic Process Automation）に注力しています。,東京都渋谷区神宮前6-19-16越一ビル402,1999,35.0,62,50百万円,https://www.cipher-net.co.jp/,,
2024-07-01,株式会社ソルネットシステム,ITコンサルティング,4,■会社概要：創業22年目を迎える、インフラネットワーク技術とSAP BIコンサル技術に強みを持つソフトハウスになります。主な事業内容は以下の通りです。(1)SAP BIコンサル・構築・保守(2)インフラ・ネットワークの提案・構築・保守(3)ビジネスシステム開発(4)中小企業向けトータルソリューション構築,大阪府大阪市北区堂島1-6-20堂島アバンザ6F,1998,37.0,60,30百万円,http://www.solnet-sys.co.jp/,,
2024-07-01,株式会社アスタリスク,システムインテグレータ（SIer）,2,～1次受けで案件に携わることができるSier企業／最先端のブロックチェーン研究等にも携われます／月残業5～10時間前後／年間休日120日前後～■事業内容：・システム構築・システムコンサルティング・エンジニア派遣・保守、運用支援・IT教育支援主にWebオープン系のアプリケーション開発を行います。常駐先での業務が8割、受託業務が2割前後を占めています。■同社の製品：（1）iOS…タバタイマー、てかがみ、BlockBreaker Zero、いち・に・よん・はち…、きれいに照明写真、もえならべ（2）Android…タバタイマー,東京都台東区浅草橋4-18-6ポポラーレ浅草橋2B,2002,,14,30百万円,http://www.astrsk.jp/index.html,,
2024-06-01,株式会社アイシーエム,システムインテグレータ（SIer）,1,■事業内容：医療システム開発・販売■サービス詳細：医療の質と収益の向上を実現する 薬剤管理指導支援システム「メディカラボ」薬剤師は最適な薬物療法を提供する医療の担い手として、その役割が多様化・高度化しています。必要な機能をより使いやすくするため、医療現場の薬剤師と共同開発を行いました。薬剤師の負担を増やすことなく、業務の「効率」「精度」の向上を実現します。,東京都港区芝大門2-5-5,1999,,15,100百万円,https://www.i-c-m.com/,,
2024-05-01,株式会社エイト,システムインテグレータ（SIer）,1,■概要：システム開発事業、人材アウトソーシングサービス事業、メディア事業等、幅広く事業を展開しており、トータルソリューションをプライムで提供しています。,東京都渋谷区神宮前6-33-14神宮ハイツ203,2004,29.0,100,30百万円,https://8grp.co.jp/,,
2024-08-01,株式会社リキシステム,システムインテグレータ（SIer）,2,■事業内容：ソフトウェア開発システムソリューション事業として製造系ソリューション、流通系ソリューション、その他ソリューション等のシステムを導入しております。各種業務系アプリケーションを中心としたソリューションをご提案しています。システムの提案、設計、開発、運用、保守等のトータルソリューションでお客さまをサポートいたします。,静岡県浜松市中央区初生町1254-14,2008,36.4,25,10百万円,https://www.rikisys.co.jp,,
2024-06-01,株式会社カスタメディア,システムインテグレータ（SIer）,1,◆ソフトウェア開発◆SaaS事業◆プロモーション事業◆コンサルティング事業,大阪府大阪市北区西天満2-5-2,,,,,Error accessing https://doda.jp/DodaFront/View/JobSearchDetail/j_jid__3010477874/: 'NoneType' object has no attribute 'get',代表取締役 宮﨑 耕史,
2024-07-01,株式会社レイサス,システムインテグレータ（SIer）,2,■事業概要：データベース技術を中核としたオープン系システム開発事業を手がけています。オープン系システム開発を中心にアプリケーションソフトの開発を提供し、また開発に伴うサーバ構築やネットワークデザイン業務についても信頼性の高いシステムを提供します。■これまでの開発実績：システム開発：エントリーシステム（COBOL、VB)／証券取引システム（C言語）／商品システムDB専属担当（Oracle）／法人取引webサイト（Java）／予約webシステム（Java）／Android携帯アプリ開発（Java）など,東京都新宿区市谷砂土原町3-4-2市ヶ谷グリーンプラザ012号,2005,,30,10百万円,http://www.raysus.co.jp/,,
2024-07-01,株式会社プロサポート,ITアウトソーシング,2,■事業内容：当社は人材派遣サービスを行っております。システムエンジニア等のIT系、機械/電気・電子系のような専門性の高い技術を持つスタッフを正社員として、オフィスワーク、製造・物流、販売サービス等の業務は登録型契約社員として雇用し、お客様へ派遣しております。,愛知県名古屋市中区栄2-11-7伏見大島ビル5F,1999,35.0,70,50百万円,https://www.pro-sup.co.jp/,,
2024-07-01,株式会社コネクティボ,システムインテグレータ（SIer）,6,＜雑談が技術の話で盛り上がる／自己研鑽に向けての補助が手厚い／ベンダー認定多数／自社パッケージあり＞■概要：Web系アプリケーションの受託開発及び自社クラウドサービス開発を行っております。,愛知県名古屋市中区錦3-4-6桜通大津第一生命ビル12F,2000,39.0,20,28百万円,https://www.conextivo.com/,,
2024-06-01,アクロ株式会社,システムインテグレータ（SIer）,1,■WEB系、オープン系業務システム開発■モバイルアプリケーション開発■汎用系システム開発■ネットワーク設計・構築・運用■サーバ設計・構築・運用■クラウド導入・運用,東京都新宿区西新宿8-3-1 西新宿GFビル1階,2008,,50,5000万円,https://www.acro.vc/,代表取締役 川島 航,
2024-07-01,株式会社タイムクリエイターズ,ベンダ（ハードウェア・ソフトウェア）,13,■事業概要：ソフトウェア受託サービス、情報処理サービス・2008年の創業以来、製造業を中心とする大手企業に向けた業務システム導入支援を軸に事業展開してきました。システムの要件定義～設計開発、導入後の運用保守まで、一気通貫でサービス提供しています。・設立以来強みとしていたERPパッケージ導入だけでなく、スクラッチシステムの導入に注力し、IoTシステム構築サービスを強化しています。・今後は、クラウド型ソリューションの提供開始を予定しています。,東京都文京区小石川1-1-17,2008,34.0,92,30百万円,https://www.time-creators.co.jp/,,
2024-06-01,株式会社JustEnough,システムインテグレータ（SIer）,1,■各種業務システム（Web、C/S、スタンドアロン）の受託開発■自社プロダクトの企画、開発、運営■ERP、MES、WMSなどのパッケージシステム導入支援、アドオン・カスタマイズ、保守■労働者派遣事業、求人広告代理店事業,東京都千代田区外神田2-2-19 丸和ビル6F,2008,,40,,https://justenough.jp/,代表取締役社長 斎藤 幸治,
2024-07-01,株式会社デルタ総研,システムインテグレータ（SIer）,1,◆移動体通信事業◆ITインフラ事業◆法人サービス事業◆開発事業,東京都江戸川区西葛西6-13-12 第一大高ビル4Ｆ,2008,,82,,https://www.delta-souken.co.jp/,代表取締役 福原 浩太郎,
2024-08-01,株式会社ＨＡＬ,システムインテグレータ（SIer）,99+,■事業内容： ・ コンピュータシステム導入に関するコンサルティング・ コンピュータシステム構築請負業務・ ネットワーク設計、構築、運用・ サーバー設計、構築、運用業務・ コンピュータシステム運用管理業務・ ERP導入コンサルティング業務・ エンジニア教育業務 (新人研修、スキルアップ研修他),東京都千代田区丸の内2-6-1丸の内パークビルディング6F,2003,33.5,950,10百万円,https://www.hal21.co.jp/,,
2024-08-01,株式会社ＡＥＶＩＣ,ITアウトソーシング,1,■コンピュータシステムコンサルティング■ソフトウェア開発受託および業務請負開発■ソフトウェアパッケージ製作・販売■コンピュータシステム運用管理■SaaS事業▼自社開発アプリがテレビで紹介されました▼『ToDotto』https://youtu.be/nPiBTADAEzQ『SaqQutto』https://youtu.be/Om_Z8c1p0PI日本最大級のIT展示会にも出展！,東京都千代田区岩本町2-4-3 太陽生命神田ビル7F,2007,28.0,260,"5,000万円","Failed to retrieve page, status code: 410",代表取締役 村田 伸也,
2024-08-01,株式会社デックス,ベンダ（ハードウェア・ソフトウェア）,1,■事業内容：・機械系ソフトウェア／プロダクト販売及び技術サポート・受託構造解析、3次元モデリング／サービス・機械設計アウトソーシングサービス,福岡県福岡市博多区住吉2-3-7-1305,2005,,13,3百万円,"Failed to retrieve page, status code: 410",,
2024-08-01,ＡＺＡＰＡ株式会社,ITコンサルティング,10,当社は、愛知県名古屋市に本社を置き、自動車を中心としたモビリティ開発支援やコンサルティングサービスを提供している企業です。2008年の設立以来、仮想シミュレーションによるモビリティ開発（モデルベース開発）などの最先端開発技術を武器として大手自動車メーカーやシステムサプライヤーに技術提供してきました。現在では、自動車だけにとどまらず、モビリティ全般の価値設計やエネルギーシステムとの循環設計など事業の裾野を広げ、私たちの生活が一変するような、未来を拓く価値創出に取り組んでおります。,愛知県名古屋市中区錦2-4-15ORE錦二丁目ビル2F,2008,39.0,41,100百万円,https://www.azapa.co.jp,,
2024-06-01,株式会社アプライド・ビジョン・システムズ,ベンダ（ハードウェア・ソフトウェア）,1,■事業内容：・お客様のニーズに合せた３次元画像処理システムの企画/設計/開発/構築・画像処理全般に関するソフトウェアの受託開発・画像処理アルゴリズム開発・３次元画像処理ライブラリ（SDK）の各種カスタマイズ 等,茨城県つくば市梅園2-7-3つくばシティビル403,2004,,19,24百万円,http://avsc.jp/,,
2024-06-01,株式会社フォーサイト・バリュー・テクノロジー,システムインテグレータ（SIer）,4,■企業概要当社は2002年創業のシステムエンジニアリング会社です。2023年現在において、当社の事業の90％はSES事業、10％が受託開発事業となっております。そのうち当社が元請となるプライム比率は売上ベースで70％、案件数ベースでは50％となっており、プライム案件の取引先は銀行、証券会社、建設会社、コンビニエンスストア、損害保険会社、広告代理店など多岐に亘ります。2023年12月現在、86名のシステムエンジニアが都内を中心とする各プロジェクトで活躍しています。,東京都墨田区錦糸1-2-1アルカセントラル7F,2002,37.5,94,30百万円,http://www.fvt.co.jp/,,
2024-08-01,株式会社シーケンス,ITアウトソーシング,5,コンピュータシステムの企画・開発・販売及び保守に関する業務、ハードウエアエンジニア派遣業務などの事業を行っている会社です。社員の自主性を尊重する社風も特徴です。,東京都新宿区新宿3-2-7PLAZA EST新宿三丁目 7F,2001,44.0,64,30百万円,http://www.e-sqc.co.jp/,,
2024-07-01,株式会社グローバルＩＴサービス（GIS）,システムインテグレータ（SIer）,44,■事業概要：すき家等の外食チェーン店を営む、東証一部上場の株式会社ゼンショーの完全子会社で、IT開発・運用を行っています。私たちは、グループシナジー効果の発揮のため、常に業務の標準化・効率化を追求しています。また、そのノウハウを生かし開発したソリューション・プロダクトの販売を実施しています。 ■事業詳細：（1）コンピュータ・システムの企画、開発、保守、運用サービス（2）事務処理代行業務、コンピュータ・データ入力（3）コンピュータ関連機器、ソフト、ネットワークの販売、保守（4）ITコンサルティング・サービス,東京都港区港南2-18-1JR品川イーストビル,2008,,9,10百万円,https://evolio.global-its.co.jp/index.html,,
2024-07-01,株式会社グッドフィールドアンドカンパニー,ITコンサルティング,5,■企業概要：当社はIT運用の保守・サポート、移転・移設作業、ICT運用やITセキュリティをアウトソーシングサービスで支援している企業であり幅広いニーズにお応えすることができる企業です。お客様のそれぞれの企業・組織活動を最適化する上でお客様に必要なサービスを提供しています。IT顧問サービスやwindows10の導入なども積極的に行っており、導入だけではなく使い方まで一貫してサポートを行っています。,東京都中央区八丁堀3-27-4八重洲第8長岡ビル3F,1998,,138,30百万円,https://www.goodfield.co.jp/,,
2024-08-01,ソフトヒューベリオン株式会社,ベンダ（ハードウェア・ソフトウェア）,3,■事業概要：（1）システム開発事業（2）研究開発,東京都千代田区神田佐久間町1-11,2008,28.0,193,50百万円,https://soft-hyperion.com/,,
2024-07-01,株式会社グローテック,システムインテグレータ（SIer）,5,■事業内容：・オンライン金融取引システムの開発／保守・金融情報配信システムの開発・取引所との受発注システム・取引先システムのコンサル業務,東京都中央区新川1-4-1住友不動産六甲ビル6F,2008,38.0,17,46百万円,http://www.growtech.co.jp,,
2024-05-01,大和株式会社,システムインテグレータ（SIer）,3,■概要：当社は、文書管理を専門に扱う専門会社として2008年に起業して以来、様々な業界で文書管理ソリューションの構築に組み込み、業務変革を実現してきました。今後ますます高度化・厳格化するデジタル・データに対する保護・変更記録・監査証跡などの要求にも対応し、お客様の企業理念の実現をサポートするソリューションを提供しつづけます。新しい技術の恩恵をユーザーが日々の業務の中で享受できるようにしたい。私たちの企業価値はそこにあります。,東京都豊島区北大塚1-18-1サンバレー大塚301,2008,33.0,22,10百万円,http://www.yamato-ltd.com,,
2024-07-01,株式会社シーエムシー,ベンダ（ハードウェア・ソフトウェア）,2,■システム受託開発■システムエンジニアリングサービス（SES）,東京都港区新橋4-30-6 京急中はらビル,1998,,729,4000万円,https://www.cmcnet.co.jp/it-division/,代表取締役社長 神部 幸生,
2024-08-01,株式会社アスネット,ITアウトソーシング,6,■事業内容: (1)ソフトウェアディベロップメント(2)ネットワークソリューション(3)プロダクトテスティング (4)ITコンサルティング業務,東京都新宿区西新宿7-23-1TSビル5F,2001,30.0,80,10百万円,http://www.asnet.co.jp/,,
2024-07-01,エスコ・ジャパン株式会社,システムインテグレータ（SIer）,2,■企業概要：ローコード開発、Web・オープン系システム開発や、ITプラットフォーム構築、大手金融・生損保業界を中心に事業を展開し大きく伸びている企業です。お客様のDXを全面的に支援するローコードツールソリューション『ESCCO Low Code Suite（略称ELCS）』をメインとしたITソリューションの開発・販売を行い、順調に成長しています,東京都新宿区大久保2-2-12VORT東新宿6F,2008,36.9,76,67百万円,http://www.escco.co.jp/,,
2024-08-01,株式会社エーティーエルシステムズ,ITコンサルティング,17,■事業内容・IT ソリューションの企画、アドバイザリー業務・電算業務システム全般のコンサル調査、調達支援・ネットワークシステム全般のコンサル調査、設計、構築、運用保守・Web システム全般の企画、構築、運用保守,山梨県甲府市太田町9-7,2008,35.7,81,20百万円,https://www.atl-systems.co.jp/,,
2024-07-01,使えるねっと株式会社,通信キャリア・ISP・データセンター,2,■事業内容： 20年間幅広くクラウドサービスを展開しています。国内だけでなく、オーストラリア、インドネシア、米国、デンマークなど、ソリューション事業を軸に大きく5つの事業で展開しています。,長野県長野市南県町1082ND南県町ビル3F,1999,,25,"7,400百万円",https://www.tsukaeru.net/,,
2024-07-01,株式会社グリュックス,システムインテグレータ（SIer）,1,■事業内容： ・ワイアレスデータ通信システム「V-NET」の開発・販売・ファンクラブ管理システム「ifanアイファン」・Web用CMS（コンテンツ更新プログラム）「eventa」・こどもプログラミングスクール「GNY」,秋田県秋田市川尻大川町1-25アップヒル21,2006,35.0,6,3百万円,https://glucks.jp/,,
