更新日,名称,業界(小分類),求人有無,所在地,設立,代表者,資本金,平均年齢,従業員数,企業URL,事業内容,上場市場名
2024-08-01,ＬｉＶエンヂニアリング株式会社,サブコン,求人なし,兵庫県伊丹市中野東3-130,2008,代表取締役 橋本 剛志,30 百万円,,,Error accessing nan: Invalid URL 'nan': No scheme supplied. Perhaps you meant https://nan?,,
2024-08-01,琉球国際航業株式会社,建設コンサルタント,求人なし,沖縄県那覇市字小禄1831-1沖縄産業支援センター 4Ｆ,2008,代表取締役 駒宮 聡,40 百万円,,,Error accessing nan: Invalid URL 'nan': No scheme supplied. Perhaps you meant https://nan?,,
2024-08-01,株式会社東都設計,ゼネコン,求人なし,東京都目黒区上目黒1-5-7,1989,代表取締役 片野 秀夫,5 百万円,,,Error accessing nan: Invalid URL 'nan': No scheme supplied. Perhaps you meant https://nan?,,
2024-08-01,株式会社日光ホーム,土地活用,無,大阪府大阪市浪速区稲荷2-1-3日光ハウジング本社ビル 1Ｆ,2003,代表取締役 上杉 薫,10 百万円,,,Error accessing nan: Invalid URL 'nan': No scheme supplied. Perhaps you meant https://nan?,,
2024-08-01,株式会社ソウ・システム・サービス,プラントメーカー・プラントエンジニアリング,求人なし,東京都青梅市新町3-3-1宇源ビル 5Ｆ,1998,代表取締役 戸梶 総,80 百万円,,,Error accessing nan: Invalid URL 'nan': No scheme supplied. Perhaps you meant https://nan?,,
2024-08-01,Ｔ‐ＰＬＡＮ株式会社,プラントメーカー・プラントエンジニアリング,求人なし,大分県中津市大字牛神404-11,2006,代表取締役 寺下 満,34 百万円,,,Error accessing nan: Invalid URL 'nan': No scheme supplied. Perhaps you meant https://nan?,,
2024-08-01,株式会社アコードエンジニアリング,住宅設備・建材,求人なし,愛知県豊橋市小向町字北小向15,2003,代表取締役 川瀬 知幸,20 百万円,,,Error accessing nan: Invalid URL 'nan': No scheme supplied. Perhaps you meant https://nan?,,
2024-08-01,株式会社ＳＴＣ,サブコン,求人なし,神奈川県相模原市中央区矢部3-18-7ＧＨＰビル 301,2009,代表取締役 末原 拓男,8 百万円,,,Error accessing nan: Invalid URL 'nan': No scheme supplied. Perhaps you meant https://nan?,,
2024-08-01,株式会社ＣｏｅｘＣｏｎｎｅｃｔ,設備管理・メンテナンス,求人なし,東京都大田区蒲田4-43-14ＥＰＩ6ビル 3Ｆ,2005,代表取締役 齊藤 篤志,10 百万円,,,Error accessing nan: Invalid URL 'nan': No scheme supplied. Perhaps you meant https://nan?,,
2024-08-01,株式会社アイビーホーム,不動産仲介,無,愛知県名古屋市南区明治1-16-1,2006,代表取締役 金谷 京子,10 百万円,,,Error accessing nan: Invalid URL 'nan': No scheme supplied. Perhaps you meant https://nan?,,
2024-08-01,川端エンジニアリング株式会社,サブコン,求人なし,大阪府堺市堺区緑町4-152堺鐵鋼ビル 213,1962,代表取締役 益田 誠記,30 百万円,,,Error accessing nan: Invalid URL 'nan': No scheme supplied. Perhaps you meant https://nan?,,
2024-08-01,株式会社リアルリンク・アネックス,不動産仲介,求人なし,東京都文京区後楽1-4-14後楽森ビル18Ｆ,2004,代表取締役 菊池 淳,3 百万円,,,Error accessing nan: Invalid URL 'nan': No scheme supplied. Perhaps you meant https://nan?,,
2024-08-01,北斗株式会社,サブコン,求人なし,宮城県気仙沼市最知荒沢192-1,1985,代表取締役 武田 孝志,20 百万円,,,Error accessing nan: Invalid URL 'nan': No scheme supplied. Perhaps you meant https://nan?,,
2024-08-01,株式会社中瀬古工務店,住宅（ハウスメーカー）,求人なし,大阪府大阪狭山市西山台3-1-30,2016,代表取締役 中瀬古 優一,9 百万円,,,Error accessing nan: Invalid URL 'nan': No scheme supplied. Perhaps you meant https://nan?,,
2024-08-01,株式会社スペースリブ,不動産仲介,求人なし,東京都港区南青山5-9-6青山596 1Ｆ,1965,代表取締役 永田 恵,10 百万円,,,Error accessing nan: Invalid URL 'nan': No scheme supplied. Perhaps you meant https://nan?,,
2024-08-01,熊本管工建設株式会社,サブコン,求人なし,熊本県熊本市中央区萩原町14-85,2008,代表取締役 谷本 篤史,50 百万円,,,Error accessing nan: Invalid URL 'nan': No scheme supplied. Perhaps you meant https://nan?,,
2024-08-01,株式会社北海道ライン興業,内装・インテリア・リフォーム,無,北海道札幌市西区発寒九条9-1-33,1977,代表取締役 加藤 悟,10 百万円,,,Error accessing nan: Invalid URL 'nan': No scheme supplied. Perhaps you meant https://nan?,情報が古い可能性があります。最新の情報を確認する場合はHP等をご覧ください。 ■道路区画線・標示工事の設計施工■駐車場関連（白線、車止めブロック等）工事の設計施工■道路標識設置に関する設計施工■視覚障害者誘導標示設置・施工■その他各種作業・物品・資材の販売 2021年11月doda掲載求人より引用,
2024-08-01,三原電機有限会社,サブコン,求人なし,広島県三原市宗郷3-4-6,1983,代表取締役 川島 利成,3 百万円,,,Error accessing nan: Invalid URL 'nan': No scheme supplied. Perhaps you meant https://nan?,,
2024-08-01,株式会社ジーエイチアール,内装・インテリア・リフォーム,求人なし,岐阜県岐阜市茜部大川2-16-1,1996,代表取締役 堀 静義,10 百万円,,,Error accessing nan: Invalid URL 'nan': No scheme supplied. Perhaps you meant https://nan?,,
2024-08-01,株式会社シルクフィールド,不動産仲介,無,神奈川県相模原市南区古淵4-4-17ベネフィーク 1Ｆ,1991,代表取締役 山田 絹子,3 百万円,,,Error accessing nan: Invalid URL 'nan': No scheme supplied. Perhaps you meant https://nan?,,
2024-08-01,株式会社エス土地調査企画,不動産仲介,求人なし,岡山県倉敷市福島698-2,1998,代表取締役 中山田 英樹,10 百万円,,,Error accessing nan: Invalid URL 'nan': No scheme supplied. Perhaps you meant https://nan?,,
2024-08-01,株式会社豊川,不動産仲介,求人なし,愛知県豊田市長興寺3-55-1,2002,代表取締役 佐藤 栄亮,10 百万円,,,Error accessing nan: Invalid URL 'nan': No scheme supplied. Perhaps you meant https://nan?,,
2024-08-01,Ｍｅｄｉｃｏ－ｔｅｃ株式会社,内装・インテリア・リフォーム,求人なし,京都府京都市中京区壬生西檜町17-2,2003,代表取締役 宿野 秀晴,3 百万円,,,Error accessing nan: Invalid URL 'nan': No scheme supplied. Perhaps you meant https://nan?,,
2024-08-01,株式会社高山不動産,不動産仲介,求人なし,福岡県宗像市赤間駅前1-7-1,1972,代表取締役 高山 卓也,10 百万円,,,Error accessing nan: Invalid URL 'nan': No scheme supplied. Perhaps you meant https://nan?,,
2024-08-01,株式会社スクリーン設備,設備管理・メンテナンス,求人なし,茨城県坂東市内野山916-1,1997,代表取締役 上村 秀人,3 百万円,,,Error accessing nan: Invalid URL 'nan': No scheme supplied. Perhaps you meant https://nan?,,
2024-08-01,株式会社ドット・スペース,サブコン,求人なし,東京都大田区北馬込2-36-4,2002,代表取締役 江守 教裕,5 百万円,,,Error accessing nan: Invalid URL 'nan': No scheme supplied. Perhaps you meant https://nan?,,
2024-08-01,株式会社テクノ,設備管理・メンテナンス,求人なし,大阪府阪南市桃の木台2-1-3,2004,代表取締役 藤居 秀敏,30 百万円,,,Error accessing nan: Invalid URL 'nan': No scheme supplied. Perhaps you meant https://nan?,,
2024-08-01,株式会社丸善住宅販売,不動産仲介,求人なし,埼玉県入間郡毛呂山町中央4-13-1グランドコスモス 101,1998,代表取締役 遠藤 潤,10 百万円,,,Error accessing nan: Invalid URL 'nan': No scheme supplied. Perhaps you meant https://nan?,,
2024-08-01,株式会社柏陽ビケ,住宅設備・建材,求人なし,千葉県柏市若白毛916-1,2007,代表取締役 木村 達也,5 百万円,,,Error accessing nan: Invalid URL 'nan': No scheme supplied. Perhaps you meant https://nan?,,
2024-08-01,株式会社日橋コンサルタント,建築設計事務所,求人なし,岡山県倉敷市沖新町48-19,1975,代表取締役 岩﨑 幸則,15 百万円,,,Error accessing nan: Invalid URL 'nan': No scheme supplied. Perhaps you meant https://nan?,,
2024-08-01,株式会社鉄建設計,建築設計事務所,求人なし,静岡県静岡市清水区新緑町3-12,1981,代表取締役 小倉 雄介,10 百万円,,,Error accessing nan: Invalid URL 'nan': No scheme supplied. Perhaps you meant https://nan?,,
2024-08-01,株式会社杉本建装工業,ゼネコン,求人なし,大阪府堺市西区草部818-3,1997,代表取締役 杉本 務,10 百万円,,,Error accessing nan: Invalid URL 'nan': No scheme supplied. Perhaps you meant https://nan?,,
2024-08-01,株式会社斉藤興業,サブコン,求人なし,埼玉県草加市金明町186-8,1990,代表取締役 磯部 孝志,20 百万円,,,Error accessing nan: Invalid URL 'nan': No scheme supplied. Perhaps you meant https://nan?,,
2024-08-01,株式会社ユーダイ,設備管理・メンテナンス,無,東京都杉並区松ノ木2-20-4,1990,代表取締役 吉原 晴夫,35 百万円,,,Error accessing nan: Invalid URL 'nan': No scheme supplied. Perhaps you meant https://nan?,,
2024-08-01,有限会社堅昇土建,サブコン,求人なし,神奈川県海老名市国分北2-17-34,2003,代表取締役 見上 健一,6 百万円,,,Error accessing nan: Invalid URL 'nan': No scheme supplied. Perhaps you meant https://nan?,,
2024-08-01,株式会社さくら塗建,サブコン,求人なし,千葉県千葉市花見川区こてはし台3-4-15,2006,代表取締役 小関 操,3 百万円,,,Error accessing nan: Invalid URL 'nan': No scheme supplied. Perhaps you meant https://nan?,,
2024-08-01,株式会社丸吉住宅センター,不動産管理,求人なし,埼玉県越谷市千間台東1-1-12,1977,代表取締役 堀野 眞孝,3 百万円,,,Error accessing nan: Invalid URL 'nan': No scheme supplied. Perhaps you meant https://nan?,,
2024-08-01,株式会社レントホーム,不動産仲介,求人なし,大阪府藤井寺市藤井寺1-1-19安松ビル 2Ｆ,1998,代表取締役 佐伯 透,10 百万円,,,Error accessing nan: Invalid URL 'nan': No scheme supplied. Perhaps you meant https://nan?,,
2024-08-01,アベ不動産株式会社,不動産仲介,求人なし,愛知県名古屋市緑区滝ノ水1-1004,2003,代表取締役 阿部 茂男,10 百万円,,,Error accessing nan: Invalid URL 'nan': No scheme supplied. Perhaps you meant https://nan?,,
2024-08-01,ワンズ不動産株式会社,不動産仲介,求人なし,熊本県熊本市中央区京町1-11-20エンペラーハウス 101,1997,代表取締役 中島 潔,10 百万円,,,Error accessing nan: Invalid URL 'nan': No scheme supplied. Perhaps you meant https://nan?,,
2024-08-01,株式会社ワイズステイツ,不動産仲介,求人なし,東京都豊島区池袋2-23-4国土池袋ビル20Ａ,1998,代表取締役 髙原 康,3 百万円,,,Error accessing nan: Invalid URL 'nan': No scheme supplied. Perhaps you meant https://nan?,,
2024-08-01,株式会社コーティング企画,内装・インテリア・リフォーム,求人なし,滋賀県湖南市日枝町101-37,1985,代表取締役 中村 康夫,25 百万円,,,Error accessing nan: Invalid URL 'nan': No scheme supplied. Perhaps you meant https://nan?,,
2024-08-01,株式会社アーキグラム,建設コンサルタント,求人なし,埼玉県さいたま市浦和区上木崎2-16-6,2009,代表取締役 三木 さおり,2 百万円,,,Error accessing nan: Invalid URL 'nan': No scheme supplied. Perhaps you meant https://nan?,,
2024-08-01,株式会社一哲,サブコン,求人なし,愛知県名古屋市西区城町35,2008,代表取締役 藤本 哲也,10 百万円,,,Error accessing nan: Invalid URL 'nan': No scheme supplied. Perhaps you meant https://nan?,,
2024-08-01,株式会社石倉屋,内装・インテリア・リフォーム,求人なし,愛知県名古屋市緑区相原郷2-1814,2008,代表取締役 石倉 勇志,1 百万円,,,Error accessing nan: Invalid URL 'nan': No scheme supplied. Perhaps you meant https://nan?,,
2024-08-01,株式会社古林,建設・プラント・不動産業界,求人なし,東京都新宿区四谷3-7-5グレナデン四谷三丁目 3Ｆ,2009,代表取締役 小林 剛,3 百万円,,,Error accessing nan: Invalid URL 'nan': No scheme supplied. Perhaps you meant https://nan?,,
2024-08-01,株式会社広信工業,ゼネコン,求人なし,北海道札幌市東区東苗穂八条1-7-16,2009,代表取締役 海老名 賢一,30 百万円,,,Error accessing nan: Invalid URL 'nan': No scheme supplied. Perhaps you meant https://nan?,,
2024-08-01,技建コンセプト株式会社,ゼネコン,求人なし,北海道札幌市白石区川下589-265,1984,代表取締役 守田 周平,40 百万円,,,Error accessing nan: Invalid URL 'nan': No scheme supplied. Perhaps you meant https://nan?,,
2024-08-01,株式会社アクアシーン,設備管理・メンテナンス,求人なし,広島県広島市南区段原山崎3-2-12,2008,代表取締役 三谷 勝也,1 百万円,,,Error accessing nan: Invalid URL 'nan': No scheme supplied. Perhaps you meant https://nan?,,
2024-08-01,株式会社ガッツ,サブコン,求人なし,広島県広島市東区中山北町1-2,1998,代表取締役 吉永 征史,20 百万円,,,Error accessing nan: Invalid URL 'nan': No scheme supplied. Perhaps you meant https://nan?,,
2024-08-01,株式会社エコテックシステム,住宅設備・建材,無,福岡県筑紫野市杉塚6-11-24,2004,代表取締役 用松 昭信,15 百万円,,,Error accessing nan: Invalid URL 'nan': No scheme supplied. Perhaps you meant https://nan?,,
2024-08-01,株式会社Ｒ’Ｚ・エバーラスティング,不動産仲介,無,福岡県福岡市中央区薬院3-14-26Ｆ－ＢＩＬＤ 4Ｆ,2009,代表取締役 石村 良平,20 百万円,,,Error accessing nan: Invalid URL 'nan': No scheme supplied. Perhaps you meant https://nan?,,
2024-08-01,太洋技建株式会社,内装・インテリア・リフォーム,求人なし,福岡県北九州市小倉北区昭和町13-13太洋技建小倉ビル 2Ｆ,2005,代表取締役 池田 和久,10 百万円,,,Error accessing nan: Invalid URL 'nan': No scheme supplied. Perhaps you meant https://nan?,,
2024-08-01,不動産マーケット株式会社,不動産仲介,求人なし,山梨県甲府市丸の内2-32-5ラ・レジダンス・ド・グロワール 1Ｆ,1996,代表取締役 小林 士朗,10 百万円,,,Error accessing nan: Invalid URL 'nan': No scheme supplied. Perhaps you meant https://nan?,,
2024-08-01,株式会社上原不動産,不動産仲介,求人なし,山口県下関市上条町1-47,2001,代表取締役 上原 祥典,10 百万円,,,Error accessing nan: Invalid URL 'nan': No scheme supplied. Perhaps you meant https://nan?,,
2024-08-01,株式会社ＨＡＳ,住宅設備・建材,求人なし,神奈川県横浜市神奈川区菅田町1758,2009,代表取締役 戸村 進一,9 百万円,,,Error accessing nan: Invalid URL 'nan': No scheme supplied. Perhaps you meant https://nan?,,
2024-08-01,株式会社ユウ・イー・エヌ,設備管理・メンテナンス,求人なし,神奈川県横浜市栄区公田町936-4,2009,代表取締役 漆原 一範,10 百万円,,,Error accessing nan: Invalid URL 'nan': No scheme supplied. Perhaps you meant https://nan?,,
2024-08-01,株式会社湘南りあるホーム,不動産仲介,求人なし,神奈川県藤沢市藤沢3-1-29,2009,代表取締役 中島 智司,5 百万円,,,Error accessing nan: Invalid URL 'nan': No scheme supplied. Perhaps you meant https://nan?,,
2024-08-01,株式会社ユニバーサルスペース,内装・インテリア・リフォーム,求人なし,神奈川県横浜市港北区新横浜2-6-1アーバス新横浜3Ｆ,2009,代表取締役 遠藤 哉,47 百万円,,,Error accessing nan: Invalid URL 'nan': No scheme supplied. Perhaps you meant https://nan?,,
2024-08-01,株式会社Ｄｌｉｆｅｐｌａｎｎｉｎｇ,建築設計事務所,求人なし,大阪府大阪市西区江戸堀2-5-26804,2009,代表取締役 大下 礼子,7 百万円,,,Error accessing nan: Invalid URL 'nan': No scheme supplied. Perhaps you meant https://nan?,,
2024-08-01,ＡＩＭＳ株式会社,設備管理・メンテナンス,求人なし,東京都世田谷区三軒茶屋2-56-7,2009,代表取締役 北田 憲二,10 百万円,,,Error accessing nan: Invalid URL 'nan': No scheme supplied. Perhaps you meant https://nan?,,
2024-08-01,ハニカム株式会社,内装・インテリア・リフォーム,求人なし,大阪府大阪市中央区安土町1-7-20新トヤマビル 9Ｆ,2009,代表取締役 常深 哲也,5 百万円,,,Error accessing nan: Invalid URL 'nan': No scheme supplied. Perhaps you meant https://nan?,,
2024-08-01,株式会社ケイビュロー,内装・インテリア・リフォーム,求人なし,大阪府大阪市東成区東小橋1-12-30,2009,代表取締役 久保 治彦,3 百万円,,,Error accessing nan: Invalid URL 'nan': No scheme supplied. Perhaps you meant https://nan?,,
2024-08-01,サウス工業株式会社,ゼネコン,求人なし,大阪府大阪市東住吉区桑津5-19-9,2009,代表取締役 奥山 秀人,35 百万円,,,Error accessing nan: Invalid URL 'nan': No scheme supplied. Perhaps you meant https://nan?,,
2024-08-01,株式会社ケイエスジー,住宅設備・建材,求人なし,大阪府大阪市東淀川区東中島1-6-14第2日大ビル 4Ｆ,2009,代表取締役 濱岡 やよい,3 百万円,,,Error accessing nan: Invalid URL 'nan': No scheme supplied. Perhaps you meant https://nan?,,
2024-08-01,株式会社アメニティ,不動産管理,求人なし,大阪府大阪市中央区北久宝寺町3-5-12御堂筋本町アーバンビル 8Ｆ,2009,代表取締役 河村 博之,100 百万円,,,Error accessing nan: Invalid URL 'nan': No scheme supplied. Perhaps you meant https://nan?,,
2024-08-01,株式会社モリコー,内装・インテリア・リフォーム,求人なし,大阪府堺市南区槇塚台2-38-58,2009,代表取締役 森 幸一,3 百万円,,,Error accessing nan: Invalid URL 'nan': No scheme supplied. Perhaps you meant https://nan?,,
2024-08-01,株式会社ライフナビゲート,不動産仲介,求人なし,東京都渋谷区代々木2-23-1ニューステイトメナー743,2009,代表取締役 青木 純子,9 百万円,,,Error accessing nan: Invalid URL 'nan': No scheme supplied. Perhaps you meant https://nan?,,
2024-08-01,日本リアライズ株式会社,ディベロッパー,求人なし,東京都新宿区新宿1-36-7新宿内野ビルＩＩ 3Ｆ、8Ｆ,2009,代表取締役 大橋 孝行,100 百万円,,,Error accessing nan: Invalid URL 'nan': No scheme supplied. Perhaps you meant https://nan?,,
2024-08-01,トーユーハウス株式会社,内装・インテリア・リフォーム,求人なし,東京都新宿区新宿6-24-22リレント新宿 203,2009,代表取締役 伊藤 雅子,9 百万円,,,Error accessing nan: Invalid URL 'nan': No scheme supplied. Perhaps you meant https://nan?,,
2024-08-01,株式会社日本トラスト,ディベロッパー,無,東京都新宿区新宿3-13-5クリハシビル 7Ｆ,2009,代表取締役 三好 浩司,9 百万円,,,Error accessing nan: Invalid URL 'nan': No scheme supplied. Perhaps you meant https://nan?,,
2024-08-01,臼倉建装株式会社,内装・インテリア・リフォーム,求人なし,東京都足立区江北4-26-7,2009,代表取締役 臼倉 徹,7 百万円,,,Error accessing nan: Invalid URL 'nan': No scheme supplied. Perhaps you meant https://nan?,,
2024-08-01,株式会社ケーエルシー,建築設計事務所,求人なし,東京都港区南青山5-4-35たつむら青山マンション 501,2009,代表取締役 矢野 寛明,1 百万円,,,Error accessing nan: Invalid URL 'nan': No scheme supplied. Perhaps you meant https://nan?,,
2024-08-01,昭和アステック株式会社,プラントメーカー・プラントエンジニアリング,求人なし,東京都港区東新橋2-8-1パラッツォアステックビル 5Ｆ、6Ｆ,2009,代表取締役 堀江 健介,100 百万円,,,Error accessing nan: Invalid URL 'nan': No scheme supplied. Perhaps you meant https://nan?,,
2024-08-01,株式会社オフィスＲ＆Ｍ,不動産仲介,無,東京都中央区八重洲2-10-10,2009,代表取締役 宮本 正好,20 百万円,,,Error accessing nan: Invalid URL 'nan': No scheme supplied. Perhaps you meant https://nan?,,
2024-08-01,株式会社オフィス・トゥ・スリー,不動産仲介,求人なし,東京都港区新橋2-20-15新橋駅前ビル壱号館 610,2009,代表取締役 岸本 修治,3 百万円,,,Error accessing nan: Invalid URL 'nan': No scheme supplied. Perhaps you meant https://nan?,,
2024-08-01,株式会社ウィルゲイツ・インベストメント,不動産仲介,求人なし,東京都渋谷区渋谷1-12-2,2009,代表取締役 髙田 祐,89 百万円,,,Error accessing nan: Invalid URL 'nan': No scheme supplied. Perhaps you meant https://nan?,,
2024-08-01,有限会社陸正開発,サブコン,求人なし,岡山県倉敷市連島1-17-19,1978,代表取締役 大熊 正嗣,20 百万円,,,Error accessing nan: Invalid URL 'nan': No scheme supplied. Perhaps you meant https://nan?,,
2024-08-01,株式会社はろうす,建築設計事務所,求人なし,愛知県知多市新知東町2-27-8,1997,代表取締役 道元 英夫,10 百万円,,,Error accessing nan: Invalid URL 'nan': No scheme supplied. Perhaps you meant https://nan?,,
2024-08-01,株式会社アレンジコンクリート,内装・インテリア・リフォーム,求人なし,埼玉県北足立郡伊奈町栄2-113,2004,代表取締役 田淵 憲一,20 百万円,,,Error accessing nan: Invalid URL 'nan': No scheme supplied. Perhaps you meant https://nan?,,
2024-08-01,株式会社レオガーデン,住宅（ハウスメーカー）,求人なし,千葉県船橋市山野町103-4,1989,代表取締役 増子 範幸,3 百万円,,,Error accessing nan: Invalid URL 'nan': No scheme supplied. Perhaps you meant https://nan?,,
2024-08-01,光陽送電サービス株式会社,サブコン,求人なし,栃木県宇都宮市宝木町2-880,1974,代表取締役 飯村 愼一,3 百万円,,,Error accessing nan: Invalid URL 'nan': No scheme supplied. Perhaps you meant https://nan?,,
2024-08-01,株式会社マトリックスレジデンシャル,不動産仲介,無,東京都八王子市八幡町14-16,2009,代表取締役 湊 正明,10 百万円,,,Error accessing nan: Invalid URL 'nan': No scheme supplied. Perhaps you meant https://nan?,,
2024-08-01,株式会社オレンジホーム企画,不動産仲介,無,埼玉県上尾市宮本町10-25,2007,代表取締役 佐藤 敏昭,20 百万円,,,Error accessing nan: Invalid URL 'nan': No scheme supplied. Perhaps you meant https://nan?,,
2024-08-01,株式会社フロンティアホールディングス,不動産仲介,求人なし,大阪府大阪市都島区東野田町1-21-14ニュー若杉ビル 9Ｆ,2007,代表取締役社長 中西 栄仁,100 百万円,,,Error accessing nan: Invalid URL 'nan': No scheme supplied. Perhaps you meant https://nan?,,地方上場
2024-08-01,株式会社フロンティアエクスプレス,住宅設備・建材,求人なし,埼玉県川口市江戸袋1-12-17,2003,代表取締役 三堀 淳,10 百万円,,,Error accessing nan: Invalid URL 'nan': No scheme supplied. Perhaps you meant https://nan?,,
2024-08-01,Ｔ＆日本メンテ開発株式会社,サブコン,求人なし,山形県酒田市木川字東中道29-8,1970,代表取締役 土門 雅仁,20 百万円,,,Error accessing nan: Invalid URL 'nan': No scheme supplied. Perhaps you meant https://nan?,,
2024-08-01,株式会社東和リース,サブコン,求人なし,愛知県知多郡東浦町大字森岡字一色畑60-8,1996,代表取締役 鈴木 智博,12 百万円,,,Error accessing nan: Invalid URL 'nan': No scheme supplied. Perhaps you meant https://nan?,,
2024-08-01,コバ測建株式会社,サブコン,求人なし,千葉県習志野市花咲1-17-18,2008,代表取締役 小林 一彦,5 百万円,,,Error accessing nan: Invalid URL 'nan': No scheme supplied. Perhaps you meant https://nan?,,
2024-08-01,株式会社カネデン,住宅設備・建材,求人なし,千葉県船橋市本町3-6-12,2007,代表取締役 金子 大介,9 百万円,,,Error accessing nan: Invalid URL 'nan': No scheme supplied. Perhaps you meant https://nan?,,
2024-08-01,百年住宅西日本株式会社,住宅（ハウスメーカー）,無,山口県山口市嘉川3471-1,2008,代表取締役 中嶋 文雄,45 百万円,,,Error accessing nan: Invalid URL 'nan': No scheme supplied. Perhaps you meant https://nan?,■建設業（一般住宅、集合住宅の建築）■一級建築士事務所■宅地建物取引業■保険業 2023年12月doda掲載求人より引用,
2024-08-01,株式会社コルピソス,建築設計事務所,求人なし,東京都世田谷区北烏山9-1-4コルピソス 1Ｆ,2001,代表取締役 満田 哲哉,10 百万円,,,Error accessing nan: Invalid URL 'nan': No scheme supplied. Perhaps you meant https://nan?,,
2024-08-01,株式会社ビルドエイトワンホーム,住宅（ハウスメーカー）,無,千葉県鎌ケ谷市東道野辺2-10-45,1989,代表取締役 八重樫 壽,3 百万円,,,Error accessing nan: Invalid URL 'nan': No scheme supplied. Perhaps you meant https://nan?,,
