更新日,名称,業界(小分類),求人有無,所在地,設立,代表者,資本金,平均年齢,従業員数,企業URL,事業内容
2024-08-01,株式会社未来都市住販,不動産管理,求人なし,東京都新宿区新宿1-4-13溝呂木第二ビル80Ｃ,2012,代表取締役 高橋 昌成,9 百万円,,,Error accessing nan: Invalid URL 'nan': No scheme supplied. Perhaps you meant https://nan?,
2024-08-01,株式会社江戸建装,内装・インテリア・リフォーム,求人なし,静岡県磐田市赤池32-1,2012,代表取締役 有田 エド,1 百万円,,,Error accessing nan: Invalid URL 'nan': No scheme supplied. Perhaps you meant https://nan?,
2024-08-01,アサヒアレックス東日本株式会社,内装・インテリア・リフォーム,求人なし,宮城県仙台市太白区長町南4-11-182Ｆ,2012,代表取締役 石倉 茂雄,50 百万円,,,Error accessing nan: Invalid URL 'nan': No scheme supplied. Perhaps you meant https://nan?,
2024-08-01,株式会社Ｍ＆Ｂ,住宅設備・建材,求人なし,宮城県宮城郡利府町菅谷字東浦32-1202,2012,代表取締役 佐藤 修平,20 百万円,,,Error accessing nan: Invalid URL 'nan': No scheme supplied. Perhaps you meant https://nan?,
2024-08-01,中西不動産株式会社,不動産仲介,求人なし,兵庫県姫路市南駅前町81,2012,代表取締役 中西 康貴,10 百万円,,,Error accessing nan: Invalid URL 'nan': No scheme supplied. Perhaps you meant https://nan?,
2024-08-01,株式会社桜咲工務店,内装・インテリア・リフォーム,求人なし,兵庫県加古郡稲美町国安335-5,2012,代表取締役 大庭 伸昭,10 百万円,,,Error accessing nan: Invalid URL 'nan': No scheme supplied. Perhaps you meant https://nan?,
2024-08-01,スマートホーム株式会社,不動産仲介,求人なし,兵庫県西宮市花園町11-19,2012,代表取締役 前川 格,7 百万円,,,Error accessing nan: Invalid URL 'nan': No scheme supplied. Perhaps you meant https://nan?,
2024-08-01,株式会社和不動産,不動産仲介,求人なし,東京都千代田区神田須田町1-7-9ＶＯＲＴ秋葉原ｍａｘｉｍ 7Ｆ～9Ｆ,1978,代表取締役 仲宗根 和徳,15 百万円,,,Error accessing nan: Invalid URL 'nan': No scheme supplied. Perhaps you meant https://nan?,
2024-08-01,株式会社立飛ホールディングス,ディベロッパー,求人なし,東京都立川市栄町6-1立飛ビル3号館,2011,代表取締役 村山 正道,15 百万円,,,Error accessing nan: Invalid URL 'nan': No scheme supplied. Perhaps you meant https://nan?,
2024-08-01,株式会社セイワメンテナンス,住宅設備・建材,求人なし,福岡県福岡市南区井尻4-7-19,2012,代表取締役 坂井 正満,3 百万円,,,Error accessing nan: Invalid URL 'nan': No scheme supplied. Perhaps you meant https://nan?,
2024-08-01,株式会社オークハウジング,不動産仲介,求人なし,福岡県福岡市中央区大名2-10-38ディー・ウイングタワー 2Ｆ,2012,代表取締役 村上 秀樹,10 百万円,,,Error accessing nan: Invalid URL 'nan': No scheme supplied. Perhaps you meant https://nan?,
2024-08-01,株式会社ＳＨＯＷ，ＥＩ．,内装・インテリア・リフォーム,求人なし,神奈川県横浜市都筑区東山田4-45-21,2012,代表取締役 山下 照久,5 百万円,,,Error accessing nan: Invalid URL 'nan': No scheme supplied. Perhaps you meant https://nan?,
2024-08-01,オーガニックスタジオ兵庫株式会社,内装・インテリア・リフォーム,求人なし,兵庫県神戸市垂水区名谷町字丸尾474-2,2012,代表取締役 大島 伊知郎,5 百万円,,,Error accessing nan: Invalid URL 'nan': No scheme supplied. Perhaps you meant https://nan?,
2024-08-01,株式会社Ｌ．Ｓ,不動産仲介,求人なし,兵庫県尼崎市東園田町9-1-6,2011,代表取締役 武中 千代,1 百万円,,,Error accessing nan: Invalid URL 'nan': No scheme supplied. Perhaps you meant https://nan?,
2024-08-01,株式会社翔建装,内装・インテリア・リフォーム,求人なし,福岡県福岡市西区石丸3-32-9,2012,代表取締役 坂根 照政,3 百万円,,,Error accessing nan: Invalid URL 'nan': No scheme supplied. Perhaps you meant https://nan?,
2024-08-01,アスカリビング株式会社,内装・インテリア・リフォーム,求人なし,神奈川県川崎市中原区下小田中2-28-26,2012,代表取締役 林 里美,10 百万円,,,Error accessing nan: Invalid URL 'nan': No scheme supplied. Perhaps you meant https://nan?,
2024-08-01,ＰｒｉｍｅＨｏｐｅｓ株式会社,設備管理・メンテナンス,求人なし,神奈川県横浜市瀬谷区瀬谷4-39-17,2012,代表取締役 青木 章浩,1 百万円,,,Error accessing nan: Invalid URL 'nan': No scheme supplied. Perhaps you meant https://nan?,
2024-08-01,株式会社ラフワークス,建築設計事務所,無,神奈川県横浜市中区海岸通4-20-2ＹＴ馬車道ビル,2012,代表取締役 武田 潤,3 百万円,,,Error accessing nan: Invalid URL 'nan': No scheme supplied. Perhaps you meant https://nan?,
2024-08-01,株式会社ラックスエステート,不動産仲介,求人なし,神奈川県藤沢市藤沢101-6シティーポート藤沢西原ビル 302,2012,代表取締役 小川 頌平,10 百万円,,,Error accessing nan: Invalid URL 'nan': No scheme supplied. Perhaps you meant https://nan?,
2024-08-01,株式会社ウィステリア,建築設計事務所,求人なし,神奈川県横浜市神奈川区鶴屋町2-21-9三善ビル602,2012,代表取締役 藤江 俊彦,3 百万円,,,Error accessing nan: Invalid URL 'nan': No scheme supplied. Perhaps you meant https://nan?,
2024-08-01,メルカート株式会社,設備管理・メンテナンス,求人なし,神奈川県川崎市高津区新作4-17-31,2012,代表取締役 間地 正,30 百万円,,,Error accessing nan: Invalid URL 'nan': No scheme supplied. Perhaps you meant https://nan?,
2024-08-01,株式会社ＩＴＰエンジニアリング,設備管理・メンテナンス,求人なし,新潟県新潟市中央区米山2-7-4,2012,代表取締役 松川 忠史,17 百万円,,,Error accessing nan: Invalid URL 'nan': No scheme supplied. Perhaps you meant https://nan?,
2024-08-01,株式会社フィール,サブコン,求人なし,新潟県新潟市東区江南1-5-1ＹＳビル 1Ｆ,2012,代表取締役 碓井 勝尋,5 百万円,,,Error accessing nan: Invalid URL 'nan': No scheme supplied. Perhaps you meant https://nan?,
2024-08-01,株式会社ｅｃｏａハウス,建築設計事務所,求人なし,北海道千歳市花園2-1-5,1994,代表取締役 神出 良英,40 百万円,,,Error accessing nan: Invalid URL 'nan': No scheme supplied. Perhaps you meant https://nan?,
2024-08-01,株式会社イーホライズン,不動産管理,無,北海道札幌市中央区北六条西25-2-5イーホライズン北円山ＢＬＤ 2Ｆ,2012,代表取締役 鈴木 洋平,10 百万円,,,Error accessing nan: Invalid URL 'nan': No scheme supplied. Perhaps you meant https://nan?,
2024-08-01,株式会社アイラス,サブコン,求人なし,北海道札幌市白石区菊水上町一条1-46-2,2012,代表取締役 相蘇 有人,5 百万円,,,Error accessing nan: Invalid URL 'nan': No scheme supplied. Perhaps you meant https://nan?,
2024-08-01,日本地建株式会社,不動産仲介,無,北海道札幌市中央区北五条西26-1-7ベンビル 5Ｆ,2012,代表取締役 小野寺 徹,50 百万円,,,Error accessing nan: Invalid URL 'nan': No scheme supplied. Perhaps you meant https://nan?,
2024-08-01,株式会社セナホーム企画,不動産仲介,求人なし,北海道札幌市中央区南二条西7-9-6,2012,代表取締役 米倉 康二,10 百万円,,,Error accessing nan: Invalid URL 'nan': No scheme supplied. Perhaps you meant https://nan?,
2024-08-01,井手工業株式会社,サブコン,求人なし,熊本県球磨郡あさぎり町上北469-1,1988,代表取締役 井手 敏博,10 百万円,,,Error accessing nan: Invalid URL 'nan': No scheme supplied. Perhaps you meant https://nan?,
2024-08-01,株式会社タウン開発,不動産仲介,求人なし,熊本県熊本市中央区水前寺2-1-28,1984,代表取締役 前田 尚毅,3 百万円,,,Error accessing nan: Invalid URL 'nan': No scheme supplied. Perhaps you meant https://nan?,
2024-08-01,株式会社イズミコーポレーション,サブコン,求人なし,熊本県熊本市東区画図町大字下無田1756,2012,代表取締役 泉 拓磨,3 百万円,,,Error accessing nan: Invalid URL 'nan': No scheme supplied. Perhaps you meant https://nan?,
2024-08-01,株式会社みずほ電工社,サブコン,求人なし,北海道札幌市東区北三十五条東26-3-22,2012,代表取締役 保住 輝明,3 百万円,,,Error accessing nan: Invalid URL 'nan': No scheme supplied. Perhaps you meant https://nan?,
2024-08-01,ＥＮＩＳＨＩ株式会社,不動産管理,求人なし,東京都港区新橋2-16-11024,2011,代表取締役 石田 龍也,12 百万円,,,Error accessing nan: Invalid URL 'nan': No scheme supplied. Perhaps you meant https://nan?,
2024-08-01,麻布ベストハウス株式会社,不動産管理,求人なし,東京都文京区本郷3-16-6本郷コンドミニアム 102,2011,代表取締役 金岡 弘大,90 百万円,,,Error accessing nan: Invalid URL 'nan': No scheme supplied. Perhaps you meant https://nan?,
2024-08-01,株式会社日本総合環境開発,不動産管理,求人なし,東京都港区麻布十番1-3-9ＴＢＣ麻布 3Ｆ,2011,代表取締役 桑島 光弘,5 百万円,,,Error accessing nan: Invalid URL 'nan': No scheme supplied. Perhaps you meant https://nan?,
2024-08-01,青木コーポレーション株式会社,不動産仲介,求人なし,東京都新宿区市谷八幡町16,2011,代表取締役 青木 繁蔵,10 百万円,,,Error accessing nan: Invalid URL 'nan': No scheme supplied. Perhaps you meant https://nan?,
2024-08-01,創造系不動産株式会社,不動産仲介,求人なし,東京都墨田区千歳2-6-9201,2011,代表取締役 高橋 寿太郎,2 百万円,,,Error accessing nan: Invalid URL 'nan': No scheme supplied. Perhaps you meant https://nan?,
2024-08-01,小木建設工業株式会社,ゼネコン,求人なし,埼玉県入間市大字中神1036-1,2008,代表取締役 小木 慎太郎,62 百万円,,,Error accessing nan: Invalid URL 'nan': No scheme supplied. Perhaps you meant https://nan?,
2024-08-01,株式会社塩塚,ゼネコン,求人なし,大分県大分市大在北4-9-35,2009,代表取締役 宮脇 一博,5 百万円,,,Error accessing nan: Invalid URL 'nan': No scheme supplied. Perhaps you meant https://nan?,
2024-08-01,株式会社鬼塚工務店,住宅（ハウスメーカー）,求人なし,神奈川県横浜市神奈川区松本町1-3-10,2009,代表取締役 鬼塚 武則,20 百万円,,,Error accessing nan: Invalid URL 'nan': No scheme supplied. Perhaps you meant https://nan?,
2024-08-01,株式会社ＲＯＯＴＳ,内装・インテリア・リフォーム,求人なし,東京都文京区本郷3-41-9ウオトミビル 501,2010,代表取締役 岩元 龍郎,20 百万円,,,Error accessing nan: Invalid URL 'nan': No scheme supplied. Perhaps you meant https://nan?,
2024-08-01,株式会社タック,建築設計事務所,求人なし,京都府八幡市上津屋石ノ塔79,1994,代表取締役 富山 勝,15 百万円,,,Error accessing nan: Invalid URL 'nan': No scheme supplied. Perhaps you meant https://nan?,
2024-08-01,株式会社エヌケーツウ,サブコン,求人なし,東京都品川区戸越6-4-7,2009,代表取締役 西澤 誠幸,50 百万円,,,Error accessing nan: Invalid URL 'nan': No scheme supplied. Perhaps you meant https://nan?,
2024-08-01,株式会社イケダプランニング,サブコン,求人なし,熊本県熊本市中央区水前寺6-43-10,2003,代表取締役 池田 憲昭,38 百万円,,,Error accessing nan: Invalid URL 'nan': No scheme supplied. Perhaps you meant https://nan?,
2024-08-01,ティーワンズネット株式会社,サブコン,求人なし,埼玉県富士見市水谷2-10-8,2008,代表取締役 佐藤 忠由,5 百万円,,,Error accessing nan: Invalid URL 'nan': No scheme supplied. Perhaps you meant https://nan?,
2024-08-01,株式会社大慶住建,住宅（ハウスメーカー）,求人なし,新潟県新潟市北区下大谷内897-2,1996,代表取締役 松田 慶,10 百万円,,,Error accessing nan: Invalid URL 'nan': No scheme supplied. Perhaps you meant https://nan?,
2024-08-01,株式会社若田緑地建設,サブコン,求人なし,広島県東広島市高屋町杵原1566,1990,代表取締役 若田 隆治,22 百万円,,,Error accessing nan: Invalid URL 'nan': No scheme supplied. Perhaps you meant https://nan?,
2024-08-01,株式会社昭和管工,設備管理・メンテナンス,求人なし,福岡県飯塚市天道68,2002,代表取締役 重清 康,13 百万円,,,Error accessing nan: Invalid URL 'nan': No scheme supplied. Perhaps you meant https://nan?,
2024-08-01,株式会社システムリバース,内装・インテリア・リフォーム,求人なし,東京都江戸川区東葛西6-14-10サニー彦田 201,1978,代表取締役 後藤 悟,30 百万円,,,Error accessing nan: Invalid URL 'nan': No scheme supplied. Perhaps you meant https://nan?,
2024-08-01,株式会社フィールドホーム,内装・インテリア・リフォーム,求人なし,千葉県千葉市美浜区磯辺2-6-8,2005,代表取締役 古口 政範,10 百万円,,,Error accessing nan: Invalid URL 'nan': No scheme supplied. Perhaps you meant https://nan?,
2024-08-01,株式会社武井工務店,住宅（ハウスメーカー）,求人なし,埼玉県川口市東領家5-2-8,1982,代表取締役 武井 道明,30 百万円,,,Error accessing nan: Invalid URL 'nan': No scheme supplied. Perhaps you meant https://nan?,
2024-08-01,株式会社かまた商事,不動産仲介,求人なし,神奈川県川崎市中原区市ノ坪66-5ライオンズマンション武蔵小杉第2,1962,代表取締役 山川 真由美,10 百万円,,,Error accessing nan: Invalid URL 'nan': No scheme supplied. Perhaps you meant https://nan?,
2024-08-01,株式会社ファーストホーム,不動産仲介,求人なし,愛知県名古屋市南区豊田1-15-9,2002,代表取締役 山内 義洋,10 百万円,,,Error accessing nan: Invalid URL 'nan': No scheme supplied. Perhaps you meant https://nan?,
2024-08-01,株式会社ダイセイビルド,不動産管理,無,大阪府大阪市中央区本町2-3-4アソルティ本町ビル 5Ｆ,2009,代表取締役 金子 泰成,50 百万円,,,Error accessing nan: Invalid URL 'nan': No scheme supplied. Perhaps you meant https://nan?,
2024-08-01,株式会社アルファ,不動産仲介,求人なし,東京都府中市晴見町2-12-1,1995,代表取締役 比留間 正太郎,3 百万円,,,Error accessing nan: Invalid URL 'nan': No scheme supplied. Perhaps you meant https://nan?,
2024-08-01,有限会社クィーンズエステイト,不動産仲介,求人なし,神奈川県相模原市南区松が枝町12-3,1983,取締役 岡﨑 玲奈,3 百万円,,,Error accessing nan: Invalid URL 'nan': No scheme supplied. Perhaps you meant https://nan?,
2024-08-01,株式会社ＳＳ　ｃｒｅａｔｅ,内装・インテリア・リフォーム,無,東京都杉並区阿佐谷北3-41-5,2010,代表取締役 八橋 進,1 百万円,,,Error accessing nan: Invalid URL 'nan': No scheme supplied. Perhaps you meant https://nan?,
2024-08-01,Ｓｕｒｆ　Ｚｉｏｎ株式会社,内装・インテリア・リフォーム,求人なし,東京都杉並区井草2-16-12,2004,代表取締役 平井 利幸,28 百万円,,,Error accessing nan: Invalid URL 'nan': No scheme supplied. Perhaps you meant https://nan?,
2024-08-01,株式会社アクト,内装・インテリア・リフォーム,求人なし,東京都中央区入船3-9-5第二松本ビル 4Ｆ,2003,代表取締役 田上 博敏,3 百万円,,,Error accessing nan: Invalid URL 'nan': No scheme supplied. Perhaps you meant https://nan?,
2024-08-01,成田空港駐車場システム株式会社,不動産管理,求人なし,千葉県成田市取香530-38,1991,代表取締役 佐藤 正嗣,3 百万円,,,Error accessing nan: Invalid URL 'nan': No scheme supplied. Perhaps you meant https://nan?,
2024-08-01,株式会社サンエス,サブコン,求人なし,愛知県清須市春日長久寺106,2006,代表取締役 西本 勲,10 百万円,,,Error accessing nan: Invalid URL 'nan': No scheme supplied. Perhaps you meant https://nan?,
2024-08-01,株式会社河野製作所,設備管理・メンテナンス,求人なし,大分県大分市大道町1-3-3,1948,代表取締役 河野 茂喜,10 百万円,,,Error accessing nan: Invalid URL 'nan': No scheme supplied. Perhaps you meant https://nan?,
2024-08-01,有限会社高良コーキ,設備管理・メンテナンス,求人なし,千葉県船橋市二和東2-3-18,1989,代表取締役 柏崎 隆幸,3 百万円,,,Error accessing nan: Invalid URL 'nan': No scheme supplied. Perhaps you meant https://nan?,
2024-08-01,慧和産業株式会社,サブコン,求人なし,東京都立川市西砂町5-26-34,2010,代表取締役 大山 重之,1 百万円,,,Error accessing nan: Invalid URL 'nan': No scheme supplied. Perhaps you meant https://nan?,
2024-08-01,株式会社王壽,不動産仲介,求人なし,東京都世田谷区太子堂1-12-40グレート王寿ビル 7Ｆ,1985,代表取締役 河野 一裕,10 百万円,,,Error accessing nan: Invalid URL 'nan': No scheme supplied. Perhaps you meant https://nan?,
2024-08-01,株式会社サン・リフォーム,内装・インテリア・リフォーム,求人なし,山口県下松市美里町2-2-7,2007,代表取締役 中村 壽秀,10 百万円,,,Error accessing nan: Invalid URL 'nan': No scheme supplied. Perhaps you meant https://nan?,
2024-08-01,株式会社新生住宅販売,サブコン,求人なし,神奈川県藤沢市藤沢38-17ルミエール湘南 1Ｆ,2001,代表取締役 鈴木 哲次,3 百万円,,,Error accessing nan: Invalid URL 'nan': No scheme supplied. Perhaps you meant https://nan?,
2024-08-01,空建築家工房株式会社,住宅（ハウスメーカー）,求人なし,神奈川県横浜市都筑区中川中央1-23-15Ｔ’Ｓビル 201,2001,代表取締役 櫨原 裕次,6 百万円,,,Error accessing nan: Invalid URL 'nan': No scheme supplied. Perhaps you meant https://nan?,
2024-08-01,株式会社バイオンマネジメント,不動産仲介,求人なし,東京都豊島区東池袋1-23-8東池袋ＩＳＫビル 2Ｆ,2011,代表取締役 竹内 耕司,3 百万円,,,Error accessing nan: Invalid URL 'nan': No scheme supplied. Perhaps you meant https://nan?,
2024-08-01,株式会社アーキシステムエンジ,建築設計事務所,求人なし,山形県鶴岡市切添町23-5,2008,代表取締役 長谷川 明,5 百万円,,,Error accessing nan: Invalid URL 'nan': No scheme supplied. Perhaps you meant https://nan?,
2024-08-01,グラウンド・ワークス株式会社,ゼネコン,求人なし,静岡県袋井市川井873-4,2007,代表取締役 山下 英俊,10 百万円,,,Error accessing nan: Invalid URL 'nan': No scheme supplied. Perhaps you meant https://nan?,
2024-08-01,株式会社エスアール,サブコン,求人なし,神奈川県横浜市神奈川区入江1-29-22,2007,代表取締役 松本 吾郎,10 百万円,,,Error accessing nan: Invalid URL 'nan': No scheme supplied. Perhaps you meant https://nan?,
2024-08-01,株式会社ＳＥＣ,プラントメーカー・プラントエンジニアリング,無,東京都新宿区西新宿4-32-4ハイネスロフティビル 2Ｆ,2009,代表取締役 髙橋 徹,20 百万円,,,Error accessing nan: Invalid URL 'nan': No scheme supplied. Perhaps you meant https://nan?,情報が古い可能性があります。最新の情報を確認する場合はHP等をご覧ください。 建設業全般に特化した労働者派遣事業及び職業紹介業【労働者派遣業】厚生労働大臣許可番号（派 13-304577）【有料職業紹介業】厚生労働大臣許可番号（13-ユ-304387）【加盟団体】東京商工会議所 会員番号：C2351528 2023年2月doda掲載求人より引用
2024-08-01,有限会社サプライ,設備管理・メンテナンス,求人なし,埼玉県春日部市大衾13-1システムマンション南桜井 102,2004,代表取締役 小塙 剛,3 百万円,,,Error accessing nan: Invalid URL 'nan': No scheme supplied. Perhaps you meant https://nan?,
2024-08-01,株式会社都市交通テクノロジー,ゼネコン,求人なし,東京都港区三田3-4-12三田ＭＴビル 201,2003,代表取締役 大塚 勝弘,10 百万円,,,Error accessing nan: Invalid URL 'nan': No scheme supplied. Perhaps you meant https://nan?,
2024-08-01,株式会社アクシアホーム,住宅（ハウスメーカー）,無,埼玉県入間市大字下藤沢722-2,2008,代表取締役 岩切 努,8 百万円,,,Error accessing nan: Invalid URL 'nan': No scheme supplied. Perhaps you meant https://nan?,
2024-08-01,株式会社アーリーワン,内装・インテリア・リフォーム,求人なし,東京都新宿区新宿6-7-16新宿ハイブリッジ103号室,2000,代表取締役 髙橋 美晴,10 百万円,,,Error accessing nan: Invalid URL 'nan': No scheme supplied. Perhaps you meant https://nan?,
2024-08-01,株式会社アソシエイト,不動産仲介,求人なし,東京都三鷹市下連雀3-4-34山田ハイツ 1Ｆ,1991,代表取締役 豊嶋 勇多,3 百万円,,,Error accessing nan: Invalid URL 'nan': No scheme supplied. Perhaps you meant https://nan?,
2024-08-01,株式会社シーワンプロテック,サブコン,求人なし,東京都町田市小山町3449-44,2012,代表取締役 田中 伸一,3 百万円,,,Error accessing nan: Invalid URL 'nan': No scheme supplied. Perhaps you meant https://nan?,
2024-08-01,株式会社高橋設計,建築設計事務所,求人なし,神奈川県厚木市中町3-10-15アメニティ中町 4Ｆ,2001,代表取締役 高橋 孝英,3 百万円,,,Error accessing nan: Invalid URL 'nan': No scheme supplied. Perhaps you meant https://nan?,
2024-08-01,株式会社コムズワーク,建築設計事務所,無,北海道札幌市西区西町北12-7-10北友ビル 2Ｆ,2000,代表取締役 竹ノ内 久,6 百万円,,,Error accessing nan: Invalid URL 'nan': No scheme supplied. Perhaps you meant https://nan?,
2024-08-01,有限会社マヴェリック,設備管理・メンテナンス,無,大阪府大阪市中央区谷町7-1-56,2005,代表取締役 古川 剛,3 百万円,,,Error accessing nan: Invalid URL 'nan': No scheme supplied. Perhaps you meant https://nan?,情報が古い可能性があります。最新の情報を確認する場合はHP等をご覧ください。 ■ 耐震補強工事の施工・設計補助（施工図作成）及び工事■ 住宅プランニング■ 工事管理 2021年9月doda掲載求人より引用
2024-08-01,株式会社ベルノ,設備管理・メンテナンス,求人なし,山形県山形市荒楯町1-15-1,2007,代表取締役 長谷川 求洋,5 百万円,,,Error accessing nan: Invalid URL 'nan': No scheme supplied. Perhaps you meant https://nan?,
2024-08-01,株式会社Ｔｒｅａｓｕｒｅ　Ｖｉｔ,設備管理・メンテナンス,求人なし,埼玉県白岡市西4-3-10,2007,代表取締役 鈴木 真琴,3 百万円,,,Error accessing nan: Invalid URL 'nan': No scheme supplied. Perhaps you meant https://nan?,
2024-08-01,トマト工業株式会社,住宅設備・建材,求人なし,岐阜県関市富之保3861-1,1990,代表取締役 馬渕 敦史,10 百万円,,,Error accessing nan: Invalid URL 'nan': No scheme supplied. Perhaps you meant https://nan?,
2024-08-01,株式会社賃貸や,不動産仲介,求人なし,三重県四日市市諏訪栄町1-1四日市ＭＮビル 1Ｆ,2008,代表取締役 菅谷 太一,6 百万円,,,Error accessing nan: Invalid URL 'nan': No scheme supplied. Perhaps you meant https://nan?,
2024-08-01,アンド・ビヨンド株式会社,不動産仲介,求人なし,東京都渋谷区代々木5-36-5,2011,代表取締役 ラッセル 朋美,10 百万円,,,Error accessing nan: Invalid URL 'nan': No scheme supplied. Perhaps you meant https://nan?,
2024-08-01,株式会社レグナム,ディベロッパー,求人なし,東京都千代田区九段南2-3-10ＢＣプラザ 7Ｆ,2011,代表取締役 玖島 豪,30 百万円,,,Error accessing nan: Invalid URL 'nan': No scheme supplied. Perhaps you meant https://nan?,
2024-08-01,株式会社ＴＡＫＡＳＨＩＮ,サブコン,求人なし,栃木県足利市田所町1102-7,2012,代表取締役 高橋 伸輔,10 百万円,,,Error accessing nan: Invalid URL 'nan': No scheme supplied. Perhaps you meant https://nan?,
2024-08-01,株式会社エコ・リーディング・カンパニー,設備管理・メンテナンス,求人なし,東京都新宿区新宿1-34-13貝塚ビル 201,2012,代表取締役 福島 祐,9 百万円,,,Error accessing nan: Invalid URL 'nan': No scheme supplied. Perhaps you meant https://nan?,
2024-08-01,株式会社エスアイシーグローバル,不動産仲介,求人なし,兵庫県神戸市東灘区向洋町西6-7,2012,代表取締役 杉原 康夫,10 百万円,,,Error accessing nan: Invalid URL 'nan': No scheme supplied. Perhaps you meant https://nan?,
2024-08-01,ラズライト・インベストメント株式会社,不動産仲介,求人なし,東京都品川区南大井6-24-13第14下川ビル 9Ｆ,2010,代表取締役 下川 有司,66 百万円,,,Error accessing nan: Invalid URL 'nan': No scheme supplied. Perhaps you meant https://nan?,
2024-08-01,株式会社トップルーム,不動産仲介,求人なし,東京都港区六本木7-18-6六本木グランドール 205,2006,代表取締役 村田 健太郎,20 百万円,,,Error accessing nan: Invalid URL 'nan': No scheme supplied. Perhaps you meant https://nan?,
