更新日,名称,業界(小分類),求人有無,事業内容,所在地,設立,資本金,平均年齢,従業員数,企業URL,代表者,上場市場名
2024-08-01,株式会社エースプロテック,サブコン,1,■膜構造物・テント工事全般,福岡県筑紫野市大字古賀55-4,2020,,,3,Error accessing https://doda.jp/DodaFront/View/JobSearchDetail/j_jid__3010852966/: 'NoneType' object has no attribute 'get',代表取締役 高木 幸治,
2024-06-01,株式会社ＮＩＴＴＯ,設備管理・メンテナンス,1,・機械式立体駐車場各種加工保守／管理・産業機器設計／設置／メンテナンス・ビルメンテナンス・立体駐車場の運営・エレベーター各種加工法主／管理,福岡県福岡市博多区奈良屋町14-18,,1000万円,,26,https://www.nitto.work/,代表取締役 古海 佳宏,
2024-08-01,マスター不動産株式会社,不動産仲介,3,■事業内容： 不動産業：土地建物売買、仲介、土地建物資産運用コンサルティング、土地建物に関わる相続、借地借家権問題の解決、事業誘致、事業地の確保,長野県松本市宮田23-1,2019,5百万円,42.0,5,"Failed to retrieve page, status code: 410",,
2024-08-01,百年アルミ株式会社,住宅（ハウスメーカー）,4,■事業内容：一般住宅及び集合住宅の屋根・外壁メンテナンスリフォーム工事,広島県広島市中区銀山町3-1ひろしまハイビル21、16F,2020,1百万円,36.0,100,なし,,
2024-07-01,株式会社下川建築設計事務所,建築設計事務所,2,"■事業内容： 建築意匠設計 "" ■ビジョン： 私達の仕事は、クライアントのイメージしているライフスタイルを「思い描いたもの以上の実現」を目指すこと。大阪を中心として住宅をはじめ店舗、オフィス、マンション等様々な建築物の設計を行っております。常にお客様に寄り添い、経験から培った知識・情報量を武器にお客様のご要望にお応えいたします。",大阪府堺市北区長曽根町3-603,2020,1百万円,,5,https://www.shimokawa-ad.co.jp/,,
2024-06-01,株式会社エルスタット,不動産仲介,1,■事業内容： 2020年4月設立され、住宅不動産販売、太陽光発電事業を展開しています。3年前に母体の株式会社Success（本社／東京都豊島区）から分社化しました。,愛知県名古屋市千種区今池3-12-20KAビル1F,2020,3百万円,,20,https://suma-ie.com/,,
2024-07-01,リベル株式会社,不動産仲介,1,■不動産売買、売買仲介業務■不動産コンサルティング【免許番号】東京都知事（1）第106062号,東京都港区西新橋2-4-3 プロス西新橋ビル5階,2021,500万円,,,https://re-vel.co.jp/,代表取締役 大坪 新,
2024-06-01,株式会社ライトハウス,不動産仲介,1,■事業用不動産の売買仲介■居住用不動産の売買仲介■オフィス・店舗の賃貸仲介■建物管理業務・プロパティマネジメント業務■不動産サブリース事業■内装工事、リノベーション事業,東京都千代田区隼町3-19 清水ビル1階,2021,"2,500万円",28.0,18,https://www.lhthus.co.jp/,代表取締役 高村 東英,
2024-07-01,株式会社ケービーエステート,不動産仲介,1,■事業内容： （１）不動産仲介：経験豊富なスタッフが不動産のご相談・ご購入・ご売却・賃貸借などコンサルティングからプランニング・契約ご締結・アフターフォローに至るまでを誠意をもって対応しております。（２）ビル事業：当社は利便性の高い都心エリアに、賃貸向けビルを所有しています。快適にご利用頂けるよう徹底した管理を行っております。,東京都新宿区新宿2-8-8,2021,10百万円,,35,https://www.kbestate.co.jp/index.html,,
2024-08-01,株式会社横浜真和エンタープライズ,不動産仲介,2,■事業内容： 不動産売買業、不動産仲介業を展開しています。■当社について：当社は不動産事業で30年以上の実績を誇るLALLグループの一員です。最適な立地、快適な居住空間、安定した資産運用、将来の豊かな生活のための『基礎づくり』をご提案します。,神奈川県横浜市西区高島2-12-6,2021,3百万円,,7,https://yokohama-shinwa-ent.co.jp/,,
2024-08-01,クレド・アセットマネジメント株式会社,不動産仲介,5,■事業概要：・不動産の開発・所有・賃貸・管理・売買・仲介業務└ 土地の選定～プランニング～プロジェクトマネジメント（施工管理）～リーシング～運営管理までを一貫して行っております。・不動産アセットマネジメント業務・コンサルティング業務└ アクイジション・CRE（セール・アンド・リースバック）事業を含みます,東京都港区虎ノ門1-17-1虎ノ門ヒルズビジネスタワー15F,2021,10百万円,40.0,7,https://credo-asset.com/,,
2024-07-01,株式会社Ｓ’Ｃｏｎｎｅｃｔ,内装・インテリア・リフォーム,1,◆不動産の売買・賃貸仲介及び賃貸管理事業◆不動産コンサルティング事業◆リノベーション及びリフォーム事業◆損害保険代理店業、生命保険代理店業,東京都港区虎ノ門1-13-5 VORT虎ノ門2 6F,2021,1000万円（資本準備金含む）,28.0,,https://r-sconnect.jp/,代表者 梅田 秀成,
2024-08-01,株式会社ＲｅＣ,不動産仲介,1,◇不動産購入コンシェルジュ土地、マンション、戸建て（新築、中古）のご購入のサポートを行います。住宅ローンの手続きのサポートからリフォーム、注文住宅のご相談まで、住まいに関するあらゆる事をご相談いただけます。もちろん事業用地や店舗用地のご相談もお受けします。◇不動産売却コンシェルジュ土地、マンション、戸建て、事業用地のご売却のサポートを行います。不動産売却は、どこの不動産業者に任せるかがとても重要となります。実際のデータを提示の上、根拠を持ってご説明をします。大切な不動産への思いをしっかりとくみとったご提案をさせていただきます。,愛知県北名古屋市沖村舟附80,2021,1百万円,29.4,5,https://office-rec.jp/,,
2024-08-01,株式会社ザイマックス東海,不動産管理,35,■会社概要株式会社ザイマックス東海は約6000名規模に拡大したザイマックスグループの一員として、東海地区に根差した活動をするため、2021年4月にザイマックスより分社化致しました。不動産の所有者であるオーナー様に代わり、オフィスビルや商業施設等の運営管理、設備管理、工事管理など様々な視点で不動産の側面を支えています。東海地方の企業様と「パートナー」となるべく、「この地で、みんなで、創る」をスローガンに掲げ、一緒に会社を大きく、東海地方をより盛り上げていただける方を募集しています。,愛知県名古屋市中区栄4-2-29名古屋広小路プレイス6F,2021,100百万円,37.0,130,https://www.xymax.co.jp/about/groups/xy-tokai/,,
2024-06-01,株式会社インデックスストラテジー,建設コンサルタント,2,インデックスストラテジーは、海外における社会・公共インフラPPPプロジェクトに特化したプロジェクトマネジメント会社です。PPPとはパブリック・プライベート・パートナーシップの略で、行政と民間企業や団体が連携して、行政サービスの向上、財政資金の効率的な活用や行政の業務効率化を図るために活用される手法です。PPPを活用したプロジェクトの案件発掘から事業化まで一気通貫でサービスを提供するという、これまでの日本にはなかった新しい業態の企業として誕生しました。,東京都港区虎ノ門4-3-1城山トラストタワー23F,2021,10百万円,,7,https://index-group.co.jp/index-strategy/,,
2024-06-01,株式会社ＪＡＳＴＹ,建築設計事務所,2,■経営理念ITの力で、建設業界に革命を。建設情報の高度化とデジタル化(BIM/CIM)によって建設業界にIT革命を起こし、社会の発展に貢献していくこと。この志を原動力として、JASTYは成長を続けていきます。,東京都千代田区内神田1-5-13内神田TKビル,2021,,,17,なし,,
2024-07-01,株式会社アレシス,サブコン,2,■事業内容： 建築工事、大工工事、左官工事、とび・土工工事、石工事、屋根工事、タイル・れんが・ブロツク工事、鋼構造物工事、鉄筋工事、板金工事、ガラス工事、塗装工事、防水工事、内装仕上工事、熱絶縁工事、建具工事、解体工事,福岡県福岡市博多区金の隈1‐23‐17,2021,10百万円,48.0,9,なし,,
2024-07-01,東光建設株式会社,ゼネコン,1,■建築・土木工事の施工■土木建築、設計コンサルタント業務■保安及び防災用機械器具の設置工事の施工■機械器具及び建築土木設備の保守メンテナンス業務■鉄道用機器の開発設計及び製造■軌道関係補修工事の施工■清掃業務■設備等の設計施工,東京都江東区新木場一丁目14番5号,2021,4000万円,,,https://toko-kensetsu.jp/,代表取締役社長 吉野 賢一,
2024-07-01,ボイスインターコミュニケーション株式会社,設備管理・メンテナンス,1,■空調自動制御設計、施設、保守■空調自動制御ソフト設計■省エネ、省力化ソフト設計、製作★建設業許可番号 建設業許可（電気工事業、管工事業）東京都知事（般-3）第154010号,東京都豊島区池袋2-57-2,2021,600万円,,74,http://voint.com/index.html,代表取締役社長 佐久間 茂,
2024-08-01,株式会社みずむすびサービスみやぎ,設備管理・メンテナンス,10,■事業について：ＳＰＣの構成企業が出資し、本事業期間（２０年間）の後も宮城県に存続する地域密着の企業です。地域を代表する水プロフェッショナル専門企業として、上工下水道施設の運転・維持管理業務などを担い、将来にわたってみやぎの水を支えていきます。,宮城県仙台市青葉区立町27-21,2021,90百万円,,,https://www.mizumusubi.com/,,
2024-08-01,プラントエンジニアリング株式会社,サブコン,求人なし,,栃木県宇都宮市野沢町310-315棟82号,2021,10 百万円,,,"Failed to retrieve page, status code: 410",代表取締役 佐藤 純一,
2024-08-01,ビズマーチ株式会社,不動産仲介,無,■不動産買取及びリノベーション事業、建売事業■不動産売買・交換・仲介事業■不動産の賃貸及び管理免許：宅地建物取引業 東京都知事（1）第106640号「溢れ出る<幸せ>を創造する」をビジョンとして掲げています。元々の素材を活かしつつトレンドを取り入れた「お洒落で最新」そして温もりや癒やしも感じていただけるような上質なお住まいを追求しています。 2024年6月doda掲載求人より引用,東京都港区三田3-9-116Ｆ,2021,8 百万円,,,"Failed to retrieve page, status code: 410",代表取締役 長谷川 直人,
2024-07-01,サンクレス・リノベーション株式会社,内装・インテリア・リフォーム,1,■事業内容： 建築一式工事、管工事、内装仕上工事■社長の想い： 「時間とお金のバランスを大事にする」背景：社長は某大手ビル管理会社出身。始発から終電までの長時間労働が当たり前で、子供が4人いるが、上の子3人に関しては、仕事ばかりでほぼ成長する姿を見れなかった。それでは、人生が楽しくならない事に気付き「時間とお金のバランスを大事にできる」会社を起業しました。それがサンクレスです。会議の為の会議や、朝礼、日報、中間・月末会議などの無駄を排除し、各社員が自己管理を徹底し、高収入を得ながら家族を大事にしています。この想いに賛同いただける方のご応募をお待ちしています。,愛知県大府市森岡町1-210,2021,5百万円,35.0,5,https://thankless-renovation.co.jp/company/,,
2024-06-01,株式会社日本住宅クリエイト,サブコン,1,電気設備工事・リフォーム工事・施工管理・太陽光発電、蓄電池工事・FIT申請,愛知県名古屋市守山区菱池町12-23,2021,"7,777,777円",28.0,38,https://nj-create.jp/,代表取締役 中山 成,
2024-07-01,株式会社恕抄堂,建設コンサルタント,1,【事業内容/強み】2021年6月に、建設会社（株）長谷川商店の関連会社として設立。当社は2期目を迎える家具の設計・製作をはじめ、内装工事や大工工事、リフォーム等の施工を行っている企業です。設立家具の設計、製作をはじめ、内装工事や大工工事、リフォーム等の施工を行っており、全国のドラックストアの陳列什器分野に強みがあります。,埼玉県新座市あたご3-7-9クルトーア新座101号室,2021,3百万円,35.0,5,なし,,
2024-08-01,株式会社ルフト空調設備,住宅設備・建材,1,■空調設備設計・施工・修理・保守 ■一般家庭・オフィス・店舗・工場の空調設備工事,静岡県浜松市中区高丘西3-25-16,2019,,26.0,5,"Failed to retrieve page, status code: 410",代表者 金子 和弘,
2024-07-01,株式会社イードア,内装・インテリア・リフォーム,2,■事業内容： 東証スタンダード市場上場「株式会社イーグランド」の完全子会社として、住宅リフォームの施工を専門で行う会社です。主な施工エリアは、埼玉県南部および東京23区です。◇マンション・戸建住宅のリフォーム、リノベーション◇デザイン全般／法人向けリノベーション,埼玉県川口市栄町3-10-3みどりビルディング3F,2021,10百万円,,24,https://www.edoor.co.jp/,,
2024-08-01,株式会社ＹＡＫディベロップメント,不動産管理,1,■事業内容： 海外のお客向けの不動産仲介売買■当社について：インバウンド不動産に強みを持つ「株式会社YAK」のグループ会社として不動産サービスを展開しております。近年、インバウンド需要が増加しており当グループ会社がテレビ番組やニュース等に取り上げられ、注目が高まる中で当社も右肩上がりに成長を続けています。,東京都千代田区岩本町3-4-11,2021,5百万円,,5,"Failed to retrieve page, status code: 410",,
2024-05-01,株式会社ＮＲＳ,設備管理・メンテナンス,2,■事業内容： 建設機械のメンテナンス■特徴大阪や京都を中心とした近畿圏を対象に建機の販売/修理部門を担っています。,京都府宇治市志津川北組53-3,2021,3百万円,,2,なし,,
2024-06-01,リヴ匠建設株式会社,内装・インテリア・リフォーム,1,おとくに地域に特化し、地元に根を張って、この地域で共に働く棟梁・職人・パートナー会社との絆が最大の強みです。20代～ベテラン社員がチームとなりお客様の理想をかたちにしております。京都市・長岡京市・向日市・大山崎町を中心に、住宅から非住宅まで豊富な経験値と確かな技術力で安心・安全の建物を施工します。,京都府向日市上植野町落堀18-1,2021,,,,なし,,
2024-08-01,ＮＳリノベーション株式会社,設備管理・メンテナンス,23,■事業概要：マンション・ビル・工場等の建物設備の改修工事・企画・設計・施工マンション・ビルの衛生・空調・電気設備の保守・管理・メンテナンスエコロジー施設の企画・設計・施工■事業内容：同社は設立47年、関東・中部・関西に展開し、関西においてはNo.１の規模と実績があるマンション給排水設備の専門業者です。劣化調査から改修工事の計画や施工、点検・洗浄まで一貫した業務を展開しており、地域に密着し水廻りから、居住者様の快適な生活を守ります。,大阪府大阪市西区立売堀4-2-21,1974,450百万円,,170,https://nsr.inc,,
2024-06-01,株式会社幸峯,住宅設備・建材,1,■事業内容： 給・排水、空調、衛生、換気ダクト、配管工事、配管施工図作成、諸官庁申請手続業務■同社について：生活に必要不可欠な水道をはじめとする住宅関連設備業務のため、今後もニーズがなくなることはありません。手に職をつけたい方、安定した職を求める方をお待ちしております。,東京都三鷹市上連雀8-4-15,2021,10百万円,44.0,5,なし,,
2024-08-01,Ｂｅｃｋ＆Ｐｏｌｌｉｔｚｅｒ　Ｊａｐａｎ株式会社,プラントメーカー・プラントエンジニアリング,1,■事業概要： 機械設置に関するプロジェクトの運営、監理、施工管理及び請負■事業詳細：≪世界中のお客様のニーズに沿ったエンジニアリングソリューションの提供≫Beck & Pollitzerは、工場移転、機械据付、重機移転サービス分野でのエンジニアリング・ソリューションを提供する世界のリーディングカンパニーです。当社は製造・工業部門において、比類なきエンジニアリングサポートサービスを提供します。世界各国に30以上の拠点を有しており、国内外のあらゆるプロジェクトへの対応が可能です。,東京都港区六本木7-12-2R7ビルディングSpace六本木,2021,,,4,https://beck-pollitzer.com/ja/,,
2024-08-01,株式会社アミ,設備管理・メンテナンス,1,■事業概要について：個人宅・集合住宅（新築マンション）向け給排水衛生工事■当社の特徴新築マンションを中心として就業住宅の新規給排水設備の導入をしております。主に民間企業からの案件を受注しております。対応エリアとは23区と神奈川の都市圏エリアとなり、新築マンションでは、工期約1年間・2000万円～1億円規模の工事案件を中心に対応いただきます。給排水衛生工事としては新築マンションの案件が多く、協力会社の適切な差配等の連携を取りながら０から建造物の設備導入を行います。協力会社としては、10～15社ほどと案件によって連携を取っていただく予定となります。,東京都大田区久が原1-16-15,2021,6百万円,44.0,16,なし,,
2024-06-01,株式会社Ａｂｕｎｄ,設備管理・メンテナンス,1,■施設管理業務■派遣実績紹介労働者派遣事業許可（派23-304147）有料職業紹介許可（23-ユ-302822）,愛知県名古屋市中村区太閤1-20-13秀幸ビル5階,2021,2000万円,,120,https://abund.co.jp/,代表取締役社長 中田 正樹,
2024-07-01,株式会社ラッセルエステート,不動産仲介,1,■不動産の売買、賃貸、斡旋、仲介及び管理■建築工事の設計、施工、請負及び監理■損害保険の代理及び生命保険の募集に関する事業■建築物のリフォーム及びリノベーション事業■各種コンサルティング事業,【東京本社】東京都渋谷区南平台町３－１３渋谷ＳＴビル4階【名古屋支社】愛知県名古屋市西区名駅2-23-14【福岡支社】2024年8月稼働開始予定,2021,1000万円,25.0,,Error accessing https://doda.jp/DodaFront/View/JobSearchDetail/j_jid__3008425705/-tab__jd/: 'NoneType' object has no attribute 'get',代表取締役 上場 圭祐,
2024-08-01,アスベスト調査分析株式会社,サブコン,10,■事業概要：・アスベストの調査及び分析・アスベスト除去工事の設計及び施工・アスベスト事前調査・上記に関するコンサルティング■企業概要：アスベスト除去工事の設計から施工を行う企業グループにより、総合的なアスベスト問題解決を目指し生まれた、調査分析の専門会社です。私たちの企業グループは、調査分析、工事計画と新技術開発、安心安全な除去工事が三位一体となっての、建築物のアスベスト除去という総合的なシステムを構築しています。様々な局面でのお客様ニーズを知り尽くしているからこそ、それぞれの役割の重責を認識し、常に品質の向上に努めています。,東京都港区新橋4-27-7田村町Shinshodoh BLDG4F,2021,,,,https://www.chousabunseki.co.jp/,,
2024-06-01,フジナガホールディングス株式会社,住宅設備・建材,2,■事業内容：下記事業を行う【株式会社フジナガ】など、グループ企業の統括を行います。※関連会社従業員数：110名（2022年7月現在） 株式会社フジナガ 等・鳥害対策機器メーカー ・鳥害対策コンサルタント ・新事業 （イベント事業、海外拠点の運営）,兵庫県尼崎市道意町6-28-7,2021,"1,000百万円",33.0,6,なし,,
2024-06-01,株式会社ＡＳＡＰ,不動産仲介,1,・不動産売買事業、賃貸管理（投資用ワンルームマンションをメインに取り扱っています）,東京都渋谷区神宮前4丁目2-12 WES表参道ビル3F,2021,"5,000万円",,15,https://a-sap.co.jp/,代表取締役 太田 優樹,
2024-06-01,レボティメットホーム株式会社,内装・インテリア・リフォーム,3,■事業内容：リフォーム提案・販売・施工管理・外壁塗装・屋根塗装・太陽光発電システム・蓄電池システム・オール電化住宅リフォーム全般（外構工事・内装工事・カーポート・水回り工事・屋根葺き替え）など～太陽光発電事業にルーツをもつ私達は、社会や環境へ高い意識を持って住宅リフォーム事業に取り組んでいます～,愛知県名古屋市名東区本郷2-173-4,2021,9百万円,,,https://r-t-home.co.jp/,,
2024-08-01,株式会社九州中央不動産,不動産仲介,2,"■CENTURY21とはセンチュリー21は、世界最大級の不動産ネットワーク85の国と地域、14,250店舗、そして14.7万人の営業スタッフ。日本では、1983年、伊藤忠商事と大手金融機関が株主となり(株)センチュリー21・ジャパン（日本本部）が設立されました。「安心」と「信頼」をモットーに店舗ネットワークを拡大し、全国の991店舗、6,321人（2022年3月末時点）の加盟店スタッフが住まい選びのお手伝いをしています。",福岡県福岡市早良区西新1-8-11,2021,50百万円,,,https://www.c21-kyushu.jp/,,
2024-08-01,株式会社アーキテクト・クアラン,住宅（ハウスメーカー）,2,■会社概要:2021年設立、栃木県日光市に本社を持ち、宇都宮をメインの拠点として総合建設事業を運営しております。■事業内容:・住宅建築、リフォームなどの住宅建築・社屋や工場などの建設・商業建築■当社の特徴:栃木県内や隣接地域をメインエリアとし、地域密着型でお客様のご要望にお応えしております。住宅建築から商業建築まで、幅広く様々な建築・建設を行う中で顧客より支持いただいております。,栃木県日光市土沢1538-7,2021,5百万円,,4,https://www.quaran.jp/,,
2024-07-01,株式会社クロスティホールディングス,設備管理・メンテナンス,2,■事業内容： 工事事業（電気・給排水・空調）、設備調達事業（住宅流通）、改修工事事業（アフターメンテナンス）、建築事業（住宅・特建）,北海道札幌市東区北三十七条東15-1-1,2021,100百万円,,262,https://www.crossty-hd.ne.jp/,,
2024-07-01,桜不動産株式会社,不動産仲介,1,■売買仲介■賃貸仲介業■不動産管理■不動産有効利用■リフォーム・リノベーション事業,【桜不動産株式会社】大阪府大阪市中央区内本町1-2-14 秀和ビル４階,2021,1000万円,,,https://sakurakaihatsu.com/,代表取締役 塩見 文明,
2024-06-01,株式会社ショウホーム,不動産仲介,1,■事業内容： ・不動産売買■特徴（TOPICS）： ・不動産のことを一緒に考えるお店・不動産売買仲介としてお客様第一主義で地域に密着して高槻市を中心に活動しております。不動産売買仲介としてお家の購入と売却に寄り添って考えるお店として気軽に相談しやすいお店を目指しております。・SNS広告に特化しており、今の若い方やご年配の方までに広告発信しております。SNS広告とGoogle口コミでは高槻市で一番を目指してます。,大阪府高槻市天王町1-1,2021,5百万円,,2,https://www.shohome.co.jp/,,
