更新日,名称,業界(小分類),求人有無,事業内容,所在地,設立,資本金,平均年齢,従業員数,企業URL,代表者,上場市場名
2024-08-01,株式会社岳南不動産,不動産仲介,4,岳南不動産は「連結売上高180億円」の安定したエネルギー産業(全国送電網建設事業)を基幹事業とした岳南グループ(11社構成)の親会社である岳南ホールディングスの不動産事業部門として産声をあげてから11年目となる、東証プライム上場ハウスドゥの看板を掲げるFC店舗・不動産事業会社です。不動産事業カテゴリーとしては「売買仲介」「買取再販」「グループ不動産管理(収益物件)サポート」等の活動を、グループの安定潤沢な資金力をバックボーンとして松戸市をはじめとした東葛地区を中心に総合的に行っています。,東京都中央区築地1-3-7岳南ビルディング7F,2017,100百万円,37.0,14,http://housedo-gakunan.jp/,,
2024-08-01,株式会社ダブルジェイシー,不動産仲介,1,■不動産店舗『大国住まい』『昭和町住まい』の運営■マンション・ビル管理■賃貸仲介業■売買仲介業,大阪府大阪市浪速区戎本町1-5-20,2018,,20.0,,https://www.sumai-wjc.co.jp/company/,代表者 細川 茂克 ／ 中西 俊貴,
2024-07-01,株式会社アクシス,内装・インテリア・リフォーム,1,■リフォーム事業■不動産事業■エコライフ事業■人材サービス事業【グループ会社】□株式会社アクシス□株式会社アクシス21□株式会社A-LIFE21,埼玉県さいたま市大宮区宮町4-123 大栄ツインビルS館3F,2017,4000万円(グループ合計),26.0,70,https://axis21.info/,代表取締役 石村 卓也,
2024-07-01,朝日Ｉ＆Ｒビルディズ株式会社,住宅設備・建材,3,■事業内容： 総合建築・請負・リフォーム,佐賀県武雄市朝日町大字甘久3589-2,1965,,32.4,43,なし,,
2024-08-01,エコアティア株式会社,建設コンサルタント,6,■事業内容： ・環境汚染対策の調査、設計及び施工・土木建築工事その他建設工事の設計、施工、監理及び保守,東京都江戸川区西小岩1-20-8丸昌西ビル3C,2018,40百万円,35.0,10,http://www.ecoatia.co.jp/,,
2024-07-01,株式会社アセットビルダー,不動産仲介,1,■不動産コンサルティング業■不動産の仲介、売買、賃貸、管理、鑑定、受託販売業■リフォーム業■損害保険代理業■生命保険の募集に関する業務,■東京都豊島区東池袋１丁目３４－２ スエル池袋 7階,2018,3000万円,27.0,20,https://www.asset-builder.jp/,代表取締役社長 菊地 冬輝,
2024-08-01,株式会社環境住宅研究所,住宅（ハウスメーカー）,1,■事業内容：建築物の設計・工事監理、建築資材の販売■当社の特徴：◇エコボード日本ではまだ珍しい、、質断熱材「エコボード」を強みとしています。エコボードは環境先進国ドイツで番使われている、世界最高基準の素材です。木材ならではの優れた性質を持ち、夏は涼しく、冬は暖かい家をかなえます。将来的に家を取り壊すことになったとしても土に還る、未来の環境にも負担をかけない無添加の断熱材です。◇エコハウス（エコボードを利用した注文住宅）https://ecohaus.jp/ecohaus,愛知県名古屋市名東区大針1-13,2018,12百万円,,,https://ecohaus.jp/,,
2024-08-01,株式会社ガーデンメーカー,設備管理・メンテナンス,6,■事業内容：・フランチャイズ本部運営（直営店3店舗／FC店189店舗（グループ店舗総数192店舗）※2024年6月現在）・中小零細建設業コンサルティング業務・販促ツール・WEBサイト・アプリ企画制作運用・庭のメンテナンス業務・造園緑化工事設計施工・外構・エクステリア工事設計施工・エクステリア商品販売・植木・庭木の生産卸販売・庭業界専門の正社員領域・アルバイト・パート領域の求人メディアの運営,愛知県稲沢市馬場1-96,2018,10百万円,,42,https://www.oniwa-smilegroup.jp/,,
2024-08-01,株式会社オファーズ,不動産仲介,3,■現在の事業内容①オフィス事業：新しい働き方を提案するプラットフォームサービス②不動産仲介事業：物件の資産価値を上げる不動産仲介サービス（ソフトバンク関連企業含む）③WeWork（コワーキングスペース）サービスへの紹介を中核とし、テクノロジーx不動産のイノベーティブな提案を推進しています。,東京都港区西新橋1-1-1,2018,100百万円,,53,https://ofaas.jp/,,
2024-08-01,カエル・デザイン・プロジェクト株式会社,内装・インテリア・リフォーム,16,■当社について：カエル・デザイン・プロジェクトは、用途に限定せず空間の使い方を提案する存在でありたいと考え、2017年に設立されました。従来の設計会社・建設会社とは違う切り口で、様々な面白そうなことにチャレンジしていきます。,北海道小樽市新光2-21-17,2017,3百万円,,32,https://kaeru.design/,,
2024-06-01,株式会社Ｅｌ．Ａｓｓｉｓｔ．,住宅設備・建材,3,■事業内容：産業用・住宅用太陽光発電システム・産業用・住宅用蓄電システム、オール電化機器、空調制御機器、電子ブレーカーの販売、施工各電力会社の契約の見直しと変更、節水事業、ガス事業、各種住宅リフォーム、省エネリフォーム、屋根サイディング塗装、株式会社環境保全研究所取扱代理店,広島県広島市西区庚午北3-1-24F,2018,5百万円,,15,なし,,
2024-08-01,株式会社K.D.S,建築設計事務所,6,■事業内容：・マンションの大規模修繕コンサルティング業務・長期修繕計画の作成、見直し業務・給排水等設備改修コンサルティング業務・耐震診断、耐震補強設計業務,大阪府大阪市浪速区元町2-3-19TCAビル7F,2018,20百万円,,22,https://kds-arc.com/,,
2024-08-01,ＶＩＳＩＯクリエイトシングス株式会社,建築設計事務所,9,■事業内容： 建築設計、デザイン事業を展開しております。お金をかけることだけが理想の住宅づくりとは言い切れません。本当に住みたい家はどんな家か？十人十色の考え方があるからこそ、お客様本位の家づくりを実現させていただきます。イメージからで構いません。お客様の理想の「住空間」を一緒に創造します。,千葉県船橋市習志野台1-19-13,2018,,,6,https://visio-ct.co.jp/,,
2024-08-01,株式会社サンキホーム,内装・インテリア・リフォーム,1,■住宅設計、施工、販売事業■リフォーム事業■宅地開発事業■マンション、戸建販売事業■マンション、ビル管理事業■不動産全般 仲介事業東京都知事許可（般-2）第153037号,東京都新宿区四谷2-1-1 SK四谷ビル,2014,"3,000万円",,50,http://sanki-home.jp/,代表取締役 中道 伸高,
2024-07-01,株式会社アクト,不動産仲介,1,■事業内容： 当社は2018年創業の総合不動産会社です。注文住宅、売買、賃貸、管理と不動産に関わることすべて自社で対応しています。青森市を中心に、賃貸のお部屋探しや、一戸建て・土地などのご購入用物件のご紹介を行っております。,青森県青森市浪打2-1-17,,10百万円,,17,https://www.c21act.com,,
2024-08-01,株式会社ＩＰＰＯ,不動産仲介,10,■事業内容：事業用の不動産仲介事業および不動産に関連するプラットフォーム運営事業を行っています。,東京都渋谷区道玄坂2-11-1JMFビル渋谷035F,2018,50百万円,,29,https://ippooffice.co.jp/,,
2024-08-01,城南マネジメント株式会社,不動産管理,2,■グループ会社及び自社保有物件の賃貸管理/建物管理■東京及び神奈川に、グループ会社関連保有の1棟マンションが約30棟300室あります。その物件の賃貸管理や建物管理、メンテナンス業務などを行っています。■ファミリータイプの1棟物件及び民泊対応物件の購入■大田区で特区民泊に向いている1棟物件または、東京神奈川エリアにおけるファミリータイプの1棟物件の購入をおこなっています。,東京都大田区大森北1-23-7,2018,9百万円,,6,なし,,
2024-08-01,Progetto　Fresco株式会社,内装・インテリア・リフォーム,5,■事業内容：・店舗内装の施工及びマネージメント・各種家具の製造及び輸入並びに販売,大阪府大阪市中央区久太郎町1-4-8,2018,20百万円,,5,https://www.progetto-fresco.jp/,,
2024-08-01,Gpica株式会社・Gpicaライフパートナー株式会社【Gpicaグループ合同募集】,不動産仲介,1,【Gpica株式会社】■不動産業（賃貸・売買・管理）■宅地建物取引業 東京都知事(2)第101001号【Gpicaライフパートナー株式会社】■保険代理店業,東京都中野区中野4-4-11 第12南日本ビル3階＜各社共通＞,2016,300万円＜各社共通＞,,,https://www.gpica.jp/,代表取締役 齊藤 由貴子＜各社共通＞,
2024-06-01,株式会社ビルドアップ,内装・インテリア・リフォーム,1,■事業内容： 【一般建築】新築工事の他、増改築工事・リフォーム工事を手掛けており、一般住宅をはじめ、アパート(共同住宅)、店舗など幅広い分野の建造物に対応しております。徹底された施工管理で、お客様に満足していただける高い品質の建造物を提供いたします。【新築工事】木造・鉄骨造による新築工事（戸建住宅・共同住宅）をご要望に応じて建築致します。【増改築工事】お住いのお部屋や水回りを増築・改築致します。【リフォーム工事】お住いのお悩みを解決すべく、リフォーム致します。,愛知県名古屋市名東区延珠町101新和ビル1F,2018,5百万円,,,https://bld-up.com/,,
2024-08-01,ベンチャーサポート不動産株式会社,不動産仲介,1,"■不動産売買の仲介■相続コンサルティング全国22拠点・グループ社員数1,350名。旧来の慣習にとらわれない「日本最大級の士業グループ」です。税理士・社会保険労務士・行政書士・土地家屋調査士・司法書士・弁護士 すべての5士業が集まり、中小・ベンチャー企業経営者のさまざまなニーズにお応えしてサポートします。業界の常識を次々に変えることで、上場企業並みの「高収入」「高待遇」を実現しました。",東京都中央区銀座3-7-3 銀座オーミビル7階,2018,,,40,https://vs-group.jp/real-estat,代表者 内田 和希,
2024-06-01,株式会社ＯＨＡＮＡ,建設コンサルタント,2,■事業内容：総合建設業・設計・施工・管理1.建設工事：公共建設工事・マンション施工・太陽光発電・多目的ホールなど／2.一般建築：注文住宅・アパート建築・ガレージエクステリアなど3.修繕管理：マンション外壁工事・耐震強化工事・定期点検など／4.リフォーム：住宅リフォーム・店舗内装工事など,大阪府大阪市生野区巽南4-7-23,2018,3百万円,33.0,3,https://www.k-ohana.co.jp/_company,,
2024-06-01,株式会社アサヒホーム,サブコン,1,■事業内容： ・アスベスト工事一式・煙突洗浄工事・外壁塗膜・下地調整材工共撤去工事・建築物石綿含有建材事前調査・ダイオキシン除染工事・解体工事・復旧工事・仮設足場一式工事・橋梁工事全般,大阪府堺市堺区大浜中町3-11-6,2018,5百万円,26.7,21,http://asahihome0309.com/,,
2024-06-01,和幸エンジニアリング株式会社,建設コンサルタント,3,■事業内容：・コンクリート構造物の調査、診断、補修、設計・地中レーダーを使用したトンネル空洞及び覆工厚調査・土木構造物の定期点検業務,広島県東広島市高屋町檜山921-5,2018,5百万円,54.0,5,http://www.wakoeng.jp/index.html,,
2024-07-01,株式会社英光建設,サブコン,1,当社は、豊富な経験と技術で土木工事全般や外構工事を主に行っております。測量から山留・排水工事等、造成・開発に伴う工事を一貫して対応できます。■事業内容：・一般建設業・土木工事業・とび・土木工事業・石工事業・鋼構造物工事業・舗装工事業・しゅんせつ工事業・水道施設工事業・解体工事業■企業理念：【英知 英断 英気】優れた知識と優れた決断力、英気溢れるチームで、光る未来を造る社会人として利他に努め、社業を通じて人格と技術を磨き、会社発展をもって社会に貢献する,神奈川県三浦市三崎町小網代1586-3,2018,10百万円,44.0,10,https://m-eikou.com,,
2024-06-01,株式会社ユニテック,サブコン,1,■企業概要：当社は、2018年に設立して以降は、電気工事のプロ集団として日々技術を追求し、一歩一歩確実に成果を納めながら信用と信頼を積上げてまいりました。現在、商工会議所をはじめとした経済団体にも加盟させていただき、地域に根を張り、地域の方々に信頼いただける仕事を続けることで、支えていただいております。■事業内容： ・空調設備工事・高圧受電設備工事・一般電気設備工事・保安管理事業・産業用太陽光発電設計施工,千葉県成田市中台2-22-1,2018,5百万円,,9,https://unitec-narita.jp/info/,,
2024-07-01,株式会社日本ビルドテック,土地活用,4,【事業用建物の将来性】 同社グループの株式会社日本サブリースは、主に企業向け事業用建物に特化した独自の土地活用システムを導入しており、創業以来積み重ねてきたノウハウを元に、入居率は98％をほぼ変動なく推移しております。 また、現在ではコロナ禍によって、都心部の大きなオフィスは形骸化し、その近郊で自社の建物を建てる企業が増加していることから、同社の事業用建物を注文する企業が増加傾向にあります。特に製造メーカー会社等、自社製品のための倉庫を必要としているような企業には、同社の事務所兼倉庫の建物は需要があるため、今後も安定的な受注が見込めます。,大阪府大阪市東成区東小橋1-11-2,2018,50百万円,,10,https://sub-lease.co.jp/business/construction/,,
2024-08-01,株式会社ＲＥＲＩＳＥ,不動産仲介,19,■不動産仲介■土地売買及び仲介業■顧客・パートナー開拓■新規事業戦略立案■企業コンサル【登録・免許番号】宅地建物取引業 東京都知事（1）第102928号【受賞歴】2023年度 ベストベンチャー100選出（イシン株式会社調べ）2023年度 日本における「働きがいのある会社」若手ランキング3位（Great Place To Work Institute Japan調べ）,東京都新宿区西新宿2-6-1 新宿住友ビル37F,2018,1000万円,29.0,120,http://rerise.co/,代表取締役 田口 大志,
2024-07-01,株式会社Ｏｃｅａｎ　ｅｓｔａｔｅ,不動産仲介,1,■事業内容： ・不動産再販業・不動産仲介業・不動産管理業・リノベーション事業,東京都中央区築地2-10-26F,2018,10百万円,,5,https://ocean-estate.jp/,,
2024-05-01,ヒサマツエンジニアリング株式会社,サブコン,3,■事業内容・特徴：当社は、代表者のオルガノ株式会社に約30年間勤務していた経験を活かし、2018年4月に独立創業しました。水処理関係の制御盤製造、電気計装計画設計などのエンジニアリングおよび付随する電気工事がメインで、プラント事業のシステム設計等も手掛けています。,茨城県猿島郡境町大字長井戸247,2018,23百万円,,39,https://hisa-eng.com/,,
2024-07-01,株式会社ｄｉｆｆ,土地活用,4,私たちはデザイナーズマンション「trias」を軸とし、住む人の人生を好転させる住まいを提供する不動産開発会社です。代表の古川は、”つらかった営業時代、家賃15万円のデザイナーズマンションに引っ越し、環境を変化させることで自分自身も変えることができた”という実体験から、環境を変えることは人の人生が大きく変わることだと感じ、『仕事も遊びも夢中になれる場所』というコンセプトのもと「trias」のブランドを広げてきました。,東京都渋谷区桜丘町10-4モドマルシェ渋谷桜丘 8F,,,,,https://diff.co.jp/,,
2024-06-01,株式会社ネクサス・アールハウジング,内装・インテリア・リフォーム,1,■事業内容：不動産売買・仲介、不動産コンサルティング、分譲住宅事業、住宅リフォーム事業、会員制住宅メンテナンス事業、海外不動産事業 他,千葉県船橋市本中山5-10-17,2007,,,,https://hikarinobe.com/,,
2024-07-01,株式会社裕新総業,内装・インテリア・リフォーム,1,■事業内容： ・電気工事・内装工事・店舗工事・原状回復・外構工事・住宅工事全般（修理・補修） ■ビジョン： 当社は、宇都宮市を中心に北関東エリアで業務を行っています。そんな当社の使命は、お客様の想いに応える仕上がりをお届けすること。そのためにも、・完全自社施工・幅広い建許による対応力・『＋α』のご提案力にこだわっています。店舗やオフィス、戸建住宅などの電気工事や内装の改装・改修などのご依頼を承っています。,栃木県宇都宮市石井町3373-14,,,,6,https://www.yushinsougyo.com/,,
2024-08-01,株式会社Ｙ’ｓ建築,内装・インテリア・リフォーム,3,■事業内容：各種リフォーム一式、リノベーション当社ではマンション、住宅リフォーム、リノベーション、内装工事、スケルトン工事、外構工事などを名古屋市内を中心に手がけております。,愛知県名古屋市守山区御膳洞1517‐3,,1百万円,,4,https://ys-kenchiku.jp/,,
2024-06-01,ラピアスデザイン株式会社,住宅（ハウスメーカー）,2,当社は、住宅・店舗・外構等のデザイン・設計・施工やリフォーム・リノベーションを請け負う会社です。「安心」・「安全」・「快適」の３つの要素をデザインの中核と捉え、お客様に「家」のその先にある「暮らし」を提供しております。■事業概要：・住宅・店舗・外構等のデザイン・設計・施工・リフォーム・リノベーション・WEB・出版物の企画・デザイン,三重県津市安濃町東観音寺384-3,2018,5百万円,,4,https://www.lapias-design.com/,,
2024-08-01,株式会社こころ建築工房,住宅（ハウスメーカー）,2,■事業内容：・中大規模木造建設・新築工事請負業・設計事務所（プランニング、確認申請、長期優良住宅申請、低炭素住宅申請、許容応力度計算、耐震計算）・建築工事業・リフォーム工事請負業,大阪府堺市堺区向陵中町3-4-24,2018,80百万円,,21,https://kokoro-kenchikukobo.net/index.html,,
2024-07-01,ナカザワワークス株式会社,内装・インテリア・リフォーム,4,■事業内容： ⇒事業概要とその詳細について詳しく記載。また、ビジネスモデルに 関する記載も同項目にて記載。 ■ビジョン： ⇒設立背景や社長の思いは同項目にて記載。 ■特徴（TOPICS）： ⇒マーケット環境、製品・サービスに関する優位性を記載。または、 教育体制や福利厚生など企業マネジメントに関する特徴も記載。 ■組織風土： ⇒風土の説明は、企業を取り巻く競合他社、マーケット要因、社内制度 や対面した社員の方の印象など社風を裏付ける根拠も記載。,大阪府和泉市あゆみ野4-3-20,2018,30百万円,,63,https://nakazawa-works.com/,,
2024-07-01,株式会社東ホールディングス,建設コンサルタント,1,■事業内容：東グループ会社の統括及びグループ会社に関する各種管理業務,埼玉県入間市新久137-1,2018,10百万円,,26,http://azuma-hd.co.jp/,,
2024-07-01,株式会社スタイリード,不動産仲介,1,新築戸建て・中古マンション・土地の仲介○神奈川県知事 (2) 第30233号,神奈川県横浜市神奈川区神奈川２丁目14-22,2018,,,,Error accessing https://doda.jp/DodaFront/View/JobSearchDetail/j_jid__3010733452/: 'NoneType' object has no attribute 'get',代表取締役社長 西村 和俊,
2024-08-01,ヤマワケエステート株式会社,不動産金融,1,■事業内容： 不動産クラウドファンディング,大阪府大阪市中央区北浜2-3-14小谷ビル3F,,,,,https://yamawake-estate.jp/,,
2024-06-01,株式会社ＺＥＲＯ,住宅設備・建材,1,タカラスタンダード株式会社の協力企業として、キッチンやユニットバス、洗面台の取り付けや、住宅設備全般のリペア、リフォームを行っています。＜大阪府知事許可 第152963号＞【主要取引先】■タカラスタンダード株式会社■株式会社LIXIL■タマホーム株式会社 など,大阪府池田市豊島北１-10-18,2013,500万円,,18,https://rashiku-zero.com,代表取締役 大竹 篤史,
2024-07-01,創家建設工業株式会社,サブコン,6,■事業概要：・鉄筋工事事業（売上全体の50％を占めます。）：マンションやビルの大規模な現場から店舗の建具の小規模な現場まで、様々な建造物の鉄筋工事に対応しています。・一般戸建て住宅事業（売上全体の25％）：創業以来、大手住宅ビルダーの新築住宅の施工を手掛けてきた技術力とノウハウで高品質な施工を行っています。・リフォーム事業（売上全体の25％）：数多くの住まいづくりで培った実績とノウハウをもとに、ちょっとした修繕から大規模なリフォームまでお客様の建物・住まいに最適なプランをご提案します。,千葉県船橋市習志野1-12-18,1956,30百万円,45.0,22,https://www.soukakensetsu.co.jp,,
2024-06-01,株式会社岡本工務店,サブコン,1,■事業内容： 基礎工事一式、型枠工事一式、型枠解体工事一式、外構工事一式、除排雪工事一式,北海道札幌市北区新琴似十条15-6-10,2018,1百万円,40.0,2,https://okakou77.com/,,
2024-07-01,株式会社ROLE,内装・インテリア・リフォーム,1,■一般住宅リフォーム工事■不動産仲介業下請けリフォーム■店舗・オフィス内装工事■住宅・店舗リフォーム■外構工事（外壁塗装・カーポート・門扉）,大阪府池田市天神2-3-4,2018,500万円,,5,https://rolereform.com/,代表取締役 菊川 暢也,
2024-08-01,株式会社アレスト,サブコン,1,太陽光発電設備工事（小規模、大規模）省エネ、エコ事業（LED更新工事）総合電気設備工事（ビル、マンション、工場、店舗、戸建住宅等）工場電力工事及び電気計装工事空調設備工事（家庭用、業務用）アンテナ基地局設備工事アンテナ共聴工事高圧デマンドコントロールシステムメンテナンス高圧機器改修工事防犯設備工事一式弱電設備工事一式,大阪府堺市西区津久野町1丁8-26,2018,,,,https://alest.co.jp/,代表取締役 植田 光貴,
2024-07-01,三愛テック株式会社,サブコン,1,■事業概要：・産業用機械の制御盤の設計・組付け配線：ハード設計・ソフト設計・調整まで一貫して行っております。・機械内配線工事：定期点検の際にもメンテナンスが短時間で完了することまで想定した作業を行っております。,愛知県一宮市奥町字土桶17-3,2018,2百万円,,8,https://www.sanaitec0607.com/index.html,,
2024-07-01,株式会社Ｔ‐Ｃｒｕｉｓｅ,内装・インテリア・リフォーム,11,■事業内容： ・電気事業（電気工事一式請負）・内装工事一式請負・古物品売買・ハウスクリーニング・エアコン取付工事・内装解体,東京都中央区湊1-12-10八丁堀リバーゲイト2F,2018,5百万円,,,なし,,
2024-07-01,株式会社みずほ,住宅設備・建材,1,■事業内容： 1.建設・土木・設備工事の設計、施工、監理及び請負2.電気設備・通信設備・空調設備・給排水設備・衛星設備の設計、施工及び管理並びに器具の販売3.不動産の売買、賃貸、仲介、保守及び管理4.発電並びに電機の供給及び販売,滋賀県蒲生郡日野町大字別所195,2018,10百万円,,9,http://www.mizuho-no-ie.co.jp/#works,,
