更新日,名称,業界(小分類),求人有無,所在地,設立,代表者,資本金,平均年齢,従業員数,企業URL,事業内容,上場市場名
2024-08-01,株式会社開成コミュニティー,不動産仲介,求人なし,東京都新宿区新宿1-20-13,2008,代表取締役 出水 直規,3 百万円,,,Error accessing nan: Invalid URL 'nan': No scheme supplied. Perhaps you meant https://nan?,,
2024-08-01,株式会社今村建装,内装・インテリア・リフォーム,求人なし,大阪府大阪市東淀川区瑞光4-1-24,2008,代表取締役 今村 正司,5 百万円,,,Error accessing nan: Invalid URL 'nan': No scheme supplied. Perhaps you meant https://nan?,,
2024-08-01,株式会社シンコー,サブコン,求人なし,大阪府松原市岡6-45,2008,代表取締役 中田 健一,6 百万円,,,Error accessing nan: Invalid URL 'nan': No scheme supplied. Perhaps you meant https://nan?,,
2024-08-01,スター・マイカ・レジデンス株式会社,不動産仲介,求人なし,東京都港区虎ノ門4-3-1城山トラストタワー 28Ｆ,2008,代表取締役 水永 政志,30 百万円,,,Error accessing nan: Invalid URL 'nan': No scheme supplied. Perhaps you meant https://nan?,,
2024-08-01,株式会社ＴＥＰ,不動産仲介,求人なし,東京都港区新橋1-9-1新橋二光ビル 2Ｆ,2008,代表取締役 竹上 大介,13 百万円,,,Error accessing nan: Invalid URL 'nan': No scheme supplied. Perhaps you meant https://nan?,,
2024-08-01,株式会社加瀬ホールディングス,不動産管理,無,神奈川県横浜市港北区新横浜3-19-11加瀬ビル88,2008,代表取締役 谷間 広視,80 百万円,,,Error accessing nan: Invalid URL 'nan': No scheme supplied. Perhaps you meant https://nan?,,
2024-08-01,株式会社増子工業,建設・プラント・不動産業界,求人なし,東京都練馬区春日町2-14-29コーポ・ミホ 1Ｆ,2008,代表取締役 増子 昇,5 百万円,,,Error accessing nan: Invalid URL 'nan': No scheme supplied. Perhaps you meant https://nan?,,
2024-08-01,エスパークマネジメント株式会社,建築設計事務所,求人なし,東京都渋谷区渋谷3-12-22渋谷プレステージ 8Ｆ,2008,代表取締役 八重樫 義男,20 百万円,,,Error accessing nan: Invalid URL 'nan': No scheme supplied. Perhaps you meant https://nan?,,
2024-08-01,株式会社アップルアドバイザーズ,不動産仲介,無,東京都渋谷区神泉町1-183Ｆ,2008,代表取締役 松野 龍俊,10 百万円,,,Error accessing nan: Invalid URL 'nan': No scheme supplied. Perhaps you meant https://nan?,,
2024-08-01,株式会社ドリームハウス,不動産管理,無,東京都調布市仙川町3-9-22グラン・ジュテ 1Ｆ,2008,代表取締役 野村 優,10 百万円,,,Error accessing nan: Invalid URL 'nan': No scheme supplied. Perhaps you meant https://nan?,＼16期連続黒字経営！100％反響型・全員未経験入社／◆不動産の売買仲介【免許番号】東京都知事(4)第89073号＜加盟団体＞社団法人 全日本不動産協会＜エリア＞東京・世田谷・調布・三鷹・狛江＜物件＞新築戸建て・中古マンション・土地など… 2024年2月doda掲載求人より引用,
2024-08-01,伸幸工業株式会社,サブコン,求人なし,東京都府中市住吉町4-17-16,2008,代表取締役 上城 正憲,5 百万円,,,Error accessing nan: Invalid URL 'nan': No scheme supplied. Perhaps you meant https://nan?,,
2024-08-01,新日本信用保証株式会社,不動産金融,無,東京都墨田区江東橋2-19-7富士ソフトビル 1Ｆ,2008,代表取締役 徳丸 健一,95 百万円,,,Error accessing nan: Invalid URL 'nan': No scheme supplied. Perhaps you meant https://nan?,■家賃債務保証業家賃債務保証事業者登録：国土交通大臣（1）第75号 2024年2月doda掲載求人より引用,
2024-08-01,株式会社商業サポート,ディベロッパー,求人なし,東京都足立区一ツ家2-16-13,2008,代表取締役 長谷川 和雄,10 百万円,,,Error accessing nan: Invalid URL 'nan': No scheme supplied. Perhaps you meant https://nan?,,
2024-08-01,株式会社ネクスコ東日本トラスティ,土地活用,求人なし,東京都港区東新橋2-3-17ＭＯＭＥＮＴＯ ＳＨＩＯＤＯＭＥ 6Ｆ,2008,代表取締役 光永 宏典,45 百万円,,,Error accessing nan: Invalid URL 'nan': No scheme supplied. Perhaps you meant https://nan?,,
2024-08-01,開設計コンサルタント株式会社,建築設計事務所,求人なし,東京都渋谷区笹塚1-56-10笹塚総栄ビル 406,2008,代表取締役 角谷 貴志,1 百万円,,,Error accessing nan: Invalid URL 'nan': No scheme supplied. Perhaps you meant https://nan?,,
2024-08-01,Ｇｌｏｂａｌ　Ａｓｓｅｔ　Ｍａｎａｇｅｍｅｎｔ株式会社,不動産仲介,求人なし,東京都世田谷区代田5-16-7,2008,代表取締役 對間 美実子,53 百万円,,,Error accessing nan: Invalid URL 'nan': No scheme supplied. Perhaps you meant https://nan?,,
2024-08-01,株式会社ユービックス,内装・インテリア・リフォーム,求人なし,東京都中央区日本橋中洲5-8リバーシティ日本橋 101,2008,代表取締役会長 井口 義能,10 百万円,,,Error accessing nan: Invalid URL 'nan': No scheme supplied. Perhaps you meant https://nan?,,
2024-08-01,株式会社みらいアーキテクト,内装・インテリア・リフォーム,無,神奈川県横浜市神奈川区泉町17-1第一泉ビル 5Ｆ,2008,代表取締役 萩原 祐一,99 百万円,,,Error accessing nan: Invalid URL 'nan': No scheme supplied. Perhaps you meant https://nan?,情報が古い可能性があります。最新の情報を確認する場合はHP等をご覧ください。 ■新築住宅の建築・施工、外構工事、リフォーム 2023年7月doda掲載求人より引用,
2024-08-01,瀧本林業株式会社,不動産仲介,求人なし,神奈川県相模原市中央区矢部1-5-20,2008,代表取締役 瀧本 哲洋,10 百万円,,,Error accessing nan: Invalid URL 'nan': No scheme supplied. Perhaps you meant https://nan?,,
2024-08-01,株式会社コミヤマ環境,ゼネコン,求人なし,東京都豊島区南大塚2-40-1大塚中央ビル 606,2008,代表取締役 谷岡 亘,10 百万円,,,Error accessing nan: Invalid URL 'nan': No scheme supplied. Perhaps you meant https://nan?,,
2024-08-01,株式会社ケイエスランド,不動産金融,求人なし,東京都杉並区高円寺南3-3-1ＫＳビル 2Ｆ,2008,代表取締役 喜入 隆,10 百万円,,,Error accessing nan: Invalid URL 'nan': No scheme supplied. Perhaps you meant https://nan?,,
2024-08-01,株式会社ヒューマンネット,不動産管理,求人なし,東京都足立区千住1-4-1,2008,代表取締役 澤田 浩志,6 百万円,,,Error accessing nan: Invalid URL 'nan': No scheme supplied. Perhaps you meant https://nan?,,
2024-08-01,株式会社リヴシステム,不動産仲介,求人なし,東京都千代田区丸の内2-7-2ＪＰタワー 10Ｆ,2008,代表取締役 福元 恒徳,8 百万円,,,Error accessing nan: Invalid URL 'nan': No scheme supplied. Perhaps you meant https://nan?,,
2024-08-01,首都高機械メンテナンス株式会社,設備管理・メンテナンス,無,東京都千代田区神田小川町3-9-2,2008,代表取締役社長 高橋 三雅,90 百万円,,,Error accessing nan: Invalid URL 'nan': No scheme supplied. Perhaps you meant https://nan?,,
2024-08-01,株式会社ビッグストリーム,不動産仲介,求人なし,東京都中央区日本橋本町3-1-6日本橋永谷ビル 513,2008,代表取締役 大沢 伸夫,10 百万円,,,Error accessing nan: Invalid URL 'nan': No scheme supplied. Perhaps you meant https://nan?,,
2024-08-01,株式会社三好空調,サブコン,求人なし,神奈川県横浜市青葉区大場町293-15,2008,代表取締役 三好 亮太,3 百万円,,,Error accessing nan: Invalid URL 'nan': No scheme supplied. Perhaps you meant https://nan?,,
2024-08-01,株式会社大塚機工,サブコン,求人なし,神奈川県横浜市保土ケ谷区新井町459-8,2008,代表取締役 大塚 晃広,10 百万円,,,Error accessing nan: Invalid URL 'nan': No scheme supplied. Perhaps you meant https://nan?,,
2024-08-01,株式会社ｉ．トータルエステート,不動産管理,無,東京都練馬区東大泉2-9-15,2008,代表取締役 元持 彰夫,3 百万円,,,Error accessing nan: Invalid URL 'nan': No scheme supplied. Perhaps you meant https://nan?,情報が古い可能性があります。最新の情報を確認する場合はHP等をご覧ください。 ■戸建て・マンション・アパートの賃貸管理■リフォーム工事■不動産の売買及び仲介■火災保険取扱代理店（e-Net少額短期保険）■ケーブルテレビ取扱代理店（J:COM）東京都知事（3）89199号 2023年2月doda掲載求人より引用,
2024-08-01,株式会社清隆建設,サブコン,求人なし,大阪府東大阪市東山町4-10新石切ライトハウス 4Ｆ,1945,代表取締役 萩原 良隆,5 百万円,,,Error accessing nan: Invalid URL 'nan': No scheme supplied. Perhaps you meant https://nan?,,
2024-08-01,金城電設株式会社,サブコン,求人なし,大阪府藤井寺市沢田2-10-2,2008,代表取締役 金城 孝至,5 百万円,,,Error accessing nan: Invalid URL 'nan': No scheme supplied. Perhaps you meant https://nan?,,
2024-08-01,株式会社東京ＤＡＮＯＩ,不動産仲介,無,東京都千代田区九段北4-1-14Ｆ,2008,代表取締役 日高 哲也,8 百万円,,,Error accessing nan: Invalid URL 'nan': No scheme supplied. Perhaps you meant https://nan?,,
2024-08-01,株式会社エイチ・ビー,内装・インテリア・リフォーム,求人なし,東京都多摩市南野3-5-8,2008,代表取締役 細田 博之,20 百万円,,,Error accessing nan: Invalid URL 'nan': No scheme supplied. Perhaps you meant https://nan?,,
2024-08-01,エスアイシー株式会社,設備管理・メンテナンス,求人なし,大阪府守口市大日東町4Ａ3202,2008,代表取締役 佐川 智,1 百万円,,,Error accessing nan: Invalid URL 'nan': No scheme supplied. Perhaps you meant https://nan?,,
2024-08-01,株式会社銀座プライド,不動産仲介,求人なし,東京都中央区銀座3-8-4新聞会館 33,2008,,6 百万円,,,Error accessing nan: Invalid URL 'nan': No scheme supplied. Perhaps you meant https://nan?,,
2024-08-01,内村工業株式会社,サブコン,求人なし,大阪府豊中市大島町1-18-15,2008,代表取締役 内村 順一,3 百万円,,,Error accessing nan: Invalid URL 'nan': No scheme supplied. Perhaps you meant https://nan?,,
2024-08-01,株式会社二葉屋,ゼネコン,求人なし,東京都豊島区目白2-1-1大下ビル 301,1965,代表取締役 大下 浩二,10 百万円,,,Error accessing nan: Invalid URL 'nan': No scheme supplied. Perhaps you meant https://nan?,,
2024-08-01,株式会社ＫＩＭ,住宅設備・建材,求人なし,福岡県北九州市八幡西区美吉野町10-19,2003,代表取締役 池上 幸二,10 百万円,,,Error accessing nan: Invalid URL 'nan': No scheme supplied. Perhaps you meant https://nan?,,
2024-08-01,株式会社西川ホームサービス,サブコン,求人なし,大阪府堺市美原区北余部220-8,2002,代表取締役 西川 能弘,6 百万円,,,Error accessing nan: Invalid URL 'nan': No scheme supplied. Perhaps you meant https://nan?,,
2024-08-01,株式会社メイクアップ,ゼネコン,求人なし,神奈川県横浜市旭区金が谷735-6,1994,代表取締役 宮崎 美奈子,8 百万円,,,Error accessing nan: Invalid URL 'nan': No scheme supplied. Perhaps you meant https://nan?,,
2024-08-01,株式会社総合ハイテック,設備管理・メンテナンス,求人なし,香川県坂出市林田町4285-147,1970,代表取締役 中井 康司,34 百万円,,,Error accessing nan: Invalid URL 'nan': No scheme supplied. Perhaps you meant https://nan?,,
2024-08-01,株式会社ＰＯＲＯＳＵＳ,不動産金融,求人なし,千葉県千葉市花見川区幕張町5-417-4菊栄ハイツ 106,2008,代表取締役 小田 徹,13 百万円,,,Error accessing nan: Invalid URL 'nan': No scheme supplied. Perhaps you meant https://nan?,,
2024-08-01,株式会社ビルテック,ゼネコン,無,東京都葛飾区お花茶屋3-7-7,2004,代表取締役 宇田 考行,10 百万円,,,Error accessing nan: Invalid URL 'nan': No scheme supplied. Perhaps you meant https://nan?,,
2024-08-01,住まいの戸田株式会社,不動産仲介,求人なし,北海道千歳市千代田町5-5-1戸田ビル 1Ｆ,1960,代表取締役 戸田 貢介,10 百万円,,,Error accessing nan: Invalid URL 'nan': No scheme supplied. Perhaps you meant https://nan?,,
2024-08-01,株式会社大誠ホーム,住宅（ハウスメーカー）,求人なし,熊本県熊本市中央区九品寺5-11-1,1988,代表取締役 宮本 一徳,10 百万円,,,Error accessing nan: Invalid URL 'nan': No scheme supplied. Perhaps you meant https://nan?,,
2024-08-01,株式会社コーボウ設備工業,住宅設備・建材,求人なし,大分県大分市大字三佐2122-8,1998,代表取締役 鶴原 一正,20 百万円,,,Error accessing nan: Invalid URL 'nan': No scheme supplied. Perhaps you meant https://nan?,,
2024-08-01,株式会社マーシャルホーム,不動産仲介,求人なし,東京都千代田区内神田1-18-11,2004,代表取締役 松本 聖紀,10 百万円,,,Error accessing nan: Invalid URL 'nan': No scheme supplied. Perhaps you meant https://nan?,,
2024-08-01,株式会社グッドハウス,内装・インテリア・リフォーム,求人なし,大阪府四條畷市雁屋南町11-12,2004,代表取締役 倉前 英明,20 百万円,,,Error accessing nan: Invalid URL 'nan': No scheme supplied. Perhaps you meant https://nan?,,
2024-08-01,株式会社大塚設備,設備管理・メンテナンス,無,東京都日野市百草2027第5イースト 1Ｆ,1977,代表取締役 大塚 拓也,20 百万円,,,Error accessing nan: Invalid URL 'nan': No scheme supplied. Perhaps you meant https://nan?,■各種給排水衛生設備の設計、施工、保守管理■各種空気調和設備の設計、施工、保守管理 2024年4月doda掲載求人より引用,
2024-08-01,株式会社アセットホームサービス,ゼネコン,求人なし,埼玉県川越市中原町2-3-2,2003,代表取締役 内田 親也,3 百万円,,,Error accessing nan: Invalid URL 'nan': No scheme supplied. Perhaps you meant https://nan?,,
2024-08-01,株式会社ムサシホームズ,不動産仲介,求人なし,東京都国分寺市本町2-7-4Ｍ・Ｈビル,2008,代表取締役 廣田 雅宣,3 百万円,,,Error accessing nan: Invalid URL 'nan': No scheme supplied. Perhaps you meant https://nan?,,
2024-08-01,アセットマネジメント株式会社,不動産仲介,求人なし,神奈川県横浜市青葉区市ケ尾町1175-24パールマンション 1Ｆ 105,2006,代表取締役 大屋 悦生,3 百万円,,,Error accessing nan: Invalid URL 'nan': No scheme supplied. Perhaps you meant https://nan?,,
2024-08-01,株式会社マルエイプロパティマネジメント,ディベロッパー,求人なし,東京都港区六本木5-16-5インペリアル六本木1号館 510,2002,代表取締役 椎奈 孝樹,40 百万円,,,Error accessing nan: Invalid URL 'nan': No scheme supplied. Perhaps you meant https://nan?,,
2024-08-01,株式会社カネコウ,サブコン,求人なし,埼玉県新座市野火止8-5-3,1992,代表取締役 田中 宏,3 百万円,,,Error accessing nan: Invalid URL 'nan': No scheme supplied. Perhaps you meant https://nan?,,
2024-08-01,株式会社アスコム,住宅設備・建材,求人なし,福岡県福岡市南区長住2-1-34,2008,代表取締役 松岡 潔,5 百万円,,,Error accessing nan: Invalid URL 'nan': No scheme supplied. Perhaps you meant https://nan?,,
2024-08-01,株式会社メイジン／株式会社ナミト （メイジングループ合同募集 ）,サブコン,2,■株式会社メイジン本社宮城県仙台市青葉区中央1-6-28 メットライフ仙台駅前ビル8F■株式会社ナミト本社愛知県名古屋市中区錦1-6-5 名古屋錦シティビル7F,2008,代表取締役 宮原 司 [株式会社メイジン],800万円 [株式会社メイジン],43.0,447,Error accessing nan: Invalid URL 'nan': No scheme supplied. Perhaps you meant https://nan?,[株式会社メイジン／株式会社ナミト共通]■建設事業部建設領域における「建築」「土木」「空調衛生設備」「電気設備」等の各種施工管理および図面作成業務（許可番号：派04-300313）[株式会社メイジン]■飲食事業部,
2024-08-01,株式会社就学館,不動産仲介,求人なし,宮城県仙台市若林区荒町70-4,2008,代表取締役 髙橋 真由美,8 百万円,,,Error accessing nan: Invalid URL 'nan': No scheme supplied. Perhaps you meant https://nan?,,
2024-08-01,テクノメイト株式会社,プラントメーカー・プラントエンジニアリング,求人なし,静岡県静岡市駿河区宮竹1-1-8,2008,代表取締役 田中 航,10 百万円,,,Error accessing nan: Invalid URL 'nan': No scheme supplied. Perhaps you meant https://nan?,,
2024-08-01,株式会社コラボラボ,内装・インテリア・リフォーム,求人なし,兵庫県神戸市中央区波止場町2-8ＦＩＳＨＩＮＴＨＥＦＯＲＥＳＴ,2008,代表取締役 小林 祐介,20 百万円,,,Error accessing nan: Invalid URL 'nan': No scheme supplied. Perhaps you meant https://nan?,,
2024-08-01,株式会社ビルネット千葉,不動産仲介,求人なし,千葉県千葉市中央区富士見2-3-1塚本大千葉ビル 9Ｆ,2008,代表取締役 石井 秀法,10 百万円,,,Error accessing nan: Invalid URL 'nan': No scheme supplied. Perhaps you meant https://nan?,,
2024-08-01,株式会社北恒不動産,不動産仲介,求人なし,北海道札幌市北区北十一条西4-2-21リー北11条ビルココロホーム北11条 2Ｆ,2005,代表取締役 阿部 孝光,10 百万円,,,Error accessing nan: Invalid URL 'nan': No scheme supplied. Perhaps you meant https://nan?,,
2024-08-01,株式会社ミスタービルド埼玉,内装・インテリア・リフォーム,求人なし,埼玉県さいたま市大宮区天沼町1-442-2,1993,代表取締役 長竹 嘉昌,50 百万円,,,Error accessing nan: Invalid URL 'nan': No scheme supplied. Perhaps you meant https://nan?,,
2024-08-01,株式会社ＧＯ　ＳＴＲＡＩＧＨＴ,不動産管理,求人なし,東京都港区虎ノ門3-10-3,2008,代表取締役 咲本 慶喜,10 百万円,,,Error accessing nan: Invalid URL 'nan': No scheme supplied. Perhaps you meant https://nan?,,
2024-08-01,株式会社協和機工製作所,プラントメーカー・プラントエンジニアリング,求人なし,北海道札幌市白石区川下2115,1981,代表取締役 辻 信太郎,30 百万円,,,Error accessing nan: Invalid URL 'nan': No scheme supplied. Perhaps you meant https://nan?,,
2024-08-01,株式会社フィルド,建築設計事務所,求人なし,北海道札幌市中央区南二条西1-7-8山口中央ビル 4Ｆ,2008,代表取締役 齋藤 貴之,11 百万円,,,Error accessing nan: Invalid URL 'nan': No scheme supplied. Perhaps you meant https://nan?,,
2024-08-01,株式会社エアシス,設備管理・メンテナンス,求人なし,兵庫県神戸市西区前開南町2-14-9リバーサイド安藤2 1Ｆ,2003,代表取締役 中島 忠,20 百万円,,,Error accessing nan: Invalid URL 'nan': No scheme supplied. Perhaps you meant https://nan?,,
2024-08-01,株式会社構造メンテ,ゼネコン,求人なし,兵庫県神戸市中央区脇浜町2-11-4レオ・脇浜 101,2003,代表取締役 加藤 昌幸,10 百万円,,,Error accessing nan: Invalid URL 'nan': No scheme supplied. Perhaps you meant https://nan?,,
2024-08-01,株式会社日経プラザ＆サービス,不動産管理,無,東京都千代田区内神田1-6-10笠原ビル 9Ｆ,2008,代表取締役 金丸 泰輔,100 百万円,,,Error accessing nan: Invalid URL 'nan': No scheme supplied. Perhaps you meant https://nan?,,
2024-08-01,株式会社尾張工業所,設備管理・メンテナンス,求人なし,愛知県名古屋市西区名駅2-4-3ウエスタンビル 1Ｆ,1974,代表取締役 若原 誠之,4 百万円,,,Error accessing nan: Invalid URL 'nan': No scheme supplied. Perhaps you meant https://nan?,,
2024-08-01,大川スティール株式会社,サブコン,求人なし,新潟県新潟市北区太郎代字山の下1523-3,2004,代表取締役 佐野 芳雄,50 百万円,,,Error accessing nan: Invalid URL 'nan': No scheme supplied. Perhaps you meant https://nan?,,
2024-08-01,株式会社イーディーオー,設備管理・メンテナンス,無,東京都台東区浅草橋4-2-2ユニゾ浅草橋四丁目ビル 2Ｆ,2005,代表取締役 武井 一義,10 百万円,,,Error accessing nan: Invalid URL 'nan': No scheme supplied. Perhaps you meant https://nan?,,
2024-08-01,株式会社東邦,サブコン,求人なし,大阪府豊中市小曽根3-1-7,2004,代表取締役 東畠 邦和,10 百万円,,,Error accessing nan: Invalid URL 'nan': No scheme supplied. Perhaps you meant https://nan?,,
2024-08-01,株式会社テシオ,不動産仲介,無,埼玉県草加市北谷3-38-10英美ビル 1Ｆ,2001,代表取締役 小笠原 圭吾,20 百万円,,,Error accessing nan: Invalid URL 'nan': No scheme supplied. Perhaps you meant https://nan?,情報が古い可能性があります。最新の情報を確認する場合はHP等をご覧ください。 ■空間デザイン事業■リフォーム・リノベーション事業■不動産仲介業■内装施工事業 2023年7月doda掲載求人より引用,
2024-08-01,東伸塗装株式会社,サブコン,求人なし,茨城県結城市大字結城11712-2,1964,代表取締役 比留間 国良,10 百万円,,,Error accessing nan: Invalid URL 'nan': No scheme supplied. Perhaps you meant https://nan?,,
2024-08-01,アクシス株式会社,内装・インテリア・リフォーム,無,大阪府大阪市西区南堀江2-13-26アクシスビル,1996,代表取締役 彦坂 充宏,50 百万円,,,Error accessing nan: Invalid URL 'nan': No scheme supplied. Perhaps you meant https://nan?,情報が古い可能性があります。最新の情報を確認する場合はHP等をご覧ください。 ◇収納家具・内装材の商品企画・開発・販売◇住宅設備用金物・人工大理石加工品の企画・開発・アセンブリ・販売◇内装家具の施工・取付 2022年10月doda掲載求人より引用,
2024-08-01,首都高ＥＴＣメンテナンス株式会社,設備管理・メンテナンス,無,東京都港区芝2-28-8,2007,代表取締役 大塚 明,90 百万円,,,Error accessing nan: Invalid URL 'nan': No scheme supplied. Perhaps you meant https://nan?,,
2024-08-01,株式会社アイエス,内装・インテリア・リフォーム,求人なし,茨城県土浦市神立東1-24-13,2006,代表取締役 入江 謙吾,10 百万円,,,Error accessing nan: Invalid URL 'nan': No scheme supplied. Perhaps you meant https://nan?,,
2024-08-01,株式会社ワールドスペース,設備管理・メンテナンス,求人なし,神奈川県横浜市中区麦田町4-110-6Ｔ＆Ｋビルディング 401,1998,代表取締役 井村 哲男,10 百万円,,,Error accessing nan: Invalid URL 'nan': No scheme supplied. Perhaps you meant https://nan?,,
2024-08-01,株式会社ユアテック,設備管理・メンテナンス,求人なし,東京都練馬区羽沢3-26-6アーデンハイム 1Ｆ,1994,代表取締役 中村 祐士,17 百万円,,,Error accessing nan: Invalid URL 'nan': No scheme supplied. Perhaps you meant https://nan?,,
2024-08-01,株式会社アキ・アーキテクト,不動産仲介,無,東京都渋谷区神宮前3-7-1マリオンビル 3Ｆ,1995,代表取締役 秋草 達夫,10 百万円,,,Error accessing nan: Invalid URL 'nan': No scheme supplied. Perhaps you meant https://nan?,,
2024-08-01,有限会社勝俣工業,設備管理・メンテナンス,無,埼玉県北足立郡伊奈町大字小室7062-2,2006,代表取締役 勝俣 浩,5 百万円,,,Error accessing nan: Invalid URL 'nan': No scheme supplied. Perhaps you meant https://nan?,情報が古い可能性があります。最新の情報を確認する場合はHP等をご覧ください。 ・エレベーターの部材製作・エレベーター据え付け工事及び改修・解体工事 2023年4月doda掲載求人より引用,
2024-08-01,ケイメディアフォース株式会社,サブコン,求人なし,神奈川県大和市林間1-8-11,2008,代表取締役 金子 政彦,15 百万円,,,Error accessing nan: Invalid URL 'nan': No scheme supplied. Perhaps you meant https://nan?,,
2024-08-01,株式会社坂本電気設備,サブコン,求人なし,大阪府大阪市城東区関目3-16-18,2008,代表取締役 坂本 博,20 百万円,,,Error accessing nan: Invalid URL 'nan': No scheme supplied. Perhaps you meant https://nan?,,
2024-08-01,株式会社関西クリエイト,サブコン,求人なし,大阪府大阪市淀川区西宮原2-7-53マルタビル 5Ｆ,2008,代表取締役 金 将史,8 百万円,,,Error accessing nan: Invalid URL 'nan': No scheme supplied. Perhaps you meant https://nan?,,
2024-08-01,株式会社レジェンドホーム,住宅（ハウスメーカー）,求人なし,神奈川県横浜市旭区笹野台1-29-7櫻井ビル 2Ｆ,2008,代表取締役 瀬田 和之,10 百万円,,,Error accessing nan: Invalid URL 'nan': No scheme supplied. Perhaps you meant https://nan?,,
2024-08-01,株式会社山口設備,サブコン,求人なし,大阪府大東市野崎3-11-5,2008,代表取締役 山口 直樹,3 百万円,,,Error accessing nan: Invalid URL 'nan': No scheme supplied. Perhaps you meant https://nan?,,
