更新日,名称,業界(小分類),求人有無,所在地,設立,代表者,資本金,平均年齢,従業員数,企業URL,事業内容,上場市場名
2024-08-01,東部配達株式会社,道路貨物運送業（宅配便・トラック運送など）,求人なし,大阪府守口市梶町4-46-7,1981,代表取締役 上北 昭豊,10 百万円,,,,,
2024-08-01,株式会社山三,道路貨物運送業（宅配便・トラック運送など）,求人なし,愛知県あま市七宝町下之森八之坪37,1966,代表取締役 山崎 誠之,30 百万円,,,,,
2024-08-01,大バス太平タクシー株式会社,道路旅客運送業,無,大阪府守口市金田町4-7-10,1962,代表取締役 名藏謙吾,41 百万円,,,,,
2024-08-01,株式会社松川運輸倉庫,道路貨物運送業（宅配便・トラック運送など）,求人なし,大阪府守口市東郷通3-13-25,1960,代表取締役 松川 信門,20 百万円,,,,,
2024-08-01,大バス米運タクシー株式会社,道路貨物運送業（宅配便・トラック運送など）,求人なし,大阪府守口市金田町4-7-10,1962,代表取締役 西村 信義,21 百万円,,,,,
2024-08-01,大阪やよい運送株式会社,道路貨物運送業（宅配便・トラック運送など）,無,大阪府守口市八雲中町2-12-24,1963,代表取締役 田邉 一郎,10 百万円,,,,,
2024-08-01,浅見運輸倉庫株式会社,道路貨物運送業（宅配便・トラック運送など）,求人なし,東京都世田谷区駒沢5-15-11,1953,代表取締役 浅見 博之,50 百万円,,,,,
2024-08-01,ネクストブレードロジ株式会社,倉庫業・梱包業,求人なし,大阪府大東市御領3-5-60,1988,代表取締役 網本 雅之,9 百万円,,,,,
2024-08-01,ゴールド運送株式会社,道路貨物運送業（宅配便・トラック運送など）,無,大阪府守口市佐太中町6-18-1,1970,代表取締役 石橋 広行,10 百万円,,,,,
2024-08-01,三陸運送株式会社,道路貨物運送業（宅配便・トラック運送など）,無,東京都世田谷区玉堤1-6-2,1950,代表取締役 中村 正雄,11 百万円,,,,■石油製品の運送（ガソリン・灯油・軽油・LPガス・アスファルト）■整備工場 2023年12月doda掲載求人より引用,
2024-08-01,かねまた運輸倉庫株式会社,道路貨物運送業（宅配便・トラック運送など）,求人なし,大阪府枚方市中宮大池4-1-1,1959,代表取締役 堀田 浩,24 百万円,,,,,
2024-08-01,高尾運輸興業株式会社,道路貨物運送業（宅配便・トラック運送など）,求人なし,大阪府枚方市池之宮4-7-21,1960,代表取締役 中尾 一也,14 百万円,,,,,
2024-08-01,枚方梱包株式会社,倉庫業・梱包業,求人なし,大阪府枚方市上野3-1-1,1962,代表取締役 小松 範行,46 百万円,,,,,
2024-08-01,保証運輸株式会社,道路貨物運送業（宅配便・トラック運送など）,求人なし,大阪府枚方市中宮大池4-4-1,1968,代表取締役 西田 進,13 百万円,,,,,
2024-08-01,かねいち運送有限会社,道路貨物運送業（宅配便・トラック運送など）,求人なし,東京都世田谷区桜上水1-20-8,1977,代表取締役 宮下 満枝,10 百万円,,,,,
2024-08-01,株式会社松栄運輸,道路貨物運送業（宅配便・トラック運送など）,無,東京都江東区豊洲6-6-2東京都中央卸売市場豊洲市場7街区水産卸売場棟 3Ｆ 324,1974,代表取締役 永倉 隆幸,10 百万円,,,,,
2024-08-01,大阪硝運株式会社,道路貨物運送業（宅配便・トラック運送など）,無,大阪府枚方市春日西町1-50-30,1988,代表取締役 納身 英利,15 百万円,,,,情報が古い可能性があります。最新の情報を確認する場合はHP等をご覧ください。 大阪陸運局許可、阪神圏、一般貸切運送業 2023年6月doda掲載求人より引用,
2024-08-01,コフジ物流株式会社,道路貨物運送業（宅配便・トラック運送など）,求人なし,大阪府枚方市春日西町3-45-1,1967,代表取締役 堂坂 佳延,15 百万円,,,,,
2024-08-01,大信物流輸送株式会社,道路貨物運送業（宅配便・トラック運送など）,求人なし,大阪府枚方市中宮大池4-5-16,1981,代表取締役 長谷川 政明,10 百万円,,,,,
2024-08-01,平田運輸株式会社,道路貨物運送業（宅配便・トラック運送など）,求人なし,大阪府枚方市南中振3-5-16,1982,代表取締役 平田 豊治,25 百万円,,,,,
2024-08-01,浅田運輸有限会社,道路貨物運送業（宅配便・トラック運送など）,求人なし,大阪府枚方市堂山2-8-1ハチビル 301,1992,代表取締役 右井 良二,18 百万円,,,,,
2024-08-01,アクシアロジ株式会社,道路貨物運送業（宅配便・トラック運送など）,無,大阪府枚方市長尾家具町2-1-1,1950,代表取締役 安納 一樹,66 百万円,,,,■一般貨物自動車運送事業■運送取扱事業■貨物軽自動車運送事業■倉庫業■倉庫業に係る荷役作業の請負業務 2023年8月doda掲載求人より引用,
2024-08-01,日の丸商運株式会社,道路貨物運送業（宅配便・トラック運送など）,無,東京都世田谷区桜新町2-11-12日の丸商運ビル 3Ｆ,1964,代表取締役 吉田 滋,10 百万円,,,,,
2024-08-01,株式会社コダマ,道路貨物運送業（宅配便・トラック運送など）,求人なし,大阪府堺市南区赤坂台5-17-12,1995,代表取締役 兒玉 誠,20 百万円,,,,,
2024-08-01,株式会社堀企画,道路貨物運送業（宅配便・トラック運送など）,求人なし,東京都世田谷区千歳台2-32-13,1971,代表取締役 森 妙子,10 百万円,,,,,
2024-08-01,株式会社マエダオート,道路貨物運送業（宅配便・トラック運送など）,求人なし,東京都世田谷区喜多見4-1-1,1968,代表取締役 前田 初江,10 百万円,,,,,
2024-08-01,株式会社ランナーズ,道路旅客運送業,求人なし,東京都世田谷区砧3-5-12,1985,代表取締役 一瀬 博亮,10 百万円,,,,,
2024-08-01,ホンダ運送株式会社,道路貨物運送業（宅配便・トラック運送など）,無,大阪府茨木市上穂東町3-19,1956,代表取締役 丸矢 哲生,196 百万円,,,,【事業内容】1.貨物自動車運送事業2.通運事業3.倉庫業4.貨物運送取扱事業5.軽車輛運送事業6.陸送業7.損害保険代理店業8.自動車整備事業 2023年12月doda掲載求人より引用,
2024-08-01,株式会社エー・エム・エス,道路貨物運送業（宅配便・トラック運送など）,求人なし,東京都世田谷区三宿2-25-4,1978,代表取締役 安藤 哲,85 百万円,,,,,
2024-08-01,株式会社小山倉庫,倉庫業・梱包業,求人なし,大阪府茨木市清水1-3-36,1964,代表取締役 小山 和也,30 百万円,,,,,
2024-08-01,総合物流サービス株式会社,道路貨物運送業（宅配便・トラック運送など）,求人なし,大阪府茨木市畑田町1-57,1983,代表取締役 山本 和高,10 百万円,,,,,
2024-08-01,木本興産株式会社,道路貨物運送業（宅配便・トラック運送など）,求人なし,大阪府茨木市下穂積2-4-11,1967,代表取締役 木本 喜美子,10 百万円,,,,,
2024-08-01,株式会社北部市場運送,道路貨物運送業（宅配便・トラック運送など）,無,大阪府茨木市島3-12-25,1979,代表取締役 黒田 敬弘,30 百万円,,,,,
2024-08-01,コズモスゼネラルサービス株式会社,倉庫業・梱包業,求人なし,埼玉県新座市本多1-7-29,1986,代表取締役 弓能家 勤,10 百万円,,,,,
2024-08-01,株式会社Ｔ．Ｍ．Ｇ,道路貨物運送業（宅配便・トラック運送など）,無,大阪府茨木市目垣1-23-15ＴＭＧビル,1988,代表取締役 椿本 孝幸,100 百万円,,,,,
2024-08-01,株式会社小山紙器,倉庫業・梱包業,求人なし,大阪府茨木市清水1-3-35,1974,代表取締役 小山 和也,30 百万円,,,,,
2024-08-01,大和運送株式会社,道路貨物運送業（宅配便・トラック運送など）,求人なし,大阪府茨木市五日市1-6-3,1960,代表取締役 栗尾 尚孝,22 百万円,,,,,
2024-08-01,大阪中央運輸株式会社,道路貨物運送業（宅配便・トラック運送など）,求人なし,大阪府茨木市東安威2-12-7,1979,代表取締役 安部 陽子,10 百万円,,,,,
2024-08-01,清水運輸倉庫株式会社,倉庫業・梱包業,求人なし,大阪府茨木市豊川3-7-30,1982,代表取締役 清水 博史,12 百万円,,,,,
2024-08-01,株式会社ハンワ,道路貨物運送業（宅配便・トラック運送など）,無,大阪府茨木市南目垣2-5-38,1982,代表取締役 元木 弘教,15 百万円,,,,,
2024-08-01,株式会社タイコウ物流,道路貨物運送業（宅配便・トラック運送など）,求人なし,大阪府茨木市沢良宜西1-7-6ロイヤルミサワ 101,1994,代表取締役 中山 博治,10 百万円,,,,,
2024-08-01,株式会社青山本店関西,道路貨物運送業（宅配便・トラック運送など）,求人なし,大阪府茨木市南目垣3-5-1,1987,代表取締役 山下 英博,14 百万円,,,,,
2024-08-01,株式会社三村運送,倉庫業・梱包業,無,東京都渋谷区千駄ヶ谷5-1-7,1965,代表取締役 三村 偉一郎,40 百万円,,,,,
2024-08-01,阪菱企業株式会社,道路貨物運送業（宅配便・トラック運送など）,求人なし,大阪府茨木市藤の里2-15-8,1957,代表取締役 佐藤 慶,10 百万円,,,,,
2024-08-01,川田配送株式会社,道路貨物運送業（宅配便・トラック運送など）,無,大阪府茨木市島4-23-7,1991,代表取締役 川田 悦史,10 百万円,,,,,
2024-08-01,羽田空港グランドサービス株式会社,航空運輸業,無,東京都大田区平和島6-1-1ＴＲＣアネックス 4Ｆ,1970,代表取締役 丸尾 紘治郎,10 百万円,,,,,
2024-08-01,河本運送有限会社,道路貨物運送業（宅配便・トラック運送など）,求人なし,大阪府八尾市南木の本5-5,1955,代表取締役 吉村 鶴樹,4 百万円,,,,,
2024-08-01,共和運輸株式会社,道路貨物運送業（宅配便・トラック運送など）,求人なし,東京都中央区日本橋人形町1-3-6共同ビル,1961,代表取締役 萩原 篤博,20 百万円,,,,,
2024-08-01,新東宝自動車株式会社,道路貨物運送業（宅配便・トラック運送など）,求人なし,大阪府東大阪市小阪2-6-14,1957,代表取締役 岸下 義幸,15 百万円,,,,,
2024-08-01,河内商事株式会社,倉庫業・梱包業,求人なし,大阪府八尾市東老原1-12,1964,代表取締役 小笠 原勝,10 百万円,,,,,
2024-08-01,大阪航空株式会社,航空運輸業,求人なし,大阪府八尾市空港2-12八尾空港,1968,代表取締役 中山 博樹,48 百万円,,,,,
2024-08-01,朝日航空株式会社,航空運輸業,無,大阪府八尾市空港2-12,1967,代表取締役 庄島 広孝,135 百万円,,,,航空事業■チャーター飛行 旅客・貨物輸送/航空写真撮影 測量・計測飛行/調査・視察飛行■セスナ遊覧飛行パイロット養成事業■プロパイロット養成課程■航空会社・官公庁等の委託訓練航空機整備事業■航空機点検整備 航空機耐空検査整備 航空機局無線検査■航空機格納保管■航空機及び部品販売その他■鹿部飛行場運営管理■日本アマチュア飛行クラブ事務局■自家用機運航支援 2024年2月doda掲載求人より引用,
2024-08-01,福塚運送株式会社,道路貨物運送業（宅配便・トラック運送など）,無,大阪府八尾市志紀町南1-117,1962,代表取締役 福塚 正徳,90 百万円,,,,,
2024-08-01,株式会社ニッソー,倉庫業・梱包業,求人なし,大阪府八尾市太田7-43,1971,代表取締役 西村 勉,20 百万円,,,,,
2024-08-01,株式会社大通,道路貨物運送業（宅配便・トラック運送など）,求人なし,大阪府柏原市円明町1000-16,1956,代表取締役 松本 望,30 百万円,,,,,
2024-08-01,株式会社ドライバーズサービスセンター,道路旅客運送業,無,東京都渋谷区代々木4-22-11,1977,代表取締役 宇野 弘之,15 百万円,,,,,
2024-08-01,上商物流株式会社,道路貨物運送業（宅配便・トラック運送など）,無,大阪府八尾市東山本新町9-3-27,1996,代表取締役 上田 哲夫,11 百万円,,,,,
2024-08-01,田中陸運株式会社,道路貨物運送業（宅配便・トラック運送など）,求人なし,東京都渋谷区代々木4-60-10,1970,代表取締役 田中 大策,35 百万円,,,,,
2024-08-01,株式会社日東発送センター,道路貨物運送業（宅配便・トラック運送など）,無,大阪府八尾市南太子堂4-4-27,1968,代表取締役 中村 精孝,10 百万円,,,,,
2024-08-01,川崎商事株式会社,道路貨物運送業（宅配便・トラック運送など）,求人なし,大阪府八尾市恩智中町4-229,1987,代表取締役 川崎 哲也,10 百万円,,,,,
2024-08-01,日本商運株式会社,道路貨物運送業（宅配便・トラック運送など）,求人なし,大阪府八尾市青山町1-6-5,1968,代表取締役 田中 康正,23 百万円,,,,,
2024-08-01,株式会社関西エアポートシャトル,道路旅客運送業,求人なし,大阪府泉佐野市上之郷2043-1,2007,代表取締役 松原 健一郎,3 百万円,,,,,
2024-08-01,高山運輸株式会社,道路貨物運送業（宅配便・トラック運送など）,求人なし,大阪府泉佐野市住吉町11-8,1956,代表取締役 高山 久男,10 百万円,,,,,
2024-08-01,株式会社大野商会,道路貨物運送業（宅配便・トラック運送など）,求人なし,大阪府泉佐野市鶴原1592,1996,代表取締役 大野 寿一,10 百万円,,,,,
2024-08-01,泉陽タクシー株式会社,道路貨物運送業（宅配便・トラック運送など）,求人なし,大阪府泉佐野市日根野3579-2,1954,代表取締役 角谷 裕一郎,20 百万円,,,,,
2024-08-01,ＬＩＭＳＴＡＲＴ株式会社,道路貨物運送業（宅配便・トラック運送など）,求人なし,大阪府泉佐野市長滝3970-1,1987,代表取締役 髙木 俊之,15 百万円,,,,,
2024-08-01,株式会社関空エンタープライズ,航空運輸業,求人なし,大阪府和泉市坪井町30-5,1992,代表取締役社長 谷 宗光,30 百万円,,,,,
2024-08-01,東信梱包株式会社,道路貨物運送業（宅配便・トラック運送など）,求人なし,大阪府富田林市若松町東2-2-10,1970,代表取締役 三嶋 昌紀,30 百万円,,,,,
2024-08-01,株式会社伸明プロパティ,運輸・物流業界,求人なし,東京都足立区栗原3-21-11,1999,代表取締役 山崎 伸,10 百万円,,,,,
2024-08-01,金剛自動車株式会社,道路貨物運送業（宅配便・トラック運送など）,求人なし,大阪府富田林市本町18-17,1937,代表取締役 白江 暢孝,45 百万円,,,,,
2024-08-01,日本通商株式会社,道路貨物運送業（宅配便・トラック運送など）,求人なし,三重県松阪市大口町1648-15,1976,代表取締役 鈴木 孝佳,48 百万円,,,,,
2024-08-01,有限会社植田商運,道路貨物運送業（宅配便・トラック運送など）,無,大阪府富田林市大字喜志2586,1990,代表取締役 植田 健一,14 百万円,,,,,
2024-08-01,株式会社オルター,道路貨物運送業（宅配便・トラック運送など）,求人なし,大阪府南河内郡千早赤阪村大字森屋962-1,1997,代表取締役 西川 榮郎,10 百万円,,,,,
2024-08-01,株式会社山田物流サービス,道路貨物運送業（宅配便・トラック運送など）,求人なし,大阪府富田林市中野町2-548-3,1995,代表取締役 山田 祐司,13 百万円,,,,,
2024-08-01,ニシリク株式会社,道路貨物運送業（宅配便・トラック運送など）,求人なし,大阪府寝屋川市池田新町19-30ニシリク（株）本社事務所棟,1952,代表取締役 千原裕輝,100 百万円,,,,,
2024-08-01,株式会社マルニコーポレーション,道路貨物運送業（宅配便・トラック運送など）,無,大阪府寝屋川市豊里町35-5,1949,代表取締役 中西 大輔,30 百万円,,,,情報が古い可能性があります。最新の情報を確認する場合はHP等をご覧ください。 機械器具設置工事業 2023年3月doda掲載求人より引用,
2024-08-01,小田運輸株式会社,道路貨物運送業（宅配便・トラック運送など）,求人なし,大阪府東大阪市東鴻池町4-5-23,1953,代表取締役 岸上 剛志,40 百万円,,,,,
2024-08-01,株式会社和エンタープライズ,道路貨物運送業（宅配便・トラック運送など）,無,大阪府寝屋川市打上高塚町1-3,1996,代表取締役社長 樋口 慎一,10 百万円,,,,,
2024-08-01,朝日町運輸倉庫株式会社,道路貨物運送業（宅配便・トラック運送など）,求人なし,大阪府寝屋川市楠根南町1-2,1961,代表取締役 足立 尚三,40 百万円,,,,,
2024-08-01,共和物産株式会社,倉庫業・梱包業,求人なし,東京都中央区日本橋人形町1-3-6共同ビル,1948,代表取締役 萩原 篤博,20 百万円,,,,,
2024-08-01,ベルテック株式会社,道路貨物運送業（宅配便・トラック運送など）,求人なし,東京都渋谷区神宮前1-10-1メゾンドシオン 2Ｆ,1966,代表取締役 坪井 一髙,350 百万円,,,,,
2024-08-01,株式会社ニッパック,倉庫業・梱包業,求人なし,神奈川県小田原市蓮正寺783,1961,代表取締役 森 亮介,80 百万円,,,,,
2024-08-01,代々木自動車株式会社,道路旅客運送業,無,東京都渋谷区初台2-6-9,1950,代表取締役 西澤 明洋,59 百万円,,,,一般乗用旅客自動車運送業 2024年5月doda掲載求人より引用,
2024-08-01,三幸運送株式会社,道路貨物運送業（宅配便・トラック運送など）,求人なし,大阪府寝屋川市葛原2-14-9,1987,代表取締役 松永 浩志,50 百万円,,,,,
2024-08-01,スリーボンド貿易株式会社,海運業,求人なし,東京都渋谷区恵比寿1-18-15スリーボンドビル 5Ｆ,1977,代表取締役 伊達 嘉光,40 百万円,,,,,
2024-08-01,中央物流有限会社,道路貨物運送業（宅配便・トラック運送など）,求人なし,東京都武蔵村山市学園1-125,1987,代表取締役 浜田 嘉昭,8 百万円,,,,,
2024-08-01,村岡運輸株式会社,道路貨物運送業（宅配便・トラック運送など）,求人なし,大阪府寝屋川市葛原1-31-8,1954,代表取締役 村岡 公一,18 百万円,,,,,
2024-08-01,株式会社大阪サンワ,道路貨物運送業（宅配便・トラック運送など）,求人なし,大阪府寝屋川市新家1-6-7,1976,代表取締役 安田 朗子,10 百万円,,,,,
2024-08-01,和晃運輸株式会社,道路貨物運送業（宅配便・トラック運送など）,求人なし,大阪府泉北郡忠岡町新浜1-5-23,1974,代表取締役 片山 浩志,10 百万円,,,,,
2024-08-01,株式会社小西水道工業所,運輸・物流業界,求人なし,大阪府寝屋川市木屋町8-8,1968,代表取締役 小西 隆夫,20 百万円,,,,,
2024-08-01,上高運輸株式会社,道路貨物運送業（宅配便・トラック運送など）,求人なし,東京都西多摩郡瑞穂町長岡3-7-12,1973,代表取締役 上田 政晴,10 百万円,,,,,
2024-08-01,株式会社シティデイリーサービス,道路貨物運送業（宅配便・トラック運送など）,求人なし,東京都西多摩郡瑞穂町長岡3-2-4,1980,代表取締役 横山 豊,20 百万円,,,,,
2024-08-01,旭交通株式会社,道路旅客運送業,求人なし,東京都八王子市千人町1-4-14,1962,代表取締役 加藤 善信,10 百万円,,,,,
2024-08-01,大利運輸株式会社,道路貨物運送業（宅配便・トラック運送など）,求人なし,大阪府泉大津市新港町1-39,1973,代表取締役 松井 宣貴,50 百万円,,,,,
2024-08-01,西尾運送株式会社,道路貨物運送業（宅配便・トラック運送など）,求人なし,大阪府泉北郡忠岡町新浜1-1-5,1968,代表取締役社長 辻宗 樹,10 百万円,,,,,
2024-08-01,株式会社野出運輸,道路貨物運送業（宅配便・トラック運送など）,求人なし,大阪府寝屋川市太秦桜が丘34-14,1991,代表取締役 園田 常徳,32 百万円,,,,,
2024-08-01,エフ・テクノ株式会社,道路貨物運送業（宅配便・トラック運送など）,求人なし,大阪府大阪市北区東天満1-7-17東天満ビル 301,1995,代表取締役 清 正輝,50 百万円,,,,,
2024-08-01,西郡観光バス株式会社,道路貨物運送業（宅配便・トラック運送など）,求人なし,東京都西多摩郡檜原村513,1991,代表取締役 山口 寿昭,36 百万円,,,,,
2024-08-01,キャピタル交通株式会社,道路貨物運送業（宅配便・トラック運送など）,求人なし,東京都八王子市左入町791-6,1958,代表取締役 磯 史洋,15 百万円,,,,,
2024-08-01,関空運輸株式会社,道路貨物運送業（宅配便・トラック運送など）,求人なし,大阪府泉佐野市中庄102-1,1991,代表取締役 内畑谷 剛,25 百万円,,,,,
2024-08-01,長福運送株式会社,道路貨物運送業（宅配便・トラック運送など）,求人なし,大阪府河内長野市寿町6-32,1971,代表取締役 大北 和繁,10 百万円,,,,,
2024-08-01,河内長野貨物運送株式会社,道路貨物運送業（宅配便・トラック運送など）,無,大阪府河内長野市原町1-19-3,1962,代表取締役 泰中 一樹,10 百万円,,,,,
2024-08-01,株式会社日本カーゴテック,道路貨物運送業（宅配便・トラック運送など）,求人なし,東京都八王子市楢原町1336,1979,代表取締役 倉田 保政,56 百万円,,,,,
2024-08-01,ニュープリンス観光バス株式会社,道路旅客運送業,無,東京都八王子市丹木町2-207-1,1987,代表取締役 鈴木 敦,46 百万円,,,,,
2024-08-01,丸長運送株式会社,道路貨物運送業（宅配便・トラック運送など）,求人なし,大阪府河内長野市上原西町6-20,1977,代表取締役 井戸 清明,10 百万円,,,,,
2024-08-01,京阪久宝株式会社,道路貨物運送業（宅配便・トラック運送など）,求人なし,大阪府堺市美原区小寺413-1,1955,代表取締役 中西 義彦,16 百万円,,,,,
2024-08-01,大信運輸株式会社,道路貨物運送業（宅配便・トラック運送など）,求人なし,東京都渋谷区西原3-32-5,1974,代表取締役 山田 肇,10 百万円,,,,,
2024-08-01,株式会社合通カシロジ,道路貨物運送業（宅配便・トラック運送など）,求人なし,大阪府松原市丹南3-2-33,1960,代表取締役 松本 旭,25 百万円,,,,,
2024-08-01,都流通商会株式会社,道路貨物運送業（宅配便・トラック運送など）,求人なし,東京都八王子市中山570,1986,代表取締役 田口 精一,25 百万円,,,,,
2024-08-01,宮本金属株式会社,道路貨物運送業（宅配便・トラック運送など）,求人なし,東京都八王子市万町98-8,1987,代表取締役 宮本 貴正,10 百万円,,,,,
2024-08-01,株式会社谷商店,道路貨物運送業（宅配便・トラック運送など）,無,大阪府松原市別所3-1-12,1955,代表取締役 谷 昌樹,31 百万円,,,,情報が古い可能性があります。最新の情報を確認する場合はHP等をご覧ください。 物流事業リサイクル事業産業廃棄物収集運搬事業 2023年2月doda掲載求人より引用,
2024-08-01,株式会社豊興,道路貨物運送業（宅配便・トラック運送など）,無,大阪府松原市大堀1-6-5,1960,代表取締役 堀川 顕広,99 百万円,,,,情報が古い可能性があります。最新の情報を確認する場合はHP等をご覧ください。 ■貨物自動車運送事業（特積・区域）貨物利用運送事業（自動車・内航海運）■倉庫業■労働者派遣事業■不動産賃貸業■環境に関するあらゆる商品その他の物販業務■前各号に附帯する一切の事業ISO認証を取得、Gマーク認定を受けるなど、社内の管理体制の適正化に真摯に取り組み、長年にわたり、お客様からの厚い信頼を受けています。 2022年3月doda掲載求人より引用,
2024-08-01,松原交通株式会社,道路貨物運送業（宅配便・トラック運送など）,求人なし,大阪府松原市東新町4-4-17,1952,代表取締役 飯尾 源明,10 百万円,,,,,
2024-08-01,大長運輸株式会社,道路貨物運送業（宅配便・トラック運送など）,求人なし,大阪府堺市美原区丹上315-1,1958,代表取締役 芳仲 秀訓,25 百万円,,,,,
2024-08-01,高鉄交通株式会社,道路貨物運送業（宅配便・トラック運送など）,求人なし,東京都八王子市東浅川町33-1,1956,代表取締役 青木 淑行,20 百万円,,,,,
2024-08-01,グリーン運送株式会社,道路貨物運送業（宅配便・トラック運送など）,求人なし,大阪府堺市美原区平尾280-1,1992,代表取締役 荻野 治,30 百万円,,,,,
2024-08-01,美原運送株式会社,道路貨物運送業（宅配便・トラック運送など）,無,大阪府堺市美原区北余部219-8,1975,代表取締役 杉浦 繁樹,10 百万円,,,,,
2024-08-01,大東陸運株式会社,道路貨物運送業（宅配便・トラック運送など）,求人なし,大阪府大東市太子田3-1-16,1979,代表取締役 大東 昌彦,15 百万円,,,,,
2024-08-01,株式会社森田組重量,倉庫業・梱包業,求人なし,大阪府大阪市鶴見区茨田大宮1-7-43,1979,代表取締役 福島 常行,30 百万円,,,,,
