更新日,名称,業界(小分類),求人有無,所在地,設立,代表者,資本金,平均年齢,従業員数,企業URL,事業内容,上場市場名
2024-08-01,家の光製本梱包株式会社,倉庫業・梱包業,求人なし,東京都板橋区東坂下2-5-24家の光ビル 6Ｆ,1963,代表取締役 小川 亮,88 百万円,,,,,
2024-08-01,株式会社フジデン運送,道路貨物運送業（宅配便・トラック運送など）,求人なし,東京都葛飾区西水元3-31-19,1978,代表取締役 松本 武徳,35 百万円,,,,,
2024-08-01,田島梱包資材株式会社,倉庫業・梱包業,求人なし,千葉県鎌ケ谷市くぬぎ山1-3-26,1962,代表取締役 田島 理彦,10 百万円,,,,,
2024-08-01,有限会社東晃運輸,道路貨物運送業（宅配便・トラック運送など）,求人なし,東京都江戸川区中葛西7-20-4202,1961,代表取締役 塚邉 実,3 百万円,,,,,
2024-08-01,株式会社協栄清水商店,倉庫業・梱包業,求人なし,東京都足立区佐野2-14-11,1982,代表取締役 清水 伸浩,30 百万円,,,,,
2024-08-01,アサヒ産業株式会社,道路貨物運送業（宅配便・トラック運送など）,求人なし,東京都荒川区東尾久1-23-10,1960,代表取締役 三橋 淳志,10 百万円,,,,,
2024-08-01,有限会社千代田流通サービス,道路貨物運送業（宅配便・トラック運送など）,求人なし,東京都練馬区大泉町2-54-5大泉ガレーヂ,1960,代表取締役 石塚 一成,13 百万円,,,,,
2024-08-01,株式会社田仲商店,道路貨物運送業（宅配便・トラック運送など）,求人なし,東京都足立区梅田4-29-5,1982,代表取締役 田仲 貞一郎,10 百万円,,,,,
2024-08-01,株式会社サム・トータルサービス,倉庫業・梱包業,求人なし,東京都板橋区志村1-17-9読売ＩＳビル 3Ｆ,1995,代表取締役 日下 義尊,10 百万円,,,,,
2024-08-01,サンテックサービス株式会社,道路貨物運送業（宅配便・トラック運送など）,求人なし,東京都板橋区成増1-31-10あいおいニッセイ同和損保成増ビル 3Ｆ,1993,代表取締役 佐藤 俊録,10 百万円,,,,,
2024-08-01,扶桑運輸株式会社,道路貨物運送業（宅配便・トラック運送など）,求人なし,東京都足立区東和1-1-25,1973,代表取締役 宮下 大,10 百万円,,,,,
2024-08-01,株式会社ヤマシン,道路貨物運送業（宅配便・トラック運送など）,求人なし,東京都足立区皿沼1-11-15,1987,代表取締役 佐藤 賢司,10 百万円,,,,,
2024-08-01,株式会社サンコーサービス,道路貨物運送業（宅配便・トラック運送など）,求人なし,東京都江戸川区鹿骨5-31-2,1961,代表取締役 三浦 学,10 百万円,,,,,
2024-08-01,ビックモア株式会社,運輸・物流業界,求人なし,東京都渋谷区渋谷2-1-1,1989,代表取締役 國分 利治,50 百万円,,,,,
2024-08-01,株式会社新日本観光自動車,道路貨物運送業（宅配便・トラック運送など）,求人なし,東京都足立区加賀1-12-5,1991,代表取締役 佐久間 洋行,18 百万円,,,,,
2024-08-01,株式会社リンクスタッフ,道路貨物運送業（宅配便・トラック運送など）,求人なし,東京都中野区江古田1-22-15ＩＣＡレジデンス 301,1996,代表取締役 中川 泰,91 百万円,,,,,
2024-08-01,トーハク物流サービス株式会社,道路貨物運送業（宅配便・トラック運送など）,求人なし,千葉県千葉市花見川区天戸町1364-3東洋精箔ビル 2Ｆ,1991,代表取締役 千々和 正峰,60 百万円,,,,,
2024-08-01,有限会社湯浅商会,道路貨物運送業（宅配便・トラック運送など）,求人なし,東京都足立区加平2-4-7綾建荘 103,1988,代表取締役 湯浅 一志,5 百万円,,,,,
2024-08-01,鈴直商事株式会社,道路貨物運送業（宅配便・トラック運送など）,求人なし,東京都江東区南砂6-2-12,1976,代表取締役 鈴木 健之,20 百万円,,,,,
2024-08-01,東京港運送株式会社,道路貨物運送業（宅配便・トラック運送など）,無,東京都練馬区北町5-18-2東京港ビルディング 2Ｆ,1954,代表取締役 田中 秀明,10 百万円,,,,,
2024-08-01,岡葉流通株式会社,倉庫業・梱包業,求人なし,東京都足立区竹の塚5-29-11,1970,代表取締役 岡山 良次,100 百万円,,,,,
2024-08-01,練馬交通株式会社,道路旅客運送業,1,東京都練馬区中村南2-2-7,1960,代表取締役 永山 和正,1800万円,,250,,一般乗用旅客自動車運送業,
2024-08-01,国産自動車交通株式会社,道路旅客運送業,無,東京都練馬区豊玉南3-24-18,1952,代表取締役 荻野 隆義,22 百万円,,,,情報が古い可能性があります。最新の情報を確認する場合はHP等をご覧ください。 ■一般乗用旅客自動車運送事業 ■自動車の修理に関する一切の事業 ■自動車の買収・販売に関する一切の事業 2022年1月doda掲載求人より引用,
2024-08-01,森永タクシー株式会社,道路旅客運送業,求人なし,東京都葛飾区東立石2-24-11,1961,代表取締役 増田 充孝,18 百万円,,,,,
2024-08-01,大日本自動車交通株式会社,道路貨物運送業（宅配便・トラック運送など）,求人なし,東京都荒川区荒川8-1-11,1960,代表取締役 海田 正則,22 百万円,,,,,
2024-08-01,共栄交通株式会社,道路旅客運送業,求人なし,東京都板橋区新河岸1-7-10,1952,代表取締役 本多 隆,24 百万円,,,,,
2024-08-01,榮自動車株式会社,道路貨物運送業（宅配便・トラック運送など）,求人なし,東京都足立区梅田3-3-3,1950,代表取締役 安田 敏明,30 百万円,,,,,
2024-08-01,東洋総業株式会社,道路貨物運送業（宅配便・トラック運送など）,求人なし,東京都練馬区土支田4-4-3,1951,代表取締役 今岡 嘉光,10 百万円,,,,,
2024-08-01,アサヒ交通株式会社,道路貨物運送業（宅配便・トラック運送など）,無,東京都江戸川区松島1-28-2,1955,代表取締役 星野 浩一,10 百万円,,,,,
2024-08-01,有限会社高橋木箱製作所,道路貨物運送業（宅配便・トラック運送など）,求人なし,東京都葛飾区奥戸2-7-7,1958,代表取締役 嶋田 貫一,5 百万円,,,,,
2024-08-01,株式会社興産運輸,道路貨物運送業（宅配便・トラック運送など）,求人なし,東京都練馬区下石神井3-4-25,1963,代表取締役 本橋 美華,20 百万円,,,,,
2024-08-01,株式会社ジャパンクイックサービス,道路貨物運送業（宅配便・トラック運送など）,無,東京都荒川区南千住3-5-20,1988,代表取締役 和佐見 次男,10 百万円,,,,,
2024-08-01,松竹交通株式会社,道路貨物運送業（宅配便・トラック運送など）,無,東京都北区浮間4-32-26ＰＡＲＫＦＲＯＮＴ 2Ｆ,1951,代表取締役 尾林 宏,10 百万円,,,,,
2024-08-01,日本運輸荷造株式会社,道路貨物運送業（宅配便・トラック運送など）,求人なし,東京都板橋区成増3-2-15,1966,代表取締役 宮地 宙,30 百万円,,,,,
2024-08-01,小松川タクシー株式会社,道路貨物運送業（宅配便・トラック運送など）,求人なし,東京都江戸川区松島1-32-20,1961,代表取締役 中村 政弘,30 百万円,,,,,
2024-08-01,株式会社江戸川造船所,道路貨物運送業（宅配便・トラック運送など）,無,東京都江戸川区東葛西3-17-16,1950,代表取締役 浅見 洋史,10 百万円,,,,,
2024-08-01,信濃運輸株式会社,道路貨物運送業（宅配便・トラック運送など）,無,東京都江戸川区臨海町4-2-1,1965,代表取締役 林 俊彦,58 百万円,,,,情報が古い可能性があります。最新の情報を確認する場合はHP等をご覧ください。 ■一般貨物自動車運送事業■利用運送事業■営業倉庫事業■冷凍冷蔵倉庫事業■国内外梱包事業■倉庫・荷役・商品・管理・流通加工事業■産業廃棄物収集運搬事業■その他付帯する一切の業務-【加盟団体】-（社）東京都トラック協会（社）東京倉庫協会江戸川運輸施設協同組合浦安流通事業協同組合-【管理車両】-約450台（10t以上300台、3t以上50台、1.5t以上100台） 2023年5月doda掲載求人より引用,
2024-08-01,柴又運輸株式会社,道路貨物運送業（宅配便・トラック運送など）,求人なし,東京都江戸川区東小岩1-5-1,1963,代表取締役 橋場 広太郎,40 百万円,,,,,
2024-08-01,株式会社ワタコー,道路貨物運送業（宅配便・トラック運送など）,無,東京都葛飾区鎌倉3-38-16,1974,代表取締役 渡邊 直人,30 百万円,,,,,
2024-08-01,昭和自動車株式会社,道路旅客運送業,無,東京都練馬区貫井2-16-21,1960,代表取締役 矢野 正隆,15 百万円,,,,情報が古い可能性があります。最新の情報を確認する場合はHP等をご覧ください。 一般乗用旅客自動車運送事業（タクシー） 2022年1月doda掲載求人より引用,
2024-08-01,丸都運輸株式会社,道路貨物運送業（宅配便・トラック運送など）,求人なし,東京都足立区入谷9-6-8,1954,代表取締役 榊原 義之,10 百万円,,,,,
2024-08-01,米井運送株式会社,道路貨物運送業（宅配便・トラック運送など）,求人なし,東京都江戸川区東小岩5-33-17米井ビル,1966,代表取締役 米井 新吾,60 百万円,,,,,
2024-08-01,菊池運輸株式会社,道路貨物運送業（宅配便・トラック運送など）,無,東京都足立区舎人5-25-6,1965,代表取締役 菊池 正,50 百万円,,,,,
2024-08-01,株式会社東京運搬社,道路貨物運送業（宅配便・トラック運送など）,求人なし,東京都板橋区高島平9-37-6,1958,代表取締役 福原 和則,40 百万円,,,,,
2024-08-01,省東自動車株式会社,道路旅客運送業,求人なし,東京都板橋区前野町6-11-1,1952,代表取締役 佐藤 伸好,10 百万円,,,,,
2024-08-01,公徳運輸株式会社,道路貨物運送業（宅配便・トラック運送など）,無,東京都練馬区谷原4-7-20,1964,代表取締役 関口 浩,10 百万円,,,,,
2024-08-01,株式会社江北重機運輸,道路貨物運送業（宅配便・トラック運送など）,求人なし,東京都足立区鹿浜1-17-4,1970,代表取締役 中澤美史緒,18 百万円,,,,,
2024-08-01,マルコーパッケージ株式会社,倉庫業・梱包業,求人なし,東京都足立区鹿浜4-6-15,1975,代表取締役 関口 恵,30 百万円,,,,,
2024-08-01,昭栄自動車株式会社,道路貨物運送業（宅配便・トラック運送など）,無,東京都足立区中央本町2-21-6,1950,代表取締役 片倉 太,42 百万円,,,,,
2024-08-01,東鉄運輸株式会社,道路貨物運送業（宅配便・トラック運送など）,求人なし,東京都江戸川区篠崎町3-22-11,1957,代表取締役 竹内 良孝,10 百万円,,,,,
2024-08-01,日盛運輸株式会社,道路貨物運送業（宅配便・トラック運送など）,求人なし,東京都江戸川区篠崎町3-1-11,1953,代表取締役 宇田川 幸一,13 百万円,,,,,
2024-08-01,株式会社ニチエイ・ベスト・プロデュース,道路貨物運送業（宅配便・トラック運送など）,求人なし,東京都台東区上野7-14-2三恵中田ビル 6Ｆ,1956,代表取締役 飯塚 貴則,40 百万円,,,,,
2024-08-01,株式会社岩瀬運輸機工,道路貨物運送業（宅配便・トラック運送など）,求人なし,東京都江戸川区臨海町4-2-1,1970,代表取締役 武藤 浩之,73 百万円,,,,,
2024-08-01,愛國運輸倉庫株式会社,道路貨物運送業（宅配便・トラック運送など）,無,東京都江戸川区鹿骨1-5-5愛国ビル 4Ｆ,1968,代表取締役 大塲 秀隆,30 百万円,,,,,
2024-08-01,日日交通ホールディングス株式会社,道路貨物運送業（宅配便・トラック運送など）,求人なし,東京都足立区保木間1-32-15,1953,代表取締役 市川 信,20 百万円,,,,,
2024-08-01,豊田運送株式会社,道路貨物運送業（宅配便・トラック運送など）,求人なし,東京都板橋区小豆沢1-9-4,1957,代表取締役 豊田 敦子,10 百万円,,,,,
2024-08-01,日月東交通株式会社,道路貨物運送業（宅配便・トラック運送など）,無,東京都江戸川区東小岩3-21-3,1951,代表取締役 星野 浩一,26 百万円,,,,情報が古い可能性があります。最新の情報を確認する場合はHP等をご覧ください。 タクシー旅客運送：グリーン認証経営、優良申告法人、働きやすい職場認証制度で一つ星取得！ 2023年8月doda掲載求人より引用,
2024-08-01,三成運輸株式会社,倉庫業・梱包業,求人なし,東京都江戸川区西小岩5-18-1,1969,代表取締役 遠藤 朋之,10 百万円,,,,,
2024-08-01,株式会社スワロー輸送,道路貨物運送業（宅配便・トラック運送など）,求人なし,東京都江戸川区中葛西3-29-1スワロー第2ビル 4Ｆ,1961,代表取締役 藤川 守,90 百万円,,,,,
2024-08-01,丸孝運輸倉庫株式会社,倉庫業・梱包業,求人なし,東京都足立区鹿浜4-6-15,1968,代表取締役 関口 恵,50 百万円,,,,,
2024-08-01,株式会社大協運輸,運輸・物流業界,求人なし,東京都板橋区高島平7-16-15ダイトウビル 5Ｆ,1963,代表取締役 石井 幹大,98 百万円,,,,,
2024-08-01,東京荒井清運送株式会社,道路貨物運送業（宅配便・トラック運送など）,求人なし,東京都足立区大谷田5-10-9,1971,代表取締役 荒井 孝志,30 百万円,,,,,
2024-08-01,ラッキータクシー株式会社,道路旅客運送業,無,東京都板橋区上板橋2-11-12,1962,代表取締役 山野 直也,50 百万円,,,,■一般乗用旅客自動車運送事業 2024年2月doda掲載求人より引用,
2024-08-01,昭和倉庫株式会社,倉庫業・梱包業,求人なし,東京都足立区入谷9-22-17,1978,代表取締役 矢部 達也,50 百万円,,,,,
2024-08-01,株式会社リョウエイ物流,道路貨物運送業（宅配便・トラック運送など）,無,東京都板橋区徳丸6-7-8,1966,代表取締役 砂永 篤志,30 百万円,,,,,
2024-08-01,株式会社東京急送,道路貨物運送業（宅配便・トラック運送など）,求人なし,東京都江戸川区臨海町4-2-1,1968,代表取締役 間野 勉,20 百万円,,,,,
2024-08-01,株式会社関東ロジスティクス,道路貨物運送業（宅配便・トラック運送など）,求人なし,東京都足立区鹿浜4-9-8,1975,代表取締役 根本 まゆみ,10 百万円,,,,,
2024-08-01,弘済運輸株式会社,道路貨物運送業（宅配便・トラック運送など）,求人なし,東京都足立区東伊興2-1-22矢崎共同ビル グリーンマンションＮｏ．2－201,1974,代表取締役 矢崎 敏央,10 百万円,,,,,
2024-08-01,株式会社ウエルストンエキスプレス,道路貨物運送業（宅配便・トラック運送など）,無,東京都足立区入谷2-25-3,1975,代表取締役 宮本 正,44 百万円,,,,,
2024-08-01,ファースト運輸株式会社,道路貨物運送業（宅配便・トラック運送など）,無,東京都江戸川区北葛西5-17-4ファーストビル 2Ｆ,1953,代表取締役 荒木 和明,55 百万円,,,,,
2024-08-01,五島運輸倉庫株式会社,道路貨物運送業（宅配便・トラック運送など）,求人なし,東京都足立区入谷7-15-6,1975,代表取締役 高橋 文江,10 百万円,,,,,
2024-08-01,豊島運送株式会社,道路貨物運送業（宅配便・トラック運送など）,求人なし,東京都板橋区舟渡2-11-18,1944,代表取締役 吉田 正康,10 百万円,,,,,
2024-08-01,ジャストサービス株式会社,倉庫業・梱包業,求人なし,東京都練馬区東大泉1-19-35三慶ビル 203,1992,代表取締役 小宮 市治,68 百万円,,,,,
2024-08-01,三通国際商事株式会社,海運業,求人なし,東京都江戸川区一之江7-35-22イチトミビル 5Ｆ,1993,代表取締役 李 振生,66 百万円,,,,,
2024-08-01,日本搬送株式会社,道路貨物運送業（宅配便・トラック運送など）,無,東京都板橋区徳丸5-16-14,1965,代表取締役 砂永 篤志,20 百万円,,,,,
2024-08-01,株式会社首都圏ロジスティクス,道路貨物運送業（宅配便・トラック運送など）,無,埼玉県さいたま市岩槻区大字浮谷705-1,1984,代表取締役 駒形 友章,10 百万円,,,,,
2024-08-01,株式会社アドバンス芙蓉,倉庫業・梱包業,無,東京都板橋区坂下3-37-8博愛自動車工業内,1987,代表取締役 西岡 有子,14 百万円,,,,,
2024-08-01,鳳自動車株式会社,道路旅客運送業,求人なし,東京都葛飾区西水元5-13-14,1960,代表取締役 椿貴喜,13 百万円,,,,,
2024-08-01,エストアール株式会社,道路貨物運送業（宅配便・トラック運送など）,無,埼玉県八潮市大字伊勢野226-1,1957,代表取締役 白井 剛,10 百万円,,,,,
2024-08-01,京成タウンバス株式会社,道路旅客運送業,求人なし,東京都葛飾区奥戸2-6-10,1999,代表取締役 檜山 雅紀,60 百万円,,,,,
2024-08-01,株式会社デュオ,道路貨物運送業（宅配便・トラック運送など）,求人なし,東京都江戸川区南篠崎町1-7-4,1992,代表取締役 小松 進一郎,30 百万円,,,,,
2024-08-01,丸勤食販企業組合,道路貨物運送業（宅配便・トラック運送など）,求人なし,東京都足立区千住橋戸町50関連事業者食堂棟 2Ｆ,1954,代表理事 渡井 良昌,12 百万円,,,,,
2024-08-01,河北運輸株式会社,道路貨物運送業（宅配便・トラック運送など）,求人なし,東京都練馬区東大泉1-28-7琴坂ビル,1971,代表取締役 琴坂 益代,20 百万円,,,,,
2024-08-01,株式会社アスカ運送,道路貨物運送業（宅配便・トラック運送など）,求人なし,東京都足立区鹿浜8-22-5,1994,代表取締役 鈴木 良一,25 百万円,,,,,
2024-08-01,株式会社大垣通商,道路貨物運送業（宅配便・トラック運送など）,求人なし,東京都足立区舎人5-13-13,1986,代表取締役 大垣 正雄,10 百万円,,,,,
2024-08-01,有限会社孝富運輸,道路貨物運送業（宅配便・トラック運送など）,求人なし,東京都足立区大谷田5-23-17,1974,代表取締役 関根 一隆,6 百万円,,,,,
2024-08-01,飛鳥交通第二株式会社,道路貨物運送業（宅配便・トラック運送など）,求人なし,東京都板橋区舟渡3-22-7,1950,代表取締役 川野 繁,9 百万円,,,,,
2024-08-01,株式会社板橋紙流通センター,倉庫業・梱包業,求人なし,東京都板橋区高島平6-4,1970,代表取締役 茂手木 明,540 百万円,,,,,
2024-08-01,三協運輸株式会社,道路貨物運送業（宅配便・トラック運送など）,求人なし,東京都足立区保木間1-1-3,1964,代表取締役 岸本 卓也,45 百万円,,,,,
2024-08-01,株式会社工藤出版サービス,倉庫業・梱包業,求人なし,東京都板橋区前野町4-40-18,1977,代表取締役 工藤 裕樹,10 百万円,,,,,
2024-08-01,カルガモ引越センター株式会社,道路貨物運送業（宅配便・トラック運送など）,無,東京都板橋区赤塚3-29-15美樹運輸ビル,1975,代表取締役 的場 栄一,40 百万円,,,,,
2024-08-01,株式会社大黄,運輸・物流業界,求人なし,東京都江戸川区中葛西4-16-18,1976,代表取締役 古山 晴人,10 百万円,,,,,
2024-08-01,上昇運輸株式会社,道路貨物運送業（宅配便・トラック運送など）,無,東京都足立区南花畑4-3-22,1981,代表取締役 上野 巨志,16 百万円,,,,運送業（一般貨物・貨物取扱・産業廃棄物収集運搬）倉庫業（保管・梱包・発送・流通加工・在庫管理等） 2024年2月doda掲載求人より引用,
2024-08-01,竹下産業株式会社,道路貨物運送業（宅配便・トラック運送など）,求人なし,東京都足立区関原1-14-2,1975,代表取締役 竹下 敏史,10 百万円,,,,,
2024-08-01,株式会社ネキストＥＸＰ,道路貨物運送業（宅配便・トラック運送など）,求人なし,東京都江戸川区北葛西5-19-1,1977,代表取締役 中原 修,10 百万円,,,,,
2024-08-01,有限会社松下運送,道路貨物運送業（宅配便・トラック運送など）,求人なし,東京都江戸川区一之江3-14-2,1970,取締役 松下 章一,10 百万円,,,,,
2024-08-01,株式会社藤倉運輸,道路貨物運送業（宅配便・トラック運送など）,求人なし,東京都足立区神明南2-1-2,1969,代表取締役 藤倉 泰徳,10 百万円,,,,,
2024-08-01,株式会社森田商運,道路貨物運送業（宅配便・トラック運送など）,求人なし,東京都足立区綾瀬2-22-15204,1974,代表取締役 山田 正信,10 百万円,,,,,
2024-08-01,株式会社つばさ流通,道路貨物運送業（宅配便・トラック運送など）,求人なし,東京都足立区大谷田5-30-8,1985,代表取締役 齋藤 要二,23 百万円,,,,,
2024-08-01,ティエム・トランスポート株式会社,道路貨物運送業（宅配便・トラック運送など）,求人なし,東京都足立区本木西町14-4,1964,代表取締役 守山 輝夫,10 百万円,,,,,
2024-08-01,株式会社東京ベイサービス,道路貨物運送業（宅配便・トラック運送など）,無,東京都足立区北加平町15-6,1986,代表取締役 田中 豊明,50 百万円,,,,,
2024-08-01,株式会社リネット,道路貨物運送業（宅配便・トラック運送など）,無,東京都江戸川区西一之江3-4-12,1995,代表取締役 宮﨑 俊典,20 百万円,,,,情報が古い可能性があります。最新の情報を確認する場合はHP等をご覧ください。 ・電気通信事業の設計・建設・施工管理・設備保守（メタル・光）・電気工事・防犯事業・一般貨物・運送事業 2021年10月doda掲載求人より引用,
2024-08-01,株式会社タイセイ物流,道路貨物運送業（宅配便・トラック運送など）,無,東京都足立区大谷田3-12-35湯元ビル 1Ｆ,1998,代表取締役 高久 栄男,20 百万円,,,,情報が古い可能性があります。最新の情報を確認する場合はHP等をご覧ください。 ■貨物自動車運送事業■貨物運送取扱業■倉庫業■生命保険の募集に関する業務■損保保険代理業■労働者派遣業■包装材料の製造加工・販売■経営コンサルタント業■ソフト設計開発■食料品の販売 2023年7月doda掲載求人より引用,
2024-08-01,協同運輸株式会社,道路貨物運送業（宅配便・トラック運送など）,求人なし,東京都足立区西伊興1-2-15,1973,代表取締役 鳥ノ海 学,26 百万円,,,,,
2024-08-01,有限会社夏井輸送,道路貨物運送業（宅配便・トラック運送など）,求人なし,東京都江戸川区南葛西4-23-20,1987,取締役 夏井 正雄,10 百万円,,,,,
2024-08-01,株式会社長島倉庫,倉庫業・梱包業,求人なし,東京都江戸川区西瑞江3-14-12,1954,代表取締役 長島 秀雄,20 百万円,,,,,
2024-08-01,有限会社勝己運輸,道路貨物運送業（宅配便・トラック運送など）,求人なし,東京都江戸川区新堀1-11-6,1978,代表取締役 伊藤 勝洋,7 百万円,,,,,
2024-08-01,株式会社明和運輸,道路貨物運送業（宅配便・トラック運送など）,求人なし,東京都足立区宮城1-6-12,1953,代表取締役 植田 毅,10 百万円,,,,,
2024-08-01,晴栄運送有限会社,道路貨物運送業（宅配便・トラック運送など）,求人なし,東京都足立区梅田4-22-11,1963,取締役 谷口 良,5 百万円,,,,,
2024-08-01,株式会社三洋エクスプレス,道路貨物運送業（宅配便・トラック運送など）,求人なし,東京都江戸川区東葛西6-47-16,1985,代表取締役 富沢 進,10 百万円,,,,,
2024-08-01,株式会社ジャパン流通プランニング,海運業,求人なし,東京都足立区鹿浜4-11-8,2001,代表取締役 金澤 伸一郎,10 百万円,,,,,
2024-08-01,株式会社エフサービス,道路貨物運送業（宅配便・トラック運送など）,求人なし,東京都足立区六町1-13-30,1990,代表取締役 福田 茂途,15 百万円,,,,,
2024-08-01,ロジスティード北日本株式会社,道路貨物運送業（宅配便・トラック運送など）,求人なし,北海道札幌市東区中沼町5-3,2001,代表取締役 藤谷 寛幹,100 百万円,,,,,
2024-08-01,ＵＤトラックス北海道株式会社,道路貨物運送業（宅配便・トラック運送など）,求人なし,北海道札幌市厚別区厚別中央二条2-1-1,1972,代表取締役 古舘 利幸,100 百万円,,,,,
2024-08-01,旭川電気軌道株式会社,道路旅客運送業,求人なし,北海道旭川市三条通18-左3,1926,代表取締役 河西 利記,100 百万円,,,,,
2024-08-01,アイジーアールいわて銀河鉄道株式会社,鉄道業,求人なし,岩手県盛岡市青山2-2-8,2001,代表取締役 鈴木 敦,"1,849 百万円",,,,,
2024-08-01,株式会社流通団地オリエントオートサービス,道路旅客運送業,求人なし,山形県山形市流通センター4-2-1,1960,代表取締役 齊藤 明廣,50 百万円,,,,,
2024-08-01,ロジスティード東日本株式会社,道路貨物運送業（宅配便・トラック運送など）,求人なし,東京都台東区上野1-19-10上野広小路会館 10Ｆ,1962,代表取締役 神宮司 孝,100 百万円,,,,,
