更新日,名称,業界(小分類),求人有無,所在地,設立,代表者,資本金,平均年齢,従業員数,企業URL,事業内容,上場市場名
2024-08-01,丸友商事株式会社,その他,求人なし,長崎県長崎市中町5-23大久保中町第二ビル 4Ｆ,1955,代表取締役 黒目国希,16 百万円,,,,,
2024-08-01,前田株式会社,その他,無,長崎県長崎市田中町1264,1969,代表取締役 前田 隆宏,50 百万円,,,,,
2024-08-01,株式会社酒の吉田屋,その他,求人なし,長崎県長崎市籠町5-4,1987,代表取締役 吉田 淳介,10 百万円,,,,,
2024-08-01,大同産業株式会社,その他,求人なし,広島県広島市中区宝町10-11,1953,代表取締役 高橋 幸久,20 百万円,,,,,
2024-08-01,中國商事株式会社,その他,求人なし,広島県広島市中区本川町1-1-29,1946,代表取締役 三好 浩誌,10 百万円,,,,,
2024-08-01,中国溶材株式会社,その他,求人なし,広島県広島市中区南吉島1-2-3中酸ビル 2Ｆ,1965,代表取締役 石原 拓郎,10 百万円,,,,,
2024-08-01,株式会社エヌ・デー・ケー,その他,求人なし,埼玉県所沢市東所沢2-53-19,1990,代表取締役 野村 昌午,20 百万円,,,,,
2024-08-01,東邦工事株式会社,その他,求人なし,広島県広島市中区光南1-4-15,1952,代表取締役 造座 功,20 百万円,,,,,
2024-08-01,有限会社エルコ,その他,求人なし,静岡県浜松市中央区上西町5-6,1990,代表取締役 古山 竜也,7 百万円,,,,,
2024-08-01,株式会社えんおり,その他,無,静岡県浜松市中央区北島町445,1972,代表取締役 袴田 英徳,18 百万円,,,,旅館、ホテル向け業務用浴衣、ガウン等の染色加工、及び製品販売 2024年5月doda掲載求人より引用,
2024-08-01,中島電業株式会社,その他,求人なし,広島県広島市中区東平塚町8-21,1961,代表取締役 中島 武志,20 百万円,,,,,
2024-08-01,みずほ昭和株式会社,その他,求人なし,埼玉県富士見市東みずほ台2-2-8,1941,代表取締役 川野 繁,9 百万円,,,,,
2024-08-01,明光産業株式会社,その他,求人なし,埼玉県所沢市東所沢和田1-10-1,1985,代表取締役 福岡 健太郎,10 百万円,,,,,
2024-08-01,有限会社久米タイヤサービス,その他,求人なし,静岡県浜松市中央区丸塚町307-1,1980,代表取締役 久米 建次,3 百万円,,,,,
2024-08-01,栗田鉄工株式会社,その他,求人なし,静岡県浜松市中央区大瀬町2312,1972,,11 百万円,,,,,
2024-08-01,広島テント工業株式会社,その他,求人なし,広島県広島市中区東平塚町4-24ルネスｅスペース 1Ｆ,1955,代表取締役 井田 達成,10 百万円,,,,,
2024-08-01,広島トヨタ自動車株式会社,その他,求人なし,広島県広島市中区広瀬北町2-24,1942,代表取締役 藤井 一裕,81 百万円,,,,,
2024-08-01,加藤産業株式会社,建材 （商社）,求人なし,長崎県長崎市竹の久保町20-9加藤産業ビル 3Ｆ,1966,代表取締役 加藤 博文,30 百万円,,,,,
2024-08-01,株式会社ヒロセキ,その他,求人なし,広島県広島市中区西川口町14-14,1961,代表取締役 室﨑 雅宣,10 百万円,,,,,
2024-08-01,株式会社東洋商行,その他,求人なし,長崎県長崎市滑石2-3-9,1975,代表取締役 埴生 健一,20 百万円,,,,,
2024-08-01,株式会社広島ゴルフショップ,専門店・その他小売,求人なし,広島県広島市中区鉄砲町7-27,1974,代表取締役 高橋 心里,10 百万円,,,,,
2024-08-01,株式会社ヒラオカユニ,その他,求人なし,広島県広島市中区広瀬北町8-9,1971,代表取締役 吉田 範子,10 百万円,,,,,
2024-08-01,比布町農業協同組合,特殊法人・財団法人・その他団体・連合会,求人なし,北海道上川郡比布町西町3-5-14,1948,代表理事 大西 勝視,517 百万円,,,,,
2024-08-01,加藤木材工業株式会社,その他,求人なし,埼玉県飯能市大字笠縫418-8,1970,代表取締役 加藤 義明,34 百万円,,,,,
2024-08-01,太洋電設株式会社,その他,求人なし,北海道上川郡愛別町字本町255,1967,代表取締役 南 一也,10 百万円,,,,,
2024-08-01,株式会社三浦組,その他,求人なし,北海道上川郡愛別町字東町183,1967,代表取締役 三浦 友二,20 百万円,,,,,
2024-08-01,有限会社中部熔接工業所,その他,求人なし,静岡県浜松市中央区小池町1620-1,1954,代表取締役 河合 卓,3 百万円,,,,,
2024-08-01,株式会社エネルギア・ビジネスサービス,その他,求人なし,広島県広島市中区国泰寺町1-3-29ＭＲＲデルタビル,2001,代表取締役 中村 公俊,100 百万円,,,,,
2024-08-01,東海消毒株式会社,その他,求人なし,静岡県浜松市中央区恒武町680,1976,代表取締役 野沢 雅也,10 百万円,,,,,
2024-08-01,株式会社三信衣料,その他,求人なし,長崎県諫早市多良見町囲446,1974,代表取締役 江上 弘美,10 百万円,,,,,
2024-08-01,大久保鉄工株式会社,その他,求人なし,北海道旭川市東光三条5-1-5,1992,代表取締役 大久保 諒,10 百万円,,,,,
2024-08-01,株式会社ダンクユ,その他,求人なし,長崎県長崎市滑石5-1-15,1969,代表取締役 猶崎 勉,40 百万円,,,,,
2024-08-01,社会医療法人健友会,特殊法人・財団法人・その他団体・連合会,求人なし,長崎県長崎市下町2-11,1977,理事長 宮崎 幸哉,292 百万円,,,,,
2024-08-01,株式会社ニューメタル,その他,求人なし,静岡県浜松市中央区湖東町3222,1991,代表取締役 鈴木 檢維,80 百万円,,,,,
2024-08-01,九商産業株式会社,その他,求人なし,長崎県長崎市元船町16-12,1973,代表取締役 美根 晴幸,30 百万円,,,,,
2024-08-01,株式会社北海工芸,その他,求人なし,北海道上川郡東川町北町8-5-1,1977,代表取締役 今井 康人,38 百万円,,,,,
2024-08-01,浜松上下水道協同組合,特殊法人・財団法人・その他団体・連合会,求人なし,静岡県浜松市中央区茄子町3-2,1958,代表理事 三輪 容次郎,112 百万円,,,,,
2024-08-01,株式会社浜松白洋舎,その他,求人なし,静岡県浜松市中央区篠ケ瀬町1247-1,1971,代表取締役 杉原 徳彦,43 百万円,,,,,
2024-08-01,長崎でじま青果株式会社,その他,求人なし,長崎県長崎市田中町279-4長崎中央卸売市場,1972,代表取締役 加藤 誠治,50 百万円,,,,,
2024-08-01,医療法人博和会,特殊法人・財団法人・その他団体・連合会,求人なし,長崎県長崎市愛宕4-14-1,1954,理事長 宇宿 慶一,"1,610 百万円",,,,,
2024-08-01,株式会社谷口ファーム,水産・農林・鉱業,求人なし,北海道空知郡上富良野町東3線北24,1989,代表取締役 谷口 喜章,59 百万円,,,,,
2024-08-01,株式会社リーガル,その他,求人なし,長崎県長崎市金屋町1-17福徳ビル 4Ｆ,1956,代表取締役 福島 誠,15 百万円,,,,,
2024-08-01,株式会社外港工業,造船・重工業,求人なし,長崎県長崎市土井首町509-20,1975,代表取締役 太田 美由紀,10 百万円,,,,,
2024-08-01,株式会社マルエイ自動車,その他,求人なし,静岡県浜松市中央区飯田町677,1984,代表取締役 六部市 武,10 百万円,,,,,
2024-08-01,丸岡自動車株式会社,その他,求人なし,静岡県浜松市中央区上西町849-2,1954,代表取締役 岡 俊治,10 百万円,,,,,
2024-08-01,株式会社丸喜製作所,その他,求人なし,静岡県浜松市中央区田尻町87,1979,代表取締役 落合 秀之,10 百万円,,,,,
2024-08-01,有限会社明和,その他,求人なし,広島県広島市中区住吉町9-16住吉町Ｍビル 1Ｆ,1983,代表取締役 松本 奨,4 百万円,,,,,
2024-08-01,株式会社山彦,その他,求人なし,静岡県浜松市中央区豊町2258,1983,代表取締役 栗原 和彦,10 百万円,,,,,
2024-08-01,株式会社三葉ポンプ,その他,求人なし,広島県広島市中区舟入南3-13-3,1968,代表取締役 筒井 敏之,12 百万円,,,,,
2024-08-01,武藏鋼管株式会社,その他,求人なし,広島県広島市中区十日市町2-6-17,1951,代表取締役 長﨑 洋也,35 百万円,,,,,
2024-08-01,有限会社浜松油化,その他,求人なし,静岡県浜松市中央区高丘西2-13-19,1977,代表取締役 赤堀 智子,5 百万円,,,,,
2024-08-01,ユアサ電機株式会社,その他,求人なし,広島県広島市中区光南2-16-19,1969,代表取締役 田中 秀和,10 百万円,,,,,
2024-08-01,吉岡機工株式会社,その他,無,広島県広島市中区榎町6-7,1953,代表取締役 吉岡 伸浩,30 百万円,,,,,
2024-08-01,下川町森林組合,特殊法人・財団法人・その他団体・連合会,求人なし,北海道上川郡下川町南町133,1952,代表理事 阿部 勇夫,68 百万円,,,,,
2024-08-01,マスコー運輸有限会社,その他,求人なし,埼玉県加須市北小浜1264-1,1982,代表取締役 増田 俊行,10 百万円,,,,,
2024-08-01,遠州溶接工業株式会社,その他,求人なし,静岡県浜松市中央区鼡野町388-1,1989,代表取締役 山下 広樹,10 百万円,,,,,
2024-08-01,有限会社アスカ商会,その他,求人なし,静岡県浜松市中央区将監町47-14,1996,代表取締役 岡部 武士,3 百万円,,,,,
2024-08-01,株式会社ジック技建,その他,求人なし,埼玉県加須市南篠崎2-11-9,1992,代表取締役 米内 清和,3 百万円,,,,,
2024-08-01,株式会社旭管工社,その他,求人なし,長崎県長崎市諏訪町4-8,2004,代表取締役 中村 勝,20 百万円,,,,,
2024-08-01,株式会社ニューテック,その他,求人なし,静岡県浜松市中央区材木町38,1996,代表取締役 亀谷 謙司,10 百万円,,,,,
2024-08-01,株式会社日本彫刻工芸,専門広告代理店（雑誌・新聞・交通・屋外・折込など）,求人なし,広島県広島市中区宝町10-19大世渡ビル 2Ｆ,1973,代表取締役 大世渡 英和,10 百万円,,,,,
2024-08-01,株式会社和創工藝,その他,求人なし,静岡県浜松市中央区篠ケ瀬町1190,1996,代表取締役 袴田 和利,13 百万円,,,,,
2024-08-01,社会福祉法人加須福祉会,その他,求人なし,埼玉県加須市北小浜572,1960,理事長 村山 祐一,"1,779 百万円",,,,,
2024-08-01,有限会社長崎エレベーターサービス,その他,求人なし,長崎県長崎市畝刈町1613-167,1979,代表取締役 松下 満利,3 百万円,,,,,
2024-08-01,平木工業株式会社,その他,求人なし,長崎県長崎市三京町2842-1,1974,代表取締役 髙濵 有志,33 百万円,,,,,
2024-08-01,株式会社広成産業,その他,求人なし,広島県広島市中区三川町2-6くれしん広島ビル 10Ｆ,1968,代表取締役 市原 俊典,20 百万円,,,,,
2024-08-01,新生電工株式会社,その他,求人なし,広島県広島市中区小町5-33,1960,代表取締役 福島 宏明,20 百万円,,,,,
2024-08-01,株式会社ぜに屋本店,その他,無,長崎県長崎市大黒町3-15藤丸ビル,1953,代表取締役 藤本 伸,35 百万円,,,,情報が古い可能性があります。最新の情報を確認する場合はHP等をご覧ください。 宝石・貴金属・ブランドバッグ・時計等を担保に融資をする質業及び買取業務及び買取商品・仕入商品等の販売業務。 2023年7月doda掲載求人より引用,
2024-08-01,鶴洋海運商事有限会社,その他,求人なし,長崎県長崎市元船町11-5,1975,代表取締役 多良 達夫,10 百万円,,,,,
2024-08-01,株式会社中央環境,その他,求人なし,長崎県長崎市西海町2739-4,1981,代表取締役 上田 恭久,12 百万円,,,,,
2024-08-01,株式会社胡子,その他,求人なし,広島県広島市中区堀川町5-11,1963,代表取締役 二上 英信,50 百万円,,,,,
2024-08-01,川崎興産ホールディングス株式会社,その他,求人なし,長崎県長崎市出島町5-2川崎ビル,1959,代表取締役 川崎 孝,50 百万円,,,,,
2024-08-01,株式会社トヨタレンタリース広島,その他,求人なし,広島県広島市中区白島北町11-14,1971,代表取締役 卜部 典昌,12 百万円,,,,,
2024-08-01,大倉水産株式会社,その他,求人なし,埼玉県本庄市西富田421,1989,代表取締役 門倉 浩之,20 百万円,,,,,
2024-08-01,株式会社ロルフハルトゲジャパン,その他,求人なし,静岡県浜松市中央区本郷町170-2,1999,代表取締役 髙橋 惣太郎,48 百万円,,,,,
2024-08-01,株式会社和興,その他,求人なし,埼玉県本庄市前原1-6-1,1976,代表取締役 中田 貴裕,10 百万円,,,,,
2024-08-01,株式会社大興,その他,求人なし,広島県広島市中区宝町4-28大興ビル 4Ｆ,1984,代表取締役 濵本 英亮,82 百万円,,,,,
2024-08-01,株式会社アースクリエーション,その他,求人なし,広島県広島市中区舟入南5-3-7,1986,代表取締役 道家 剛,10 百万円,,,,,
2024-08-01,株式会社セイブコーポレーション,その他,求人なし,広島県広島市中区幟町14-11ウィング八丁堀ビル 8Ｆ,1976,代表取締役 仲西 毅,10 百万円,,,,,
2024-08-01,幌延町農業協同組合,特殊法人・財団法人・その他団体・連合会,求人なし,北海道天塩郡幌延町二条北1-14,1992,代表理事 無量谷 稔,510 百万円,,,,,
2024-08-01,社会福祉法人宥和,特殊法人・財団法人・その他団体・連合会,求人なし,埼玉県本庄市早稲田の杜5-14-8,1996,理事長 髙橋 誠一,"1,766 百万円",,,,,
2024-08-01,有限会社救急けん引代行センター,その他,求人なし,広島県広島市中区光南3-6-17,1977,代表取締役 森田 正史,3 百万円,,,,,
2024-08-01,株式会社シーエヌシー,その他,求人なし,静岡県浜松市中央区中島2-22-2,1999,代表取締役 久田 泰正,10 百万円,,,,,
2024-08-01,東宗谷農業協同組合,特殊法人・財団法人・その他団体・連合会,求人なし,北海道枝幸郡浜頓別町大通2-19,2000,代表理事 佐藤 裕司,668 百万円,,,,,
2024-08-01,フジケミ株式会社,その他,求人なし,東京都中央区日本橋人形町1-18-12日土地人形町ビル 6Ｆ,1984,代表取締役 鈴木 基文,60 百万円,,,,,
2024-08-01,株式会社エム・ジー商事,その他,求人なし,広島県広島市中区幟町13-4広島マツダビル別館 1Ｆ,1982,代表取締役 梯 文彦,10 百万円,,,,,
2024-08-01,株式会社サンテック,その他,求人なし,静岡県磐田市小中瀬734-3,1990,代表取締役 三浦 圭司,10 百万円,,,,,
2024-08-01,西武建設株式会社,その他,求人なし,埼玉県本庄市栄1-3-32,1973,代表取締役 榊田 利彦,10 百万円,,,,,
2024-08-01,株式会社丸正小林金物店,その他,求人なし,北海道枝幸郡枝幸町幸町120-4,1960,代表取締役 小林 正浩,10 百万円,,,,,
2024-08-01,一般財団法人広島県まちづくり土地区画整理協会,特殊法人・財団法人・その他団体・連合会,求人なし,広島県広島市中区大手町1-1-26大手町一番ビル 102,1961,代表理事 畠山 和憲,,,,,,
2024-08-01,株式会社リライアンス,その他,求人なし,広島県広島市中区胡町4-28,1986,代表取締役 重松 朋哉,22 百万円,,,,,
2024-08-01,有限会社ハウジング匠,その他,求人なし,広島県広島市中区国泰寺町1-3-11タカミビル 202,1977,取締役 山根 昇,3 百万円,,,,,
2024-08-01,枝幸漁業株式会社,特殊法人・財団法人・その他団体・連合会,求人なし,北海道枝幸郡枝幸町幸町241-1,1929,代表取締役社長 池田 祐司,45 百万円,,,,,
2024-08-01,株式会社サンエイト,その他,求人なし,静岡県浜松市中央区飯田町445-1,1996,代表取締役 伊藤 正樹,10 百万円,,,,,
2024-08-01,株式会社かなめ創建,内装・インテリア・リフォーム,求人なし,静岡県浜松市中央区渡瀬町804-5,2000,代表取締役 牧野 敏之,10 百万円,,,,,
2024-08-01,株式会社上野組,その他,求人なし,埼玉県本庄市東台2-6-39,1956,代表取締役 田村 文彦,20 百万円,,,,,
2024-08-01,有限会社興和,その他,求人なし,埼玉県本庄市児玉町入浅見843-1,1994,代表取締役社長 井上 雅則,10 百万円,,,,,
2024-08-01,有限会社小月工業,その他,求人なし,広島県広島市中区江波西1-6-49,1986,代表取締役 小月 進吉,5 百万円,,,,,
2024-08-01,長崎花き園芸農業協同組合,特殊法人・財団法人・その他団体・連合会,求人なし,長崎県長崎市田中町279-43,1953,代表理事 後田 博之,81 百万円,,,,,
2024-08-01,山本リサイクル株式会社,その他,求人なし,静岡県浜松市中央区神田町758,2001,代表取締役 山本 大,19 百万円,,,,,
2024-08-01,本庄商工会議所,特殊法人・財団法人・その他団体・連合会,求人なし,埼玉県本庄市朝日町3-1-35,1948,会頭 狩野 輝昭,,,,,,
2024-08-01,株式会社エイブルクリエイション,その他,求人なし,広島県広島市佐伯区倉重2-238-1,1990,代表取締役 中川 秀之,10 百万円,,,,,
2024-08-01,株式会社共栄ファスナー,その他,求人なし,長崎県長崎市田中町215-3,1984,代表取締役 南 恵介,10 百万円,,,,,
2024-08-01,安本工業株式会社,その他,求人なし,広島県広島市中区舟入南5-2-5,1990,代表取締役 安本 行福,10 百万円,,,,,
2024-08-01,利尻電業株式会社,その他,求人なし,北海道利尻郡利尻町沓形字富士見町56-4,1969,代表取締役 大沼 百合子,20 百万円,,,,,
2024-08-01,株式会社高橋組,その他,求人なし,北海道利尻郡利尻富士町鬼脇字野中80,1984,代表取締役 髙橋 祐彦,10 百万円,,,,,
2024-08-01,株式会社ビルテックス,その他,求人なし,長崎県長崎市滑石5-12-25,1988,代表取締役 石本 隆,13 百万円,,,,,
2024-08-01,総合ハイウエー協同組合,特殊法人・財団法人・その他団体・連合会,求人なし,広島県広島市中区宝町4-1宝町小川ビル 301,1989,代表理事 曽川 貢,6 百万円,,,,,
2024-08-01,協同組合ビジネス交流センター,その他,求人なし,広島県広島市中区三川町2-10,1990,代表理事 藤原 睦躬,7 百万円,,,,,
2024-08-01,有限会社ケイエーダブルユーエーアイ,その他,求人なし,静岡県浜松市中央区富屋町198-5,1994,代表取締役 河合 隆,3 百万円,,,,,
2024-08-01,美幌町農業協同組合,特殊法人・財団法人・その他団体・連合会,求人なし,北海道網走郡美幌町字青山南30-1,1948,代表理事 清野 政彦,"1,726 百万円",,,,,
2024-08-01,株式会社横山土建,その他,求人なし,北海道網走郡美幌町字稲美212,1961,代表取締役 横山 直樹,63 百万円,,,,,
2024-08-01,株式会社吉田工務店,その他,求人なし,埼玉県東松山市和泉町1-1,1960,代表取締役 吉田 眞一,20 百万円,,,,,
2024-08-01,保健事業株式会社,その他,求人なし,埼玉県東松山市大字大谷1891-1,1985,代表取締役 飯田 澈,10 百万円,,,,,
2024-08-01,株式会社アグリミライズ,その他,求人なし,静岡県浜松市中央区大原町465-2,1997,代表取締役 原野 吉勝,48 百万円,,,,,
2024-08-01,株式会社梅島ロープ,その他,求人なし,静岡県浜松市中央区旅籠町67,1947,代表取締役 梅島 忠三,45 百万円,,,,,
2024-08-01,美幌町森林組合,特殊法人・財団法人・その他団体・連合会,求人なし,北海道網走郡美幌町字稲美234-3,1952,代表理事 漆原 裕一,337 百万円,,,,,
2024-08-01,株式会社西日本ビルサービス,不動産管理,求人なし,長崎県長崎市昭和3-256-9,1982,代表取締役 門岡 亜矢,10 百万円,,,,,
2024-08-01,有限会社ケイ・ビー・シー,その他,求人なし,埼玉県東松山市大字宮鼻1018-2,1989,代表取締役 近藤 一正,8 百万円,,,,,
2024-08-01,株式会社中島機工,その他,求人なし,広島県広島市南区向洋中町2-13,1969,代表取締役 嶋田 規宏,10 百万円,,,,,
2024-08-01,株式会社日本発色広島,その他,求人なし,広島県広島市西区庚午北4-6-25庚午北ビル 6Ｆ,1978,代表取締役 岩本 和一,10 百万円,,,,,
2024-08-01,株式会社浜名湖エンタープライズ,その他,求人なし,静岡県湖西市鷲津1098-28,1984,代表取締役 稲垣 智康,72 百万円,,,,,
2024-08-01,株式会社白陽ライン,その他,求人なし,静岡県浜松市中央区笠井上町139,1990,代表取締役 田邊 廣通,10 百万円,,,,,
2024-08-01,株式会社イワテック,その他,求人なし,長崎県長崎市宝町7-5第2イワテックビル,1989,代表取締役 岩元 孝一郎,20 百万円,,,,,
2024-08-01,株式会社中島工業,その他,求人なし,長崎県長崎市江川町2902Ｆ,1987,代表取締役 中島 豊喜,10 百万円,,,,,
2024-08-01,株式会社浜松南工業,その他,求人なし,静岡県浜松市中央区米津町1037-2,1992,代表取締役 大石 加奈子,23 百万円,,,,,
2024-08-01,有限会社徳信,その他,求人なし,長崎県長崎市牧島町864-4,1984,代表取締役 牧島 健,3 百万円,,,,,
2024-08-01,株式会社童話館,放送・新聞・出版,求人なし,長崎県長崎市中町5-21,1981,代表取締役 川端 翔,27 百万円,,,,,
2024-08-01,有限会社島山工務所,その他,求人なし,埼玉県東松山市大字大谷2635,1987,代表取締役 島山 祐一,8 百万円,,,,,
2024-08-01,株式会社橋本,その他,求人なし,長崎県長崎市中川1-4-5,1952,代表取締役 山﨑 秀章,12 百万円,,,,,
2024-08-01,丸栄産業株式会社,その他,求人なし,長崎県長崎市田上1-10-41,1985,代表取締役 古賀 清嗣,10 百万円,,,,,
2024-08-01,有限会社川下工業,その他,求人なし,長崎県長崎市若草町1-15,1965,代表取締役 川下 徹,3 百万円,,,,,
2024-08-01,しれとこ斜里農業協同組合,特殊法人・財団法人・その他団体・連合会,求人なし,北海道斜里郡斜里町本町36-1,1948,代表理事 平田 隆雄,"2,209 百万円",,,,,
2024-08-01,アイワ自動車販売株式会社,その他,求人なし,静岡県浜松市中央区宮竹町237-1,1974,代表取締役 山田 淳一,10 百万円,,,,,
2024-08-01,株式会社伊勢屋,その他,求人なし,静岡県浜松市中央区佐藤1-40-28,1950,代表取締役 湖東 悦郎,10 百万円,,,,,
2024-08-01,有限会社オカザキ,その他,求人なし,広島県広島市中区加古町14-21,1994,代表取締役 岡崎 孝至,3 百万円,,,,,
2024-08-01,株式会社アンゼン,その他,求人なし,埼玉県東松山市大字柏崎832-1,1988,代表取締役 石川 裕二,33 百万円,,,,,
2024-08-01,小野建設株式会社,その他,求人なし,静岡県浜松市中央区三和町425,1975,代表取締役 詫摩 洪太,10 百万円,,,,,
2024-08-01,株式会社稲徳工業所,その他,求人なし,静岡県浜松市中央区佐鳴台1-4-23,1953,代表取締役 稲川 洋,20 百万円,,,,,
2024-08-01,株式会社タカラ電設,その他,求人なし,長崎県長崎市昭和3-3-20,1973,代表取締役 宮本 義弘,20 百万円,,,,,
2024-08-01,株式会社ユートピア知床,その他,求人なし,北海道斜里郡斜里町ウトロ中島113,1988,代表取締役 櫻井 晋吾,30 百万円,,,,,
2024-08-01,いけや空調・配管株式会社,その他,求人なし,静岡県浜松市中央区三方原町1188-6,1974,代表取締役 池谷 和洋,20 百万円,,,,,
2024-08-01,株式会社丹羽工務店,その他,求人なし,北海道斜里郡斜里町字豊倉55-61,1992,代表取締役 丹羽 豊文,3 百万円,,,,,
2024-08-01,公益財団法人知床財団,特殊法人・財団法人・その他団体・連合会,求人なし,北海道斜里郡斜里町大字遠音別村字岩宇別531,1988,代表理事 村田 良介,,,,,,
2024-08-01,高瀬測量設計株式会社,その他,求人なし,埼玉県東松山市日吉町1-16,1975,代表取締役 高瀨映仁,10 百万円,,,,,
2024-08-01,ビジネス・ワンホールディングス株式会社,その他,求人なし,福岡県福岡市中央区薬院3-16-27薬院ビル 3Ｆ,1987,代表取締役社長全事業統括責任者 尾﨑 朝樹,436 百万円,,,,,地方上場
2024-08-01,遠州綿業株式会社,その他,求人なし,静岡県浜松市中央区早馬町1-5,1951,代表取締役 小栗 福典,49 百万円,,,,,
2024-08-01,株式会社エフ浜松,その他,求人なし,静岡県浜松市中央区西塚町321-6,1959,代表取締役 磯部 大介,10 百万円,,,,,
2024-08-01,清里町農業協同組合,特殊法人・財団法人・その他団体・連合会,求人なし,北海道斜里郡清里町羽衣町2,1948,代表理事 石井 透,"2,061 百万円",,,,,
2024-08-01,株式会社太田電機商会,その他,求人なし,静岡県浜松市中央区和田町648,1958,代表取締役 太田 修,10 百万円,,,,,
2024-08-01,鈴建輸送株式会社,その他,求人なし,静岡県浜松市中央区初生町1372-2,1989,代表取締役 鈴木 利幸,10 百万円,,,,,
2024-08-01,小清水町農業協同組合,特殊法人・財団法人・その他団体・連合会,求人なし,北海道斜里郡小清水町字小清水379,1948,代表理事 佐藤 正昭,"1,961 百万円",,,,,
2024-08-01,株式会社大石組,その他,求人なし,静岡県浜松市中央区三方原町646,1969,代表取締役 大石 大介,10 百万円,,,,,
2024-08-01,富士運輸株式会社,その他,求人なし,埼玉県さいたま市岩槻区大字大戸234,1968,代表取締役 坂口 和伸,10 百万円,,,,,
