更新日,名称,業界(小分類),求人有無,所在地,設立,代表者,資本金,平均年齢,従業員数,企業URL,事業内容,上場市場名
2024-08-01,城北紙業株式会社,その他,求人なし,埼玉県さいたま市岩槻区大字大戸234,1953,代表取締役 坂本 睦子,33 百万円,,,,,
2024-08-01,株式会社現代フードサービス,その他,求人なし,長崎県長崎市泉2-15-27,1993,代表取締役 加藤 尚之,10 百万円,,,,,
2024-08-01,株式会社川嶋,その他,求人なし,静岡県浜松市中央区湖東町3222,1981,代表取締役 川嶋 一義,90 百万円,,,,,
2024-08-01,株式会社登新精機製作所,その他,求人なし,埼玉県川口市前川2-48-20,1967,代表取締役 田中 雅浩,10 百万円,,,,,
2024-08-01,株式会社森甚,その他,求人なし,埼玉県さいたま市見沼区大和田町1-797-1,1971,代表取締役 森田 径,40 百万円,,,,,
2024-08-01,新生紀森林組合,特殊法人・財団法人・その他団体・連合会,求人なし,北海道常呂郡置戸町字置戸164,1951,代表理事 小林 満,111 百万円,,,,,
2024-08-01,杉田電線株式会社,その他,求人なし,埼玉県さいたま市岩槻区大字浮谷2290,1960,代表取締役 杉田 幸男,45 百万円,,,,,
2024-08-01,有限会社広島構造技研,その他,求人なし,広島県広島市佐伯区五日市町大字石内5998-1,1989,取締役 神原 雅弘,5 百万円,,,,,
2024-08-01,株式会社ニイガタ精密,その他,求人なし,埼玉県さいたま市岩槻区大字裏慈恩寺854-5,1973,代表取締役 本田 敦弘,20 百万円,,,,,
2024-08-01,医療法人慈弘会,その他,求人なし,埼玉県さいたま市岩槻区東岩槻2-2-20,1978,理事長 岡田 弘俊,"1,268 百万円",,,,,
2024-08-01,原鉄筋工業株式会社,その他,求人なし,埼玉県さいたま市岩槻区大字浮谷744-2,1979,代表取締役 原 翔太郎,10 百万円,,,,,
2024-08-01,株式会社五島組,その他,求人なし,静岡県浜松市中央区石原町517,1973,代表取締役 村瀬 昌幸,20 百万円,,,,,
2024-08-01,有限会社井手写真製版,その他,求人なし,長崎県佐世保市瀬戸越町449-7,1979,代表取締役 井手 政次,3 百万円,,,,,
2024-08-01,有限会社小林ベニヤ,その他,求人なし,静岡県浜松市中央区上石田町697-1,1988,取締役 小林 稔,10 百万円,,,,,
2024-08-01,株式会社栄組,その他,求人なし,静岡県浜松市中央区萩丘1-7-23,1952,代表取締役 飯田 明男,20 百万円,,,,,
2024-08-01,株式会社笠間製作所,その他,求人なし,埼玉県さいたま市岩槻区大字浮谷2811-1,1948,代表取締役 笠間 俊幸,10 百万円,,,,,
2024-08-01,新日本環境整備株式会社,その他,求人なし,埼玉県さいたま市岩槻区大字浮谷1881-3,1983,代表取締役 三橋 謙一,12 百万円,,,,,
2024-08-01,株式会社カーショップフクダ,その他,求人なし,長崎県佐世保市棚方町207-16,1993,代表取締役 福田 欣也,3 百万円,,,,,
2024-08-01,株式会社サンヨークリーニング,その他,求人なし,静岡県浜松市中央区小池町15,1969,代表取締役 野田 滋丈,10 百万円,,,,,
2024-08-01,有限会社かねしめ青果,その他,求人なし,長崎県佐世保市干尽町1-20,1961,代表取締役 木村 公康,10 百万円,,,,,
2024-08-01,株式会社田村商会,その他,求人なし,埼玉県さいたま市岩槻区東岩槻2-7-4,1975,代表取締役 田村 善一郎,10 百万円,,,,,
2024-08-01,杉浦金属株式会社,その他,求人なし,静岡県浜松市中央区東町737,1951,代表取締役 杉浦 政秀,10 百万円,,,,,
2024-08-01,有限会社ユモト,その他,求人なし,北海道常呂郡佐呂間町字永代町89,1964,代表取締役 湯本 吉夫,10 百万円,,,,,
2024-08-01,有限会社豊進,その他,求人なし,広島県広島市南区金屋町3-13ＴＡ38－1Ｆ,1997,代表取締役 井上 貴博,3 百万円,,,,,
2024-08-01,常呂漁業協同組合,特殊法人・財団法人・その他団体・連合会,求人なし,北海道北見市常呂町字常呂691,1949,代表理事 髙桑 康文,"2,360 百万円",,,,,
2024-08-01,常呂町農業協同組合,特殊法人・財団法人・その他団体・連合会,求人なし,北海道北見市常呂町字常呂608,1948,代表理事 川上 和則,856 百万円,,,,,
2024-08-01,株式会社スズゲン,その他,求人なし,静岡県浜松市中央区茄子町318-2,1972,代表取締役 二橋 利光,20 百万円,,,,,
2024-08-01,株式会社ナックス静岡,その他,求人なし,静岡県浜松市中央区有玉南町2459-2,1973,代表取締役 鈴木 哲司,12 百万円,,,,,
2024-08-01,広基産業株式会社,その他,求人なし,広島県広島市中区舟入幸町17-11,1974,代表取締役 藤川 昭廣,10 百万円,,,,,
2024-08-01,渡部容器株式会社,その他,求人なし,埼玉県さいたま市岩槻区大字裏慈恩寺1128-1,1977,代表取締役 渡部 達巳,40 百万円,,,,,
2024-08-01,社会福祉法人聖隷福祉事業団,特殊法人・財団法人・その他団体・連合会,無,静岡県浜松市中央区元城町218-26聖隷ビル,1942,理事長 青木 善治,"60,817 百万円",,,,医療・保健・福祉・介護サービス 2024年2月doda掲載求人より引用,
2024-08-01,安住環境整美株式会社,その他,求人なし,埼玉県さいたま市岩槻区大字高曽根1037,1978,代表取締役 大澤 佑介,20 百万円,,,,,
2024-08-01,積志自動車有限会社,その他,求人なし,静岡県浜松市中央区積志町1522-1,1964,代表取締役 馬塚 明博,20 百万円,,,,,
2024-08-01,株式会社高忠商会,その他,求人なし,静岡県浜松市中央区福塚町310,1948,代表取締役 髙橋 和男,20 百万円,,,,,
2024-08-01,有限会社高柳,その他,求人なし,静岡県浜松市中央区佐鳴台1-5-2,1967,代表取締役 髙栁 栄一,24 百万円,,,,,
2024-08-01,株式会社オックス,その他,求人なし,広島県広島市中区光南3-9-6,1996,代表取締役 井下統介,10 百万円,,,,,
2024-08-01,ツカサ工業株式会社,その他,求人なし,長崎県佐世保市小佐々町小坂606-32,1981,代表取締役 村田 光穂,18 百万円,,,,,
2024-08-01,誠光産業株式会社,その他,求人なし,埼玉県さいたま市岩槻区東岩槻1-5-5,1977,代表取締役 久次 文勝,20 百万円,,,,,
2024-08-01,長崎県北生コン協同組合,その他,求人なし,長崎県佐世保市宮田町1-6ＮＫビル 3Ｆ,1981,代表理事 福田 輝機,27 百万円,,,,,
2024-08-01,株式会社太洋サービス,その他,求人なし,静岡県浜松市中央区篠原町9254-2,1974,代表取締役 川口 知司,10 百万円,,,,,
2024-08-01,中部電装株式会社,その他,求人なし,静岡県浜松市中央区寺脇町928,1966,代表取締役 鈴木 実,10 百万円,,,,,
2024-08-01,有限会社ガーデン森,その他,求人なし,埼玉県さいたま市岩槻区大字岩槻3746,1994,代表取締役 森 政人,9 百万円,,,,,
2024-08-01,公益財団法人広島平和文化センター,特殊法人・財団法人・その他団体・連合会,求人なし,広島県広島市中区中島町1-2,1976,代表理事 小泉 崇,,,,,,
2024-08-01,大同産業開発株式会社,その他,求人なし,北海道紋別郡遠軽町白滝149-1,1964,代表取締役 今野 政男,50 百万円,,,,,
2024-08-01,東邦電気技研株式会社,その他,求人なし,静岡県浜松市中央区下池川町15-13,1982,代表取締役 尾﨑 勝己,20 百万円,,,,,
2024-08-01,有限会社協和牧場,その他,求人なし,北海道紋別郡遠軽町東白滝246,1973,取締役 早川 剛司,3 百万円,,,,,
2024-08-01,東洋設備株式会社,その他,求人なし,静岡県浜松市中央区曳馬5-23-40,1969,代表取締役 袴田 修,20 百万円,,,,,
2024-08-01,大洋電設株式会社,その他,求人なし,長崎県佐世保市大塔町1565-7,1972,代表取締役 松永 敏美,10 百万円,,,,,
2024-08-01,えんゆう農業協同組合,その他,求人なし,北海道紋別郡湧別町上湧別屯田市街地230,1999,代表理事組合長 関口 哲治,"1,410 百万円",,,,,
2024-08-01,湧別漁業協同組合,特殊法人・財団法人・その他団体・連合会,求人なし,北海道紋別郡湧別町曙町9-1,1949,代表理事 阿部 俊彦,"2,318 百万円",,,,,
2024-08-01,株式会社広島建築住宅センター,その他,求人なし,広島県広島市中区八丁堀15-10セントラルビル 3Ｆ,2000,代表取締役 宮地 正人,10 百万円,,,,,
2024-08-01,日邦ライン株式会社,その他,求人なし,静岡県浜松市中央区飯田町500,1970,代表取締役 下西 利幸,10 百万円,,,,,
2024-08-01,株式会社ノセパーツ商会,その他,求人なし,静岡県浜松市中央区菅原町13-7,1952,代表取締役 徳増 大輔,10 百万円,,,,,
2024-08-01,埼広エンジニヤリング株式会社,その他,求人なし,広島県広島市中区大手町3-3-27大手町マンション 3Ｆ,1992,代表取締役社長 森脇 雄二,30 百万円,,,,,
2024-08-01,株式会社藤共工業,その他,求人なし,北海道紋別郡興部町字興部193-1,1949,代表取締役 工藤 喜代子,49 百万円,,,,,
2024-08-01,株式会社橋本組,その他,求人なし,静岡県浜松市中央区大瀬町2106-2,1978,代表取締役 金山 和弘,20 百万円,,,,,
2024-08-01,宗教法人浜松八幡宮,その他,求人なし,静岡県浜松市中央区八幡町2,1954,代表役員 桑島 佳令,7 百万円,,,,,
2024-08-01,沙留漁業協同組合,その他,求人なし,北海道紋別郡興部町字沙留143-1,1949,代表理事 加賀谷 一則,"1,918 百万円",,,,,
2024-08-01,浜名湖養魚漁業協同組合,特殊法人・財団法人・その他団体・連合会,求人なし,静岡県浜松市中央区馬郡町2465,1949,代表理事 外山 昭廣,100 百万円,,,,,
2024-08-01,橋本螺子株式会社,その他,無,静岡県浜松市中央区神立町124-11,1968,代表取締役 藤田 浩司,11 百万円,,,,,
2024-08-01,浜松自動車機工株式会社,その他,求人なし,静岡県浜松市中央区薬師町28-1,1961,代表取締役 桐山 輝文,10 百万円,,,,,
2024-08-01,雄武漁業協同組合,特殊法人・財団法人・その他団体・連合会,求人なし,北海道紋別郡雄武町字雄武983,1963,代表理事 片川 隆市,"1,642 百万円",,,,,
2024-08-01,株式会社茶通亭,その他,求人なし,静岡県沼津市大諏訪555,1948,代表取締役 植松 崇宏,10 百万円,,,,,
2024-08-01,株式会社西九州パリガン,その他,求人なし,長崎県佐世保市花園町201,2000,代表取締役 土井 庸正,10 百万円,,,,,
2024-08-01,株式会社洞爺湖温泉観光ホテル,ホテル・旅館・宿泊施設,求人なし,北海道虻田郡洞爺湖町洞爺湖温泉33,1953,代表取締役 三浦 良夫,60 百万円,,,,,
2024-08-01,共立化工株式会社,石油化学メーカー,求人なし,静岡県沼津市桃里112-2,1966,代表取締役 村松 力,16 百万円,,,,,
2024-08-01,岩倉建設株式会社,その他,求人なし,北海道虻田郡洞爺湖町栄町93-2,1979,代表取締役 吉岡 隆子,1 百万円,,,,,
2024-08-01,株式会社近藤本社,その他,求人なし,静岡県沼津市沼北町2-2-16,1953,代表取締役 近藤 千秋,50 百万円,,,,,
2024-08-01,三陽電業株式会社,その他,求人なし,静岡県沼津市大岡2060-2,1956,代表取締役 中島 大介,10 百万円,,,,,
2024-08-01,株式会社彩光,その他,無,埼玉県春日部市豊野町2-20-2,1991,代表取締役 古田 裕之,20 百万円,,,,情報が古い可能性があります。最新の情報を確認する場合はHP等をご覧ください。 ■テント倉庫の設計・施工事業 2022年8月doda掲載求人より引用,
2024-08-01,有限会社田園,その他,求人なし,埼玉県さいたま市岩槻区大字釣上新田422,1982,代表取締役 大倉 隆,10 百万円,,,,,
2024-08-01,医療法人社団洞仁会,その他,求人なし,北海道虻田郡洞爺湖町洞爺町54-41,1992,理事長 中谷 玲二,643 百万円,,,,,
2024-08-01,堤冷機工業株式会社,その他,求人なし,静岡県沼津市下河原町2-9-7,1960,代表取締役 堤 秀樹,10 百万円,,,,,
2024-08-01,ワカサリゾート株式会社,その他,求人なし,北海道有珠郡壮瞥町字昭和新山184-5,1979,代表取締役 若狭 高司,30 百万円,,,,,
2024-08-01,株式会社冨倉製作所,その他,求人なし,静岡県沼津市足高292-37,1959,代表取締役社長 冨倉 豪人,50 百万円,,,,,
2024-08-01,株式会社山本商会,その他,求人なし,埼玉県さいたま市岩槻区大字長宮633-1,1980,代表取締役 山本 竜也,16 百万円,,,,,
2024-08-01,丸幸鈴木建設工業株式会社,その他,求人なし,北海道白老郡白老町字社台53-1,1952,代表取締役 鈴木 武幸,23 百万円,,,,,
2024-08-01,胆振軽種馬農業協同組合,特殊法人・財団法人・その他団体・連合会,求人なし,北海道白老郡白老町字社台335,1965,代表理事 田中 芳郎,57 百万円,,,,,
2024-08-01,株式会社エステイ,その他,求人なし,広島県広島市東区戸坂山根2-4-22,1980,代表取締役 大武 慶介,10 百万円,,,,,
2024-08-01,内藤工機株式会社,その他,求人なし,静岡県沼津市三枚橋町4-18,1959,代表取締役 内藤 崇裕,10 百万円,,,,,
2024-08-01,西海みずき信用組合,特殊法人・財団法人・その他団体・連合会,求人なし,長崎県佐世保市松川町1-19,1960,代表理事 池田 正治,235 百万円,,,,,
2024-08-01,株式会社まるしん産業,その他,求人なし,広島県広島市東区戸坂山崎町4-47,1982,代表取締役 新宅 信雄,20 百万円,,,,,
2024-08-01,株式会社おづつみ園,その他,求人なし,埼玉県春日部市粕壁2-1-1,1968,代表取締役 尾堤 宏,15 百万円,,,,,
2024-08-01,東武スズキ販売株式会社,その他,求人なし,埼玉県春日部市小渕31,1966,代表取締役 竹田 孝一,10 百万円,,,,,
2024-08-01,株式会社縣北衛生社,その他,求人なし,長崎県佐世保市干尽町3-47,1964,代表取締役 外間 広一,48 百万円,,,,,
2024-08-01,株式会社三宅鉄工所,その他,求人なし,静岡県沼津市今沢17-3,1963,代表取締役 三宅 延知,10 百万円,,,,,
2024-08-01,株式会社山田自動車,その他,求人なし,静岡県沼津市東間門144,1960,代表取締役 山田 のりこ,10 百万円,,,,,
2024-08-01,中国トラック交通共済協同組合,特殊法人・財団法人・その他団体・連合会,求人なし,広島県広島市西区南観音7-10-25,1979,代表理事 小丸 成洋,26 百万円,,,,,
2024-08-01,医療法人光仁会,特殊法人・財団法人・その他団体・連合会,求人なし,埼玉県春日部市緑町6-11-48,1975,理事長 西村 直久,"1,794 百万円",,,,,
2024-08-01,株式会社内藤城,その他,求人なし,埼玉県春日部市粕壁東2-9-11,1969,代表取締役 内藤 城太郎,10 百万円,,,,,
2024-08-01,株式会社北海道コクボ,その他,求人なし,北海道勇払郡安平町早来富岡254-8,1997,代表取締役 小久保 淳,10 百万円,,,,,
2024-08-01,みなと建設株式会社,その他,求人なし,長崎県佐世保市稲荷町2-53,1951,代表取締役 長田 政隆,40 百万円,,,,,
2024-08-01,株式会社ヴイ・ディー・エフ・サンロイヤル,その他,求人なし,埼玉県春日部市南栄町9-10,1968,代表取締役 河合 幸志,236 百万円,,,,,
2024-08-01,野本興業株式会社,その他,求人なし,埼玉県春日部市谷原新田2165-5,1972,代表取締役 野本 大成,40 百万円,,,,,
2024-08-01,株式会社森白汀,その他,求人なし,長崎県佐世保市早岐3-11-112Ｆ,1949,代表取締役社長 内海 暢邦（森 暢邦）,1 百万円,,,,,
2024-08-01,有限会社あすま商事,その他,求人なし,埼玉県春日部市豊野町3-5-3,1973,代表取締役 遊馬 孝浩,30 百万円,,,,,
2024-08-01,株式会社カネトモ,その他,求人なし,静岡県沼津市西島町13-22,1972,代表取締役 山田 誠,10 百万円,,,,,
2024-08-01,ホクダイ株式会社,その他,求人なし,北海道勇払郡安平町早来富岡257,1994,代表取締役 細木 大亮,100 百万円,,,,,
2024-08-01,株式会社ハナカツ,その他,求人なし,埼玉県春日部市粕壁2-7-29,1953,代表取締役 加藤 良太,10 百万円,,,,,
2024-08-01,株式会社あらた総合技術,その他,求人なし,長崎県佐世保市園田町3-1,1961,代表取締役 小田 四方平,36 百万円,,,,,
2024-08-01,東海精機株式会社,その他,求人なし,静岡県沼津市下香貫上障子421,1946,代表取締役 大古田 真二,10 百万円,,,,,
2024-08-01,株式会社テリトリー開発,その他,求人なし,広島県広島市東区曙4-4-27,1973,代表取締役 角田 知己,20 百万円,,,,,
2024-08-01,株式会社平安,その他,求人なし,静岡県沼津市大岡2170-1,1990,代表取締役 中野 宰孝,20 百万円,,,,,
2024-08-01,株式会社タカギ,その他,求人なし,埼玉県春日部市大沼1-43春日部グリーンコープＤ 105,1989,代表取締役 髙木 憲介,10 百万円,,,,,
2024-08-01,門脇建設工業株式会社,その他,求人なし,埼玉県春日部市藤塚1689-4,1990,代表取締役 駒 順一,10 百万円,,,,,
2024-08-01,株式会社ナガノ,その他,求人なし,静岡県沼津市松長613-1,1977,代表取締役 長野 喜髙,15 百万円,,,,,
2024-08-01,株式会社大野水産,その他,求人なし,北海道勇払郡むかわ町美幸2-43,1976,代表取締役 大野 満,10 百万円,,,,,
2024-08-01,有限会社新林,その他,求人なし,広島県広島市東区戸坂山根3-8-3,1984,代表取締役 新林 裕章,10 百万円,,,,,
2024-08-01,鵡川農業協同組合,特殊法人・財団法人・その他団体・連合会,求人なし,北海道勇払郡むかわ町末広2-124,1948,代表理事 長門 宏市,655 百万円,,,,,
2024-08-01,株式会社中外,その他,求人なし,長崎県佐世保市西大久保町4-20,1957,代表取締役 中本 美洋子,20 百万円,,,,,
2024-08-01,株式会社加藤オート・リペア,その他,求人なし,静岡県沼津市岡宮1320-10,1969,代表取締役 加藤 紀明,10 百万円,,,,,
2024-08-01,株式会社啓電工業所,その他,求人なし,静岡県沼津市双葉町9-117号,1962,代表取締役 成田 勇,10 百万円,,,,,
2024-08-01,株式会社北谷組,その他,求人なし,広島県広島市東区矢賀6-4-50,1991,代表取締役 少前 紀信,10 百万円,,,,,
2024-08-01,苫小牧広域森林組合,その他,求人なし,北海道勇払郡むかわ町穂別433,1944,代表理事 小坂 利政,90 百万円,,,,,
2024-08-01,有限会社ヨシダ設備,その他,求人なし,広島県広島市東区福田7-33-7,1988,代表取締役 樋口 満治,5 百万円,,,,,
2024-08-01,佐世保木材協同組合,特殊法人・財団法人・その他団体・連合会,求人なし,長崎県佐世保市沖新町2-18,1954,代表理事 岩永 忠美,30 百万円,,,,,
2024-08-01,びらとり農業協同組合,特殊法人・財団法人・その他団体・連合会,求人なし,北海道沙流郡平取町本町40-1,1975,代表理事 仲山 浩,840 百万円,,,,,
2024-08-01,有限会社大木梱包,その他,求人なし,静岡県沼津市志下74-3,1988,代表取締役 大木 康則,7 百万円,,,,,
2024-08-01,株式会社コダマホーム,その他,求人なし,埼玉県春日部市緑町5-7-27,2001,代表取締役 小玉 和彦,30 百万円,,,,,
2024-08-01,有限会社メイリン,その他,求人なし,広島県広島市東区若草町5-3,1996,取締役 大庭 伸明,3 百万円,,,,,
2024-08-01,株式会社カクイチ,その他,求人なし,静岡県沼津市春日町37-1,1975,代表取締役 綾部 惠市,10 百万円,,,,,
2024-08-01,株式会社新和測機,その他,求人なし,埼玉県春日部市緑町3-1-47,1978,代表取締役 福地 一路,50 百万円,,,,,
2024-08-01,株式会社フードプラス・ホールディングス,その他,無,福岡県福岡市博多区博多駅前1-9-3博多駅前シティビル 13Ｆ,1971,代表取締役 小澤 俊治,50 百万円,,,,,
2024-08-01,近藤総業株式会社,その他,求人なし,静岡県沼津市本字出口町328,1989,代表取締役 近藤 千秋,50 百万円,,,,,
2024-08-01,有限会社プロテック創輝,その他,求人なし,広島県広島市東区光町2-2-13中輪マンション 103,2000,代表取締役 鵜飼 健悟,8 百万円,,,,,
2024-08-01,東海ガス圧接株式会社,その他,求人なし,静岡県沼津市大岡488-1,1963,代表取締役 宮口 茂樹,10 百万円,,,,,
2024-08-01,有限会社坂東牧場,その他,求人なし,北海道沙流郡日高町字福満85-1,1972,代表取締役 坂東 正積,10 百万円,,,,,
2024-08-01,株式会社美幸工業,その他,求人なし,静岡県沼津市小諏訪926-2,1988,代表取締役 竹村 俊克,10 百万円,,,,,
2024-08-01,株式会社アート技研,その他,求人なし,静岡県沼津市西条町50,1965,代表取締役 飯田 辰博,10 百万円,,,,,
2024-08-01,株式会社エスイーシー,その他,求人なし,静岡県沼津市山王台11-1,1988,代表取締役 秋山太輔,10 百万円,,,,,
2024-08-01,新冠町農業協同組合,特殊法人・財団法人・その他団体・連合会,求人なし,北海道新冠郡新冠町字本町59-1,1991,代表理事 前川 隆範,704 百万円,,,,,
2024-08-01,井上物流株式会社,その他,求人なし,広島県広島市南区出島2-18,1962,代表取締役 井上 良明,55 百万円,,,,,
2024-08-01,株式会社坂口ダクト工業,その他,求人なし,長崎県佐世保市浦川内町82-1,1973,代表取締役 坂口 登貴子,10 百万円,,,,,
2024-08-01,株式会社榎本緑化センター,その他,求人なし,埼玉県春日部市増富622-2,1987,代表取締役 榎本 裕樹,10 百万円,,,,,
2024-08-01,胡子自動車工業株式会社,その他,求人なし,広島県広島市南区出島2-14-47,1952,代表取締役 結城 範宗,18 百万円,,,,,
2024-08-01,富士伊豆農業協同組合,特殊法人・財団法人・その他団体・連合会,求人なし,静岡県沼津市下香貫上障子415-1,1993,代表理事 梶 毅,"10,900 百万円",,,,,
2024-08-01,富士マスキング株式会社,その他,求人なし,静岡県沼津市西間門181-1,1994,代表取締役 脇 伸一郎,20 百万円,,,,,
2024-08-01,小野建スチール株式会社,金属・製綱・鉱業・非鉄金属メーカー,求人なし,広島県広島市南区出島1-34-61,1966,代表取締役社長 小野 剛,50 百万円,,,,,
2024-08-01,株式会社カープタクシー,その他,求人なし,広島県広島市南区比治山本町7-10,1953,代表取締役 平原 一彦,7 百万円,,,,,
2024-08-01,カワダ株式会社,その他,求人なし,広島県広島市南区堀越2-8-11,1952,代表取締役 川田 淳雄,100 百万円,,,,,
2024-08-01,株式会社角商店,その他,求人なし,長崎県佐世保市干尽町3-11,1950,代表取締役 角 孟,10 百万円,,,,,
2024-08-01,株式会社京屋,その他,求人なし,広島県広島市南区金屋町9-8,1956,代表取締役 堀 栄治郎,20 百万円,,,,,
2024-08-01,有限会社協和製作所,その他,求人なし,広島県広島市南区青崎2-8-2,1965,代表取締役 岡本 憲良,3 百万円,,,,,
2024-08-01,株式会社クマヒラ・ホールディングス,その他,求人なし,広島県広島市南区宇品東2-1-42,1943,代表取締役 熊平 雅人,450 百万円,,,,,
2024-08-01,株式会社久米組,その他,求人なし,広島県広島市南区宇品海岸3-8-54,1963,代表取締役 久米 秀治,20 百万円,,,,,
2024-08-01,武蔵野マスカー株式会社,その他,求人なし,静岡県沼津市井出1205-1,1994,代表取締役 脇 伸一郎,20 百万円,,,,,
2024-08-01,西海水処理株式会社,その他,求人なし,長崎県佐世保市広田2-196-12,1979,代表取締役 佐々木 兵太,10 百万円,,,,,
2024-08-01,株式会社ホーセイ,その他,求人なし,長崎県佐世保市立神町23-17,1974,代表取締役 池田 真秀,28 百万円,,,,,
2024-08-01,株式会社興洋,その他,求人なし,広島県広島市南区出島2-13-18,1974,代表取締役 奥村 邦夫,10 百万円,,,,,
2024-08-01,生活クラブ生活協同組合,特殊法人・財団法人・その他団体・連合会,求人なし,静岡県沼津市宮前町21-4,1987,代表理事 芹澤 潤二,480 百万円,,,,,
2024-08-01,東陽機械株式会社,その他,求人なし,静岡県沼津市大岡1749-32,1964,代表取締役 片野 友博,10 百万円,,,,,
2024-08-01,株式会社レックス,その他,無,北海道日高郡新ひだか町静内目名491-2,1987,代表取締役 岡田 牧雄,45 百万円,,,,,
2024-08-01,有限会社アイエム共同企画,その他,求人なし,埼玉県春日部市大沼4-12-2,1985,取締役 刈谷 克巳,5 百万円,,,,,
2024-08-01,株式会社ユニオンオーナーズクラブ,その他,求人なし,北海道日高郡新ひだか町静内本町1-2-1ジェイエスビル,1992,代表取締役 辻 助,12 百万円,,,,,
2024-08-01,株式会社博多屋,ホテル・旅館・宿泊施設,求人なし,長崎県佐世保市三浦町4-1,1953,代表取締役 芹野 隆英,10 百万円,,,,,
2024-08-01,創造設計株式会社,その他,求人なし,広島県広島市南区出島2-12-37,1973,代表取締役 平岡 健,10 百万円,,,,,
2024-08-01,株式会社ダテモータース,その他,求人なし,広島県広島市南区金屋町2-14アフロディテ 9Ｆ,1952,代表取締役 伊達 一雄,10 百万円,,,,,
