更新日,名称,業界(小分類),求人有無,所在地,設立,代表者,資本金,平均年齢,従業員数,企業URL,事業内容,上場市場名
2024-08-01,味の素構内サービス株式会社,その他,求人なし,佐賀県佐賀市諸富町大字諸富津450-1,1987,代表取締役 小南 信三,30 百万円,,,,,
2024-08-01,医療法人社団杠葉会,特殊法人・財団法人・その他団体・連合会,求人なし,佐賀県佐賀市諸富町大字諸富津230-2,1990,理事長 牧 孝将,246 百万円,,,,,
2024-08-01,株式会社望月工事店,その他,求人なし,静岡県静岡市清水区西高町11-8,1994,代表取締役 望月 昭宏,10 百万円,,,,,
2024-08-01,福永工作所株式会社,その他,求人なし,北海道北広島市大曲工業団地4-2-1,1988,代表取締役 福永 好宣,10 百万円,,,,,
2024-08-01,有限会社サンジェルマン,その他,求人なし,佐賀県佐賀市諸富町大字徳富700-5,1991,代表取締役 大鶴 晃央,3 百万円,,,,,
2024-08-01,医療法人樟風会,特殊法人・財団法人・その他団体・連合会,求人なし,佐賀県佐賀市川副町大字福富827,1955,理事長 松永 啓介,"3,749 百万円",,,,,
2024-08-01,株式会社古沢商会,その他,求人なし,北海道北広島市輪厚中央5-2-7,1990,代表取締役 安田 孝広,20 百万円,,,,,
2024-08-01,新太平洋運輸株式会社,その他,求人なし,北海道北広島市輪厚332-49,1987,代表取締役 佐藤 信也,22 百万円,,,,,
2024-08-01,医療法人源勇会,その他,求人なし,佐賀県佐賀市川副町大字早津江津339,1991,理事長 枝國 源一郎,10 百万円,,,,,
2024-08-01,有限会社宮田設備,その他,求人なし,佐賀県佐賀市川副町大字西古賀1-4,1996,代表取締役 宮田 勝之,11 百万円,,,,,
2024-08-01,医療法人社団北裕会,その他,求人なし,北海道札幌市西区八軒九条西10-1-11,1997,理事長 穴田 健一郎,5 百万円,,,,,
2024-08-01,株式会社東与賀建設,その他,求人なし,佐賀県佐賀市東与賀町大字下古賀1070-6,1989,代表取締役 入部 憲一,50 百万円,,,,,
2024-08-01,株式会社エーデルワイスファーム,その他,求人なし,北海道北広島市輪厚531-7,1989,代表取締役 野崎 創,10 百万円,,,,,
2024-08-01,木村組有限会社,その他,求人なし,佐賀県佐賀市久保田町大字久富3008-2,1973,代表取締役 木村 信文,5 百万円,,,,,
2024-08-01,大松建設工業株式会社,その他,求人なし,北海道北広島市西の里北1-4-1,1976,代表取締役 小松 直之,10 百万円,,,,,
2024-08-01,株式会社日設工業,その他,求人なし,佐賀県佐賀市大和町大字東山田3584-4,1985,代表取締役 田代 安弘,20 百万円,,,,,
2024-08-01,クラーク電業株式会社,その他,求人なし,北海道北広島市中央3-8-4三和ビル 3Ｆ,1984,代表取締役 漆舘 龍治,21 百万円,,,,,
2024-08-01,有限会社北桜商会,その他,求人なし,北海道北広島市虹ヶ丘5-7-1,1998,代表取締役 中井 克則,3 百万円,,,,,
2024-08-01,株式会社太平プレテック,その他,求人なし,佐賀県佐賀市大和町大字川上157,1970,代表取締役 野口 清二,10 百万円,,,,,
2024-08-01,大岩メタルワークス株式会社,その他,求人なし,北海道石狩市新港西3-701-2,1963,代表取締役 上林 和亮,16 百万円,,,,,
2024-08-01,株式会社ファーストリバー,その他,求人なし,佐賀県佐賀市富士町大字市川1328,1989,代表取締役 野中 美佐子,10 百万円,,,,,
2024-08-01,株式会社コールドモービル札幌,その他,求人なし,北海道石狩市新港南1-22-6,1974,代表取締役 小笠原 榮,30 百万円,,,,,
2024-08-01,ミナト工業株式会社,その他,求人なし,北海道石狩市花畔三条1-138,1956,代表取締役 野島 忠雄,20 百万円,,,,,
2024-08-01,株式会社アルファ・ネットワーク,その他,求人なし,静岡県静岡市葵区錦町7-3インナーコート 1Ｆ,1992,代表取締役 志垣 恭平,11 百万円,,,,,
2024-08-01,株式会社エースランドリー,その他,求人なし,北海道石狩市新港南1-19-52,1977,代表取締役 小林 岳人,30 百万円,,,,,
2024-08-01,株式会社日新鋼機製作所,その他,求人なし,北海道石狩市新港西3-750-9,1979,代表取締役 三上 学,10 百万円,,,,,
2024-08-01,池田屋印刷株式会社,その他,求人なし,静岡県静岡市駿河区中原746-1,1961,代表取締役 八木 伴則,10 百万円,,,,,
2024-08-01,株式会社イケダ,その他,求人なし,佐賀県神埼市千代田町下西458-1,1992,代表取締役 桝田哲彰,10 百万円,,,,,
2024-08-01,シンエイメタルテック株式会社,その他,求人なし,佐賀県神埼市千代田町崎村551,1971,代表取締役 田原 和幸,10 百万円,,,,,
2024-08-01,産共土木株式会社,その他,求人なし,北海道石狩市花川南二条6-265,1985,代表取締役 今野 弘隆,23 百万円,,,,,
2024-08-01,佐賀環境整備株式会社,その他,求人なし,佐賀県神埼市千代田町姉67,1972,代表取締役 石橋 誠一郎,10 百万円,,,,,
2024-08-01,株式会社大島産業,その他,求人なし,佐賀県神埼郡吉野ヶ里町吉田2469-1,1975,代表取締役 大島 権人,20 百万円,,,,,
2024-08-01,チクシ電気株式会社,その他,求人なし,福岡県福岡市中央区渡辺通2-9-22西鉄渡辺通ビル 4Ｆ,1985,代表取締役 寺本 和則,35 百万円,,,,,
2024-08-01,株式会社静岡セイコー,その他,求人なし,静岡県静岡市駿河区みずほ2-18-15,1968,代表取締役 櫻井 貴彦,10 百万円,,,,,
2024-08-01,静岡大学生活協同組合,特殊法人・財団法人・その他団体・連合会,求人なし,静岡県静岡市駿河区大谷836,1963,代表理事 柴垣 裕司,239 百万円,,,,,
2024-08-01,学校法人静岡雙葉学園,その他,求人なし,静岡県静岡市葵区追手町10-71,1944,,"7,074 百万円",,,,,
2024-08-01,株式会社プラザワン,その他,求人なし,佐賀県三養基郡基山町大字宮浦186-55,1988,代表取締役 早川 俊介,10 百万円,,,,,
2024-08-01,株式会社光宮製作所,その他,求人なし,佐賀県三養基郡みやき町大字簑原3933-3,1962,代表取締役 篠﨑 明美,37 百万円,,,,,
2024-08-01,株式会社コジマ建設,その他,求人なし,佐賀県三養基郡みやき町大字簑原5385-1,1994,代表取締役 小島 洋,10 百万円,,,,,
2024-08-01,株式会社東和化成商事,その他,求人なし,静岡県静岡市葵区瀬名川1-12-13,1980,代表取締役 高橋 宏幸,10 百万円,,,,,
2024-08-01,株式会社シンエー機材,その他,求人なし,北海道石狩市新港南1-22-10,1994,代表取締役 福井 幸彦,10 百万円,,,,,
2024-08-01,株式会社三川,その他,求人なし,佐賀県三養基郡みやき町大字西島2973,1950,代表取締役 高取 祐介,10 百万円,,,,,
2024-08-01,有限会社ササキ通信,その他,求人なし,北海道石狩市花川北三条5-4,1985,代表取締役 佐々木 幸男,10 百万円,,,,,
2024-08-01,剛健運輸株式会社,その他,求人なし,北海道石狩市新港西1-767-2,1996,代表取締役 佐藤 良夫,22 百万円,,,,,
2024-08-01,三田川金属工業株式会社,その他,求人なし,佐賀県三養基郡上峰町大字坊所2514,1957,代表取締役 八谷 泰正,20 百万円,,,,,
2024-08-01,辻野建設工業株式会社,その他,求人なし,北海道石狩郡当別町末広380,1962,代表取締役 辻野 浩,50 百万円,,,,,
2024-08-01,ロータス静岡株式会社,その他,求人なし,静岡県静岡市葵区栄町3-1あいおいニッセイ同和損保静岡第一ビル 6Ｆ,1979,代表取締役 桒高百明,48 百万円,,,,,
2024-08-01,ファームエイジ株式会社,その他,求人なし,北海道石狩郡当別町字金沢166-8,1985,代表取締役 小谷 栄二,31 百万円,,,,,
2024-08-01,北石狩農業協同組合,特殊法人・財団法人・その他団体・連合会,求人なし,北海道石狩郡当別町錦町58-57,1999,代表理事 川村 義宏,"1,224 百万円",,,,,
2024-08-01,株式会社小城倉庫,その他,求人なし,佐賀県小城市三日月町石木262,1974,代表取締役 尾藤 由美子,10 百万円,,,,,
2024-08-01,株式会社共和金型製作所,その他,求人なし,静岡県静岡市清水区北脇新田633,1978,代表取締役 小長井 淳,10 百万円,,,,,
2024-08-01,株式会社三水,その他,求人なし,静岡県静岡市清水区三保526-6,1983,代表取締役 上原 由,10 百万円,,,,,
2024-08-01,有限会社静岡大和サービス,その他,求人なし,静岡県静岡市清水区西大曲町7-9,1974,取締役 中村 彰宏,5 百万円,,,,,
2024-08-01,静脈産業株式会社,その他,求人なし,静岡県静岡市清水区長崎新田235,1979,代表取締役 町田 慈彦,10 百万円,,,,,
2024-08-01,株式会社九州パール紙工,製紙・パルプメーカー,求人なし,佐賀県小城市牛津町柿樋瀬468,1966,代表取締役 坂本 正光,30 百万円,,,,,
2024-08-01,東名自動車サービス株式会社,その他,求人なし,静岡県静岡市清水区七ツ新屋523,1965,代表取締役 丹羽 啓道,10 百万円,,,,,
2024-08-01,ヒノデネット株式会社,その他,求人なし,静岡県静岡市清水区宮加三324-2,1963,代表取締役 西澤 幸隆,10 百万円,,,,,
2024-08-01,有限会社辻製作所,その他,求人なし,佐賀県小城市芦刈町三王崎280-15,1990,代表取締役社長 辻 吉武,5 百万円,,,,,
2024-08-01,有限会社マルミ海産物,その他,求人なし,静岡県静岡市清水区高橋6-6-26,1995,代表取締役 山田 勝幸,5 百万円,,,,,
2024-08-01,有限会社マ・ニ・フィーク,専門店（アパレル・アクセサリー）,求人なし,静岡県静岡市葵区呉服町2-6-4,2005,代表取締役 前島 孝則,3 百万円,,,,,
2024-08-01,有限会社七山建設,その他,求人なし,佐賀県唐津市七山藤川2737-4,1963,代表取締役 鬼塚 康成,10 百万円,,,,,
2024-08-01,株式会社スリーエス,その他,求人なし,北海道上磯郡知内町字湯ノ里48-13,1989,代表取締役 大野 樹,27 百万円,,,,,
2024-08-01,静岡県医師信用組合,特殊法人・財団法人・その他団体・連合会,求人なし,静岡県静岡市葵区鷹匠3-6-3,1968,代表理事 篠原 彰,27 百万円,,,,,
2024-08-01,栗原工業株式会社,その他,求人なし,佐賀県唐津市相知町久保289,1971,代表取締役 家原 良二,21 百万円,,,,,
2024-08-01,株式会社タカフジ,その他,求人なし,北海道北斗市七重浜1-11-19,1960,代表取締役 髙藤 典生,10 百万円,,,,,
2024-08-01,有限会社浜松砂利,その他,求人なし,静岡県浜松市中央区大瀬町950,1958,取締役 中川 雄介,3 百万円,,,,,
2024-08-01,濱建工業株式会社,その他,求人なし,静岡県磐田市竜洋稗原632,2023,代表取締役 鈴木 諭,5 百万円,,,,,
2024-08-01,協業組合浜松輸送センター,その他,求人なし,静岡県浜松市中央区流通元町1-2,1970,代表理事 松下 敏雄,30 百万円,,,,,
2024-08-01,株式会社久保製作所,その他,求人なし,北海道北斗市追分3-4-12,1972,代表取締役 久保 晴美,20 百万円,,,,,
2024-08-01,株式会社美洗舎,その他,求人なし,静岡県浜松市中央区初生町637,1964,代表取締役 船越 俊廣,10 百万円,,,,,
2024-08-01,光タクシー株式会社,その他,求人なし,静岡県浜松市中央区鴨江3-56-5,1951,代表取締役社長 林 好子,24 百万円,,,,,
2024-08-01,カネフジ冷蔵株式会社,その他,求人なし,北海道北斗市七重浜8-14-21,1989,代表取締役 米沢 彰則,10 百万円,,,,,
2024-08-01,有限会社ヤヨイ製作所,その他,求人なし,静岡県浜松市中央区中田町561,1964,代表取締役 鈴木 幸一,6 百万円,,,,,
2024-08-01,株式会社丸八アセット,その他,求人なし,神奈川県横浜市港北区新横浜3-8-128Ｆ,1962,代表取締役 岡本 典之,100 百万円,,,,,
2024-08-01,佐賀県陶磁器工業協同組合,特殊法人・財団法人・その他団体・連合会,求人なし,佐賀県西松浦郡有田町外尾町丙1217,1949,代表理事 原田 元,108 百万円,,,,,
2024-08-01,有田ケーブル・ネットワーク株式会社,その他,求人なし,佐賀県西松浦郡有田町南原甲43-1,1979,代表取締役 諸岡 典夫,20 百万円,,,,,
2024-08-01,脇商事株式会社,その他,求人なし,北海道北斗市清水川142-28,1964,代表取締役 脇 裕輝,20 百万円,,,,,
2024-08-01,株式会社みのり,その他,求人なし,静岡県浜松市中央区幸1-1-7,1979,代表取締役 中山 知子,10 百万円,,,,,
2024-08-01,ミナミタクシー株式会社,その他,求人なし,北海道札幌市白石区本郷通7-北4-7パレス日成27－101,1971,代表取締役 濱田 伸興,25 百万円,,,,,
2024-08-01,株式会社メイユウ,その他,求人なし,北海道北斗市市渡619,1992,代表取締役 吉田 昭一,3 百万円,,,,,
2024-08-01,株式会社共栄製作所,その他,求人なし,佐賀県西松浦郡有田町広瀬1009-4,1981,代表取締役 廣 勝美,10 百万円,,,,,
2024-08-01,社会福祉法人七飯有隣会,その他,求人なし,北海道亀田郡七飯町緑町3-1-18,1994,理事長 横田 有一,"1,792 百万円",,,,,
2024-08-01,東海菱油株式会社,その他,求人なし,静岡県浜松市中央区馬郡町2500,1949,代表取締役 菊池 正,12 百万円,,,,,
2024-08-01,八洲輸送株式会社,その他,求人なし,静岡県浜松市中央区高丘西4-17-18,1961,代表取締役 荻原 三雄,10 百万円,,,,,
2024-08-01,有限会社オガネサン清藤水産,その他,求人なし,北海道茅部郡森町字砂原5-121,1988,代表取締役 坂本 拓也,20 百万円,,,,,
2024-08-01,天星製油株式会社,その他,求人なし,静岡県浜松市浜名区新原3833-1,1984,代表取締役 鈴木 宏政,10 百万円,,,,,
2024-08-01,株式会社ワイエスフーズ,その他,求人なし,北海道茅部郡森町字砂原西4-230-12,1998,代表取締役 坂本 拓也,50 百万円,,,,,
2024-08-01,株式会社ひらまつ,その他,求人なし,静岡県浜松市中央区本郷町1299-1,1974,代表取締役 平松 勝一,10 百万円,,,,,
2024-08-01,株式会社北日本送電,その他,求人なし,北海道茅部郡森町字石倉町610,1977,代表取締役 黒坂 清,24 百万円,,,,,
2024-08-01,江口金属株式会社,その他,求人なし,佐賀県杵島郡白石町大字築切4023-5,1991,代表取締役 江口 弘幸,10 百万円,,,,,
2024-08-01,有限会社丸に武藏商店,その他,求人なし,北海道茅部郡森町字本町122,1963,代表取締役 武藏 和正,20 百万円,,,,,
2024-08-01,有限会社浜設,その他,求人なし,静岡県浜松市中央区入野町16412-12,1979,代表取締役 今田 芳美津,3 百万円,,,,,
2024-08-01,静岡県西部生コンクリート協同組合,その他,求人なし,静岡県浜松市中央区薬師町346,1971,代表理事 堀内 研矢,6 百万円,,,,,
2024-08-01,有限会社遠州化成,その他,求人なし,静岡県浜松市中央区小池町235,1975,代表取締役 和久田 稔,6 百万円,,,,,
2024-08-01,澤政塗料興業株式会社,その他,求人なし,静岡県浜松市中央区上新屋町50,1972,代表取締役 日置 將喜,40 百万円,,,,,
2024-08-01,有限会社丸井配管工業,その他,求人なし,静岡県浜松市中央区舘山寺町1858-1,1970,代表取締役 丸井基宏,20 百万円,,,,,
2024-08-01,株式会社マルショウ企画,その他,求人なし,静岡県浜松市中央区入野町6311,1976,代表取締役 鈴木 美鈴,10 百万円,,,,,
2024-08-01,小杉コンクリート株式会社,その他,求人なし,静岡県浜松市中央区東三方町361,1971,代表取締役 小杉 讓治,10 百万円,,,,,
2024-08-01,有限会社森永建設,その他,求人なし,佐賀県嬉野市塩田町大字久間丙4646-3,1992,代表取締役 森永 辰朗,3 百万円,,,,,
2024-08-01,秋田整理有限会社,その他,求人なし,静岡県浜松市中央区助信町24-26,1963,代表取締役 秋田 泰宏,5 百万円,,,,,
2024-08-01,有限会社イシナガ,その他,求人なし,佐賀県嬉野市嬉野町大字吉田丙2844-2,2001,代表取締役 石永 正暁,3 百万円,,,,,
2024-08-01,医療法人社団盛翔会,特殊法人・財団法人・その他団体・連合会,求人なし,静岡県浜松市中央区大瀬町1568,1998,理事長 澤田 健,508 百万円,,,,,
2024-08-01,大興金属株式会社,その他,求人なし,静岡県浜松市中央区天王町2025,1984,代表取締役 山本 慶輝,50 百万円,,,,,
2024-08-01,新創研出版株式会社,その他,求人なし,静岡県浜松市中央区植松町1487-1,1982,代表取締役 新井 喜美雄,70 百万円,,,,,
2024-08-01,協同組合浜松卸商センター,特殊法人・財団法人・その他団体・連合会,求人なし,静岡県浜松市中央区卸本町37,1968,代表理事 中村 泰平,400 百万円,,,,,
2024-08-01,羽田屋硝子株式会社,その他,求人なし,静岡県浜松市中央区植松町1479-1,1953,代表取締役 藤田 哲也,12 百万円,,,,,
2024-08-01,アトム道路株式会社,その他,求人なし,静岡県浜松市中央区金折町171,1971,代表取締役 庄古 忠史,13 百万円,,,,,
2024-08-01,浜松総合防災設備株式会社,その他,求人なし,静岡県浜松市中央区領家2-31-15,1984,代表取締役 澤木 典子,10 百万円,,,,,
2024-08-01,有限会社ステップ・ワン企画,その他,求人なし,長崎県長崎市三和町314丸幸ビル 1Ｆ,1993,代表取締役 渕田 正直,3 百万円,,,,,
2024-08-01,アルファテクニカ株式会社,その他,求人なし,静岡県浜松市中央区桜台1-6-10,1977,代表取締役 坂井 靖成,50 百万円,,,,,
2024-08-01,ヘイワオートサービス株式会社,その他,求人なし,静岡県浜松市中央区西ケ崎町1027,1978,代表取締役 水谷 欣志,45 百万円,,,,,
2024-08-01,北栄建設株式会社,その他,求人なし,静岡県浜松市浜名区都田町8546-5,1983,代表取締役 上田 栄一,25 百万円,,,,,
2024-08-01,株式会社ナカジマ,その他,求人なし,北海道磯谷郡蘭越町字三和1277-1,1977,代表取締役 中嶋 延生,10 百万円,,,,,
2024-08-01,株式会社ヤオキュウフレッシュ,その他,求人なし,静岡県浜松市中央区菅原町16-8,1969,代表取締役 鈴木 修,10 百万円,,,,,
2024-08-01,グロープ工業株式会社,その他,求人なし,静岡県浜松市中央区天王町2008-1,1970,代表取締役 内山 靖弘,12 百万円,,,,,
2024-08-01,株式会社ユーエス,その他,求人なし,静岡県浜松市中央区坪井町1559-17,1976,代表取締役 鈴木 敦夫,10 百万円,,,,,
2024-08-01,株式会社モナミ,その他,求人なし,長崎県長崎市万屋町5-38西川家ビル 5Ｆ,1978,代表取締役 入口 豊,10 百万円,,,,,
2024-08-01,富田電気工事株式会社,その他,求人なし,静岡県浜松市中央区中島1-10-7,1970,代表取締役 富田 三代治,10 百万円,,,,,
2024-08-01,後志建設工業株式会社,その他,求人なし,北海道虻田郡喜茂別町字喜茂別275-3,1958,代表取締役 本久 雄大,30 百万円,,,,,
2024-08-01,医療法人同仁会,その他,求人なし,長崎県長崎市金屋町2-9,1954,理事長 山口 伊都子,236 百万円,,,,,
2024-08-01,有限会社ハカマタモータース,その他,求人なし,静岡県浜松市中央区高丘西1-1-8,1982,取締役 袴田 直之,5 百万円,,,,,
2024-08-01,株式会社マルエイ,その他,求人なし,静岡県浜松市中央区新貝町239-1,1979,代表取締役 大藤 幸一,15 百万円,,,,,
2024-08-01,株式会社ユニオン,その他,求人なし,北海道虻田郡倶知安町南八条東2-10,1984,代表取締役 加藤 直己,48 百万円,,,,,
2024-08-01,有限会社ハマイワ産業,その他,求人なし,静岡県浜松市中央区西島町333,1993,代表取締役 古山 貴晴,3 百万円,,,,,
2024-08-01,瀬尾建設工業株式会社,その他,求人なし,北海道虻田郡倶知安町北三条東2-7,1967,代表取締役 瀬尾 孝志,24 百万円,,,,,
2024-08-01,イトーエンタープライズ株式会社,その他,求人なし,静岡県浜松市中央区砂山町351-2ＥＳビル,1983,代表取締役 伊藤 喜章,10 百万円,,,,,
2024-08-01,千歳林業株式会社,その他,求人なし,北海道虻田郡倶知安町字琴平152-27,1988,代表取締役 栃木 幸広,80 百万円,,,,,
2024-08-01,株式会社パスエイト社,その他,求人なし,静岡県浜松市中央区寺脇町708,1989,代表取締役 長谷川 満,3 百万円,,,,,
2024-08-01,株式会社ピーアンドピー浜松,その他,求人なし,静岡県浜松市中央区三和町252-2,1979,代表取締役 小菅 亨太,10 百万円,,,,,
2024-08-01,有限会社神谷工業所,その他,求人なし,静岡県浜松市中央区桜台1-12-1,1976,取締役 神谷 淑惠,3 百万円,,,,,
2024-08-01,有限会社大広設備,その他,求人なし,静岡県浜松市天竜区山東1935-1,1991,代表取締役 宮澤 力,5 百万円,,,,,
2024-08-01,アオイリネンサービス株式会社,その他,求人なし,静岡県浜松市中央区大瀬町1278,1989,代表取締役 廣瀬 純平,50 百万円,,,,,
2024-08-01,海同冷蔵株式会社,その他,求人なし,北海道岩内郡岩内町字大浜89-1,1961,代表取締役 梅村 侑矢,30 百万円,,,,,
2024-08-01,株式会社知久,その他,無,静岡県浜松市中央区桜台1-2-1,1987,代表取締役 知久 利克,30 百万円,,,,,
2024-08-01,株式会社ワークス,その他,求人なし,静岡県浜松市中央区三島町97-1,1990,代表取締役 渡辺 美代子（高橋 美代子）,10 百万円,,,,,
2024-08-01,株式会社インテグラ技術研究所,その他,求人なし,静岡県浜松市中央区蜆塚2-24-55,1991,代表取締役 奥津 光博,25 百万円,,,,,
2024-08-01,株式会社岩佐商会,その他,求人なし,北海道函館市桔梗2-36-8,1970,代表取締役 岩佐 哲哉,10 百万円,,,,,
2024-08-01,株式会社せんざん,その他,求人なし,静岡県浜松市中央区佐鳴台1-6-21,1993,代表取締役 氏原 忠喜,10 百万円,,,,,
2024-08-01,長崎市新三重漁業協同組合,特殊法人・財団法人・その他団体・連合会,求人なし,長崎県長崎市三重町348-7,1961,代表理事 柏木 俊彦,128 百万円,,,,,
2024-08-01,有限会社仁木ファーム,その他,求人なし,北海道余市郡仁木町北町1-87,1991,代表取締役 坂東 裕美,5 百万円,,,,,
2024-08-01,株式会社渥美鐵工所,その他,求人なし,静岡県浜松市中央区新橋町283,1993,代表取締役 渥美 聡一郎,20 百万円,,,,,
2024-08-01,株式会社つかさ,その他,求人なし,静岡県浜松市中央区大瀬町688-2,1980,代表取締役 秋山 省悟,10 百万円,,,,,
2024-08-01,医療法人社団長啓会,その他,求人なし,静岡県浜松市浜名区都田町7555-47,1990,理事長 政本 多美子,"1,557 百万円",,,,,
2024-08-01,ニッカディスティラリーサービス株式会社,その他,求人なし,北海道余市郡余市町黒川町7-133,1976,代表取締役 大川 高司,10 百万円,,,,,
2024-08-01,とぴあ浜松農業協同組合,特殊法人・財団法人・その他団体・連合会,求人なし,静岡県浜松市中央区有玉南町1975,1995,代表理事理事長 豊田 勇治,"3,767 百万円",,,,,
2024-08-01,株式会社山中牧場,その他,求人なし,北海道余市郡赤井川村字落合478-1,1987,代表取締役 山中 一弘,10 百万円,,,,,
2024-08-01,有限会社エスティ舗装,その他,求人なし,静岡県浜松市中央区恒武町235,1994,代表取締役 赤堀 大介,3 百万円,,,,,
2024-08-01,田園都市株式会社,その他,求人なし,長崎県長崎市興善町4-6田都ビル 802,2001,代表取締役 猪股 賢一郎,10 百万円,,,,,
2024-08-01,札幌商販株式会社,その他,求人なし,北海道空知郡南幌町南10線西14,1975,代表取締役 有川 真澄,10 百万円,,,,,
2024-08-01,株式会社札幌麺匠,その他,求人なし,北海道空知郡南幌町南11線西14,1993,代表取締役 栗原 健一,10 百万円,,,,,
2024-08-01,株式会社総合ビジネスブレイン・道,その他,求人なし,静岡県浜松市中央区葵西1-2-15,1985,代表取締役 原田 道子,10 百万円,,,,,
2024-08-01,有限会社コスモグリーン庭好,その他,求人なし,静岡県浜松市中央区安松町66-9,2004,代表取締役 三輪 一貴,9 百万円,,,,,
2024-08-01,長崎県養鶏農業協同組合,特殊法人・財団法人・その他団体・連合会,求人なし,長崎県諫早市久山町2014-42,1955,代表理事 深沢 晃,42 百万円,,,,,
2024-08-01,長田工業株式会社,プラントメーカー・プラントエンジニアリング,求人なし,長崎県長崎市飽の浦町3-5,1963,代表取締役 松尾 秀康,21 百万円,,,,,
2024-08-01,株式会社日東商会,その他,求人なし,長崎県長崎市鍛冶屋町6-17ハイツかじや502号,1969,代表取締役 東森 仁,10 百万円,,,,,
2024-08-01,株式会社ゆびとま,その他,求人なし,長崎県長崎市万才町6-34あおば生命・時事通信社長崎ビル 6Ｆ,1990,代表取締役 古林 行雄,500 百万円,,,,,
2024-08-01,株式会社島田鉄工所,その他,求人なし,広島県広島市中区南吉島1-3-3,1953,代表取締役 島田 泰実,20 百万円,,,,,
2024-08-01,住田株式会社,その他,求人なし,広島県広島市中区東平塚町1-9ロッコーマンション京橋川コーポ,1953,代表取締役 小林 一英,70 百万円,,,,,
