更新日,名称,業界(小分類),求人有無,所在地,設立,代表者,従業員数,資本金,平均年齢,企業URL,事業内容,上場市場名
2024-08-01,ＪＡＬ　Ａｇｒｉｐｏｒｔ株式会社,その他,求人なし,千葉県成田市古込1-1,2018,代表取締役 花桝 健一,3,100 百万円,,,,
2024-08-01,株式会社ｃａｐａｂｌｅ,その他,求人なし,東京都目黒区上目黒2-1-1,2019,代表取締役 髙橋 祐希,3,100 百万円,,,,
2024-08-01,大信東京合同会社,その他,求人なし,東京都港区西新橋2-39-3,2020,,3,5 百万円,,,,
2024-08-01,ＴＳＴジャパン株式会社,その他,求人なし,大阪府大阪市中央区南本町2-1-1,2020,代表取締役 古田 兼三,3,8 百万円,,,,
2024-08-01,コンバーターテックジャパン合同会社,その他,求人なし,千葉県千葉市美浜区中瀬2-6-1ＷＢＧマリブイースト14Ｆ,2020,,3,10 百万円,,,,
2024-08-01,株式会社ＴＥＩ　Ｊａｐａｎ,その他,求人なし,東京都中央区京橋1-1-5,2021,代表取締役 伊福 澄哉,3,50 百万円,,,,
2024-08-01,リフトマネジメント株式会社,その他,求人なし,東京都中央区日本橋3-4-10,2021,代表取締役 國井 大,3,80 百万円,,,,
2024-08-01,ペンタマスターオートメーションジャパン合同会社,その他,求人なし,神奈川県横浜市神奈川区鶴屋町2-25-1ＹＳ横浜西口ビル7Ｆ,2021,,3,3 百万円,,,,
2024-08-01,株式会社ＭＤ＆アソシエイツ,その他,求人なし,香川県高松市林町2217-15香川産業頭脳化センタービル 316,2022,代表取締役 間 敬三,3,10 百万円,,,,
2024-08-01,ＱｕｒｅＤＡ　Ｒｅｓｅａｒｃｈ株式会社,その他,求人なし,兵庫県三田市学園上ケ原1,2023,代表取締役 金子 忠昭,3,450 百万円,,,,
2024-08-01,株式会社地域冷暖房千葉,その他,求人なし,千葉県千葉市中央区新町1000センシティビルディングセンシティタワー 19Ｆ,1989,代表取締役 指田 孝雄,2,"1,000 百万円",,,,
2024-08-01,デザイナーフーズ株式会社,その他,求人なし,東京都足立区六町4-12-12,1999,代表取締役 市野 真理子,2,20 百万円,,,,
2024-08-01,株式会社神戸港国際流通センター,その他,求人なし,兵庫県神戸市中央区港島8-2-1,1996,代表取締役 長田 行弘,2,30 百万円,,,,
2024-08-01,エロフ・ハンソン株式会社,その他,求人なし,東京都港区東新橋1-5-2汐留シティセンター5Ｆ,1979,代表取締役 岡田 誠,2,20 百万円,,,,
2024-08-01,センコーフーズ株式会社,その他,求人なし,大阪府大阪市北区大淀中1-1-30,1992,代表取締役 浦野 雅夫,2,90 百万円,,,,
2024-08-01,サンケンビジネスサービス株式会社,その他,求人なし,埼玉県新座市北野3-6-3,1982,代表取締役 佐々木 学,2,90 百万円,,,,
2024-08-01,加賀コミュニティプラザ株式会社,その他,求人なし,石川県加賀市作見町ル25-1,1995,代表取締役 杉崎 邦彦,2,200 百万円,,,,
2024-08-01,名工商事株式会社,その他,求人なし,愛知県清須市枇杷島駅前東1-1-1,1966,代表取締役 小林 淳祐,2,20 百万円,,,,
2024-08-01,ヴァイスハルト・インターナショナル,その他,求人なし,東京都千代田区神田神保町1-13-16神保町ＴＫビル 3Ｆ,,日本における代表者 Ｄ．ジェレール,2,,,,,
2024-08-01,アリアンスペース社　東京事務所,その他,求人なし,東京都千代田区霞が関3-2-5霞ヶ関ビル 31Ｆ,,東京事務所代表 高松 聖司,2,,,,,
2024-08-01,株式会社サテライトイメージマーケティング,その他,求人なし,東京都目黒区青葉台4-9-6日本地図センタービル 5Ｆ,2002,代表取締役 田村 洋子,2,60 百万円,,,,
2024-08-01,株式会社カリブ,その他,求人なし,東京都足立区梅田6-9-16,2004,代表取締役 瀬出井 恒,2,10 百万円,,,,
2024-08-01,近鉄バスホールディングス株式会社,その他,求人なし,大阪府大阪市天王寺区上本町6-5-13上本町新歌舞伎座ビル上本町ＹＵＦＵＲＡ 7Ｆ,2007,代表取締役 田中 耕造,2,100 百万円,,,,
2024-08-01,株式会社コンステ,その他,求人なし,東京都千代田区神田美土代町3-2神田アベビル 7Ｆ,2008,代表取締役 河野 勝平,2,9 百万円,,,,
2024-08-01,ソニックステクノロジー株式会社,その他,求人なし,東京都千代田区九段南4-8-27小林ビル 2Ｆ,2011,代表取締役 江東 亮,2,80 百万円,,,,
2024-08-01,株式会社エブリシングジャパン,その他,求人なし,東京都港区六本木3-2-1六本木グランドタワー 21Ｆ,2014,代表取締役 南 昭英,2,85 百万円,,,,
2024-08-01,一般社団法人ＳＮＳエキスパート協会,特殊法人・財団法人・その他団体・連合会,求人なし,東京都港区虎ノ門4-1-13プライムテラス神谷町 9Ｆ,2016,代表理事 後藤 真理恵,2,,,,,
2024-08-01,セレンディップ・ロボクロスマーケティング株式会社,その他,求人なし,愛知県名古屋市中区錦1-5-11名古屋伊藤忠ビル 3Ｆ,2018,代表取締役社長 和田 正信,2,50 百万円,,,,
2024-08-01,ＭａａＳ　Ｇｌｏｂａｌ　Ｊａｐａｎ株式会社,その他,求人なし,東京都渋谷区渋谷2-19-15宮益坂ビルディング609,2019,代表取締役 嶋田 智之,2,,,,,
2024-08-01,株式会社ファンケルラボ,その他,無,神奈川県横浜市中区山下町89-1,2020,代表取締役 稲葉 豊和,2,10 百万円,,,情報が古い可能性があります。最新の情報を確認する場合はHP等をご覧ください。 日本国内における化粧品や医薬部外品、健康食品の受託製造および販売 2021年12月doda掲載求人より引用,
2024-08-01,株式会社シー・エス・リアルエステート,その他,求人なし,千葉県千葉市花見川区幕張本郷1-11-26リビエール本郷 203,2020,代表取締役 中井 千代助,2,10 百万円,,,,
2024-08-01,大豊不動産株式会社,その他,求人なし,東京都中央区新川1-24-4大豊ビル 7Ｆ,1969,代表取締役 釘本 実,1,10 百万円,,,,
2024-08-01,四港サイロ株式会社,その他,求人なし,三重県四日市市千歳町34,1967,代表取締役 福永 隆,1,250 百万円,,,,
2024-08-01,徳島電工有限会社,その他,求人なし,徳島県徳島市応神町応神産業団地4-1,1966,代表取締役 向井 郁男,1,4 百万円,,,,
2024-08-01,株式会社エリアクエスト店舗＆オフィス,その他,求人なし,東京都新宿区西新宿6-5-1新宿アイランドタワー 7Ｆ,2000,代表取締役 清原 雅人,1,30 百万円,,,,
2024-08-01,室町海運株式会社,その他,求人なし,東京都千代田区大手町1-5-1大手町ファーストスクエアウエストタワー 22Ｆ,1951,代表取締役 山野井 敦寛,1,10 百万円,,,,
2024-08-01,エムケー興産株式会社,その他,求人なし,長野県長野市大字鶴賀南千歳町975,1969,代表取締役 宮澤 喜宏,1,475 百万円,,,,
2024-08-01,サンワロジスティック株式会社,その他,求人なし,東京都中央区京橋3-1-1,1990,代表取締役 玉木 克也,1,10 百万円,,,,
2024-08-01,中電ビジネスサポート株式会社,その他,求人なし,愛知県名古屋市東区東新町1,2001,代表取締役 度會 俊宏,1,100 百万円,,,,
2024-08-01,日中商品検査株式会社,その他,求人なし,東京都中央区日本橋茅場町2-7-1アソルティ日本橋茅場町,1991,代表取締役 劉 彦賓,1,30 百万円,,,,
2024-08-01,ソーラーパワー西条株式会社,その他,求人なし,愛媛県西条市北条962-14,2012,代表取締役 坂井 洋一,1,10 百万円,,,,
2024-08-01,株式会社パンパシフィックホテルズアンドリゾーツジャパン,その他,求人なし,東京都新宿区新宿4-1-6新宿ミライナタワー18Ｆ,1985,代表取締役 チョウペンサム,1,10 百万円,,,,
2024-08-01,ＳＩＥ株式会社,その他,求人なし,兵庫県神戸市中央区三宮町3-9-20南泰ビルディング 6Ｆ,2014,代表取締役 ジョ カナン,1,80 百万円,,,,
2024-08-01,株式会社ケア２１不動産,その他,求人なし,大阪府大阪市北区堂島2-2-2近鉄堂島ビル 10Ｆ,1999,代表取締役 依田 雅,1,5 百万円,,,,
2024-08-01,Ｙ　Ｓｏｆｔ　Ｊａｐａｎ株式会社,その他,求人なし,兵庫県神戸市東灘区向洋町中6-9,2008,代表取締役 ミラン・フジタ,1,85 百万円,,,,
2024-08-01,Ｏ＆Ｃペーパーバッグホールディングス株式会社,その他,求人なし,東京都中央区銀座5-12-8王子ホールディングス1号館 9Ｆ,2016,代表取締役 長谷部 明夫,1,100 百万円,,,,
2024-08-01,株式会社ＣＥｓｐａｃｅ,その他,求人なし,東京都新宿区西新宿6-5-1,2019,代表取締役社長 若泉 大輔,1,45 百万円,,,,
2024-08-01,原本株式会社,その他,求人なし,東京都千代田区麹町1-4-42Ｆ,2019,代表取締役 王 楊天,1,9 百万円,,,,
2024-08-01,紅忠黒田ラミネーション株式会社,その他,求人なし,茨城県那珂市向山字笠松1227-1,2023,代表取締役 佐々木 忠幸,1,250 百万円,,,,
2024-08-01,Ｔ＆Ｄリスクソリューションズ株式会社,その他,求人なし,東京都中央区日本橋兜町5-1兜町第1平和ビル3Ｆ,2023,代表取締役 儀賀 信利,1,50 百万円,,,,
2024-08-01,株式会社ＯＰｈｒｓ,その他,求人なし,大阪府大阪市中央区久太郎町1-8-2,2023,代表取締役 髙宮 充洋,1,10 百万円,,,,
2024-08-01,グローム・インターナショナル株式会社,その他,求人なし,東京都港区赤坂1-12-32,2023,代表取締役 菅原 正純,1,80 百万円,,,,
2024-08-01,丸金浅野商事株式会社,その他,求人なし,北海道札幌市中央区北八条西18-1-7フレクスビル,1951,代表取締役 浅野 正之,,45 百万円,,,,
2024-08-01,石狩開発株式会社,その他,求人なし,北海道石狩市新港西1-721-11石狩新港卸センター組合会館 2Ｆ,1964,代表取締役 豊岡 孝章,,33 百万円,,,,
2024-08-01,株式会社和泉組,その他,求人なし,北海道札幌市豊平区豊平四条8-1-25,1953,代表取締役 金戸 淳一,,70 百万円,,,,
2024-08-01,株式会社ＬＮＪ商事,その他,求人なし,北海道札幌市中央区大通西8-2-6ＬＮＪ札幌大通公園ビル,1972,代表取締役 大澤 利哉,,10 百万円,,,,
2024-08-01,新栄クリエイト株式会社,その他,求人なし,北海道札幌市中央区北十二条西15-4-1,1960,代表取締役 佐々木 雅一,,95 百万円,,,,
2024-08-01,北海塩業株式会社,その他,求人なし,北海道札幌市中央区北一条西16-1-27,1947,代表取締役 秋山 多平,,30 百万円,,,,
2024-08-01,株式会社エイチシーエム,その他,求人なし,北海道札幌市中央区南二条東2-8-1,1968,代表取締役 佐々木 隆年,,12 百万円,,,,
2024-08-01,ＭＩＹＡＣ株式会社,その他,求人なし,北海道札幌市中央区大通西18-1-40プログレッシブオフィス 201,1961,代表取締役 三好 康裕,,30 百万円,,,,
2024-08-01,株式会社キョーリツ事務機,その他,求人なし,北海道札幌市白石区川下2086,1976,代表取締役 西脇 勝,,50 百万円,,,,
2024-08-01,佐藤車輛部品株式会社,その他,求人なし,北海道札幌市東区北四十七条東8-2-1,1948,代表取締役 佐藤 喜勝,,10 百万円,,,,
2024-08-01,株式会社ジェイコム札幌,その他,求人なし,北海道札幌市豊平区月寒東二条18-7-20,1983,代表取締役 寺尾 弘一,,"8,800 百万円",,,,
2024-08-01,株式会社エフ・エム通商,その他,求人なし,北海道札幌市西区八軒六条東2-8-10オークビル 305,1984,代表取締役 古田 富士幸,,14 百万円,,,,
2024-08-01,株式会社北海道ジェイ・アール商事,その他,求人なし,北海道札幌市東区北六条東4-1-4ＮＥ6・4ビル 4Ｆ,1988,代表取締役 岩本 隆市,,800 百万円,,,,
2024-08-01,明成メディカル株式会社,医療機器卸,求人なし,北海道札幌市北区麻生町2-4-13,1989,代表取締役 工藤 一志,,46 百万円,,,,
2024-08-01,札幌北営株式会社,その他,求人なし,北海道札幌市西区八軒四条西4-4-6,1993,代表取締役 小松 正志,,14 百万円,,,,
2024-08-01,株式会社山一,その他,求人なし,北海道旭川市宮下通10-左5,1964,代表取締役 佐々木 睦浩,,20 百万円,,,,
2024-08-01,北海道エア・ウォーター・アグリ株式会社,その他,求人なし,北海道旭川市永山北一条10-13-5,1985,代表取締役 農端 洋行,,50 百万円,,,,
2024-08-01,株式会社合田観光商事,その他,無,北海道札幌市中央区南二条西10-1000-2ＫＵＷＡＧＡＴＡビル,1981,代表取締役 合田 高丸,,50 百万円,,,,
2024-08-01,株式会社太洋,その他,求人なし,北海道函館市北浜町10-34,1950,代表取締役 塚田 寛,,40 百万円,,,,
2024-08-01,北斗興業株式会社,その他,求人なし,北海道北斗市七重浜6-4-1,1956,代表取締役社長 柴田 健司,,20 百万円,,,,
2024-08-01,株式会社受川,その他,求人なし,北海道帯広市大通南9-19,1953,代表取締役 受川 賢一,,15 百万円,,,,
2024-08-01,本別町農業協同組合,特殊法人・財団法人・その他団体・連合会,求人なし,北海道中川郡本別町北5-2-1,1948,代表理事組合長 佐野 政利,,"1,986 百万円",,,,
2024-08-01,北日本産商株式会社,その他,求人なし,北海道苫小牧市三光町5-24-20,1978,代表取締役 後藤 潤,,30 百万円,,,,
2024-08-01,富士塗料興業株式会社,その他,求人なし,宮城県仙台市若林区卸町3-1-17,1949,代表取締役 星合 邦生,,26 百万円,,,,
2024-08-01,仙台観光株式会社,その他,求人なし,宮城県仙台市青葉区川内三十人町49-225,1967,代表取締役 延山 寛,,99 百万円,,,,
2024-08-01,株式会社北文社,その他,求人なし,宮城県仙台市太白区西中田6-4-40,1970,代表取締役 佐藤拓自,,30 百万円,,,,
2024-08-01,ミカド電装商事株式会社,その他,求人なし,宮城県仙台市若林区新寺3-4-30,1948,代表取締役社長 沢田 秀二,,24 百万円,,,,
2024-08-01,株式会社八巻商会,その他,求人なし,宮城県仙台市太白区西多賀2-6-28,1970,代表取締役 八巻 良男,,10 百万円,,,,
2024-08-01,協同組合エムビー・ネットワーク,その他,求人なし,宮城県仙台市青葉区一番町2-2-11,1992,代表理事 髙嶋 晴生,,6 百万円,,,,
2024-08-01,光和建材株式会社,その他,求人なし,福島県郡山市日和田町字原12-20,1973,代表取締役 笠原 秀幸,,20 百万円,,,,
2024-08-01,株式会社ダイサン食材,その他,求人なし,福島県郡山市駅前1-15-1,1966,代表取締役 服部 吉矩,,21 百万円,,,,
2024-08-01,株式会社あいづダストセンター,その他,求人なし,福島県会津若松市神指町大字南四合字才ノ神461,1972,代表取締役 宮下 徹,,21 百万円,,,,
2024-08-01,会津土建株式会社,その他,求人なし,福島県会津若松市追手町5-36,1948,代表取締役 菅家 忠洋,,20 百万円,,,,
2024-08-01,公益財団法人福島県保健衛生協会,特殊法人・財団法人・その他団体・連合会,求人なし,福島県福島市南中央4-21-2,1959,代表理事 鈴木 順造,,,,,,
2024-08-01,株式会社岩手牛乳,その他,求人なし,岩手県盛岡市上厨川字柳原5-8,1950,代表取締役 小泉 トシ,,95 百万円,,,,
2024-08-01,株式会社盛岡生花地方卸売市場,その他,求人なし,岩手県盛岡市羽場10地割100-3,1958,代表取締役 橋本 正,,48 百万円,,,,
2024-08-01,クシヤ株式会社,その他,求人なし,新潟県新潟市江南区東早通1-1-26,1947,代表取締役 櫛谷 努,,30 百万円,,,,
2024-08-01,株式会社サンキョーフーズ,その他,求人なし,新潟県新潟市中央区長潟2-6-17,1966,代表取締役 田畑 英樹,,10 百万円,,,,
2024-08-01,ネス株式会社,その他,求人なし,新潟県新潟市中央区南笹口1-1-13グランコンフォート笹出 1Ｆ,1973,代表取締役社長 櫛谷 正春,,10 百万円,,,,
2024-08-01,新潟空調株式会社,その他,求人なし,新潟県新潟市東区古湊町3-63,1972,代表取締役 山田 雄治,,20 百万円,,,,
2024-08-01,株式会社渡辺電気工業所,その他,求人なし,新潟県新潟市西区坂井東6-13-24,1969,代表取締役 渡辺 和博,,20 百万円,,,,
2024-08-01,株式会社アヅマテクノス,その他,求人なし,新潟県新潟市中央区弁天橋通3-9-12,1993,代表取締役 関 博司,,99 百万円,,,,
2024-08-01,株式会社コモンテックス,その他,求人なし,新潟県新潟市中央区女池神明2-3-12,1993,代表取締役 鈴木 洋康,,50 百万円,,,,
2024-08-01,ＪＦＥ精密株式会社,その他,求人なし,新潟県新潟市東区鴎島町6-5,1993,代表取締役 山崎 伸次,,450 百万円,,,,
2024-08-01,株式会社大谷ビジネス,その他,求人なし,新潟県上越市本町7-3-25,1974,代表取締役 大谷 光夫,,10 百万円,,,,
2024-08-01,スリーエムジャパンプロダクツ株式会社,その他,求人なし,東京都品川区北品川6-7-29,1970,代表取締役 伊藤 誠,,360 百万円,,,,
2024-08-01,株式会社全農ライフサポート山形,食品・GMS・ディスカウントストア,求人なし,山形県天童市長岡北4-7-18,1972,代表取締役 高橋 幸紀,,470 百万円,,,,
2024-08-01,株式会社ヨシケイ山形,その他,求人なし,山形県山形市松栄1-6-77,1978,代表取締役 佐藤 敬一,,30 百万円,,,,
2024-08-01,秋田生花株式会社,その他,求人なし,秋田県秋田市外旭川字待合28,1991,代表取締役 橋本 正史,,80 百万円,,,,
2024-08-01,株式会社栃雪,その他,無,栃木県宇都宮市江曽島町1026,1952,代表取締役 町井 海夫,,48 百万円,,,物流センター運営、業務用食品卸売事業、宅配事業■事業所：5ヶ所■関連会社：2社 2023年8月doda掲載求人より引用,
2024-08-01,アペンタクル株式会社,コールセンター,求人なし,栃木県宇都宮市下戸祭2-3-25,1984,代表取締役 山崎 文秀,,10 百万円,,,,
2024-08-01,株式会社グッドコム,その他,求人なし,栃木県宇都宮市平出町3741-11,1974,代表取締役 片山 健太,,10 百万円,,,,
2024-08-01,株式会社テクノ三和,その他,求人なし,栃木県那須塩原市北赤田1583-23,1964,代表取締役 森 功一,,20 百万円,,,,
2024-08-01,宇都宮機工株式会社,その他,求人なし,栃木県宇都宮市簗瀬町2502-7,1984,代表取締役 横塚 紀久子,,20 百万円,,,,
2024-08-01,株式会社日本理化インシュレーションズ,その他,求人なし,栃木県下都賀郡壬生町大字壬生甲3737,1997,代表取締役 大栗 崇司,,90 百万円,,,,
2024-08-01,株式会社キンセイ産業,その他,求人なし,群馬県高崎市宮原町1-1,1971,代表取締役 金子 正元,,50 百万円,,,,
2024-08-01,株式会社三陽商会,その他,求人なし,群馬県伊勢崎市連取町3313-4,1957,代表取締役 藤丸 兼一,,25 百万円,,,,
2024-08-01,株式会社環境保全センター,その他,求人なし,群馬県高崎市下大島町626,1972,代表取締役 中澤 和也,,20 百万円,,,,
2024-08-01,株式会社高草木建設,その他,求人なし,群馬県みどり市大間々町塩原96-3,1963,代表取締役 津久井 一价,,36 百万円,,,,
2024-08-01,サカモト機材株式会社,その他,求人なし,群馬県太田市別所町222-1,1975,代表取締役 坂本 詩季尾,,11 百万円,,,,
2024-08-01,株式会社伊勢甚本社,その他,求人なし,茨城県水戸市泉町3-1-28第二中央ビル 7Ｆ,1949,代表取締役 綿引 甚介,,50 百万円,,,,
2024-08-01,若葉科学株式会社,その他,求人なし,茨城県日立市若葉町3-7-6,1964,代表取締役 斉藤 寿房,,10 百万円,,,,
2024-08-01,鹿島北共同発電株式会社,その他,求人なし,茨城県神栖市東和田16,1968,代表取締役 中川 誠司,,"6,000 百万円",,,,
2024-08-01,株式会社新日東,その他,求人なし,茨城県那珂市菅谷3127,1967,代表取締役 篠原 啓一,,14 百万円,,,,
2024-08-01,株式会社サントー,その他,求人なし,茨城県行方市麻生553-4,1966,代表取締役 藤野 和芳,,12 百万円,,,,
2024-08-01,吉野電業株式会社,その他,求人なし,茨城県日立市滑川町1-5-13,1956,代表取締役 吉野 邦彦,,10 百万円,,,,
2024-08-01,茨城大学生活協同組合,特殊法人・財団法人・その他団体・連合会,求人なし,茨城県水戸市文京2-1-1茨城大学内,1967,代表理事 野澤 恵,,167 百万円,,,,
2024-08-01,株式会社産業ガステクノサービス,その他,求人なし,茨城県日立市国分町3-1-17,1987,代表取締役 篠﨑 勝洋,,25 百万円,,,,
2024-08-01,サンプラント株式会社,その他,求人なし,茨城県土浦市神立町3436-2,1980,代表取締役 大森 健二,,10 百万円,,,,
2024-08-01,公益財団法人つくば科学万博記念財団,特殊法人・財団法人・その他団体・連合会,求人なし,茨城県つくば市吾妻2-9つくばエキスポセンター,1986,代表理事 中原 徹,,,,,,
2024-08-01,株式会社アイナボホールディングス,その他,求人なし,東京都台東区元浅草2-6-6東京日産台東ビル 4Ｆ,1955,代表取締役社長 阿部 一成,,896 百万円,,,,スタンダード
2024-08-01,株式会社Ｔｏｏホールディングス,その他,無,東京都港区虎ノ門3-4-7虎ノ門36森ビル,1970,代表取締役 石井 剛太,,100 百万円,,,◆デザイン・出版・編集・印刷・CG・映像分野における画像処理機器の開発・製造・販売・保守及びシステムインテグレーション◆コンピューター用品の販売◆OA用品・OA機器の販売◆技術サービス及びサポート◆デザイン用品及び機器の開発・製造・販売 2023年12月doda掲載求人より引用,
2024-08-01,王子合金株式会社,その他,求人なし,東京都千代田区神田北乗物町11乗物町中央ビル5Ｆ,1961,代表取締役 石塚 勝一郎,,10 百万円,,,,
2024-08-01,株式会社オンワードホールディングス,その他,求人なし,東京都中央区日本橋3-10-5オンワードパークビルディング,1947,代表取締役社長 保元 道宣,,"30,079 百万円",,,,プライム
2024-08-01,株式会社銀座サクラヤ,その他,求人なし,東京都中央区銀座2-8-5銀座サクラヤビル,1949,代表取締役 浅沼 健司,,30 百万円,,,,
2024-08-01,京成電鉄株式会社,その他,無,千葉県市川市八幡3-3-1,1909,代表取締役社長 小林 敏也,,"36,803 百万円",,,,プライム
2024-08-01,三和ホールディングス株式会社,その他,求人なし,東京都新宿区西新宿2-1-1新宿三井ビル 52Ｆ,1948,代表取締役社長 執行役員社長 髙山 靖司,,"38,413 百万円",,,,プライム
2024-08-01,進藤建設株式会社,その他,求人なし,東京都中野区本町1-25-4進藤ビル 2Ｆ,1954,代表取締役 進藤 宣良,,50 百万円,,,,
2024-08-01,全国農業協同組合連合会,特殊法人・財団法人・その他団体・連合会,無,東京都千代田区大手町1-3-1ＪＡビル,1972,代表理事 野口 栄,,"115,230 百万円",,,情報が古い可能性があります。最新の情報を確認する場合はHP等をご覧ください。 『魅力ある農業づくり』『農業を守る』『心を満たす生活提案』『潤いのある地域社会の創造』を目指して、日本農業や地域社会の活性化に貢献しております。【販売事業】農家のみなさんが生産された農畜産物の販売【購買事業】農業生産や生活に必要な資材の仕入れおよび供給 2023年2月doda掲載求人より引用,
2024-08-01,東洋工業株式会社,その他,求人なし,東京都目黒区中町1-26-11ＨＩＬＬＦＯＲＴ目黒 1Ｆ,1961,代表取締役 折原 洋一,,10 百万円,,,,
2024-08-01,株式会社ＬＮＪ中通,その他,無,東京都中央区日本橋本町1-9-1Ｓ－ＧＡＴＥ日本橋本町 10Ｆ,1950,代表取締役 坂本 康弘,,95 百万円,,,,
2024-08-01,株式会社メディアリンク,その他,求人なし,東京都千代田区九段南2-3-14靖国九段南ビル,1964,代表取締役 久保田 了司,,50 百万円,,,,
2024-08-01,東信電業株式会社,その他,求人なし,東京都杉並区成田東2-30-10,1964,代表取締役 玉置 雄介,,10 百万円,,,,
2024-08-01,株式会社ＭＭコーポレーション,その他,無,東京都文京区本郷3-4-6,1975,代表取締役 北内 秀明,,100 百万円,,,,
2024-08-01,理化電子株式会社,その他,無,東京都港区三田1-4-28三田国際ビル 13Ｆ,1961,代表取締役 戸田 泰子,,100 百万円,,,,
2024-08-01,公益財団法人母子衛生研究会,特殊法人・財団法人・その他団体・連合会,求人なし,東京都千代田区外神田2-18-7ＭＣＦＨセンタービル 4Ｆ,1960,代表理事 江井 俊秀,,,,,,
2024-08-01,明光産業株式会社,その他,求人なし,東京都千代田区内神田2-11-5大沢ビル 4Ｆ,1966,代表取締役 佐々木 博,,10 百万円,,,,
2024-08-01,一般財団法人日本食品分析センター,特殊法人・財団法人・その他団体・連合会,求人なし,東京都渋谷区元代々木町52-1,1957,理事長 西村 勉,,,,,,
