更新日,名称,業界(小分類),求人有無,所在地,設立,代表者,従業員数,資本金,平均年齢,企業URL,事業内容,上場市場名
2024-08-01,日光精器株式会社,その他,求人なし,滋賀県近江八幡市馬淵町2660,1965,代表取締役 中山享一良,,80 百万円,,,,
2024-08-01,学校法人金蘭会学園,その他,無,大阪府吹田市藤白台5-25-1,1917,理事長 島﨑 靖久,,"12,247 百万円",,,学校の設置、運営◆千里金蘭大学 └栄養学部・教育学部・看護学部◆金蘭会高等学校・中学校（大阪市北区）◆金蘭会保育園（大阪市北区） 2023年10月doda掲載求人より引用,
2024-08-01,堀川化成株式会社,その他,求人なし,大阪府大阪市鶴見区横堤4-9-34,1980,代表取締役 藤本 基,,20 百万円,,,,
2024-08-01,オオサカコーワ株式会社,その他,求人なし,大阪府大阪市浪速区桜川3-4-15,1950,代表取締役 髙野 篤,,48 百万円,,,,
2024-08-01,尼信リース株式会社,その他,求人なし,兵庫県尼崎市西本町北通3-93尼崎信用金庫本店別館 2Ｆ,1986,代表取締役 石津 均,,40 百万円,,,,
2024-08-01,株式会社ディスクロードグループ,その他,求人なし,大阪府大阪市中央区博労町4-4-11,1991,代表取締役 榊原 芳樹,,20 百万円,,,,
2024-08-01,大阪商工会議所,その他,求人なし,大阪府大阪市中央区本町橋2-8,1946,会頭 尾崎 裕,,,,,,
2024-08-01,公益財団法人関西生産性本部,特殊法人・財団法人・その他団体・連合会,求人なし,大阪府大阪市北区中之島6-2-27中之島センタービル 28Ｆ,1982,代表理事 大坪 清,,,,,,
2024-08-01,株式会社進洋,その他,求人なし,大阪府大阪市西区靱本町2-2-17,1987,代表取締役 田伏儀浩,,19 百万円,,,,
2024-08-01,学校法人大阪女学院,特殊法人・財団法人・その他団体・連合会,求人なし,大阪府大阪市中央区玉造2-26-54,1938,理事長 錦織 一郎,,"4,397 百万円",,,,
2024-08-01,中央プラント株式会社,その他,求人なし,大阪府四條畷市西中野1-5-5,1977,代表取締役 宮田 正文,,10 百万円,,,,
2024-08-01,公益財団法人千里ライフサイエンス振興財団,特殊法人・財団法人・その他団体・連合会,求人なし,大阪府豊中市新千里東町1-4-2千里ライフサイエンスセンター 8Ｆ,1990,,,,,,,
2024-08-01,エムタス株式会社,その他,求人なし,石川県小松市問屋町25,1950,代表取締役 吉原 慎吾,,50 百万円,,,,
2024-08-01,株式会社グランプリ,その他,求人なし,愛知県名古屋市千種区山門町1-48-8,1980,代表取締役 田中 康範,,60 百万円,,,,
2024-08-01,一般財団法人大阪府公園協会,特殊法人・財団法人・その他団体・連合会,求人なし,大阪府大阪市中央区南船場2-6-28ユタカビル 7Ｆ,1958,代表理事 竹内 康之,,,,,,
2024-08-01,一般財団法人生産開発科学研究所,特殊法人・財団法人・その他団体・連合会,求人なし,京都府京都市左京区下鴨森本町15,1947,代表理事 髙野 幹夫,,,,,,
2024-08-01,一文株式会社,その他,求人なし,京都府京都市中京区堺町通三条下る道祐町141,1950,代表取締役 滋賀 恒正,,98 百万円,,,,
2024-08-01,高津装飾美術株式会社,その他,求人なし,東京都調布市国領町1-30-3,1944,代表取締役 南 健太郎,,50 百万円,,,,
2024-08-01,公益財団法人関西文化学術研究都市推進機構,特殊法人・財団法人・その他団体・連合会,無,京都府相楽郡精華町光台1-7けいはんなプラザ交流棟 3Ｆ,1986,代表理事 堀場 厚,,,,,,
2024-08-01,株式会社ＧＳユアサ環境科学研究所,その他,求人なし,京都府京都市南区吉祥院新田壱ノ段町5,1984,代表取締役 花井 靖男,,20 百万円,,,,
2024-08-01,福田印刷工業株式会社,その他,求人なし,兵庫県神戸市東灘区魚崎西町4-6-3,1947,代表取締役 椎名 高久,,91 百万円,,,,
2024-08-01,株式会社兵庫蓄電池,その他,求人なし,兵庫県神戸市長田区海運町8-6-14,1954,代表取締役 西岡 康裕,,20 百万円,,,,
2024-08-01,株式会社三洋商事,その他,求人なし,大阪府大阪市北区中崎西2-4-12梅田センタービル 8Ｆ,1957,代表取締役 佐藤 博之,,20 百万円,,,,
2024-08-01,一般財団法人神戸観光局,特殊法人・財団法人・その他団体・連合会,求人なし,兵庫県神戸市中央区御幸通6-1-12三宮ビル東館 9Ｆ,1987,代表理事 会長 尾山 基,,,,,,
2024-08-01,近畿海洋株式会社,その他,求人なし,兵庫県西宮市津門大箇町2-23,1985,代表取締役 後藤 壽明,,20 百万円,,,,
2024-08-01,エア・リキード工業ガス株式会社,その他,求人なし,兵庫県尼崎市南塚口町4-3-23,1981,代表取締役 中村 健二,,20 百万円,,,,
2024-08-01,大谷商事株式会社,その他,求人なし,兵庫県神戸市東灘区本山南町4-3-16甲南グランドハイム本山 102,1990,代表取締役 大谷 栄二,,10 百万円,,,,
2024-08-01,東亜商事株式会社,その他,無,兵庫県姫路市広畑区吾妻町1-68,1964,代表取締役 永尾 徹,,10 百万円,,,,
2024-08-01,ヒメジ理化株式会社,その他,求人なし,兵庫県姫路市夢前町杉之内17,1968,代表取締役 赤錆 充,,60 百万円,,,,
2024-08-01,マリヤ医科興業株式会社,医療機器卸,求人なし,兵庫県豊岡市寿町10-10,1951,代表取締役 熊本 謙一,,27 百万円,,,,
2024-08-01,徳島製粉株式会社,食品・飲料メーカー（原料含む）,求人なし,徳島県徳島市南二軒屋町3-1-8,1943,代表取締役 田中 信義,,29 百万円,,,,
2024-08-01,鳥越製粉株式会社,その他,求人なし,福岡県福岡市博多区比恵町5-1,1935,代表取締役会長 兼 社長 鳥越 徹,,"2,805 百万円",,,,スタンダード
2024-08-01,松野プレス工業株式会社,その他,求人なし,福岡県直方市大字中泉891-6,1959,代表取締役 守谷 公男,,13 百万円,,,,
2024-08-01,株式会社河内源一郎商店,その他,求人なし,鹿児島県霧島市溝辺町麓876-15,1953,代表取締役 山元 正博,,10 百万円,,,,
2024-08-01,太平自動販売機サービス株式会社,その他,求人なし,宮城県多賀城市明月2-1-42,1974,代表取締役 中島 弘,,30 百万円,,,,
2024-08-01,東北油化工業株式会社,その他,求人なし,宮城県仙台市宮城野区蒲生字八郎兵エ谷地第二112-10,1947,代表取締役 松原 柳子,,12 百万円,,,,
2024-08-01,株式会社井手口,その他,求人なし,東京都中央区入船3-10-9新富町ビル 7Ｆ,1948,代表取締役 對比地 徳明,,50 百万円,,,,
2024-08-01,一般財団法人日本海事協会,特殊法人・財団法人・その他団体・連合会,求人なし,東京都千代田区紀尾井町4-7,1936,会長 坂下 広朗,,,,,,
2024-08-01,アサヒビジネス株式会社,その他,求人なし,東京都荒川区東尾久1-18-14,1977,代表取締役 髙田 和正,,12 百万円,,,,
2024-08-01,日本フルーツ加工株式会社,その他,求人なし,埼玉県さいたま市中央区本町西6-5-11,1973,代表取締役 鶴身 忠司,,10 百万円,,,,
2024-08-01,株式会社アート１,その他,求人なし,神奈川県大和市下草柳822-3,1990,代表取締役 秋本 政弘,,10 百万円,,,,
2024-08-01,アマノメンテナンスエンジニアリング株式会社,その他,無,神奈川県横浜市港北区菊名7-3-22アマノ第2ギャラクシービル 4Ｆ,1999,代表取締役 十朱 佳頻,,30 百万円,,,,
2024-08-01,ケイアイ精密工業株式会社,その他,求人なし,神奈川県相模原市緑区根小屋672,1970,代表取締役 久保田 健,,10 百万円,,,,
2024-08-01,株式会社伊藤製作所,その他,求人なし,神奈川県藤沢市弥勒寺108,1962,代表取締役 山田 圭一,,12 百万円,,,,
2024-08-01,株式会社名港海事商会,その他,求人なし,愛知県名古屋市港区入船1-7-28,1954,代表取締役 稲吉 俊宏,,10 百万円,,,,
2024-08-01,株式会社環境公害センター,その他,求人なし,愛知県名古屋市守山区花咲台2-201,1973,代表取締役 金田 哲夫,,32 百万円,,,,
2024-08-01,東洋冷蔵フード＆ロジスティクス株式会社,その他,求人なし,静岡県静岡市清水区島崎町161-13,1988,代表取締役 近藤 克彦,,20 百万円,,,,
2024-08-01,公益財団法人光科学技術研究振興財団,特殊法人・財団法人・その他団体・連合会,求人なし,静岡県浜松市中央区砂山町325-6日本生命浜松駅前ビル 4Ｆ,1988,代表理事 晝馬 明,,,,,,
2024-08-01,株式会社ナガオカ,その他,求人なし,大阪府大阪市北区東天満2-5-17古林タワービル 4Ｆ,1974,代表取締役 東 勲,,10 百万円,,,,
2024-08-01,株式会社カワキ屋クリーニング店,その他,求人なし,兵庫県西宮市西宮浜2-21-8,1950,代表取締役 石崎 二郎,,20 百万円,,,,
2024-08-01,ひめしんリース株式会社,その他,求人なし,兵庫県姫路市十二所前町105,1986,代表取締役 廣村 尚良,,30 百万円,,,,
2024-08-01,島村青果株式会社,その他,求人なし,岡山県岡山市南区市場1-1,1964,代表取締役 田中 雅治,,30 百万円,,,,
2024-08-01,協和機工株式会社,その他,求人なし,山口県周南市千代田町11-34,1971,代表取締役 藤原 弘,,20 百万円,,,,
2024-08-01,一般財団法人九州環境管理協会,特殊法人・財団法人・その他団体・連合会,求人なし,福岡県福岡市東区松香台1-10-1,1972,代表理事 百島 則幸,,,,,,
2024-08-01,福山商事株式会社,その他,求人なし,沖縄県浦添市牧港4-14-17,1951,代表取締役 福山 一郎,,51 百万円,,,,
2024-08-01,大崎生コンクリート協同組合,特殊法人・財団法人・その他団体・連合会,求人なし,宮城県大崎市古川諏訪2-5-34,1976,代表理事 尾出 敏行,,34 百万円,,,,
2024-08-01,花楯産業株式会社,通信販売・ネット販売,求人なし,山形県山形市花楯2-14-60,1977,代表取締役 細川 博之,,20 百万円,,,,
2024-08-01,秋田基準寝具株式会社,その他,求人なし,秋田県秋田市八橋字イサノ6-1,1963,代表取締役 柳原 正俊,,20 百万円,,,,
2024-08-01,浅野商事株式会社,その他,無,東京都中央区銀座2-4-19浅野第3ビル 8Ｆ,1952,代表取締役 浅野 邦彦,,96 百万円,,,,
2024-08-01,フジノボールチェーン株式会社,その他,求人なし,東京都板橋区新河岸2-19-3,1971,代表取締役 増田 範子,,20 百万円,,,,
2024-08-01,大同計器株式会社,その他,求人なし,東京都品川区小山6-16-6,1956,代表取締役 広田 敏治,,10 百万円,,,,
2024-08-01,ジャパンカスタム株式会社,その他,求人なし,東京都東村山市久米川町3-30-25ＪＣＫビル 1Ｆ,1974,代表取締役 高橋 英統,,12 百万円,,,,
2024-08-01,電気通信大学生活協同組合,特殊法人・財団法人・その他団体・連合会,求人なし,東京都調布市調布ケ丘1-5-1電気通信大学,1960,代表理事 結城 宏信,,83 百万円,,,,
2024-08-01,富士アクア株式会社,その他,求人なし,山梨県南都留郡西桂町下暮地367,1995,代表取締役 小森 康伸,,40 百万円,,,,
2024-08-01,泉電機株式会社,その他,無,神奈川県秦野市平沢183-3ひらさわテクノビバ,1984,代表取締役 泉 順一郎,,15 百万円,,,情報が古い可能性があります。最新の情報を確認する場合はHP等をご覧ください。 各種制御盤及び自動制御盤装置の設計製作並びに現地付帯工事・調整業務など 2022年4月doda掲載求人より引用,
2024-08-01,ヴァレオカペックジャパン株式会社,その他,求人なし,神奈川県厚木市飯山南3-17-72,1986,代表取締役 キリジャン・ジル,,"2,460 百万円",,,,
2024-08-01,株式会社山田製菓,その他,求人なし,愛知県名古屋市西区天塚町1-44,1976,代表取締役 山田 晃司,,10 百万円,,,,
2024-08-01,オーム電気工業株式会社,その他,求人なし,愛知県海部郡大治町大字鎌須賀字郷前35,1977,代表取締役 杉浦 友昭,,10 百万円,,,,
2024-08-01,フタバ電子工業株式会社,その他,無,三重県津市河芸町中別保1861,1985,代表取締役 前田 英則,,60 百万円,,,,
2024-08-01,株式会社永田商会,その他,求人なし,兵庫県神戸市須磨区弥栄台3-3-4,1969,代表取締役 佐々木智敎,,16 百万円,,,,
2024-08-01,株式会社明河洋行,文具・事務機器関連 （商社）,求人なし,熊本県熊本市南区流通団地1-29熊本市流通団地,1948,代表取締役 河岸 義彦,,10 百万円,,,,
2024-08-01,株式会社曙,その他,無,東京都中央区日本橋浜町2-39-2,1969,代表取締役 細野 佳代,,48 百万円,,,,
2024-08-01,日建塗装工業株式会社,その他,求人なし,東京都荒川区荒川7-18-2,1947,代表取締役 砂田 耕作,,100 百万円,,,,
2024-08-01,相模マイクロ株式会社,その他,求人なし,神奈川県座間市ひばりが丘5-34-23,1965,代表取締役 中西 和彦,,25 百万円,,,,
2024-08-01,ロイヤルホールディングス株式会社,その他,無,福岡県福岡市博多区那珂3-28-5,1950,代表取締役社長 阿部 正孝,,"17,830 百万円",,,,プライム
2024-08-01,株式会社東海分析化学研究所,その他,求人なし,愛知県豊川市御津町赤根下川50,1972,代表取締役 大場 和子,,10 百万円,,,,
2024-08-01,ユニオン給食株式会社,その他,求人なし,北海道札幌市白石区東札幌五条2-8-19,1964,代表取締役 堀川 輝男,,25 百万円,,,,
2024-08-01,社会医療法人柏葉会,特殊法人・財団法人・その他団体・連合会,求人なし,北海道札幌市豊平区月寒東一条15-7-20,1980,理事長 寺坂 俊介,,888 百万円,,,,
2024-08-01,株式会社札幌東急ホテルズ,その他,無,北海道札幌市中央区南四条西5-1,1979,代表取締役 飯塚 雅人,,10 百万円,,,,
2024-08-01,株式会社ＣＥホールディングス,その他,求人なし,北海道札幌市白石区平和通15-北1-21,1996,代表取締役社長 齋藤 直和,,"1,224 百万円",,,,スタンダード
2024-08-01,学校法人東北医科薬科大学,その他,求人なし,宮城県仙台市青葉区小松島4-4-1,1939,理事長 高柳 元明,,"45,764 百万円",,,,
2024-08-01,株式会社小島製作所,その他,求人なし,福島県いわき市好間工業団地16-12,1968,代表取締役 菅波 大典,,10 百万円,,,,
2024-08-01,株式会社伊部鉄工所,その他,求人なし,東京都足立区千住東1-2-9,1954,代表取締役 伊部 宏次,,35 百万円,,,,
2024-08-01,株式会社共同紙販ホールディングス,その他,無,東京都台東区北上野1-9-12住友不動産上野ビル 6Ｆ,1952,代表取締役 社長執行役員 市川 裕三,,100 百万円,,,,スタンダード
2024-08-01,進竹産業株式会社,その他,求人なし,東京都葛飾区宝町1-26-18,1963,代表取締役 進藤 竹之助,,32 百万円,,,,
2024-08-01,株式会社全農ビジネスサポート,特殊法人・財団法人・その他団体・連合会,求人なし,東京都文京区小石川1-1-1文京ガーデンゲートタワー 10Ｆ,1960,代表取締役 久保田 治己,,594 百万円,,,,
2024-08-01,中央電材株式会社,その他,求人なし,東京都昭島市昭和町4-1-27,1953,代表取締役 榊原 徹也,,29 百万円,,,,
2024-08-01,東洋電熱株式会社,その他,求人なし,東京都大田区城南島2-3-6,1958,代表取締役 松尾 哲哉,,25 百万円,,,,
2024-08-01,株式会社マースグループホールディングス,その他,求人なし,東京都新宿区新宿1-10-7,1974,代表取締役社長 松波 明宏,,"7,934 百万円",,,,プライム
2024-08-01,一般財団法人海外産業人材育成協会,特殊法人・財団法人・その他団体・連合会,求人なし,東京都足立区千住東1-30-1,1959,理事長 桒山 信也,,,,,,
2024-08-01,公益財団法人東京都公園協会,特殊法人・財団法人・その他団体・連合会,無,東京都新宿区歌舞伎町2-44-1東京都健康プラザハイジア 9Ｆ,1954,代表理事 佐藤 伸朗,,,,,都市緑化、公園緑地、河川及び水辺環境に関する事業を通して、都民生活に安らぎとゆとりをもたらし、あわせて日本の文化を世界に発信する。 2024年1月doda掲載求人より引用,
2024-08-01,一般財団法人金属系材料研究開発センター,特殊法人・財団法人・その他団体・連合会,求人なし,東京都港区西新橋1-5-11第11東洋海事ビル 6Ｆ,1985,代表理事 小紫 正樹,,,,,,
2024-08-01,公益社団法人東京電気管理技術者協会,特殊法人・財団法人・その他団体・連合会,求人なし,東京都千代田区麹町5-1ＮＫ真和ビル 2Ｆ,1970,会長 荒井 行雄,,,,,,
2024-08-01,公益社団法人日本下水道協会,特殊法人・財団法人・その他団体・連合会,求人なし,東京都千代田区内神田2-10-12内神田すいすいビル 5Ｆ,1965,代表理事 岡久 宏史,,,,,,
2024-08-01,特別区競馬組合,特殊法人・財団法人・その他団体・連合会,求人なし,東京都品川区勝島2-1-2,1950,,,,,,,
2024-08-01,イワムラトレーディング株式会社,その他,求人なし,東京都品川区東五反田1-21-9ウィスタリア東五反田ビル 4Ｆ,1985,代表取締役 原田 直子,,10 百万円,,,,
2024-08-01,松永ジオサーベイ株式会社,その他,求人なし,東京都品川区大井1-23-1カクタビル 2Ｆ,1978,代表取締役 山中 和彦,,12 百万円,,,,
2024-08-01,公益社団法人雪センター,特殊法人・財団法人・その他団体・連合会,求人なし,東京都中央区日本橋堀留町1-3-17日本橋三洋ビル 7Ｆ,1990,代表理事 石河 信一,,,,,,
2024-08-01,一般社団法人日本クレジット協会,特殊法人・財団法人・その他団体・連合会,求人なし,東京都中央区日本橋小網町14-1住生日本橋小網町ビル 6Ｆ,1967,代表理事 山本 豊,,,,,,
2024-08-01,株式会社和光製作所,その他,求人なし,埼玉県越谷市七左町6-182-2,1976,代表取締役 山田 二三夫,,10 百万円,,,,
2024-08-01,株式会社渡辺,その他,求人なし,埼玉県川口市芝中田1-23-21,1977,代表取締役 渡辺 正義,,35 百万円,,,,
2024-08-01,株式会社現代計装,その他,求人なし,埼玉県草加市青柳7-36-10,1984,代表取締役 宮武 大輔,,10 百万円,,,,
2024-08-01,丸十システム有限会社,その他,求人なし,千葉県柏市西原7-3-1,1999,代表取締役 竹内 康治,,5 百万円,,,,
2024-08-01,株式会社ピーデー,その他,求人なし,東京都東大和市上北台3-429-2,1972,代表取締役 福田 能和,,20 百万円,,,,
2024-08-01,東京電子交易株式会社,その他,求人なし,東京都立川市柴崎町5-16-30,1977,代表取締役 佐土原 秀樹,,19 百万円,,,,
2024-08-01,田辺商事株式会社,その他,求人なし,神奈川県横浜市中区山下町71-2,1923,代表取締役 田辺 哲郎,,90 百万円,,,,
2024-08-01,あいざわ株式会社,その他,求人なし,神奈川県横浜市金沢区鳥浜町14-2,1964,代表取締役 相澤 誠,,30 百万円,,,,
2024-08-01,株式会社レインボー,その他,求人なし,神奈川県川崎市高津区溝口3-21-15丸勝ビル 1Ｆ,1993,代表取締役 赤津 英世,,30 百万円,,,,
2024-08-01,株式会社コーシンサービス,その他,求人なし,静岡県磐田市笠梅1220-18,1973,代表取締役 青島 邦信,,15 百万円,,,,
2024-08-01,多田ポンプ株式会社,その他,求人なし,大阪府大阪市西区新町3-7-14メゾン多田 1Ｆ,1955,代表取締役 多田 吉孝,,25 百万円,,,,
2024-08-01,近畿大学生活協同組合,特殊法人・財団法人・その他団体・連合会,求人なし,大阪府東大阪市小若江3-4-1近畿大学内,1973,代表理事 中口 譲,,471 百万円,,,,
2024-08-01,大阪公立大学生活協同組合,特殊法人・財団法人・その他団体・連合会,求人なし,大阪府大阪市住吉区杉本3-3-138,1962,代表理事 堀 隆行,,304 百万円,,,,
2024-08-01,一般社団法人人間生活工学研究センター,特殊法人・財団法人・その他団体・連合会,求人なし,大阪府大阪市北区梅田1-11-4大阪駅前第4ビル 1606,1991,代表理事 飯田 健夫,,,,,,
2024-08-01,株式会社ウェルテクノ,その他,求人なし,富山県富山市興人町2-62,1999,代表取締役 藤井 公祥,,29 百万円,,,,
2024-08-01,株式会社理工化学研究所,その他,求人なし,京都府宇治市槇島町落合144-1,1980,代表取締役 髙井 宏之,,14 百万円,,,,
2024-08-01,株式会社更井豊商店,その他,求人なし,岡山県岡山市南区福成2-13-22,1957,代表取締役 藤原 道郎,,10 百万円,,,,
2024-08-01,公益財団法人岡山県健康づくり財団,特殊法人・財団法人・その他団体・連合会,求人なし,岡山県岡山市北区平田408-1,1991,理事長 松山 正春,,,,,,
2024-08-01,中川電機株式会社,その他,求人なし,岡山県倉敷市水島川崎通1-1-459,1967,代表取締役 中川 弘治,,10 百万円,,,,
2024-08-01,堂本食品株式会社,その他,求人なし,広島県広島市安佐南区伴中央4-18-2,1965,代表取締役 堂本 高義,,60 百万円,,,,
2024-08-01,セイコービジネス株式会社,その他,求人なし,広島県呉市郷原町4010-11,1972,代表取締役 宇都宮 公徳,,20 百万円,,,,
2024-08-01,一般財団法人四国電気保安協会,特殊法人・財団法人・その他団体・連合会,求人なし,香川県高松市林町331-2,1965,理事長 酒井 達夫,,,,,,
2024-08-01,株式会社ＯＫセンター,その他,求人なし,愛媛県今治市泉川町2-2-36,1968,代表取締役 相原 正樹,,10 百万円,,,,
2024-08-01,協同組合エイケイケイ,その他,求人なし,熊本県熊本市南区流通団地1-9,1980,代表理事 富永 哲生,,41 百万円,,,,
2024-08-01,株式会社サニタリー,その他,求人なし,鹿児島県鹿児島市東谷山5-20-11,1971,代表取締役 池本 宗隆,,12 百万円,,,,
2024-08-01,東北セキスイハイム工業株式会社,住宅設備・建材メーカー,求人なし,宮城県亘理郡亘理町逢隈田沢字壇ノ越55,1976,代表取締役 佐藤 公紀,,100 百万円,,,,
2024-08-01,株式会社大湊精電社,その他,求人なし,青森県むつ市大湊新町8-5,1970,代表取締役 柳谷 敬,,30 百万円,,,,
2024-08-01,佐々木塗料株式会社,その他,求人なし,青森県八戸市卸センター1-8-8,1957,代表取締役 佐々木 悠,,10 百万円,,,,
2024-08-01,学校法人産業教育事業団,特殊法人・財団法人・その他団体・連合会,求人なし,栃木県栃木市平柳町2-1-38,1984,理事長 川嶋 武美,,943 百万円,,,,
2024-08-01,新明電材株式会社,その他,求人なし,東京都品川区南品川2-3-3,1964,代表取締役 谷岡 千代和,,10 百万円,,,,
2024-08-01,株式会社黒田屋商店,その他,求人なし,東京都墨田区吾妻橋3-7-14,1951,代表取締役 賀茂 美一,,10 百万円,,,,
2024-08-01,明治安田商事株式会社,その他,求人なし,東京都江東区東陽4-1-7佐藤ダイヤビルディング 2Ｆ,1975,代表取締役社長 松田 昭寿,,10 百万円,,,,
2024-08-01,東美商亊株式会社,その他,求人なし,東京都新宿区西新宿6-24-1西新宿三井ビルディング 9Ｆ,1970,代表取締役社長 上野 隆,,15 百万円,,,,
2024-08-01,一般財団法人民間都市開発推進機構,特殊法人・財団法人・その他団体・連合会,求人なし,東京都江東区豊洲3-3-3豊洲センタービル 8Ｆ,1987,代表理事 橋本 元秀,,,,,,
2024-08-01,公益財団法人未来工学研究所,特殊法人・財団法人・その他団体・連合会,求人なし,東京都江東区深川2-6-11富岡橋ビル 4Ｆ,1971,理事長 平澤 冷,,,,,,
2024-08-01,危険物保安技術協会,特殊法人・財団法人・その他団体・連合会,求人なし,東京都港区虎ノ門4-3-13ヒューリック神谷町ビル 1Ｆ,1976,理事長 米澤 健,,,,,,
2024-08-01,一般社団法人日本舶用工業会,特殊法人・財団法人・その他団体・連合会,求人なし,東京都港区虎ノ門1-13-3虎ノ門東洋共同ビル 5Ｆ,1956,代表理事 小田 雅人,,,,,,
2024-08-01,株式会社山梨文化会館,その他,求人なし,山梨県甲府市北口2-6-10山梨文化会館,1961,代表取締役 奈良田 伸司,,10 百万円,,,,
2024-08-01,ＴＤＫプレシジョンツール株式会社,その他,求人なし,神奈川県横浜市都筑区大熊町191,1988,代表取締役 佐藤 裕三,,10 百万円,,,,
2024-08-01,横浜ピーピーエム株式会社,その他,求人なし,神奈川県横浜市戸塚区戸塚町1006-5,1979,代表取締役 服部 堅司,,12 百万円,,,,
2024-08-01,株式会社八木商会,その他,求人なし,愛知県名古屋市中区伊勢山2-4-7,1967,代表取締役 八木 誠,,10 百万円,,,,
2024-08-01,イムラ・ジャパン株式会社,その他,求人なし,愛知県刈谷市八軒町2-36,1992,代表取締役 田内 比登志,,20 百万円,,,,
2024-08-01,株式会社インダストリーコーワ,その他,求人なし,愛知県あま市西今宿平割一22,1994,代表取締役 服部 直希,,10 百万円,,,,
