更新日,名称,業界(小分類),求人有無,事業内容,所在地,設立,上場市場名,従業員数,資本金,平均年齢,企業URL,代表者
2024-07-01,東日本スターワークス株式会社（スターワークスグループ）,技術系アウトソーシング（特定技術者派遣）,5,■機械・電気・電子・情報・化学分野における開発・設計アウトソーシング事業許認可（派）04-300268■自動化・省力化装置の構想～製作、治工具・消耗部品製作■足こぎ車いす【Profhand（プロファンド）】の技術支援および販売・普及支援,宮城県仙台市青葉区中央 1-2-3 仙台マークワン 19F,2004,,,9400万円（グループ合計）,45.0,https://www.star-east.com/,代表取締役 飯田 仁也
2024-08-01,株式会社ＳＲＣ,求人サイト・求人メディア,1,「地域で最も愛され、必要とされる企業」■ＳＲＣとは、企業との関わり（Solution sales）、地域社会との関わり（Rich relations）、個人との関わり（Careers creation）の3つの関わりを意味しています。,兵庫県神戸市中央区三宮町2-7-4神戸日興ビル7F,1989,,168,10百万円,32.0,"Failed to retrieve page, status code: 410",
2024-08-01,株式会社グラスト,人材派遣,25,事業内容： 人材派遣サービス＜オフィスサポート事業部＞・一般事務・営業事務・代表受付・テレフォンオペレーター など＜メディケアサポート事業部＞・介護ヘルパー・介護士・看護師・看護助手 など,東京都渋谷区渋谷3-10-13TOKYU REIT渋谷Rビル6F,2005,,260,50百万円,27.6,https://www.grust.co.jp/,
2024-08-01,株式会社D4cプレミアム,人材派遣,2,株式会社D4cプレミアムはビッグデータ解析を武器としたコンサルティングサービスを、マーケティング分野、金融分野、医療製薬分野などへ幅広く提供しております。《事業内容》・ データ解析業務のアウトソーシング・ アナリティクス業務のシステム化企画、実装支援データ解析適用業務・ マーケティング系、金融系等の運用コンサルティング、データ解析スペシャリストの派遣,東京都港区南麻布5-2-32興和広尾ビル,2005,,70,45百万円,,"Failed to retrieve page, status code: 410",
2024-08-01,株式会社インター･ベル,人材派遣,6,■事業内容： (1)アパレルエージェント事業・人材紹介、アパレル転職支援サービス・アパレル販売コンサルタント派遣・教育、VMD事業(2)リテールプロデュース事業(販売代行),東京都港区新橋4-1-1新虎通りCORE,2005,,305,73百万円,29.0,https://www.interbelle.co.jp/,
2024-08-01,株式会社ＦＭＣ,アウトソーシング,1,モノづくりの現場を包括的にサポートするオールラウンダー地域密着の対応力と豊富な経験でサポートするアウトソーシングカンパニー,神奈川県横浜市中区本町2-22 京阪横浜ビル3F,2020,,800,"1,000万円",,https://qit-fmc.co.jp/,代表取締役 山本 末広
2024-07-01,株式会社綜合キャリアオプション,人材派遣,7,■人材サービス事業〈人材派遣、人材紹介、紹介予定派遣等〉■コールセンター事業■CRMシステム事業■事務委託■アウトソーシング事業■採用・教育・人事コンサルティング事業■外国（特定技能）人材グローバル事業◎綜合キャリアオプションの拠点数 ※グループ計169店舗（国内）※2023年3月末時点,東京都港区浜松町2-4-1 世界貿易センタービルディング南館16F,2001,,2385,【単体】5000万円 【連結】4億円,30.0,https://sougo-career.co.jp/,代表取締役 大泉 高太
2024-08-01,株式会社レックスアドバイザーズ,人材紹介・職業紹介,3,■事業概要：会計業界・成長企業の採用支援と、会計業界・管理部門のプロフェッショナルの方々に向けたキャリア支援を展開しております。,東京都千代田区平河町2-16-1,2002,,99,60百万円,33.0,http://www.career-adv.jp/,
2024-08-01,株式会社レソリューション,人材派遣,11,■事業内容：自動車整備士、板金塗装・フロントアドバイザーなど、自動車の専門スキルに特化し下記の事業を展開しています。（1）就職・転職支援事業（2）求人・採用支援事業 （3）経営コンサルティング業（4）有料職業紹介業（5）労働者派遣業（一般・紹介予定）（6）業務請負業,東京都千代田区外神田4-14-1秋葉原UDX サウスウィング10F,2005,,1400,10百万円,,https://www.resolution.co.jp/profile,
2024-08-01,株式会社博報堂コネクト,コールセンター,2,■事業内容：・ダイレクトビジネスの支援・ECビジネスの支援・CRMの運営支援・コンタクトセンター運営受託、構築支援、コンサルティング・外部ベンダーマネジメントの受託・キャンペーン事務局、公共事務局の運営受託・BPO業務の運営受託・情報システム構築、運用受託,東京都江東区豊洲5-6-15NBF豊洲ガーデンフロント9F,2005,,341,50百万円,,https://hakuhodo-connect.co.jp/,
2024-07-01,株式会社アクセル,アウトソーシング,1,■ものづくりサポート（派遣許可番号：派23-020466）■品質サポート■テクニカルサービス■業務請負サービス■有料職業紹介（23-ユ-300047）■警備サポート（54000924）■メディア事業,愛知県名古屋市中区錦1-6-36 N.A.Pビル6F（本社）,1991,,1350,5000万円（グループ資本／2億4500万円）,33.0,https://www.758accel.com/,代表取締役 稲部 速人
2024-08-01,株式会社アネブル,技術系アウトソーシング（特定技術者派遣）,37,■事業概要：・エンジン性能試験・信頼性評価・自動車部品、プロトタイプの開発・製造事業 ・モータースポーツ部品の輸入・開発・販売・サービス事業・海外情報の収集と部品輸入事業※自動車メーカー・自動車部品メーカーからのエンジン試験業務の請負が中心です。,愛知県刈谷市小垣江町大津崎1-36,2005,,256,100百万円,35.6,http://www.enable-os.co.jp/,
2024-07-01,株式会社アンフ・スタイル,人材派遣,1,■ 一般労働者派遣事業（人材派遣）厚生労働大臣許可番号【派27-300683】■ 有料職業紹介業（人材紹介）厚生労働大臣許可番号【27-ユ-300515】■ アウトソーシング受託事業■ コンサルティング事業,大阪府大阪市中央区伏見町4-2-14 WAKITA藤村御堂筋ビル2F,2006,,98,,30.0,https://unf-style.com/,代表取締役 重豊 純
2024-06-01,株式会社アイ・エス・エス・コンサルティング,人材紹介・職業紹介,1,■事業内容：外資系企業に特化した人材紹介／キャリアコンサルティングサービスを提供しています。紹介求人の約98％が外資系企業で、外資系企業3000社以上の求人を紹介しています。年収800万円～1200万円クラスのハイクラス求人特集や各外資系企業インタビューなど、様々なコンテンツの利用が可能です。,東京都港区虎ノ門4-1-1神谷町トラストタワー23F,2006,,,50百万円,47.0,http://www.isssc.com/,
2024-08-01,テルモヒューマンクリエイト株式会社,人材紹介・職業紹介,10,東証プライム市場上場テルモ株式会社の100％出資会社です。■事業内容：品質検査業務の請負事業、労働者派遣事業（派13-301798）、有料職業紹介事業（13-ユ-301388）、能力開発・人材開発に関する教育訓練・研修事業など,東京都渋谷区幡ヶ谷2-44-1,2006,,852,30百万円,46.0,https://www.terumohumancreate.co.jp/,
2024-08-01,ジェット株式会社,技術系アウトソーシング（特定技術者派遣）,4,■事業内容：（１）エンジニア派遣事業：設計・生産技術・品質管理などスキルの高いエンジニアをお客様のニーズにあわせて派遣（２）請負事業：３次元データ作成（CADを使った製品企画・開発・設計）、検査装置、作動用データなどの作成、リバースエンジニアリング,岐阜県各務原市蘇原青雲町5-66-1,2005,,18,30百万円,37.5,https://www.jett-inc.com,
2024-08-01,株式会社ダイコーテクノ,技術系アウトソーシング（特定技術者派遣）,5,■事業優位性：同社は日本国内の産業界に広く貢献し、独自のエンジニアリングでモノ作りの現場を支えています。本社を広島に構え、東京、名古屋、福岡に営業所を開設し、自動車、電気製品、機械、IT関連等の高い技術力・開発力を自負しております。そして、あくまでもモノを作るのは人であり、人の成長こそが会社の発展につながると考え、「財産は人」という経営方針を念頭に業界No.1を目指し続けています。新入社員研修をはじめ、エンジニアとしてのキャリアアップ研修、専門性を高めるスペシャリスト養成講座など、多彩なカリキュラムを用意し社員一人一人の成長を強烈に支援しています。,広島県広島市中区東平塚町1-14大興平塚ビル5F,2003,,195,20百万円,33.0,http://www.daikonet.gr.jp/,
2024-07-01,株式会社BizPlatform,人材紹介・職業紹介,12,■事業内容：ビジネスマッチングを中心とした中小企業向け総合コンサルタント事業を行っています。・税理士・社労士事務所コンサル事業・中小企業支援事業,埼玉県さいたま市大宮区宮町4-149-3第8藤島ビル2F,2006,,280,26百万円,29.0,https://www.bizplatform.co.jp,
2024-08-01,ＡＫＫＯＤｉＳコンサルティング株式会社,技術系アウトソーシング（特定技術者派遣）,99+,弊社は、2023年4月1日付で社名を「AKKODiS （アコーディス）コンサルティング株式会社」へ変更し、日本において提供する事業ブランド名称もModisから「AKKODiS」へ変更いたしました。社名および事業ブランド名称の変更によって新たなスタートを切ったAKKODiSコンサルティング株式会社は、イノベーションを支援するエンドツーエンドのコンサルティングサービスを提供する企業として事業を展開してまいります。,東京都港区芝浦3-4-1グランパークタワー3F,2004,,10063,"1,063百万円",34.0,https://www.akkodis.co.jp/,
2024-08-01,株式会社デルタエンジニアリング,人材派遣,4,■事業内容：技術者派遣、受託、委託、請負、有料職業紹介事業,東京都千代田区有楽町1-7-1有楽町電気ビル北館6F,2003,,267,50百万円,36.0,https://www.delta-group.co.jp/totec/,
2024-07-01,株式会社エム・アール・アイ・ジャパン,人材紹介・職業紹介,4,■事業内容：世界最大の人材サーチネットワークMRI Networkの日本オフィスとして、人材サーチ コンサルティング＆リクルートメントを行っています。,東京都千代田区内幸町2-2-2富国生命ビル10F,2004,,9,50百万円,,https://www.mri-tmg.jp/,
2024-08-01,株式会社プレアデス,人材紹介・職業紹介,35,■事業内容：・人材紹介事業・人材派遣事業,東京都港区東新橋1-9-2汐留住友ビル14F,2006,,175,50百万円,29.0,https://www.pleiades-net.co.jp/,
2024-07-01,株式会社ダイレクト・リンク,アウトソーシング,3,■IT商材の販売■インサイドセールスのアウトソーシングサービス,東京都港区六本木1-4-5 アークヒルズサウスタワー3F,2006,,200,7000万円,31.0,https://www.direct-link.jp/,代表取締役社長 西村 宗晃
2024-08-01,株式会社エムステージ,人材紹介・職業紹介,32,■事業内容：・人材総合サービス事業…採用コンサルティング、求人情報サイト運営、人材紹介（厚生労働大臣許可13-ュ-010928）、医師のリスクマネジメント＆ライフサポート・企業向け産業医サポート事業…導入・産業保険業務コンサルティング、業務管理システム提供・経営支援事業…業務支援システムの販売、運用管理・マーケティング、メディア事業…情報メディア運営、マーケティング調査、病院ブランディング支援,東京都品川区大崎2-1-1ThinkParkTower5F,2003,,160,50百万円,34.0,https://www.mstage-corp.jp/,
2024-08-01,株式会社ＫＡＣテクノ,人材派遣,2,製薬会社・食品会社の工場への人材派遣・請負(医薬品の製造業務・包装業務・品質管理業務)■労働派遣事業（派05-300142）■有料職業紹介業（05-ユ-300065）,【本社】秋田県能代市万町2‐20 TKビル2階,2006,,110,1000万円,,https://www.kac-techno.co.jp/,代表取締役社長 緑川 将人
2024-08-01,株式会社天職市場,求人サイト・求人メディア,2,■事業内容：求人サイト運営事業、新卒採用支援事業（採用力強化、インタツアー）、障がいのある方の支援サービス事業、Webサイト制作事業（企画／マーケティング／ブランディング／デザイン）、Web発信力支援事業、就業支援サポート活動、職業人トレーニング普及活動、地域セイフティネット支援活動、地域振興支援活動,東京都新宿区西新宿1-25-1新宿センタービル33F,2006,,,,,https://1049.co.jp,
2024-08-01,株式会社ダイキエンジニアリング,技術系アウトソーシング（特定技術者派遣）,3,■事業内容：自動車、船舶、航空機の設計開発、生産技術、ソフトウェア開発、IT関連、教育関連,広島県呉市広白石2-7-5ダイキビル1F,2003,,800,50百万円,,http://www.dai-ki.co.jp/eng/,
2024-08-01,株式会社グローバルトラストネットワークス,アウトソーシング,8,■外国人専門の賃貸住宅保証事業■外国人専門の不動産賃貸仲介事業■外国人専門の生活サポート事業■外国人専門の福利厚生・定着支援サービス事業■外国人専門のモバイル通信サービス事業■外国人専門のアルバイト・就職紹介事業■外国人専門の旅行事業一般労働者派遣事業許可番号 (派) 13-305427有料職業紹介事業許可番号 13-ユ-306348,東京都豊島区東池袋1-21-11 オーク池袋ビル2階,2006,,383,"9億4,946万600円",34.0,https://www.gtn.co.jp/,代表取締役 執行役員 社長 後藤 裕幸
2024-08-01,アンテロープキャリアコンサルティング株式会社,人材紹介・職業紹介,4,■事業内容：金融・コンサルティングファーム・事業会社企画部門（経営企画/M&A）に特化した人材紹介会社です。主にキャリア構築への意識が高い20代後半～40代前半を中心としたビジネスパーソンのキャリアを支援しています。優秀層のキャリア支援を行うことにより、コンサルタントとして成長できるチャンスが多い環境です。まずは登録者の方へしっかりと価値を提供して多くのビジネスパーソンに支持していただいてはじめて、採用企業側へも優秀な人材をご紹介できるようになる、と考えているためキャンディデート（候補者）ファーストの考え方を徹底しています。,東京都千代田区内幸町2-2-2富国生命ビル15F,2002,,21,30百万円,42.0,http://www.antelope.co.jp,
2024-08-01,ブライザ株式会社,人材派遣,99+,■事業内容：アウトソーシング事業、労働者派遣事業、有料職業紹介事業■事業所：宇都宮営業所・横浜営業所・名古屋営業所・大阪営業所・広島営業所・熊本営業所、テクニカルセンター、トレーニングセンター■会社概要：目まぐるしく変化する企業のビジネス環境に、高い水準で応えるために。同社は最新の専門技術と、高い志を持った人材を育みサポートする、“対応力”のアウトソーシングカンパニーです。,神奈川県横浜市中区相生町6-104横浜相生町ビル8F,2003,,830,50百万円,35.0,https://bryza.co.jp/,
2024-08-01,株式会社アイネットサポート,コールセンター,1,■事業内容： ★コールセンター運営を主軸に展開している会社です。法人向けのサポートデスクやカスタマーセンター（toCの契約照会や申込）、テレマーケティング（アポイント獲得、受注獲得）を担っております。★人材派遣コールセンタースタッフ・営業スタッフ・事務スタッフ・販売スタッフ★セールスプロモーション,東京都豊島区南大塚3-30-3南大塚アロービル,2006,,590,100百万円,37.0,https://www.inet-support.co.jp/,
2024-07-01,株式会社エリメントＨＲＣ,人材紹介・職業紹介,1,■事業概要：《医療転職.com》を擁し、医療機器・製薬業界において抜群の決定数、決定率を誇っています。異なる「人が介在する価値」を追求し、候補者の「意向」と「性質」をコンサルタントが深くヒアリングをした上で、企業という大きなくくりではなく事業部単位にまで絞り込んだ求人を紹介することで高い決定率を実現しています。,東京都大田区山王2-5-10大森野村證券ビル4F,2006,,26,10百万円,34.0,http://www.element-hrc.com/index.html,
2024-08-01,株式会社ボーダーリンク,人材派遣,4,■事業内容：外国語講師派遣事業（ALT派遣事業）、オンライン英会話、教員研修、国際交流イベント、語学スクール運営事業,埼玉県さいたま市大宮区下町2-16-1アクロスビル8F,2000,,174,91百万円,,http://www.borderlink.co.jp/index.html,
2024-08-01,株式会社薬ゼミ情報教育センター,人材紹介・職業紹介,1,■事業内容：・調剤薬局、ドラッグストア、病院への人材紹介と教育コンサルティング・薬局経営サポート・各種研修会・セミナーの企画・運営・人材紹介支援サービス（薬学生、薬剤師、医療従事者などの人材紹介／就職活動／転職活動のサポート／LINE「Pharmily」の運営）・書籍の出版･編集・薬剤師研修事業・薬学教育支援事業,東京都千代田区神田錦町3-12-10神田竹尾ビル4F,1991,,12,10百万円,40.0,"Failed to retrieve page, status code: 410",
2024-07-01,株式会社医業総合企画,アウトソーシング,1,■事業内容：・医療事務等医療関連業務請負（病院等の受付、レセプト、会計、カルテ管理、精度調査等の医療事務、看護補助業務、介護業務）・ホームヘルパー＆医療事務員養成施設「カインドアカデミア」の運営（愛知県知事指定ホームヘルパー養成講座、医療事務員養成講座の開講、医師事務作業補助者養成講座）・医業（病院）経営コンサルタント業務、新規開業（開院）支援コンサルタント業務、医療事務インストラクター業務・診療報酬明細書チェック／審査業務、接遇研修講師派遣、一般労働者派遣事業、有料職業紹介事業,愛知県名古屋市東区泉1-23-36NBN泉ビル6F,2003,,250,18百万円,,http://www.igyou.com/,
2024-06-01,株式会社アフレル,研修サービス,1,■事業詳細：【新規事業：ロボティクス事業】2030年の国内におけるロボット密度20％を目指し(2023年時点では4％)、中堅製造業の生産現場自動化推進に向けて、導入運用のハードルを出来るだけ下げたこれまでにない協働ロボットによる自動化ソリューションパッケージを開発し提供しています。DOBOT社協働ロボットアーム製品シリーズ、PUDU社自動搬送ロボット各種、等取り扱い,福井県福井市中央3-5-15フロンティア福井5F,2006,,36,30百万円,,https://afrel.co.jp/,
2024-08-01,株式会社スタッフ・アクティオ,人材派遣,2,■事業内容：人材派遣、人材紹介、業務請負、建設機械の運転／操作■当社の特徴：当社のルーツは、建設機械レンタルリーディングカンパニー「AKTIO」にあります。建設のあらゆる領域ビジネスに参画するAKTIOは、単なる機器のレンタルにとどまらず、顧客のニーズを把握し提案する「コンサルティングのあるレンタル＝レンサルティング」を実践しています。このレンサルティングを進める上で、建設ビジネスに、現場に精通する「人材」の提案が望まれ、「建設業界専門の人材派遣」として同社が誕生しました。「機器を動かすのも、仕事を動かすのも、人材である」という理念のもと、あらゆるプロジェクトをサポートしています。,東京都港区新橋1-7-1,1990,,59,80百万円,,"Failed to retrieve page, status code: 410",
2024-08-01,株式会社シーディア,技術系アウトソーシング（特定技術者派遣）,99+,■事業内容：・設計協業を主体としたエンジニアリングサービス及びソリューション事業・国内外製造メーカの製品開発パートナーとしてアジア主要都市における研究開発支援,東京都大田区羽田空港1-1-4,2004,,192,50百万円,44.9,https://seedea.asia/,
2024-07-01,株式会社スターシステム,アウトソーシング,2,■事業内容： ・各種ソフトウエア企画、設計およびソフトウエアシステム開発、保守、運用業務・IT機器の販売及びソフトウエアの企画販売・保守及び付帯周りの請負業務・工作機械、搬送機等の機械制御・機械設計・電気設計業務・ソフトウェア開発支援（技術者業務請負）・労働者派遣業務（派23-302457）・IT系業務サポート等の常駐支援・コンサルティング、起業支援・ホームページ製作,愛知県名古屋市中村区名駅5-28-1名駅イーストビル5F,2005,,259,25百万円,35.0,https://www.star-system.jp/,
2024-08-01,株式会社人材ドラフト,求人サイト・求人メディア,4,■事業概要：経理・財務・税務会計に特化した人材サービスを提供している人材会社です。業界内で非常に高い知名度を誇っています。,東京都千代田区神田神保町1-14-3MT-O神保町6F,2000,,42,34百万円,35.0,"Failed to retrieve page, status code: 410",
2024-07-01,株式会社オデッセイコミュニケーションズ,研修サービス,4,"日本最大規模のIT資格「MOS」試験の立ち上げから23年、累計受験者500万人の運営実績を中心に、資格ビジネスを展開、創業以来黒字経営をしてきました。MOSだけでなく、データサイエンス分野などの、これからの時代に必要とされる働く人のキャリアを支援する教育サービスを創出しています。東京丸の内のオフィスを基点に、全国1,500か所の外部試験会場の協力を受け、海外の取引先、各分野の専門家の協力も得ながら、約60名の少人数の組織ながら、全国的なビジネスを展開。少人数で運営しているためマルチタスクになることが多く、色々なことに挑戦したい方にとっては、成長できる機会が多い環境です。",東京都千代田区丸の内3-3-1,1996,,56,27百万円,42.0,https://www.odyssey-com.co.jp,
2024-07-01,東明エンジニアリング株式会社,技術系アウトソーシング（特定技術者派遣）,13,■航空宇宙機器の設計開発（構造、装備）■航空宇宙機器組立治工具の設計■複合材製品の解析設計■一般産業用治工具の設計■油圧・空気圧試験装置の設計■航空宇宙機器製造の生産技術■製造支援人材派遣（設計、生産技術、生産管理 等 派23-300827）＜認定取得＞・愛知ファミリーフレンドリー企業（愛知県知事）,愛知県名古屋市港区大江町6-19 菱興ビル南館4階,1990,,155,"5,000万円 ※グループ計：4億円",35.0,https://tohmei-eng.com/,代表取締役 二ノ宮 啓
2024-08-01,株式会社毎日学術フォーラム,アウトソーシング,2,■概要：総合人材サービスのパイオニア、マイナビのグループ会社として2006年11月に設立されました。各種学会の委託を受け、以下の業務を代行しています。学会のあらゆるニーズに応える、ベストパートナーを目指しています。（現在アルバイトも入れて44名）,東京都千代田区一ツ橋1-1-1パレスサイドビル9階,2006,,44,10百万円,34.0,http://maf.mynavi.jp/,
