更新日,名称,業界(小分類),求人有無,事業内容,所在地,設立,上場市場名,従業員数,資本金,平均年齢,企業URL,代表者
2024-07-01,株式会社Ｈ４,人材紹介・職業紹介,1,★現在売上・拠点ともに拡大中。国内はもちろん海外にも拠点を展開し、売上高100億円規模達成と上場を目指し成長中です■一般労働者派遣業（派23-301381）■有料職業紹介事業（23-ユ-301176）■新卒中途エージェント事業■アウトソーシング事業 イベントプロモーション事業※2024ホワイト企業初年度最高ランク【PLATINUM】取得,愛知県一宮市森本4丁目13-8,2012,,350,5000万円,27.0,https://www.h4-recruit.com/,代表取締役 堀 世至臣
2024-07-01,株式会社ユース.TR,人材派遣,6,■事業内容：労働者派遣事業、有料職業紹介事業、各種人材アウトソーシング、各種ラインアウトソーシング,愛知県岡崎市明大寺本町1-34岡崎センタービル7F,2012,,,20百万円,,http://youth-haken.jp/,
2024-08-01,ネッカート株式会社,技術系アウトソーシング（特定技術者派遣）,1,■事業内容：1）技術者・労働者派遣事業※主力分野・機械、電気、電子設計開発、生産技術における技術者・工場運営にまつわる生産管理、品質管理、保全・メンテナンス要員・オフィスにおける伝票受発注業務、一般・営業事務スタッフ・工場における機械オペレーター、組付組立、検査要員・倉庫におけるリフト、クレーン作業、ピッキング、入出庫作業要員等2）業務請負事業、3）有料職業紹介事業、4）コンサルタント事業,愛知県一宮市本町3-5-9,2011,,365,40百万円,30.0,http://neckart.co.jp/index.html,
2024-07-01,ドリームスデザイン株式会社,技術系アウトソーシング（特定技術者派遣）,1,■事業内容：＊機械設計（自動車関連、工業製品等）における受託業務、技術者派遣,愛知県名古屋市西区則武新町3-1-17,2012,,73,29百万円,35.7,https://www.dreams-design.co.jp/,
2024-07-01,株式会社Ｔｅｃｈｏｕｓｅ（テックハウス）,求人サイト・求人メディア,1,■求人情報サイト『ジョブハウス』の開発・運営■人材採用のためのオールインワンサイト制作システム『クラウドハウス（採用）』の開発・運営■人事労務の社内ワークフロー効率化・ペーパーレス化実現におけるセミオーダー型DXクラウドシステムの開発・運営,東京都港区三田3丁目13-12 三田MTビル 5階,2012,,,9703万3970円（※2022年8月現在、資本準備金含む）,,https://jp.techouse.com/,代表取締役社長 礒邉 基之
2024-08-01,株式会社上武,人材派遣,3,【社員の笑顔を大切に、新たな価値観創造にチャレンジするソリューション・カンパニー】株式会社上武は、企業のさまざまな「悩み」を解決する“ソリューション・カンパニー”です。具体的には、IT、人、そしてセキュリティの3分野に特化。お客様の幸せも社員の幸せも一番に考えながら、顧客企業のビジネスをサポートする各種サービスを提供しています。■ITソリューション事業コンサルティングからシステム開発、保守・運用まで幅広いITソリューションをワンストップで提供しています。・Webアプリケーションの構築 ・業務アプリケーションシステムの構築,東京都港区赤坂8-5-28,2012,,97,42百万円,,http://www.jobu.co.jp,
2024-06-01,株式会社Ｐｒｏｕｄ　Ｐａｒｔｎｅｒｓ,人材紹介・職業紹介,1,1) 外国人専門人材紹介事業有料職業紹介事業：許可番号 13-ユ-3135602) 登録支援機関登録支援機関：許可番号 19登-000466,新宿本社／東京都新宿区北新宿2-21-1 新宿フロントタワー 28階名古屋支店／愛知県名古屋市西区那古野2-12-21-1 スクエアオフィス名駅北501※ベトナム支社あり,2012,,73,"100,000,000円",30.0,https://www.proudcorp.com/,代表取締役 鈴木 竜二
2024-08-01,株式会社オーシャンズ,研修サービス,1,■事業内容：＜教育事業＞◇オーシャンズ・アカデミーの運営・コミュニケーション心理学を応用した、各種研修・営業コンサルティング◇企業研修・企業様のご要望に合わせたオリジナルメニューの研修（トレーニング）・セールスやコミュニケーション、メンタル、リーダーシップ、他◇パーソナル・トレーニング・営業、経営者など、個人を対象にしたトレーニング、フォローアップ,東京都港区芝3-16-12,2010,,,,,https://www.oceans595.com/,
2024-08-01,スクエアプランニング株式会社,人材紹介・職業紹介,2,- SQUAREグループは人材ビジネスやITビジネスを通じて様々な企画提案を実施して参りました。今後も斬新なアイデアで日本の新しい働き方を創造します。 -■事業概要：各業務の未経験者または技術経験の浅い方に就業・キャリアアップの機会を与え、積極的な従業員教育による質の高い企画力や組織力でクライアントの要望に応える総合コンサルティング企業です。職種特化型の有料人材紹介業、障害者採用支援、各種コンサルティング事業、ITソリューション事業を行っています。,愛知県名古屋市中区錦2-4-15ORE錦二丁目ビル12F,2012,,36,30百万円,,https://square-planning.jp/,
2024-07-01,株式会社アルファテクノス,技術系アウトソーシング（特定技術者派遣）,1,■事業内容：・配管設計・設備保全・工事管理者及び品質管理者派遣・配管設備設計監理、品質管理サポート・工事管理者派遣、検査技術者派遣、品質管理者派遣・工事計画業務、設計図面照査、工事仕様書作成、施工管理要領書作成、見積検討業務・設備点検業務、各種立会代行業務、現場工事管理業務、その他コンサル業務■許認可：・派遣事業許可 派12-300158,千葉県市原市姉崎西3-4-8,2000,,40,3百万円,,https://alpha-technos.com/,
2024-08-01,株式会社リンクスタッフグループ,人材派遣,10,■事業内容： 当社では、出資関連子会社を中心として、警備事業、不動産事業、アウトソーシング事業、求人広告事業、有料職業紹介事業などを行っております。グループ展開による組織力をもとに人材不足のお客様に対して様々なアプローチで問題解決に取り組んでいます。■企業理念： 「圧倒的行動力＆新たな常識の創造 ～ 視野360°～」失敗を恐れず日々行動、そして業界にはない新たな常識を創造していける集団を目指し日々仕事に励んでいます。 ■特徴： 建設業界特化型の人材派遣事業において前年度比150％越えの急成長企業です。今後も人材不足のお客様に対して様々なアプローチで問題解決に取り組んでいきます。,千葉県船橋市湊町2-2-19イシデンビル201,2012,,85,3百万円,,http://linkstaff-group.co.jp/,
2024-08-01,株式会社サンクスパートナーズ,人材紹介・職業紹介,5,■事業内容： 採用コンサルティング事業/人事コンサルティング事業,大阪府大阪市中央区平野町3-3-10浅野ビル7F,2012,,17,9百万円,,http://www.thanks-partners.com/wp/,
2024-07-01,株式会社ワールドフェイマス,人材派遣,4,■会社概要当社は人を通じて社会を支える、RaaS（Resource as a Service）を体現する。という想いのもと、事業を展開しています。■事業内容（1）ネットワークソリューション事業（2）フィールドサポート事業（3）IoT事業（4）モビリティソリューション事業,東京都千代田区飯田橋2-1-5S-Glanz KUDAN BLD.1F,2012,,359,19百万円,29.0,http://www.world-famous.co.jp/,
2024-06-01,株式会社エンリッション,求人サイト・求人メディア,2,■事業内容トップ大学の近辺に、国内18店舗・海外9店舗の「SHIRU CAFE」を展開しています。知るカフェでは大学生向けに無料でドリンクおよびWi-Fiや電源の提供を行っており、毎日満席近い来客を誇っています。学生向けに無料でドリンクや空間提供できるのは、大手企業170社を中心とするスポンサー費用によって運営されているからです。SHIRU CAFEでは少人数制の座談会など大学生が企業と接点を持てる場を設けています。スポンサー企業に対しては優秀な学生との接点を、学生に対しては早くから仕事や業界のことを理解する機会や、自分のキャリアについて考える機会を提供しています。,京都府京都市上京区今出川通室町東入今出川町329-1SAKURA BLD.今出川3F,2013,,400,"1,000百万円",,https://enrission.jp/,
2024-07-01,株式会社リレーション,技術系アウトソーシング（特定技術者派遣）,2,■建設アウトソーシング事業建築・設備・電気設備・土木など、建設業に関わる業務の設計から施工管理まで幅広くサポートしています※派遣許可番号 派13-308224■施工図作成事業建物を建てる上で重要な施工図の作成を低価格・高品質で提供しています,【本社】東京都新宿区市谷本村町2-11 外濠スカイビルディング5F〒541-0057【大阪支店】大阪府大阪市中央区北久宝寺町4-3-5 本町サミットビル4F,2012,,200,1000万円,27.0,http://re-lation.co.jp,代表取締役社長 小林 雷太
2024-07-01,株式会社スタッフエージェント,人材派遣,1,一般労働者派遣事業 許可番号：派40-300794有料職業紹介事業 許可番号：40-ユ-300718業務請負(システム開発・ソフトウェア開発・設計等),福岡県福岡市中央区天神2-8-38 協和ビル8階,2009,,48,2000万円,,https://staffagent.jp/,代表取締役 神谷 誠
2024-08-01,株式会社エイトエンジニアリング,技術系アウトソーシング（特定技術者派遣）,13,■事業内容(1)エンジニア部門大手自動車メーカー、または部品メーカーにて、自動車の開発に携わらせて頂いております。量産車輌の開発や、レースマシンの開発を通じ、製品の企画や、設計の構想といった先行開発から、３DCADを用いた部品の詳細設計、実際に設計したものを生産するための準備や、安全性能を図るための実験業務まで、幅広い領域で技術を提供しているエンジニアリングサービス会社です。(2)コンストラクション（建築）部門関西・中部エリアの多彩なプロジェクトがございます。高速道路や橋梁関係の工事の他、国際イベントなどに関する大規模な案件にも携われる環境を整えていきます。,愛知県刈谷市広小路4-203,2006,,180,10百万円,31.0,http://www.8eng.co.jp/,
2024-07-01,株式会社マニフェスト,人材紹介・職業紹介,1,■企業概要：株式会社マニフェストは名古屋市中部地区に本社を置き、営業コンサルティングを中心に事業を展開してまいりました。現在は東京・静岡・長野にも拠点を置きさらに事業拡大を行なっております。■事業内容：・営業代行、販売代理店・人材派遣、業務委託・バックオフィスBPO事業(コールセンター運営、歯科医院向けオンライン秘書サービス)・ライブコマース事業・人材紹介事業■当社の魅力：少数のチーム運営で各々の個性を活かしながら強い組織作りを目指しております。20代前半から30代前半で組織運営をしており、社内チーム内のコミュニケーションは特に重視しています。,愛知県名古屋市中区丸の内3-18-1三晃丸の内ビル5F,2008,,114,30百万円,31.7,http://www.manifest.co.jp/,
2024-07-01,経理の特命レスキュー隊株式会社,アウトソーシング,1,■事業内容経理のアウトソーシング事業■サービス概要・経理丸投げ：クライアントから頂いた領収書から、月次決算書を作り上げ、毎月のレポートを通してお客様の経営を支援・スーパー派遣：レスキュー隊が経理のプロを派遣する派遣サービス・経理課長代行：経理の視点からの経営コンサルティング・会社設立：会社設立の代行及び、コンサルティングを行うサービス,東京都江東区深川2-6-11富岡橋ビル3F,2007,,20,10百万円,27.0,https://www.accounting-rescue.com/,
2024-07-01,Ａ＆Ｐコンサルティング株式会社,アウトソーシング,1,関連会社の経理業務を中心に、各種バックオフィス業務請負、コンサルティングを行っています。◆財務業務◆経理業務◆人事業務◆法務業務◆労務業務税務申告、訴訟、登記などは、提携している士業（税理士・弁護士・司法書士・社会保険労務士）の先生方との連携により、高度な専門性を実現しています。,東京都渋谷区鶯谷町2-3,2004,,17,1000万円,,http://www.apc-inc.co.jp/,代表取締役 小澤 直敬
2024-06-01,株式会社パートナーズ,人材派遣,1,◎職業紹介・人材派遣■職業紹介事業／33-01-ユ-0013■人材派遣事業／派33-300490■業務請負事業,岡山県岡山市北区大供表町2-3,2007,,70,"500万円（グループ全体4,650万円）",,https://www.banquet-supply.co.jp/,代表取締役社長 塩見 泰利
2024-08-01,株式会社エンリージョン,人材紹介・職業紹介,5,"■事業内容： ・人材紹介業(厚生労働大臣許可番号 15-ユ-30078) ・ヘッドハンティング・再就職支援(アウトプレースメント)・採用代行(RPO, リクルート・プロセス・アウトソーシング)人材ビジネスを新潟・長野・富山・石川・群馬・福井・山梨エリアにて展開しています。U・Iターン等、生まれ故郷や地方で働きたい人を支援し、地方に特化した支援を行い、企業の活性化や地域活性化に貢献するため長期的な視点で事業を進めています。",新潟県新潟市中央区東大通1-4-5,2010,,30,5百万円,37.4,https://enregion.jp/,
2024-08-01,株式会社アシストライン,アウトソーシング,1,■経理・給与計算のアウトソーシング受託■経理業務の指導■事務作業のアウトソーシング受託■経営コンサルティング■人事・給与・採用アウトソーシング受託■飲食店の経営・企画■有料職業紹介業 ほか,東京都豊島区東池袋1-21-11 オーク池袋ビル4F,2012,,46,1000万円,36.0,https://as-line.jp/,代表者 坂上 徹
2024-08-01,ＫＡＮＡＥアソシエイツ株式会社,人材紹介・職業紹介,2,■事業内容： 同社は金融インダストリーの幅広い分野で、外資日系を問わずスペシャリストやエグゼクティブに特化した人材紹介サービスを提供しています。,東京都港区芝公園1-1-11興和芝公園ビル9F,2010,,15,10百万円,,"Failed to retrieve page, status code: 410",
2024-08-01,日販ビジネスパートナーズ株式会社,人材派遣,2,■事業内容・シェアードサービス事業・不動産事業・清掃・警備事業・人材派遣事業,東京都千代田区神田駿河台4-3,1961,,131,82百万円,46.4,https://www.nippan-group.co.jp/,
2024-08-01,アルテンジャパン株式会社,技術系アウトソーシング（特定技術者派遣）,4,■事業内容：・エンジニア派遣…全国各エリアから幅広い分野に対応できるエンジニアを紹介します。・業務請負…あらゆるプロジェクトを効率的に対応できる体制にて業務を請け負います。・受託開発…設計／開発／納品までを顧客のニーズの元、高いクオリティで完結させます。・有料職業紹介…ハイスペックから時代を担う若手まで、妥協なく精度の高い人材を紹介します。,東京都港区芝浦3-5-39田町イーストウィング6F,2013,,616,40百万円,,https://www.alten-japan.com/,
2024-08-01,株式会社ＫＭユナイテッド,人材派遣,1,１．塗料及び塗料関連資材の販売・コンサルティング２．塗装工事業（特殊塗装含む）３．左官工事業４．熱絶縁工事業５．防水工事業６．内装仕上工事業７．労働者派遣事業８．有料職業紹介事業９．前各号に附帯又は関連する一切の事業■労働者派遣番号 派26-300701■建設業許可番号 国土交通大臣 許可（般-29）第26919号,本社：京都市左京区下鴨宮河町7,2013,,,"1,500万円",,https://www.coassist.jp/company_profile/,代表取締役社長/CEO 竹延 幸雄
2024-06-01,株式会社エッチアイティオー,技術系アウトソーシング（特定技術者派遣）,3,■事業内容各種プラント(廃棄物処理プラント、水処理プラント、製鉄プラントなど)の詳細設計、鉄道車両の詳細設計、舶用減速装置の詳細設計、産業用ロボットの詳細設計、圧縮機・回転機・樹脂機械、その他産業機械の詳細設計、その他(自動機、テスト装置、油圧機器、検査装置など)、技術者及びオペレーターによる技術支援、その他ソリューション事業における各種サービスの提供をしています。,兵庫県神戸市中央区播磨町49神戸旧居留地平和ビル7F,1985,,94,20百万円,40.0,https://www.hitoo.jp/,
2024-08-01,株式会社光和マイクロプロジェクト,技術系アウトソーシング（特定技術者派遣）,12,■事業内容： 当社は、ソフトウェア開発からヘルスケア事業まで、皆様の暮らしの安心や健康を守るトータルサポートカンパニーです。 ■事業内容：（１）ソフトウェア開発：病院総合システムや自動車生産部品管理システムなどの業務系ソフトウェアの開発および、車載システム、民生機御システムなどの制御系ソフトウェアの開発、AI、IoT、クラウド型Web系ソフトウェアの開発を行っています。 （２）サプリメント商品や沖縄特産のウェルネス商品の企画・開発・営業・販売を行っています。,愛知県豊明市西川町島原9-12,2002,,50,10百万円,29.5,http://www.kouwa-gp.co.jp/,
2024-08-01,株式会社HR team,人材紹介・職業紹介,9,■企業概要： 同社は総合人材会社です。,東京都渋谷区円山町3-6E・スペースタワー4F,2014,,165,5百万円,,https://hr-team.co.jp/,
2024-08-01,Ａｐｅｘ株式会社,人材紹介・職業紹介,25,■事業内容同社は、中間管理職以上のハイクラス人材に特化した日本市場向けエグゼクティブサーチ企業です。同社のコンサルタントは各人が専門とする業界、市場動向や人材について深い理解や経験を兼ね備えており、その業界の専門家として広範囲における人材サービスを提供します。日本でも良く知られている多国籍企業だけでなく、日本市場での成長を望む新規参入企業とも密接な連携を図りながら業務を展開しています。,東京都渋谷区恵比寿4-6-1恵比寿MFビル7F,2010,,137,20百万円,,https://www.apexkk.com/,
2024-07-01,スカイモビリティサービス株式会社,アウトソーシング,1,■レンタカー事業運営本部※スカイレンタカー・ウィングレンタカー加盟FC会社の管理・サポート＜主要取引先＞三菱オートリース株式会社芙蓉オートリース株式会社日本カーソリューションズ株式会社住友三井オートサービス株式会社損害保険ジャパン株式会社東京海上日動火災保険株式会社あいおいニッセイ同和損害保険株式会社,神奈川県横浜市港北区新横浜3-1-4 プラスタリアビル2階,2004,,34,9900万円,,https://www.skyrent.co.jp/,代表取締役社長 武井 英一
2024-08-01,株式会社データ・ファー・イースト社,アウトソーシング,無,経理を中心としたバックオフィスのトータルアウトソーシング＜許可番号＞人材紹介事業／27-ユ-302067人材派遣事業／派27-302383 2024年6月doda掲載求人より引用,大阪府大阪市北区曾根崎新地1-13-22ＷｅＷｏｒｋ御堂筋フロンティア 13Ｆ,2000,,,3 百万円,,"Failed to retrieve page, status code: 410",代表取締役 森口 真有美
2024-08-01,株式会社アルク,研修サービス,10,・通信教育用教材の企画・制作・販売・語学系出版物（月刊誌、単行本）の企画・制作・販売・法人向語学研修・e ラーニング教材の企画・制作・販売・英語・日本語スピーキング能力診断サービス ・資格試験対策講座等の顧客サービスイベントの開催,東京都品川区北品川6-7-29ガーデンシティ品川御殿山3F,2011,,260,100百万円,,http://www.alc.co.jp/,
2024-08-01,株式会社イアス,人材派遣,20,■事業内容： ・機械設計と生産・組立技術・ソフトウエア開発とネットワークインフラ構築・電気電子回路設計,愛知県名古屋市中区錦2-18-5白川第6ビル3F,2013,,52,10百万円,32.0,http://www.e-ath.co.jp/,
2024-06-01,株式会社都工業,人材派遣,1,■事業内容：・HR事業部 ＞Human Resource(人材サービス事業｜人材派遣／人材紹介／登録支援機関)・FE事業部 ＞Furnace Engineering(築炉工事事業｜高熱工業炉築炉工事／生産設備保全工事)・その他事業 ＞Other Business(人事労務活性化支援／ハンズオン支援／行政受託事業など),愛知県豊田市清水町2-79-1田園オフィス,1991,,15,10百万円,38.0,https://www.miyakoweb.jp/,
2024-08-01,株式会社パーソナル・マネジメント,人材紹介・職業紹介,5,■事業内容：【リージョナルキャリア】【ココクマ】【RPO(Recruitment Process Outsourcing)】【クリエイティブ事業】,熊本県熊本市中央区安政町4-19TM10ビル8F,2007,,5,10百万円,,http://p-mane.com/,
2024-07-01,株式会社グローマス,人材紹介・職業紹介,4,■事業内容：・歯科医師・歯科衛生士・歯科技工士・歯科助手の人材サービス(人材紹介、求人広告、人材派遣)・歯科医院向け労務支援システムの提供・歯科関連メディアの運営,東京都千代田区神田東松下町38鳥本鋼業ビル4F,2014,,49,90百万円,29.0,http://glomouth.co.jp/,
2024-08-01,株式会社ＡＰパートナーズ,人材派遣,無,■セールスプロモーション事業■コンサルティング事業■人材サービス事業アウトソーシング・人材紹介・人材派遣■代理店事業グルメサイトRetty広告代理店運営■IT事業Webサービス・アプリ事業【許認可番号】一般労働者派遣事業許可番号：派13-305238有料職業紹介事業許可番号：13-ユ-305774古物商許可番号：第301031306256号 2024年5月doda掲載求人より引用,東京都新宿区新宿2-6-4新宿通東洋ビル10Ｆ,2011,,,10 百万円,,"Failed to retrieve page, status code: 410",代表取締役 山田 昌
2024-08-01,株式会社Ｋａｉｅｎ,人材紹介・職業紹介,49,発達障害の方に特化した人材紹介や就労支援を行う日本国内初の企業。先駆けて発達障害・グレーゾーンの方向けの就労移行支援を開始し、発達障害を熟知した専門家推奨のプログラムを提供。これまでに1700名以上の就労支援実績があります。■事業内容： 発達障害の方に特化した以下の事業を展開しています。（1）人材サービス事業（2）就労支援事業（3）教育事業,東京都新宿区西新宿6-2-3新宿アイランドアネックス207,2009,,362,17百万円,,https://corp.kaien-lab.com/,
2024-08-01,タカコーホールディングス株式会社,人材派遣,5,■事業内容：労働者派遣事業/業務請負事業/有料職業紹介事業/ソフトウェア開発事業（埼玉テクニカルセンター内：システム企画・開発、システム運用・保守）,栃木県小山市城東4-19-31,2013,,,20百万円,,https://jobtkk.co.jp/corp/,
2024-07-01,株式会社ユース．ＩＢ,人材派遣,4,■事業内容：労働者派遣事業、有料職業紹介事業、各種人材アウトソーシング、各種ラインアウトソーシング■ユースグループ会社：株式会社ユース、株式会社ユース.GF、株式会社ユース.TR、株式会社ユース.IBの4社にて運営しているグループです。■経営理念：すべての「はたらく」に可能性を。,三重県四日市市鵜の森1-3-23,2013,,,20百万円,,なし,
