更新日,名称,業界(小分類),求人有無,事業内容,所在地,設立,上場市場名,平均年齢,従業員数,資本金,企業URL,代表者
2024-08-01,Ｌｉｎｋ‐Ｕグループ株式会社,ベンダ（ハードウェア・ソフトウェア）,4,■企業概要：【当社について】・当社は2013年にエンジニアが中心となって設立された会社です。2024年3月にはHD化をし、サーバープラットフォーム事業を100％子会社の株式会社Link-U Technologiesへ継承いたしました。引き続きワンストップでのサービス提供はもちろんのこと、さらなるニーズに応えていく所存です。・グループ全体として技術力を核としたサーバー運用に強みがあるため、『マンガワン』や『ゼブラック』等の電子書籍配信はもちろん、動画・音楽といった電子コンテンツの配信、その他ITサービス全般を事業対象と考えております。,東京都千代田区外神田2-2-3住友不動産御茶ノ水ビル,2013,プライム市場,29.0,115,477百万円,https://www.link-u.co.jp/,
2024-08-01,株式会社ジェイマックシステム,システムインテグレータ（SIer）,13,■事業内容：・コンピュータプログラム、ソフトウェアの開発及び販売・図書、書籍の出版及び販売／ニューメディア関連機器の販売・ニューメディアの情報サービス、運営管理及び保守サービスの提供・コンピュータ通信システムによる医療及び医学に関する情報提供・遠隔画像診断のための画像情報通信システムの開発及び運営・病医院における検査及び経営管理の業務委託・各病院の診療録（病歴、カルテ、心電図、X線写真、脳波等）の保管業務・各病院向けの医療機器類の製造及び販売・不動産の賃貸、売買及び管理／前各号に附帯する一切の業務,北海道札幌市中央区北四条東1-2-3札幌フコク生命ビル10F,1989,,40.0,150,30百万円,https://www.j-mac.co.jp/,
2024-08-01,株式会社ＫＤＤＩテクノロジー,ITコンサルティング,10,■会社概要：同社は、1988年にKDDI研究所(現・株式会社KDDI総合研究所)からスピンアウトし設立されました。より効率的で質の高いシステム開発を支援する「技術コンサルティング」と、モバイル・IoT関連ソリューションを幅広い領域にわたり 提供する「システム開発」を展開しています。KDDIグループで培った豊富なノウハウをベースに、先端テクノロジーの活用をワンストップで提供いたします。※案件の約95%がKDDI本社もしくはグループ会社向けになります。,東京都江東区豊洲5-5-13豊洲アーバンポイント3F,1988,,40.4,150,494百万円,https://kddi-tech.com/,
2024-08-01,日本ハムシステムソリューションズ株式会社,システムインテグレータ（SIer）,6,■事業内容：ニッポンハムグループの共通機器（コンピューター、ネットワーク網、等）の構築・維持・管理、日本ハム（株）およびグループ各社のアプリケーション・システムの企画提案～開発・保守・運用までを受託し、各社の事業効率化に留まらず事業戦略の立案から事業計画の遂行に貢献します。,大阪府大阪市北区梅田2-4-9ブリーゼタワー14F,1985,,,224,10百万円,https://www.nh-ss.co.jp/,
2024-08-01,日軽情報システム株式会社,システムインテグレータ（SIer）,4,■事業概要：日本軽金属および日軽金グループ企業の基幹情報システムの設計・開発・運用および全国に広がる日軽金グループ企業の拠点を網羅した大規模な情報ネットワークの設計・管理です。※日本軽金属(株)は、日本唯一のアルミニウムの総合メーカーです。アルミニウムの製造にあたり、200のグループ会社を抱え、連結売上高は4814億円に上ります。自社でダムを２つ、発電所を６つ所有しており、静岡の蒲原製造所においては東京ドーム9.8個分の規模を誇っています。,東京都港区新橋1-1-13アーバンネット内幸町ビル8F,1983,,42.9,145,100百万円,http://group.nikkeikin.co.jp/nis/,
2024-07-01,ノックスデータ株式会社【プライム市場】(アイ・エス・ビーグループ),ITアウトソーシング,2,★プライム市場上場、アイ・エス・ビーグループ★・ソフトウェア受託開発業務光伝送システム、移動体システム、 オープンシステム、インターネット関連システムなどの 各種アプリケーション及びファームウェア開発通信ネットワーク監視制御の クライアント/サーバアプリケーション開発・自社パッケージソフトウェアの開発・販売業務S・Iコンサルティング、Webサイトの構築,東京都品川区南大井6丁目26番2号 大森ベルポート B館10階,1974,,33.8,166,4500万円（授権9000万円）,https://www.knox.co.jp/,代表取締役 社長 小林 義文
2024-06-01,エコモット株式会社,システムインテグレータ（SIer）,2,■事業内容： 「未来の常識を創る」をモットーに、ワイヤレスセンシングとクラウドアプリケーションを融合させた様々なIoTソリューションを企画・開発・販売を行い、IoT関連ビジネスを全国で展開中その技術力から生み出されるさまざまなIoTソリューションで建設DXを支援,北海道札幌市中央区北一条東1-2-5カレスサッポロビル 7F,2007,グロース市場,,122,618百万円,http://www.ecomott.co.jp/,
2024-08-01,株式会社東海理化アドバンスト,ベンダ（ハードウェア・ソフトウェア）,1,～トヨタグループ大手自動車部品メーカーの株式会社東海理化の開発・設計パートナーを担っています～■概要： 車載用電子機器の開発企業として、組み込みソフトウェアの開発からハードウエアの検証まで行っています。トヨタグループの株式会社東海理化の１００％出資会社です。株式会社東海理化の依頼を受け、電子系部品などの車載システムの開発を手がけています。1.ソフトウェア事業：車載電装品の制御ソフトウエア開発と車載電装品の動作確認を行っています。2．ハードウエア事業：車載用ECUの電子回路の開発・設計。電子回路の分析、信頼性評価試験。また、車載電装品や自動車部品の性能や特性を測定する装置を開発。,愛知県名古屋市中村区名駅4-5-28桜通豊田ビル4F,2004,,32.0,122,30百万円,"Failed to retrieve page, status code: 410",
2024-08-01,新日本システック株式会社,システムインテグレータ（SIer）,4,■企業概要：システム開発からシステム検証、ITインフラ構築・設計・運用、ヘルプデスク、システム監査、パッケージソフト販売、プログラム解析までITトータルサービスを提供します。高度、効率、信頼を最も考慮したシステムの開発および提供を行い、ソフトウェアの品質を向上させることを目的としており、常に品質の高い商品およびサービスをお客様に提供しております。,東京都中央区東日本橋1-2-6ＳＮＳビル,1997,,,136,100百万円,https://www.snsystec.co.jp/,
2024-08-01,株式会社データ・アプリケーション,システムインテグレータ（SIer）,4,"■事業内容： 国内EDI市場導入シェアNo.1のACMSシリーズ、データハンドリングプラットフォームRACCOONを提供するソリューションカンパニーです。企業間電子取引から社内システム連携までデータのシームレス連携でスピード経営を支え、2,600社以上の導入企業と13,500を超えるサイトを支えています。",東京都中央区京橋1-7-2ミュージアムタワー京橋13F,1982,スタンダード市場,43.6,131,430百万円,http://www.dal.co.jp/,
2024-08-01,株式会社Ｐｒｏ－ＳＰＩＲＥ,システムインテグレータ（SIer）,16,■事業内容:(1)情報系ソリューション(BI／DWH／CRM／WEB)事業:ビジネスインテリジェンス等の開発･導入等を提供。(2)組込･制御システム開発事業:複合機を中心に各種な組込･制御システム開発を提供。過去には人工衛星から携帯電話等も。(3)システムインテグレーション事業:上流工程から運用･マネジメントまで一貫したソリューションを提供,東京都大田区大森北1-6-8ウィラ大森ビル7F,1988,,36.0,130,100百万円,https://www.pro-spire.co.jp/,
2024-08-01,株式会社シーアイエス,システムインテグレータ（SIer）,4,■事業内容：システムインテグレーター ■商品：ローコード開発、クラウド・コンテナ、セキュリティを軸としたITソリューションやAI、IoT、Cloud など新技術をベースとしたソリューション提案。ネットワークを含むインフラ基盤構築サービスの提供。,愛知県名古屋市中区栄3-11-31グラスシティ栄9F,1982,,44.4,140,173百万円,https://www.cisjp.com/,
2024-08-01,株式会社朝日ネット,通信キャリア・ISP・データセンター,18,■事業内容：インターネット接続サービス 「ASAHIネット」 を主催・運営IPv6接続サービス「v6 コネクト」の提供教育支援サービス「 manaba 」の企画・開発・提供,東京都中央区銀座4-12-15歌舞伎座タワー21F,1990,プライム市場,39.7,196,630百万円,https://asahi-net.jp/,
2024-07-01,アステリア株式会社,ベンダ（ハードウェア・ソフトウェア）,4,■概要:XMLを基盤技術として情報システム間を「つなぐ」（文字情報、数値情報、定性情報などデジタル化可能な情報の交換）ためのソフトウェアを開発、特に情報システムや情報そのものを「つなぐ」製品・サービスの提供にフォーカスし、設立以来蓄積してきたXML技術のノウハウを生かした様々なソフトウェア製品群の提供を行っております。,東京都渋谷区広尾1-1-39恵比寿プライムスクエアタワー19F,1998,プライム市場,39.8,103,"2,275百万円",https://jp.asteria.com/,
2024-06-01,株式会社ブロードエンタープライズ,ベンダ（ハードウェア・ソフトウェア）,2,■事業概要：（1）マンション向け入居者無料インターネット『B-CUBIC』の販売（2）認証付きIoTインターフォンシステム「BRO-LOCK」の販売（3）初期投資不要で空室対策ができる宅内IoTリノベーションサービス『BRO-ROOM』の販売,大阪府大阪市北区太融寺町5-15梅田イーストビル9F,2000,グロース市場,28.0,140,751百万円,https://broad-e.co.jp/,
2024-08-01,ユミルリンク株式会社,システムインテグレータ（SIer）,4,■メッセージングソリューションを軸に、多彩な事業を展開当社は、メッセージングプラットフォーム「Cuenote（キューノート）」によって、企業・団体と社会・個人をつなぐメッセージングソリューションを提供する会社です。さまざまな場面やニーズに対応する各種サービスで、企業情報の「発信」や「収集」、「分析」を効果的に進めるお手伝いをしています。,東京都渋谷区代々木2-2-1小田急サザンタワー12F,1999,グロース市場,39.3,125,273百万円,"Failed to retrieve page, status code: 410",
2024-06-01,株式会社EPARK,ITコンサルティング,1,～経験や希望に応じて、EPARK・光通信のグループの幅広いフィールドでご活躍頂くチャンスがございます～■事業概要：同社は「網羅的な通信インフラ」と「集客の専門知識」を活用し、多種多様な業種業態へとサービスを提供しています。■事業詳細：（1）プラットフォーム…EPARKサイトがハブとなり、訪れたユーザーと店舗・施設をマッチングします。またユーザーの潜在ニーズを捉え、目的のジャンルだけでなく新たなジャンルのクロス利用を促進しています。,東京都港区芝公園2-4-1芝パークビル,2007,,33.0,1175,90百万円,http://epark.co.jp/,
2024-06-01,株式会社 演算工房,ベンダ（ハードウェア・ソフトウェア）,1,■概要：日本国内において市場シェア約50％を誇るゼネコン向けトンネル情報化施工システム開発企業です。アジアでもNo.1の実績を誇り、世界でも上位3社に名を連ねています。■事業内容：計測・制御システム開発、リモートセンシング開発、ネットワーク・システムインテグレーション、CG作製建設・土木などの工事におけるシステム開発を行い、国内外の多数の現場で活躍しています。,京都府京都市上京区智恵光院通中立売下る山里町237-3,2001,,40.0,111,80百万円,http://www.enzan-k.com/,
2024-08-01,株式会社アイキューブドシステムズ,システムインテグレータ（SIer）,17,■企業概要：クラウドやスマートデバイスを活用してより良い働き方の実現に貢献する企業。国内トップシェアのサービスを開発・提供しており、高い技術力が国内外の企業から高く評価され、日本マイクロソフト社やアップル社をはじめ大手ベンダーとのパートナーシップ、国内超大手企業をはじめとする幅広いユーザーを着実に獲得しています。,福岡県福岡市中央区天神4-1-37第1明星ビル4F,2001,グロース市場,36.0,123,410百万円,http://www.i3-systems.com/,
2024-08-01,リックソフト株式会社,ベンダ（ハードウェア・ソフトウェア）,8,■リックソフト株式会社とは「お客様のビジネスがグローバルでも競争力を持つように、世界のビジネスシーンで活用されている優れたツールを日本の企業の方々にも使っていただきたい」という想いや「そこで得られたノウハウから生まれた自社開発ツールを世界に向けて提供したい」という考えを持ち、調査・分析から設計・構築・運用に至る一連のサービスを提供する「ツールソリューション事業」を主な事業として取り組んでおります。法人企業に対して、業務効率化ツールを提供しており、クライアントは大企業から中小企業問いません。,東京都千代田区大手町2-1-1大手町野村ビル8F,2005,グロース市場,38.8,91,328百万円,https://www.ricksoft.jp/,
2024-07-01,株式会社ヤマタネシステムソリューションズ,ベンダ（ハードウェア・ソフトウェア）,3,■事業内容： ・システム受託開発・メインフレーム技術支援・システム運用・保守サービス・各種システム導入コンサルティング・情報システム構築支援・ネットワーク・インフラ構築支援,東京都江東区福住2-3-10,1991,,42.3,137,150百万円,https://www.yamatane.co.jp/yss/,
2024-08-01,トピックス株式会社,ベンダ（ハードウェア・ソフトウェア）,6,■事業内容： 豊田通商グループの生産物流情報システムベンダー。トヨタ生産方式の一つである「かんばん」を用いた生産物流システムをパッケージシステムとして開発・販売しています。・トピックス生産物流情報システムパッケージ（トヨタかんばん方式・かんばんシステム・トヨタ生産方式）の開発／販売／保守 ・部品調達・受入、生産、受注・出荷に関する情報処理とネットワークシステムの開発／販売／保守 ・小型周辺装置の販売／保守,愛知県安城市東栄町3-819-1安城ソリューションプラザ,1979,,40.0,149,90百万円,http://www.topix.co.jp/,
2024-08-01,AI inside株式会社,ITコンサルティング,15,■事業内容 AI insideは2015年に創業し、生成AI・LLMや自律型AIをはじめとした最先端テクノロジーの研究開発および社会実装を行うテックカンパニーです。ディープラーニングによる手書き文字認識AIを活用した生産性向上のためのAI-OCRサービス「DX Suite」、よりセキュアかつ安定した環境でAIを動かすエッジコンピューティング「AI inside Cube」、および当社のミッション「AIテクノロジーの妥協なき追求により、非常識を常識に変え続ける」を実現するための製品「AnyData」などの開発・提供を進めております。,東京都渋谷区渋谷3-8-12渋谷第一生命ビルディング4F,2015,グロース市場,38.0,121,"1,234百万円",https://inside.ai/,
2024-08-01,アルファテックス株式会社,システムインテグレータ（SIer）,3,【当社について】1988年設立。「スムーズな運用と利益を生み出すIT＋いつまでもサポートし続ける現場力」というコンセプトのもと、お取引先から継続して依頼をいただけるのが特徴です。一度関われば関係が終わることはなく、実際に20年以上お付き合いしている現場もあります。,東京都品川区西五反田8-1-5五反田光和ビル,1988,,,136,40百万円,http://www.alfa-teccs.co.jp/,
2024-07-01,株式会社ウィクレソフト・ジャパン,システムインテグレータ（SIer）,12,■事業内容：・Microsoft 社製品を核としたインフラ構築システムソリューションサービス・ITインフラ設計・構築サービス・オープン系システム、ソフトウェアの開発・ERPパッケージの導入、カスタマイズ・上海本社と連携した大規模プロジェクトでのオフショア開発,東京都新宿区西新宿2-1-1新宿三井ビルディング45F,2006,,36.7,120,60百万円,https://www.wicresoft.co.jp/,
2024-06-01,ウィナーソフト株式会社,ベンダ（ハードウェア・ソフトウェア）,3,■事業内容：（1）SIサービス（金融、流通・小売、産業・社会基盤の幅広いお客様向けにシステムエンジニアサービスの提供) （例）銀行向け営業支援システム、生保向け営業システム、大手商社向けワークフローシステム、電力会社向け設備管理システム、航空会社予約システム など（2）DXソリューション（お客様のDX化支援、グローバルソリューションの提案・導入サービスの提供)（3）イノベーションソリューション（AIデータサービス、AIアプリケーション、サプライチェーンソリューション導入サービス）の提供,東京都千代田区神田淡路町2-105ワテラスアネックス6F,2013,,39.1,100,100百万円,https://www.winnersoft.co.jp/,
2024-08-01,スターネット株式会社,システムインテグレータ（SIer）,6,■概要：1986年設立、住友電気工業の情報システム部門より独立した歴史あるネットワークインテグレーター。WAN、LANおよびセキュリティなど企業ネットワークの設計・構築・運用・保守の業務全般を手掛けております。,大阪府大阪市中央区北浜4-7-28住友ビルディング第2号館,1986,,44.0,124,480百万円,http://www.starnet.ad.jp/,
2024-08-01,ＧＭＯグローバルサイン株式会社,システムインテグレータ（SIer）,4,"■事業内容：電子証明書発行の第三者認証サービス提供■事業詳細:2003年4月日本ジオトラスト株式会社として設立され、2007年5月にグローバルサイン株式会社へ商号変更、2008年12月にGMOグローバルサイン株式会社へ商号変更をしております。ネットビジネスのセキュリティの基本となる信用確保の手段である｢電子証明書｣140,000枚以上の発行実績があり、世界140ヵ国を超える国々でインターネット通信における安心と信頼を提供しています。",東京都渋谷区道玄坂1-2-3,2003,,,,356百万円,https://jp.globalsign.com/,
2024-07-01,ＪＮシステムパートナーズ株式会社,システムインテグレータ（SIer）,8,■事業内容： ・企画、提案、コンサルティング…顧客の真の課題を理解し、それを解決するための方法を検討、提案します。・設計、構築…パッケージソフトの活用やスクラッチ開発などを行い、利用できるサービスに仕上げます。・運用、保守…継続的に安定的にご利用いただけるよう運用メンテナンスを行います。,東京都江東区枝川1-9-4住友不動産豊洲TKビル2F,2013,,43.0,121,10百万円,https://www.jnsp.co.jp/,
2024-08-01,株式会社ＢＳＣ,システムインテグレータ（SIer）,2,■概 要大手企業様からの受託開発が中心の独立系のシステム開発を行っていおります。,大阪府大阪市西区江戸堀2-6-33江戸堀フコク生命ビル7F,1989,,34.7,137,50百万円,https://www.b-s-c.co.jp/,
2024-07-01,株式会社ダブルスタンダード,ベンダ（ハードウェア・ソフトウェア）,7,■事業内容： 【独自の基盤技術を構築したビックデータ処理を軸に、企業の新たなサービスを創出する企画開発プロバイダー】 ビックデータ先進企業として、増収増益を実現！クライアントは業界大手企業がほとんどです。,東京都港区南青山2-2-3,2012,プライム市場,35.0,64,263百万円,https://double-std.com/,
2024-07-01,サン情報サービス株式会社,システムインテグレータ（SIer）,12,■事業の特徴：医療情報システムに強味を持ち、金融系から官公庁系、メーカー系まで幅広いシステム開発を手掛けるオールラウンド型のSierです。■事業内容：・医療情報システム（電子カルテ・健診システム・臨床検査システムなどの開発、導入・運用支援、保守）・金融系システム（銀行等）の開発、運用支援・官公庁システム（中央官庁、地方自治体）の開発、運用支援、保守・大手企業基幹システムの開発、運用支援、保守,東京都文京区本郷3-15-9SWTビル6F,1987,,39.0,121,40百万円,https://www.sisco.co.jp/,
2024-06-01,株式会社システムエンタープライズ,システムインテグレータ（SIer）,2,■事業内容：・情報システムに関するコンサルティング・コンピュータソフトウェアの受託開発,岡山県岡山市北区富吉3202-1,1982,,34.3,115,50百万円,http://www.s-enter.com/,
2024-08-01,株式会社アクリート,通信キャリア・ISP・データセンター,3,■事業内容： 【SMSを活用した国内・海外のビジネスサポートを行ってきたSMS配信におけるパイオニアです】SMS（ショートメッセージサービス）とは、携帯電話番号に上限70文字などの短いテキストメッセージを送信するサービスです。SMSを利用した本人認証をはじめ、様々な業界、ビジネス、サービスでSMSの新しい可能性を提案し、実現しております。当社のSMSは電話やメールと同様の通信サービスとして、高品質、安定稼働、100万通以上の大量配信など、システムの安定稼働と高可用性を重視した構成になっております。,東京都千代田区神田小川町3-28-5axle御茶ノ水3F301,2014,グロース市場,38.9,61,370百万円,https://www.accrete-inc.com/company/outline.html,
2024-06-01,ネットスター株式会社,ベンダ（ハードウェア・ソフトウェア）,15,■概要：インターネット・アクセス・マネジメント(IAM)をコンセプトに、セキュリティ製品・サービスを自社開発する開発専門企業です。インターネットのURLフィルタリング製品の開発、WEBサイトデータベースの収集・提供サービスでは国内Topシェア。トレンドマイクロ株式会社とアルプスシステムインテグレーション株式会社の合弁で設立された戦略子会社です。,東京都港区白金台3-2-10白金台ビル7F,2001,,40.0,152,80百万円,https://www.netstar-inc.com/,
2024-08-01,株式会社エヌ・ティ・ティ・データ信越,ITコンサルティング,7,同社では信越エリアを中心に30年以上培ってきたキャリアを軸に、「公共」「金融」「法人」の分野で、システムの開発から導入・運用・支援に渡るトータルソリューションを提供しています。（1）公共分野…NTTデータグループが全国で手がける先進的な事例を活用し、顧客業務に最適な情報システムやサービスの提供に努め、豊かな地域社会の実現に貢献しています。（2）法人分野…製造・流通・サービス業等の多様な企業が抱える課題を把握し、その解決を図るための多彩なシステムを提供しています。,長野県長野市七瀬中町161-1ハーモニー七瀬ビル本館2F,1991,,41.0,113,100百万円,https://www.nttdata-shinetsu.co.jp/,
