更新日,名称,業界(小分類),求人有無,事業内容,所在地,設立,上場市場名,平均年齢,従業員数,資本金,企業URL,代表者
2024-06-01,JSAT MOBILE Communications株式会社,通信キャリア・ISP・データセンター,5,"■会社概要：「スカパー！」サービスの提供を始め、アジア最大の衛星通信事業者でもある「スカパーJSAT」と、海上や航空、陸上可搬型と多様な国際移動体衛星通信サービスを提供する事業者「インマルサット（英）」の合弁会社です。インマルサットサービスは、赤道上空36,000kmの静止衛星を通じて、衛星電話・データ通信・救難通信を提供しています。船舶会社・航空会社などの移動体ユーザーや官公庁・報道関係者向けによる地上網・携帯電話網の届かないエリアでの利用、震災BCP対策として一般企業にも広く利用されています。",東京都港区虎ノ門5-11-2オランダヒルズ森タワー19F,2008,,,23,375百万円,http://www.jsatmobile.com/,
2024-06-01,株式会社Gran Manibus,ITコンサルティング,3,■同社のサービス：Consulting Service幅広い業種・業界における豊富なコンサルティング経験を重ねてきたプロフェッショナルが、クライアントが抱える課題やニーズに対して最適解をご提供します。Engineering Serviceグランマニブスのエンジニアリングサービスは、顧客のビジネス価値を最大化するために、プロダクトエンジニアリングのアプローチを採用しています。具体的には、ビジネスとプロダクトのビジョンとロードマップを同時並行で構想し、リリースを繰り返しながらプロダクトやサービスを開発していきます。,東京都千代田区大手町1-6-1大手町ビル404,2007,,,24,,https://www.granmanibus.com/,
2024-08-01,株式会社サブゲート,ベンダ（ハードウェア・ソフトウェア）,2,■企業概要：当社は世界発のウィルス拡散を防ぐ特許を取得したMDSエンジンを搭載するネットワークセキュリティ製品の販売、保守を手掛けております。100％自社製品の為ネットワークセキュリティ専門企業として高い技術力を基に日々成長する企業を目指しております。,東京都千代田区神田須田町1-1,2011,,38.0,24,10百万円,http://www.subgate.co.jp,
2024-06-01,株式会社ジーデップ・アドバンス,ベンダ（ハードウェア・ソフトウェア）,1,■事業内容： 株式会社ジーデップ・アドバンスは、2016年設立のテクノロジー企業です。同社は東京証券取引所スタンダード市場に上場しており、AIソリューションやビジュアライズソリューションを提供しています。代表取締役社長の飯野匡道氏は、NVIDIA社との出会いをきっかけに同社を創業しました。彼をはじめとする経営陣は、グローバルな視点を持ちつつも、地域社会への貢献を忘れないバランスの取れた経営を行っています。,宮城県仙台市青葉区国分町3-4-33仙台定禅寺ビル8F,2016,スタンダード市場,,21,281百万円,https://www.gdep.co.jp/,
2024-05-01,ログイット株式会社,システムインテグレータ（SIer）,2,■業務内容：コンタクトセンターソリューション、非対面顧客支援プラットフォーム、対面録音ソリューション上記の販売、インテグレーション、保守、運用、監視をご提供,東京都豊島区南大塚2-25-15リクルート新大塚ビル8F,1999,,51.0,27,100百万円,http://www.logit.co.jp/,
2024-08-01,ザイオネックス株式会社,ITコンサルティング,4,■事業内容：・製造業ITコンサルティング・SCM（サプライチェーンマネジメント）及びPLM（プロダクトライフサイクルマネジメント）ソフトウエアの開発／販売,東京都中央区日本橋箱崎町1-2THE・SHORE日本橋茅場町7F,2013,,,29,45百万円,https://zionex.co.jp/,
2024-06-01,テクノクリエイト株式会社,ベンダ（ハードウェア・ソフトウェア）,2,■事業内容：・各種（FA、OA、PA）アプリケーションソフトウェアの設計、開発、販売及びメンテナンス・コンピュータ並びに周辺機器の販売及びメンテナンス・各種情報処理及びアプリケーションに関するコンサルティング業務,大阪府大阪市中央区松屋町7-7カナデン大阪ビル,1992,,38.4,22,20百万円,http://www.techno-create.co.jp,
2024-08-01,株式会社アムズユニティー,システムインテグレータ（SIer）,1,■事業内容1.コンピュータソフトウェアの受託開発、並びに販売2.コンピュータソフトウエアの保守及び管理3.コンピュータ利用に関するコンサルタント業4.webサイト作成、管理■会社概要当社は、社名のとおり社員が一丸となって結束しており、 品質、価格共にお客様と満足を共有することができる岡山のソフトハウスです。,岡山県岡山市北区北長瀬1201-1北長瀬MKビル2F,2007,,42.0,18,10百万円,"Failed to retrieve page, status code: 410",
2024-07-01,日本ティーマックスソフト株式会社,システムインテグレータ（SIer）,3,■事業内容：・Tibero、JEUS、WebToB、Tmaxを中心としたプロダクトビジネス・RehostingのOpenFrame、次世代システムのProFrameを中心としたソリューションビジネス・日本の事情に合わせた独自のビジネス展開,東京都港区芝公園2-3-6,2000,,,,90百万円,http://www.tmaxsoft.co.jp/,
2024-08-01,株式会社グレープ・ワン,通信キャリア・ISP・データセンター,1,■事業内容：・ローカル5G無線プラットフォーム事業・地域BWA無線プラットフォーム事業具体的には、主に全国のケーブルテレビ事業者向け、以下の事業を行う。・ローカル5G及び地域BWA対応の無線基地局及び端末等機器の調達、販売、保守・ローカル5G及び地域BWAシステムのインテグレーション・ケーブルテレビ事業者が運用する基地局の運用監視・当社が保有するローカル5G及び地域BWAのコア機能のサービス提供、運用管理,東京都千代田区岩本町2-11-2,2019,,,19,100百万円,"Failed to retrieve page, status code: 410",
2024-08-01,株式会社スクラムソフトウェア,システムインテグレータ（SIer）,4,■事業概要:株式会社スクラムソフトウェアは、物流業界へイノベーションを起こすこと目指してスクラッチ開発やパッケージのカスタマイズ開発、システムの導入支援などを行うソフトウェア受託開発企業です。■事業内容：・コンピュータシステムの設計・開発・製造および販売 ・コンピュータおよび周辺機器の販売・ネットワークシステムの設計・構築およびコンサルタント,大阪府大阪市中央区南船場1-5-21T・U南船場ビル3F,2005,,42.0,16,6百万円,https://scrumsoftware.co.jp/,
2024-07-01,フォーネスライフ株式会社,システムインテグレータ（SIer）,2,■事業内容： 「血中タンパク質測定技術」×「NECグループのICT・AI」を組み合わせて現在の健康状態と疾病リスクをわかりやすく可視化するとともに、一人ひとりに適した改善提案と結果シミュレーションにより、行動変容を後押しします。,東京都中央区日本橋本町3-8-3,2020,,,80,325百万円,"Failed to retrieve page, status code: 410",
2024-07-01,株式会社リースシステム企画,システムインテグレータ（SIer）,2,■事業内容：リース及びレンタル事業向けのサポート及びコンサルタント,埼玉県川口市芝新町4-6YS TOWER5F,1991,,41.0,19,20百万円,http://www.lease-system.co.jp/index.html,
2024-07-01,ノックス株式会社,システムインテグレータ（SIer）,4,■事業内容：・基幹業務アプリケーションソフト設計、開発、保守、運用サービス・統合業務ソフト導入、カスタマイズによるシステム構築支援・ホスティング、ハウジング、ASPサービスの構築、運用サービス・ネットワーク構築支援・Webシステムの開発,大阪府大阪市福島区福島6-13-7森山ビル5F,2006,,,19,35百万円,https://www.nocs-kk.co.jp/,
2024-06-01,株式会社綿引無線,システムインテグレータ（SIer）,1,■事業内容： ◎無線通信ソリューション…各種業務に効果的に活用できる無線通信システムを実現します。,茨城県水戸市石川2-4088-1,1968,,,15,40百万円,https://www.m-watahiki.com/,
2024-07-01,株式会社エス・ケイ,システムインテグレータ（SIer）,1,iOS（iPhone、iPadなど）、Android端末向けアプリの開発自社クラウドサービス製品の開発・提供サーバー・ネットワーク構築、ホスティング・ハウジングサービスホームページ制作、アプリ・各種印刷物などのデザイン,愛知県名古屋市東区代官町35番16号 第一富士ビル2F,,,,15,4000万円,https://www.esukei.jp/,代表取締役社長執行役員 小川 太一
2024-08-01,イーコーポレーションドットジェーピー 株式会社,ITコンサルティング,1,■企業概要：2000年1月創立以来、特に公共分野である行政と医療の分野で電子自治体のあるべき姿を実現するため、情報システムの刷新、再構築を手がけています。■事業詳細：・コンサルティング・オープン系システム開発・ソリューション販売,東京都中央区日本橋大伝馬町12-1ホワイトビル 401,2000,,36.0,12,82百万円,http://www.e-corporation.co.jp/,
2024-08-01,図研モデリンクス株式会社,ITコンサルティング,3,■経営理念モデリングがイノベーションをリードし、ものづくりを進化させる ■ビジョン： 明日のものづくりの実現- 高度なモデリング、分析、シミュレーション技術を土台としたMBD/MBSEにより、製造業のお客様の成功に貢献する- 高品質なメカ・エレキ・ソフトの総合的な技術コンサルティング・サービスを通じてものづくりのイノベーションを支援する■特徴： 当社は、MBD/MBSEにおける、コンサルティングおよびエンジニアリングサービスを提供する会社です。2019年10月に株式会社図研の100%出資で設立がされております。,東京都港区新橋5-8-11新橋エンタービル6F,2019,,,21,100百万円,https://modelinx.co.jp/,
2024-08-01,株式会社サイバージムジャパン,システムインテグレータ（SIer）,6,■事業内容：サイバー先進国イスラエルで経験豊富なメンバーとノウハウを有するサイバーセキュリティのリーディングカンパニーであるCYBERGYM社と連携し、日本およびアジアにおける事業展開を行っています。サイバーセキュリティは企業にとって重要な経営課題のひとつです。当社では、セキュリティ部門向けをはじめ経営層から一般部門まで各部門や役割の方を対象とした多様なメニューのサイバーセキュリティトレーニングはもちろんのこと、セキュリティ診断・調査、セキュリティコンサルティング、各種サイバーセキュリティソリューションに至るまで、セキュリティに関する課題に対して網羅的にサービスをご提供しています。,東京都港区赤坂1-14-11,2020,,38.0,13,4百万円,https://cybergymjapan.com/,
2024-08-01,株式会社マイタックジャパン,通信キャリア・ISP・データセンター,3,■同社についてマイタックジャパンが 1985 年東京にて設立、IT 機器の開発、製造の多国籍組織の MiTAC グループの日本法人として活動して参りました。マイタックジャパンは日本市場顧客と台湾本社事業部へのエンゲージメント、テクニカルサポート提供、アフターサービス提供、同時に TYAN ブランドサーバ販売推進、産業用 PC / IoT／車載電子製品販売推進も担っています。■事業内容 ●TYANブランドサーバー、ストレージ機器の販売●産業用PCの販売●業務用タブレット端末の販売●MiTACグループへの各種役務サービス提供 等,東京都港区海岸3-2-12安田芝浦第2ビル3F,1985,,42.0,13,50百万円,https://www.mitac.co.jp/ja,
2024-08-01,ＱＮＡＰ株式会社,システムインテグレータ（SIer）,3,■QNAPについてQNAP (Quality Network Appliance Provider) は、ソフトウェア開発、ハードウェア設計、自社製造にて総合的なソリューションを提供することに専念しています。ストレージ、ネットワーキング、スマートビデオでの革新に焦点を合わせたQNAPは、当社の先進のサブスクリプションベースのソフトウェアと多様なサービスチャネルのエコシステムを融合させた、画期的なCloud NASソリューションを紹介いたします。,東京都荒川区荒川7-50-9センターまちや502D,2004,,,10,,https://www.qnap.com/ja-jp,
2024-05-01,株式会社ＣＥＬ,システムインテグレータ（SIer）,3,■事業内容： ・AIセキュリティ検査事業「CEL TLPTシリーズ」（WEBアプリ、モバイルアプリ、社内取引システム、IoT、プラットフォーム、ネットワーク、スマートホーム、スマート家電、位置情報サービス、車載システム、ダークウェブなどを対象とした脅威ベースのペネトレーションテスト（TLPT）事業）・投融資に付随するデジタル経営リスク評価「サイバー・デューデリジェンス(R)」事業・DevSecOps、セキュア開発コンサルティング事業,東京都港区赤坂1-14-11,2018,,28.0,13,62百万円,https://celab.co.jp/,
2024-07-01,株式会社ＶｉｄｅｏＳｔｅｐ,ベンダ（ハードウェア・ソフトウェア）,1,■事業内容私たちは動画の活用によって時代と空間を超えて人をつなげ、これまでにない価値を創造することを目指しています。『Videostep』は社内に存在する情報の壁を取り除き、簡単に動画でナレッジ共有するサービスです 。ご存知の通り、現在の日本は少子高齢化が進んでいますが、その裏では多くのノウハウが失われていることや、外国人労働者受け入れに教育体制が追いついていない現状など多くの課題があります。これに対して当社は文字だけでは伝承できないノウハウを、70歳の動画編集経験のないおじいちゃんでも操作・編集ができるような、今までの動画ツールにはない体験を提供することでこの課題解決に取り組んでいます。,東京都港区芝2-5-6芝256スクエアビル6F,2019,,26.0,15,25百万円,なし,
2024-08-01,ＳｙｎｏｌｏｇｙＪａｐａｎ株式会社,ベンダ（ハードウェア・ソフトウェア）,4,■事業内容：・自社製品NAS（Network Attached Storage）の製造、販売、サポート・自社製品Router（ルーター）の製造、販売、サポート・監視カメラ統合システムの開発、販売、サポート・日本支社は営業販売・サポート拠点,東京都千代田区東神田3-1-2ユニゾ東神田三丁目ビル4F,2018,,34.0,17,30百万円,https://www.synology.com/ja-jp,
2024-08-01,株式会社ＣｌｏｕｄＴｅｃｈＰｌｕｓ,システムインテグレータ（SIer）,求人なし,,東京都千代田区神田多町2-1神田東山ビル 7Ｆ,2021,,,10,5 百万円,"Failed to retrieve page, status code: 410",代表取締役 元 春峰
2024-08-01,株式会社ａ‐ＬＩＮＫ,システムインテグレータ（SIer）,4,設立以来、大手企業様をお客様として、主にソフトウェア受託開発事業を行っております。 受託開発と言っても、単なる受託に留まるのではなく、高い技術力を持ったフィリピン人、ベトナム人技術者を活用し、『提案型受託開発』を特徴として、大手企業を顧客としています。 また、2020年より自社の製品開発に注力し、受託事業ともうひとつの柱となれるよう推進しております。さらに2021年7月より、東証一部上場会社 (株)ＣＩＪと資本業務提携を行い、提携のシナジー効果を発揮させ、さらなる事業の発展、会社の発展を図っていく軌道が出来ました。このようなことから新しい仲間を強く求めています。,神奈川県横浜市港北区新横浜2-3-9新横浜金子ビル9F,2003,,,14,3百万円,https://www.alink-group.co.jp/,
2024-06-01,株式会社インフィニットコンサルティング,ITコンサルティング,1,顧客企業の情報システム部門の一員として、現場が抱える様々な課題の解決に向けた業務支援を実施しています。大手企業の大規模案件が豊富にあり、顧客と直接やり取りをしながら、プロジェクトを推進します。東証一部上場のソルクシーズのグループ子会社である当社。親会社・グループ子会社との横のつながりで優秀な技術陣からのバックアップが受けられます。当社が大切にしているのは実体験をベースとした経営目線と現場目線、双方からの問題解決へのアプローチです。,東京都港区海岸3-9-15LOOP-Xビル 5F,2007,,47.5,9,30百万円,https://www.infinite-cs.co.jp/,
2024-07-01,株式会社ｉＭｅｄｉｃａｌ～三井物産グループ企業,ITコンサルティング,3,《当社について》■リゾートトラストグループと三井物産グループによる合弁会社である当社。『健康診断・人間ドック事業の伸長による医療機関経営の成長戦略実現と、予防医療の普及による健康長寿社会の実現に貢献』を使命とし、医療×イノベーション事業を展開中です。グループ内で多くの医療施設を有するリゾートトラストメディカル本部と、IT・情報セキュリティ分野でも豊富な経験を積んだ三井物産とがタッグを組み、既存概念にとらわれない革新的なソリューションで市場にアプローチしています。,東京都港区六本木6-2-31六本木ヒルズノースタワー6F,2013,,39.0,45,100百万円,http://www.imedi.co.jp/,
2024-08-01,株式会社トータルシステムエンジニアリング,システムインテグレータ（SIer）,1,■事業内容：◎流通業におけるソフトウェアコンサルティング及びシステム開発・販売・ユーザーシステムサポート・チェーンストア向け各種パッケージソフト開発・販売・各種LAN・WAN等の導入支援及び教育◎抗ウイルス・抗菌施工事業・抗ウイルス・抗菌コーティング剤の販売・施工・エアコンや水回りほかハウスクリーニング、家事代行サービス,大阪府大阪市中央区博労町4-2-15,1985,,,21,30百万円,"Failed to retrieve page, status code: 410",
2024-08-01,株式会社アイヴィジョン,システムインテグレータ（SIer）,1,■事業内容：リッチコンテンツ事業メディアコンテンツ事業■事業詳細：SaaSサービスとして、4つの動画関連プロダクトの販売・開発・運用業務を展開しています。（1）IR動画配信 SmartVision IR（2）会社説明・サービス説明等 SmartVision（3）企業向け映像eラーニング SmartVision MEL（4）採用向け動画配信 SmartVisionりくる,東京都渋谷区恵比寿3-3-3,2003,,,7,30百万円,http://ivision.ne.jp/,
2024-06-01,株式会社恵和ビジネス,ベンダ（ハードウェア・ソフトウェア）,1,■事業内容：＜バックオフィスサービス＞コールセンター、事務会計センター、商品券清算支援サービス、特別定額給付金事業など、幅広い業務代行により、経営活動に確かな成果を支援＜エントリー/AI-OCR/RPA＞データエントリー、OCR読み取り、スキャニング、RPAなど伝票や帳票などの煩雑な入力処理を、一手にお引き受け＜システム開発＞データベース開発、ソフトウェア開発、ネットワーク構築、ホスティング、グループウェア、各種WEBサイト構築など最新のITと豊富なノウハウのBPOで、ビジネスの課題解決を推進＜プリント アウトソーシング＞帳票設計、出力プログラム作成、データプリント、各種印刷物作成,北海道札幌市中央区南二条西12-324-1,1959,,,301,209百万円,https://www.keiwa-biz.co.jp/,
2024-06-01,北海道電子機器株式会社,ベンダ（ハードウェア・ソフトウェア）,3,■事業概要：コンピュータシステム、ハードウェア、ソフトウェアの設計・開発・製造・販売■事業詳細：・コンピュータを応用したエレクトロニクスの関連機器開発・計測、演算、伝送、制御処理などのハードウェア、ソフトウェアの開発設計、および販売・汎用電子応用機器のソフトウェア開発、設計、製作・システムの企画、分析、試作、開発、設計などの委託業務・上記各項目のOEM供給,北海道札幌市東区北十条東10-1-1,1977,,,22,20百万円,http://www.hdks.co.jp/,
2024-07-01,株式会社ハイテックシステム,ベンダ（ハードウェア・ソフトウェア）,5,■私たちについてダムや水力発電の計測と制御に関しては長い経験と豊富なノウハウを持ち、北海道内の大半の水力発電所に関わっていることから、電気という重要な社会インフラを支えていると自負しています。 その上で、安定度の高い枯れた技術はもとより、世に出たばかりの最新技術をも積極的に取り込んで次々と革新を起こしていくことが大切と考えています。 今後は、IoTの流れに乗って当社ならではの製品もしくはサービスをつくっていきます。 北海道、日本そして世界に活躍のフィールドを広げていきましょう。,北海道恵庭市戸磯76-22恵庭テクノパーク,1991,,43.0,19,36百万円,https://www.hitech-system.co.jp,
2024-08-01,株式会社アイパス,システムインテグレータ（SIer）,4,■事業内容： （1）システムコンサルティングサービス・システム導入にあっての既存システムの調査、分析、コンサルティング・IT関連の疑問・質問への対応（2）システムインテグレーションサービス・業種、業務に精通したシステムエンジニアによる稼働～運用支援（システム設計、スケジュール管理、導入計画、オペレーション指導、運用管理等のノウハウを駆使）（3）システムソリューションサービス・インターネット、グループウェア、ナレッジサーバ、データベース、BIツール等、多様な技術知識を駆使し、顧客に最適なシステムを提供（4）システムサポートサービス・導入、稼働後の問合せ窓口,北海道札幌市中央区南一条東3-10-13,1997,,,45,30百万円,http://www.ipas.co.jp/index.php,
2024-08-01,株式会社コンピュータ・システム研究所,ベンダ（ハードウェア・ソフトウェア）,20,■事業内容： 1.土木・建築事業関連のコンピュータソフトウェア開発・販売・メンテナンス2.各種マネジメントコンサルティング（IS09000、14000、45000等）3.建設業向け教育サービス4.3Ｄ画像解析ソリューション・ソフトウェアおよび周辺機器の開発・販売,宮城県仙台市青葉区本町2-19-21CST共立ビル,1986,,40.0,524,226百万円,https://www.cstnet.co.jp/,
2024-07-01,株式会社メコム,ITコンサルティング,2,■事業内容：IT機器 、ドキュメント機器、システム機器の販売・指導・メンテナンスシステムインテグレーション、ネットワーク構築の販売・運用サポートソフトウェア受託開発、業務ソフトのインストラクター業務IT機器のレンタル及びリースの業務ネットワーク工事、通信機器工事ファニチャー、什器の販売・施工サプライ供給メガソーラー事業、光回線事業,山形県山形市香澄町2-9-21,1947,,43.8,117,72百万円,https://www.mecom.jp/,
2024-08-01,東光コンピュータ・サービス株式会社,システムインテグレータ（SIer）,4,■事業内容：（1）業務を最適化する、オリジナルパッケージの開発（2）インフラの構築（3）オリジナルシステムの構築（4）IT関連機器販売（5）自治体システムや学校のサポート,秋田県大館市御成町4-8-74,1984,,43.8,72,60百万円,http://www.tcs.tokogrp.co.jp/,
