更新日,名称,業界(小分類),求人有無,所在地,設立,代表者,資本金,平均年齢,従業員数,企業URL,事業内容,上場市場名
2024-08-01,ＳＬＳ株式会社,通信販売・ネット販売,求人なし,大阪府和泉市肥子町2-3-31あすかビル 201,2017,代表取締役 齋藤 智美,,,,Error accessing nan: Invalid URL 'nan': No scheme supplied. Perhaps you meant https://nan?,,
2024-08-01,株式会社Ａ－Ｚ,自動車ディーラー,求人なし,静岡県沼津市西沢田387-1,2017,代表取締役 山本 浩嗣,5 百万円,,,Error accessing nan: Invalid URL 'nan': No scheme supplied. Perhaps you meant https://nan?,,
2024-08-01,株式会社レモネード・レモニカ,食品・GMS・ディスカウントストア,求人なし,石川県金沢市森山1-2-23,2017,代表取締役 長江 国輝,3 百万円,,,Error accessing nan: Invalid URL 'nan': No scheme supplied. Perhaps you meant https://nan?,,
2024-08-01,ベルツ株式会社,食品・GMS・ディスカウントストア,求人なし,東京都渋谷区広尾2-2-18,2017,代表取締役 梅地 幸枝,,,,Error accessing nan: Invalid URL 'nan': No scheme supplied. Perhaps you meant https://nan?,,
2024-08-01,株式会社ＣＡＲ　ＰＲＯＤＵＣＥ,自動車ディーラー,求人なし,岡山県赤磐市岩田370-1,2017,代表取締役 社 海渡,5 百万円,,,Error accessing nan: Invalid URL 'nan': No scheme supplied. Perhaps you meant https://nan?,,
2024-08-01,株式会社ＲＡＶＩＰＡ,通信販売・ネット販売,求人なし,東京都豊島区池袋2-43-1池袋青柳ビル Ｂ1Ｆ,2017,代表取締役 新井 亨,9 百万円,,,Error accessing nan: Invalid URL 'nan': No scheme supplied. Perhaps you meant https://nan?,,地方上場
2024-08-01,株式会社九州野菜育苗センター,専門店・その他小売,求人なし,熊本県菊池郡大津町大字岩坂475-1,2017,代表取締役 竹内 宏典,10 百万円,,,Error accessing nan: Invalid URL 'nan': No scheme supplied. Perhaps you meant https://nan?,,
2024-08-01,株式会社ＲＪ,専門店（アパレル・アクセサリー）,無,大阪府大阪市中央区南船場2-4-23東泉ビル 2Ｆ,2017,代表取締役社長 陸 政,5 百万円,,,Error accessing nan: Invalid URL 'nan': No scheme supplied. Perhaps you meant https://nan?,◆ヘアーエクステンション・カットウィッグの製造、卸売販売◆美容用品の輸入販売◆髪製品のOEM企画 2024年5月doda掲載求人より引用,
2024-08-01,株式会社アットカーズ,自動車ディーラー,求人なし,滋賀県守山市赤野井町761-2,2017,代表取締役 上田 和治,5 百万円,,,Error accessing nan: Invalid URL 'nan': No scheme supplied. Perhaps you meant https://nan?,,
2024-08-01,ワクワク株式会社,自動車ディーラー,求人なし,愛知県北名古屋市高田寺屋敷524,2017,代表取締役 柏原 哲郎,10 百万円,,,Error accessing nan: Invalid URL 'nan': No scheme supplied. Perhaps you meant https://nan?,,
2024-08-01,株式会社福まん家,食品・GMS・ディスカウントストア,求人なし,長崎県大村市古賀島町365-8福まん家ビル 202,2017,代表取締役 福田 万次郎,1 百万円,,,Error accessing nan: Invalid URL 'nan': No scheme supplied. Perhaps you meant https://nan?,,
2024-08-01,株式会社ＷＩＹＮペット,専門店・その他小売,求人なし,滋賀県大津市雄琴2-1-33ＷＩＹＮビル 1Ｆ,2017,代表取締役 木本 隆博,9 百万円,,,Error accessing nan: Invalid URL 'nan': No scheme supplied. Perhaps you meant https://nan?,,
2024-08-01,株式会社ＬＩＡＬ　ＷＯＲＫＳ,専門店・その他小売,求人なし,大阪府大阪市中央区南船場2-6-3第2．ＢＳビル 701,2017,代表取締役 藤岡 高志,1 百万円,,,Error accessing nan: Invalid URL 'nan': No scheme supplied. Perhaps you meant https://nan?,,
2024-08-01,株式会社さが美,専門店（アパレル・アクセサリー）,求人なし,神奈川県横浜市戸塚区川上町87-4Ｎ＆Ｆビル1－4Ｆ,2017,代表取締役 形部 幸裕,50 百万円,,,Error accessing nan: Invalid URL 'nan': No scheme supplied. Perhaps you meant https://nan?,,
2024-08-01,株式会社チルフォトグラフィー,専門店・その他小売,求人なし,福岡県福岡市南区長住2-18-10201,2017,代表取締役 李 康勲,5 百万円,,,Error accessing nan: Invalid URL 'nan': No scheme supplied. Perhaps you meant https://nan?,,
2024-08-01,株式会社ワンダービルド,専門店・その他小売,求人なし,北海道札幌市中央区南三条西6-5セザール札幌 504,2017,代表取締役 生熊 康延,25 百万円,,,Error accessing nan: Invalid URL 'nan': No scheme supplied. Perhaps you meant https://nan?,,
2024-08-01,株式会社アライブプラス,専門店・その他小売,求人なし,大阪府豊中市走井2-14-5,2017,代表取締役 渡辺 淳,1 百万円,,,Error accessing nan: Invalid URL 'nan': No scheme supplied. Perhaps you meant https://nan?,,
2024-08-01,株式会社エンイート,食品・GMS・ディスカウントストア,求人なし,神奈川県小田原市早川1-4-10,2017,代表取締役 市川 将史,3 百万円,,,Error accessing nan: Invalid URL 'nan': No scheme supplied. Perhaps you meant https://nan?,,
2024-08-01,株式会社オダイ,ドラッグストア・調剤薬局,求人なし,群馬県桐生市織姫町5-42,2017,代表取締役 尾台 隆男,1 百万円,,,Error accessing nan: Invalid URL 'nan': No scheme supplied. Perhaps you meant https://nan?,,
2024-08-01,株式会社グランツリー,専門店・その他小売,求人なし,福岡県行橋市大字金屋340-6,2017,代表取締役 久保 泰貴,1 百万円,,,Error accessing nan: Invalid URL 'nan': No scheme supplied. Perhaps you meant https://nan?,,
2024-08-01,株式会社ＣＯＨ,食品・GMS・ディスカウントストア,求人なし,東京都足立区谷在家1-22-6,2017,代表取締役 塚本 哲也,31 百万円,,,Error accessing nan: Invalid URL 'nan': No scheme supplied. Perhaps you meant https://nan?,,
2024-08-01,株式会社エルツティンジャパン,専門店・その他小売,求人なし,東京都中央区八丁堀3-5-8京橋ＹＡＨＡＴＡビル7Ｆ,2017,代表取締役 尹 喆洙,10 百万円,,,Error accessing nan: Invalid URL 'nan': No scheme supplied. Perhaps you meant https://nan?,,
2024-08-01,株式会社マロン,専門店（アパレル・アクセサリー）,求人なし,福岡県北九州市八幡西区黒崎2-10-11マロンビル 2Ｆ,2017,代表取締役 大久保 寛之,50 百万円,,,Error accessing nan: Invalid URL 'nan': No scheme supplied. Perhaps you meant https://nan?,,
2024-08-01,Ｃｏｃｏｃｈｉ　Ｃｏｓｍｅ株式会社,専門店・その他小売,無,東京都中央区銀座3-9-4草野ビルディング4Ｆ,2017,代表取締役 天海 潔,16 百万円,,,Error accessing nan: Invalid URL 'nan': No scheme supplied. Perhaps you meant https://nan?,■化粧品・健康食品開発■化粧品・健康食品販売 2023年12月doda掲載求人より引用,
2024-08-01,株式会社スクワッド,専門店（家電量販店）,求人なし,香川県高松市伏石町2071-18,2017,代表取締役 西置 祐樹,10 百万円,,,Error accessing nan: Invalid URL 'nan': No scheme supplied. Perhaps you meant https://nan?,,
2024-08-01,株式会社エスコーポレーション,自動車ディーラー,求人なし,大阪府寝屋川市高宮栄町25-40,2017,代表取締役 鈴木 翔太,10 百万円,,,Error accessing nan: Invalid URL 'nan': No scheme supplied. Perhaps you meant https://nan?,,
2024-08-01,株式会社みはら,専門店（家電量販店）,求人なし,北海道函館市美原3-8-8,2017,代表取締役 田村 吉久,32 百万円,,,Error accessing nan: Invalid URL 'nan': No scheme supplied. Perhaps you meant https://nan?,,
2024-08-01,ＶＲＴａｌｋ株式会社,専門店・その他小売,求人なし,東京都渋谷区神宮前6-23-4,2018,代表取締役 張 顕赫,5 百万円,,,Error accessing nan: Invalid URL 'nan': No scheme supplied. Perhaps you meant https://nan?,,
2024-08-01,株式会社プロテクトサービス,通信販売・ネット販売,無,東京都新宿区西新宿1-20-3,2018,代表取締役 青山 重之,3 百万円,,,Error accessing nan: Invalid URL 'nan': No scheme supplied. Perhaps you meant https://nan?,情報が古い可能性があります。最新の情報を確認する場合はHP等をご覧ください。 ●防犯機器・通信機器のレンタル、販売、設置、保守及びメンテナンス●水道配管の販売及び配水管の洗浄作業●オール電化商品の販売及び施工●建設工事業●カタログ及びインターネットによる通信販売●再生可能エネルギーに関する事業●太陽光発電設備の販売及び工事 2022年2月doda掲載求人より引用,
2024-08-01,株式会社鈴木新聞店,専門店・その他小売,求人なし,茨城県高萩市春日町2-15,2018,代表取締役 鈴木 透,1 百万円,,,Error accessing nan: Invalid URL 'nan': No scheme supplied. Perhaps you meant https://nan?,,
2024-08-01,全日本通商株式会社,通信販売・ネット販売,無,東京都豊島区東池袋5-49-7藤和シティコープ新大塚Ⅱ 1Ｆ,2017,代表取締役 杉本 譲,90 百万円,,,Error accessing nan: Invalid URL 'nan': No scheme supplied. Perhaps you meant https://nan?,■輸出入および製造、販売■通信販売事業■古物、中古品の買取・販売＜古物商許可＞埼玉県公安委員会 第431010037672号 2023年10月doda掲載求人より引用,
2024-08-01,株式会社三井グループ,自動車ディーラー,無,福岡県大牟田市大字橘934,2018,代表取締役 三井 千賀子,1 百万円,,,Error accessing nan: Invalid URL 'nan': No scheme supplied. Perhaps you meant https://nan?,,
2024-08-01,株式会社Ｎ＆Ｉ,自動車ディーラー,求人なし,埼玉県新座市菅沢2-8-2,2018,代表取締役 小嶋 規泰,10 百万円,,,Error accessing nan: Invalid URL 'nan': No scheme supplied. Perhaps you meant https://nan?,,
2024-08-01,株式会社オートアディクション,自動車ディーラー,求人なし,大阪府茨木市北春日丘3-2-31,2018,代表取締役 安藤 善章,5 百万円,,,Error accessing nan: Invalid URL 'nan': No scheme supplied. Perhaps you meant https://nan?,,
2024-08-01,株式会社神奈川中古車買取査定センター,自動車ディーラー,求人なし,神奈川県大和市渋谷7-12-7,2017,代表取締役 阿部 慎吾,1 百万円,,,Error accessing nan: Invalid URL 'nan': No scheme supplied. Perhaps you meant https://nan?,,
2024-08-01,株式会社ＭｉＬ,食品・GMS・ディスカウントストア,求人なし,東京都港区南青山4-13-9クレセントヒルズ 3Ｆ,2018,代表取締役 杉岡 侑也,374 百万円,,,Error accessing nan: Invalid URL 'nan': No scheme supplied. Perhaps you meant https://nan?,,
2024-08-01,株式会社せんだい堂,専門店・その他小売,求人なし,宮城県仙台市青葉区国見1-13-14,2018,代表取締役 佐々木 安久,3 百万円,,,Error accessing nan: Invalid URL 'nan': No scheme supplied. Perhaps you meant https://nan?,,
2024-08-01,株式会社ＬＩＮＣＲＥＳＴ,専門店・その他小売,求人なし,千葉県八千代市村上1200,2018,代表取締役 福永 敬大,3 百万円,,,Error accessing nan: Invalid URL 'nan': No scheme supplied. Perhaps you meant https://nan?,,
2024-08-01,株式会社農人たち,食品・GMS・ディスカウントストア,求人なし,栃木県宇都宮市叶谷町280,2018,代表取締役 宮本 暢常,33 百万円,,,Error accessing nan: Invalid URL 'nan': No scheme supplied. Perhaps you meant https://nan?,,
2024-08-01,株式会社エフ・トラスト,専門店・その他小売,無,東京都墨田区菊川2-9-10,2018,代表取締役 福田 鍾賢,1 百万円,,,Error accessing nan: Invalid URL 'nan': No scheme supplied. Perhaps you meant https://nan?,,
2024-08-01,株式会社通販王国,通信販売・ネット販売,無,福岡県福岡市早良区昭代2-2-30205,2017,代表取締役 田畠 光一,5 百万円,,,Error accessing nan: Invalid URL 'nan': No scheme supplied. Perhaps you meant https://nan?,,
2024-08-01,株式会社ヴィンテージ,自動車ディーラー,求人なし,宮城県仙台市宮城野区小鶴2-6-15,2017,代表取締役 鈴木 秀隆,1 百万円,,,Error accessing nan: Invalid URL 'nan': No scheme supplied. Perhaps you meant https://nan?,,
2024-08-01,株式会社ＲＥＮＥＣＴ,専門店・その他小売,無,東京都中央区東日本橋3-2-4八光ビル3Ｆ,2018,代表取締役 福友 紘,1 百万円,,,Error accessing nan: Invalid URL 'nan': No scheme supplied. Perhaps you meant https://nan?,情報が古い可能性があります。最新の情報を確認する場合はHP等をご覧ください。 ■EC専門のリサイクルショップを運営■中古製品や不要品のリユース事業※東京都公安委員会 第307761804615 2022年8月doda掲載求人より引用,
2024-08-01,株式会社Ｐｌｕｓ　Ｅｉｇｈｔｙ　Ｏｎｅ,百貨店,求人なし,東京都渋谷区渋谷2-12-12,2018,代表取締役 竹本 翔大,10 百万円,,,Error accessing nan: Invalid URL 'nan': No scheme supplied. Perhaps you meant https://nan?,,
2024-08-01,株式会社レビテイト,専門店・その他小売,求人なし,栃木県那須塩原市方京2-2-1ＫＰＥＣビル1Ｆ－Ｃ,2018,代表取締役 田代 寿樹,1 百万円,,,Error accessing nan: Invalid URL 'nan': No scheme supplied. Perhaps you meant https://nan?,,
2024-08-01,株式会社Ｄｒｅａｍ　Ｊｏｕｒｎｅｙ,通信販売・ネット販売,求人なし,大阪府大阪市浪速区敷津西2-1-12ＹＫ ＢＵＩＬＤＩＮＧ 2－Ａ,2018,代表取締役 船元義男,1 百万円,,,Error accessing nan: Invalid URL 'nan': No scheme supplied. Perhaps you meant https://nan?,,
2024-08-01,株式会社三河イエローハット,専門店・その他小売,求人なし,愛知県岡崎市羽根町字鰻池218-1,2018,代表取締役 八百谷拓治,30 百万円,,,Error accessing nan: Invalid URL 'nan': No scheme supplied. Perhaps you meant https://nan?,,
2024-08-01,ＳＲ株式会社,専門店・その他小売,求人なし,東京都足立区西新井本町5-7-9安藤ビル 1Ｆ,2018,代表取締役 星川 大亮,1 百万円,,,Error accessing nan: Invalid URL 'nan': No scheme supplied. Perhaps you meant https://nan?,,
2024-08-01,株式会社ＲＥＩＳＩＮ　ＮＯＶＡ,専門店（アパレル・アクセサリー）,求人なし,大阪府大阪市住吉区我孫子東3-11-15,2018,代表取締役 松本 和博,1 百万円,,,Error accessing nan: Invalid URL 'nan': No scheme supplied. Perhaps you meant https://nan?,,
2024-08-01,株式会社モジュール,専門店・その他小売,求人なし,沖縄県那覇市西2-2-2,2018,代表取締役 禰覇斉,9 百万円,,,Error accessing nan: Invalid URL 'nan': No scheme supplied. Perhaps you meant https://nan?,,
2024-08-01,株式会社コスメニックジャパンコミュニティ,専門店・その他小売,求人なし,大阪府吹田市豊津町2-11第2喜己ビル 303,2018,代表取締役 中村 昭彦,20 百万円,,,Error accessing nan: Invalid URL 'nan': No scheme supplied. Perhaps you meant https://nan?,,
2024-08-01,コンセプトデザイン株式会社,専門店（家電量販店）,求人なし,大阪府大阪市中央区瓦町3-2-16セントラルビル 7Ｆ,2018,代表取締役 新 博明,10 百万円,,,Error accessing nan: Invalid URL 'nan': No scheme supplied. Perhaps you meant https://nan?,,
2024-08-01,セブンシーズ株式会社,食品・GMS・ディスカウントストア,求人なし,東京都江東区青海2-7-41102号室,2018,代表取締役 伊藤 士人,10 百万円,,,Error accessing nan: Invalid URL 'nan': No scheme supplied. Perhaps you meant https://nan?,,
2024-08-01,株式会社グローバルワン,食品・GMS・ディスカウントストア,求人なし,愛知県名古屋市中村区名駅3-2-22エスカ名駅東ビル 4Ｆ,2018,代表取締役 岩渕 陽介,20 百万円,,,Error accessing nan: Invalid URL 'nan': No scheme supplied. Perhaps you meant https://nan?,,
2024-08-01,ネハ・インターナショナル・トレディング・プライベート・リミテド,食品・GMS・ディスカウントストア,求人なし,東京都八王子市子安町2-13-6藤井ハイツ14,,,,,,Error accessing nan: Invalid URL 'nan': No scheme supplied. Perhaps you meant https://nan?,,
2024-08-01,株式会社ヒロコハヤシ,専門店（アパレル・アクセサリー）,求人なし,東京都港区北青山3-5-10,2018,代表取締役 中村 佳子（佐々木 佳子）,5 百万円,,,Error accessing nan: Invalid URL 'nan': No scheme supplied. Perhaps you meant https://nan?,,
2024-08-01,株式会社エイチエム,通信販売・ネット販売,求人なし,福岡県福岡市中央区舞鶴2-3-6赤坂プライムビル 7Ｆ,2018,代表取締役 齋藤 格,30 百万円,,,Error accessing nan: Invalid URL 'nan': No scheme supplied. Perhaps you meant https://nan?,,
2024-08-01,株式会社ＯＮＥ,専門店（アパレル・アクセサリー）,無,大阪府大阪市北区豊崎3-15-9第2ショーレイビル 4Ｆ－Ａ号室,2018,代表取締役 堀之内 聡,5 百万円,,,Error accessing nan: Invalid URL 'nan': No scheme supplied. Perhaps you meant https://nan?,◆不用品の出張買取業◆不用品の宅配買取業 2023年11月doda掲載求人より引用,
2024-08-01,株式会社平安堂,専門店・その他小売,求人なし,長野県長野市南千歳1-15-3ＴＳビル 5Ｆ,2018,代表取締役 高澤 曜宏,50 百万円,,,Error accessing nan: Invalid URL 'nan': No scheme supplied. Perhaps you meant https://nan?,,
2024-08-01,株式会社ＧＥウェルネス,通信販売・ネット販売,求人なし,兵庫県神戸市中央区御幸通8-1-6神戸国際会館 16Ｆ,2018,代表取締役 荒川 健一,91 百万円,,,Error accessing nan: Invalid URL 'nan': No scheme supplied. Perhaps you meant https://nan?,,
2024-08-01,ＨＭＲ株式会社,自動車ディーラー,求人なし,東京都西多摩郡瑞穂町箱根ケ崎東松原11-5,2018,代表取締役 石川 賢志,10 百万円,,,Error accessing nan: Invalid URL 'nan': No scheme supplied. Perhaps you meant https://nan?,,
2024-08-01,アドトレード株式会社,専門店・その他小売,求人なし,埼玉県熊谷市問屋町3-2-2,2018,代表取締役 澤田 健次郎,10 百万円,,,Error accessing nan: Invalid URL 'nan': No scheme supplied. Perhaps you meant https://nan?,,
2024-08-01,株式会社充実生活,専門店・その他小売,求人なし,群馬県前橋市上新田町917-208,2018,代表取締役 本舘 唯世,3 百万円,,,Error accessing nan: Invalid URL 'nan': No scheme supplied. Perhaps you meant https://nan?,,
2024-08-01,株式会社ＨＡＬ,通信販売・ネット販売,求人なし,沖縄県那覇市真嘉比1-10-2ＳＵＮ・ＰＬＡＺＡ・ＧＩＮＯＺＡ2Ｆ,2018,代表取締役 座波 長,75 百万円,,,Error accessing nan: Invalid URL 'nan': No scheme supplied. Perhaps you meant https://nan?,,
2024-08-01,株式会社縁,専門店（アパレル・アクセサリー）,求人なし,福岡県福岡市博多区冷泉町7-31号,2018,代表取締役 鹿毛 厚恵,2 百万円,,,Error accessing nan: Invalid URL 'nan': No scheme supplied. Perhaps you meant https://nan?,,
2024-08-01,株式会社ＮＲ,通信販売・ネット販売,求人なし,東京都中央区日本橋小伝馬町4-3フジスター小伝馬ビル7Ｆ,2018,代表取締役 豊澤 裕子,3 百万円,,,Error accessing nan: Invalid URL 'nan': No scheme supplied. Perhaps you meant https://nan?,,
2024-08-01,株式会社ＲＡＢＯ,通信販売・ネット販売,求人なし,東京都渋谷区東3-9-19ＶＯＲＴ恵比寿ｍａｘｉｍ,2018,代表取締役 伊豫 愉芸子,100 百万円,,,Error accessing nan: Invalid URL 'nan': No scheme supplied. Perhaps you meant https://nan?,,
2024-08-01,合同会社ＷｉｔＢＯＸ,小売業界,求人なし,東京都港区赤坂2-17-52403,2018,代表社員 根本 正美,,,,Error accessing nan: Invalid URL 'nan': No scheme supplied. Perhaps you meant https://nan?,,
2024-08-01,株式会社ＡＬＦＥ,専門店（アパレル・アクセサリー）,求人なし,神奈川県川崎市宮前区南平台8-2307,2018,代表取締役 池田 友樹,4 百万円,,,Error accessing nan: Invalid URL 'nan': No scheme supplied. Perhaps you meant https://nan?,,
2024-08-01,株式会社あかりコミュニケーションズ,通信販売・ネット販売,求人なし,福岡県福岡市博多区東比恵3-16-28,2018,代表取締役 山田 寛行,10 百万円,,,Error accessing nan: Invalid URL 'nan': No scheme supplied. Perhaps you meant https://nan?,,
2024-08-01,株式会社Ｃ２Ｅ,専門店・その他小売,求人なし,大阪府大阪市中央区北久宝寺町2-6-1ＲＥ017ビル404,2018,代表取締役 加藤 輝之,10 百万円,,,Error accessing nan: Invalid URL 'nan': No scheme supplied. Perhaps you meant https://nan?,,
2024-08-01,ＭＫＹ’ｓ合同会社,専門店・その他小売,求人なし,東京都港区芝浦4-21-1,2018,代表社員 安田 和世,1 百万円,,,Error accessing nan: Invalid URL 'nan': No scheme supplied. Perhaps you meant https://nan?,,
2024-08-01,Ｓｏｌｖｅ株式会社,通信販売・ネット販売,求人なし,東京都港区南青山2-23-8外苑ビル 4Ｆ,2018,代表取締役 松田 里美,100 百万円,,,Error accessing nan: Invalid URL 'nan': No scheme supplied. Perhaps you meant https://nan?,,
2024-08-01,ジャパンフラワーグループ株式会社,専門店・その他小売,求人なし,東京都中央区銀座8-4-27,2018,代表取締役 松村 吉章,,,,Error accessing nan: Invalid URL 'nan': No scheme supplied. Perhaps you meant https://nan?,,
2024-08-01,合同会社ＴＲＹＰ,専門店・その他小売,求人なし,東京都新宿区新宿5-1-1ローヤルマンションビル903,2018,代表社員 小野 豊博,2 百万円,,,Error accessing nan: Invalid URL 'nan': No scheme supplied. Perhaps you meant https://nan?,,
2024-08-01,株式会社ステディケイ,自動車ディーラー,求人なし,東京都武蔵野市吉祥寺本町3-22-11,2018,代表取締役 中澤 吉浩,1 百万円,,,Error accessing nan: Invalid URL 'nan': No scheme supplied. Perhaps you meant https://nan?,,
2024-08-01,ＣＲＯＯＺ　ＳＨＯＰＬＩＳＴ株式会社,通信販売・ネット販売,無,東京都渋谷区恵比寿4-3-14恵比寿ＳＳビル,2018,代表取締役社長 仲佐 義規,120 百万円,,,Error accessing nan: Invalid URL 'nan': No scheme supplied. Perhaps you meant https://nan?,,
2024-08-01,株式会社ＩＴＡＮＳＥ,小売業界,求人なし,大阪府箕面市瀬川4-19-12,2018,代表取締役 丹生 実,7 百万円,,,Error accessing nan: Invalid URL 'nan': No scheme supplied. Perhaps you meant https://nan?,,
2024-08-01,株式会社Ｔ＆Ｊ,自動車ディーラー,求人なし,兵庫県神戸市兵庫区大開通10-2-6,2018,代表取締役 白石 賢一,1 百万円,,,Error accessing nan: Invalid URL 'nan': No scheme supplied. Perhaps you meant https://nan?,,
2024-08-01,株式会社ナンバホームセンター,ホームセンター,求人なし,岡山県津山市材木町1328-25,2018,代表取締役 難波 賢治,10 百万円,,,Error accessing nan: Invalid URL 'nan': No scheme supplied. Perhaps you meant https://nan?,,
2024-08-01,株式会社Ｒｕｆｆ　Ｃｏｌｌｅｃｔｉｏｎ,専門店・その他小売,無,兵庫県西宮市浜甲子園3-9-26,2018,代表取締役 齊藤 篤史,3 百万円,,,Error accessing nan: Invalid URL 'nan': No scheme supplied. Perhaps you meant https://nan?,,
2024-08-01,株式会社Ｂｅｅ　Ｔｒｕｃｋ,自動車ディーラー,求人なし,兵庫県たつの市誉田町下沖字久保39-1,2018,代表取締役 松島 弘樹,7 百万円,,,Error accessing nan: Invalid URL 'nan': No scheme supplied. Perhaps you meant https://nan?,,
2024-08-01,株式会社義村商店,百貨店,求人なし,鹿児島県大島郡徳之島町亀津7365,1957,代表取締役 義村 浩,30 百万円,,,Error accessing nan: Invalid URL 'nan': No scheme supplied. Perhaps you meant https://nan?,,
2024-08-01,株式会社カワニシカバンプロダクト,専門店・その他小売,求人なし,香川県高松市太田上町384-15,2018,代表取締役 川西 功志,4 百万円,,,Error accessing nan: Invalid URL 'nan': No scheme supplied. Perhaps you meant https://nan?,,
2024-08-01,楽天西友ネットスーパー株式会社,通信販売・ネット販売,無,東京都世田谷区玉川1-14-1,2018,代表取締役 盧 誠錫,100 百万円,,,Error accessing nan: Invalid URL 'nan': No scheme supplied. Perhaps you meant https://nan?,■「楽天西友ネットスーパー」の運営■その他関連事業※楽天グループ株式会社の子会社 2024年5月doda掲載求人より引用,
2024-08-01,丸富ホールディングス株式会社,専門店・その他小売,求人なし,神奈川県横浜市神奈川区三枚町267,2018,代表取締役 長田 省吾,21 百万円,,,Error accessing nan: Invalid URL 'nan': No scheme supplied. Perhaps you meant https://nan?,,
2024-08-01,株式会社ＮＴＳネクスト,専門店・その他小売,求人なし,大分県大分市大字三芳320,2018,代表取締役 三ケ尻 勇,10 百万円,,,Error accessing nan: Invalid URL 'nan': No scheme supplied. Perhaps you meant https://nan?,,
2024-08-01,合同会社アンミル,専門店・その他小売,求人なし,福井県越前市村国2-5-39ラ・サージュ 1Ｆ,2018,代表社員 谷口 昌希,1 百万円,,,Error accessing nan: Invalid URL 'nan': No scheme supplied. Perhaps you meant https://nan?,,
