更新日,名称,業界(小分類),求人有無,所在地,設立,代表者,資本金,平均年齢,従業員数,企業URL,事業内容
2024-08-01,有限会社ＣＡＴ,自動車ディーラー,求人なし,神奈川県横須賀市野比1-1-5,2005,取締役 佐藤 一記,3 百万円,,,Error accessing nan: Invalid URL 'nan': No scheme supplied. Perhaps you meant https://nan?,
2024-08-01,株式会社ＴＫＲ,専門店・その他小売,求人なし,大阪府大阪市淀川区十三本町1-18-21,2004,代表取締役 山﨑 秀一郎,6 百万円,,,Error accessing nan: Invalid URL 'nan': No scheme supplied. Perhaps you meant https://nan?,
2024-08-01,株式会社ＯＺ,専門店・その他小売,求人なし,東京都台東区上野4-1-10,2004,代表取締役 小澤 正樹,10 百万円,,,Error accessing nan: Invalid URL 'nan': No scheme supplied. Perhaps you meant https://nan?,
2024-08-01,株式会社エアリー,専門店（アパレル・アクセサリー）,求人なし,東京都港区赤坂1-12-32アーク森ビル 17Ｆ,2007,代表取締役 倉田 昌明,3 百万円,,,Error accessing nan: Invalid URL 'nan': No scheme supplied. Perhaps you meant https://nan?,
2024-08-01,株式会社キュビック,自動車ディーラー,無,兵庫県西宮市深谷町10-26,2007,代表取締役 堀内 謙憲,30 百万円,,,Error accessing nan: Invalid URL 'nan': No scheme supplied. Perhaps you meant https://nan?,
2024-08-01,ユアーハイマート株式会社,食品・GMS・ディスカウントストア,求人なし,東京都北区中里1-25-5Ｉ．Ｍ中里ビル3Ｆ,2003,代表取締役 佐々木 俊規,10 百万円,,,Error accessing nan: Invalid URL 'nan': No scheme supplied. Perhaps you meant https://nan?,
2024-08-01,有限会社デリバリーサービス東林間,専門店・その他小売,求人なし,神奈川県相模原市南区上鶴間6-27-6,2005,代表取締役 八鍬 秀雄,3 百万円,,,Error accessing nan: Invalid URL 'nan': No scheme supplied. Perhaps you meant https://nan?,
2024-08-01,株式会社ＳＯＮＳ－ＭＡＲＫＥＴ,通信販売・ネット販売,求人なし,千葉県柏市東1-3-8,2012,代表取締役 西川 憲一,,,,Error accessing nan: Invalid URL 'nan': No scheme supplied. Perhaps you meant https://nan?,
2024-08-01,有限会社未来,専門店・その他小売,求人なし,大阪府堺市東区南野田202-8,2004,代表取締役 山下 俊次,3 百万円,,,Error accessing nan: Invalid URL 'nan': No scheme supplied. Perhaps you meant https://nan?,
2024-08-01,株式会社メッツ,通信販売・ネット販売,求人なし,岐阜県羽島郡岐南町三宅7-166,1999,代表取締役 梅村 隆,3 百万円,,,Error accessing nan: Invalid URL 'nan': No scheme supplied. Perhaps you meant https://nan?,
2024-08-01,株式会社ＮＥＯ,通信販売・ネット販売,求人なし,北海道札幌市東区北二十五条東16-1-2ステラ元町ビル 3Ｆ,2011,代表取締役 稲場 剛士,3 百万円,,,Error accessing nan: Invalid URL 'nan': No scheme supplied. Perhaps you meant https://nan?,
2024-08-01,株式会社デューク・インターナショナル,専門店・その他小売,求人なし,神奈川県藤沢市片瀬海岸1-7-1,1993,代表取締役 山口 みなみ,10 百万円,,,Error accessing nan: Invalid URL 'nan': No scheme supplied. Perhaps you meant https://nan?,
2024-08-01,株式会社よつば貿易,通信販売・ネット販売,無,福岡県福岡市早良区百道浜1-7-5Ｍタワー,2002,代表取締役 秋枝 真輔,3 百万円,,,Error accessing nan: Invalid URL 'nan': No scheme supplied. Perhaps you meant https://nan?,
2024-08-01,株式会社Ｐ＆Ｓ,専門店・その他小売,求人なし,福岡県福岡市早良区原1-30-17原ビル 1Ｆ,2004,代表取締役 脇山 昭彦,3 百万円,,,Error accessing nan: Invalid URL 'nan': No scheme supplied. Perhaps you meant https://nan?,
2024-08-01,株式会社アミジェス,専門店・その他小売,求人なし,東京都調布市深大寺元町4-21-17,1994,代表取締役 瀬島 保二,10 百万円,,,Error accessing nan: Invalid URL 'nan': No scheme supplied. Perhaps you meant https://nan?,
2024-08-01,株式会社Ｄｅｓｉｒｅ,自動車ディーラー,無,愛知県一宮市浅井町尾関字上川田69,2011,代表取締役 多湖 洋希,10 百万円,,,Error accessing nan: Invalid URL 'nan': No scheme supplied. Perhaps you meant https://nan?,
2024-08-01,株式会社リンクス,小売業界,求人なし,大阪府八尾市上尾町6-1,2008,代表取締役 上田 誠,5 百万円,,,Error accessing nan: Invalid URL 'nan': No scheme supplied. Perhaps you meant https://nan?,
2024-08-01,パラドゥ株式会社,専門店（アパレル・アクセサリー）,求人なし,大阪府大阪市北区豊崎3-19-3,1995,代表取締役 谷村 真一,20 百万円,,,Error accessing nan: Invalid URL 'nan': No scheme supplied. Perhaps you meant https://nan?,
2024-08-01,株式会社ＨＥＡＰ８９,専門店・その他小売,求人なし,福岡県福岡市西区今宿駅前1-5-5,2012,代表取締役 篠原 清隆,3 百万円,,,Error accessing nan: Invalid URL 'nan': No scheme supplied. Perhaps you meant https://nan?,
2024-08-01,昭和食品株式会社,食品・GMS・ディスカウントストア,求人なし,神奈川県相模原市南区相武台3-8-9,1957,代表取締役 井上 洋一,10 百万円,,,Error accessing nan: Invalid URL 'nan': No scheme supplied. Perhaps you meant https://nan?,
2024-08-01,株式会社イクイップアジア,通信販売・ネット販売,求人なし,愛知県名古屋市名東区社台3-77,2011,代表取締役 鈴木 惠造,38 百万円,,,Error accessing nan: Invalid URL 'nan': No scheme supplied. Perhaps you meant https://nan?,
2024-08-01,株式会社ＥＬＬＥ,専門店・その他小売,求人なし,愛知県名古屋市中区丸の内2-17-3丸ノ内Ｔ・Ｓビル 1Ｆ,2012,代表取締役 池上 修治,3 百万円,,,Error accessing nan: Invalid URL 'nan': No scheme supplied. Perhaps you meant https://nan?,
2024-08-01,株式会社フォーカス,専門店（アパレル・アクセサリー）,求人なし,山梨県甲斐市篠原984-1,2009,代表取締役 常松 憲太,65 百万円,,,Error accessing nan: Invalid URL 'nan': No scheme supplied. Perhaps you meant https://nan?,
2024-08-01,株式会社ボンパナ,専門店・その他小売,求人なし,愛知県名古屋市緑区桶狭間神明3821,2009,代表取締役 岩月 康之,50 百万円,,,Error accessing nan: Invalid URL 'nan': No scheme supplied. Perhaps you meant https://nan?,
2024-08-01,ＴＫ＆Ｃ株式会社,自動車ディーラー,無,兵庫県西宮市鳴尾浜2-1-54,2010,代表取締役 金原 英三,50 百万円,,,Error accessing nan: Invalid URL 'nan': No scheme supplied. Perhaps you meant https://nan?,
2024-08-01,株式会社ハリガエ,食品・GMS・ディスカウントストア,求人なし,茨城県土浦市小岩田東1-2-36,1984,代表取締役 張替 一三,10 百万円,,,Error accessing nan: Invalid URL 'nan': No scheme supplied. Perhaps you meant https://nan?,
2024-08-01,ＣＩＮＥＲＥＮＴ　ＪＡＰＡＮ株式会社,専門店（家電量販店）,求人なし,神奈川県川崎市宮前区初山1-19-1,2009,代表取締役 木村 尚行,8 百万円,,,Error accessing nan: Invalid URL 'nan': No scheme supplied. Perhaps you meant https://nan?,
2024-08-01,株式会社ＴＫ,通信販売・ネット販売,求人なし,福岡県福岡市中央区大名1-12-61新天ビル 302,2012,代表取締役 工藤 欣也,5 百万円,,,Error accessing nan: Invalid URL 'nan': No scheme supplied. Perhaps you meant https://nan?,
2024-08-01,有限会社ｅ－トレーディング,専門店・その他小売,求人なし,神奈川県横浜市港北区新横浜3-7-19鈴喜ビル 4Ｆ,2002,取締役 村田 大典,3 百万円,,,Error accessing nan: Invalid URL 'nan': No scheme supplied. Perhaps you meant https://nan?,
2024-08-01,株式会社うさぎスイーツ,食品・GMS・ディスカウントストア,求人なし,神奈川県横浜市南区永田東1-2-16,1951,代表取締役 木内 龍之介,10 百万円,,,Error accessing nan: Invalid URL 'nan': No scheme supplied. Perhaps you meant https://nan?,
2024-08-01,昭和興産株式会社,専門店・その他小売,求人なし,福岡県北九州市小倉北区竪林町21-5,1977,代表取締役 吉田 智江,10 百万円,,,Error accessing nan: Invalid URL 'nan': No scheme supplied. Perhaps you meant https://nan?,
2024-08-01,有限会社ビッグムーン,専門店（アパレル・アクセサリー）,求人なし,愛知県名古屋市中区大須3-2-6,2000,取締役 神農 洋一,3 百万円,,,Error accessing nan: Invalid URL 'nan': No scheme supplied. Perhaps you meant https://nan?,
2024-08-01,株式会社ＪＰＦａｇｒｉ,食品・GMS・ディスカウントストア,求人なし,千葉県夷隅郡大多喜町大戸433大多喜学園内,2008,代表取締役 久場 善博,10 百万円,,,Error accessing nan: Invalid URL 'nan': No scheme supplied. Perhaps you meant https://nan?,
2024-08-01,有限会社ＢＥＳＴＰＬＡＹ,専門店（アパレル・アクセサリー）,求人なし,京都府京都市西京区上桂東ノ口町129,2005,代表取締役 吉田 由美,6 百万円,,,Error accessing nan: Invalid URL 'nan': No scheme supplied. Perhaps you meant https://nan?,
2024-08-01,株式会社Ｈ＆Ｍ,自動車ディーラー,求人なし,福岡県太宰府市水城1-3-1,2011,代表取締役 野藤 博之,3 百万円,,,Error accessing nan: Invalid URL 'nan': No scheme supplied. Perhaps you meant https://nan?,
2024-08-01,株式会社Ｆｉｎｅ－１,専門店・その他小売,求人なし,岐阜県岐阜市茜部菱野4-38-1,2005,代表取締役 山下 義喜,3 百万円,,,Error accessing nan: Invalid URL 'nan': No scheme supplied. Perhaps you meant https://nan?,
2024-08-01,株式会社ＡＩＴＥＮ,自動車ディーラー,求人なし,兵庫県三木市福井2143,2008,代表取締役 上月 泰範,5 百万円,,,Error accessing nan: Invalid URL 'nan': No scheme supplied. Perhaps you meant https://nan?,
2024-08-01,栄新工業株式会社,自動車ディーラー,求人なし,栃木県佐野市富岡町1575-2,1978,代表取締役 阿部 康,10 百万円,,,Error accessing nan: Invalid URL 'nan': No scheme supplied. Perhaps you meant https://nan?,
2024-08-01,株式会社ｅ－Ｔａｃｓ,専門店・その他小売,求人なし,神奈川県横浜市都筑区荏田南4-1-23,2002,代表取締役 金井 之広,10 百万円,,,Error accessing nan: Invalid URL 'nan': No scheme supplied. Perhaps you meant https://nan?,
2024-08-01,株式会社ピュアハート,自動車ディーラー,求人なし,岐阜県岐阜市秋沢2-117-1,2010,代表取締役 北川 雅智,3 百万円,,,Error accessing nan: Invalid URL 'nan': No scheme supplied. Perhaps you meant https://nan?,
2024-08-01,株式会社Ｑｕｅｓｔ,通信販売・ネット販売,無,大阪府大阪市中央区北久宝寺町2-1-15船場エースビル 4Ｆ,2007,代表取締役 德永一雄,10 百万円,,,Error accessing nan: Invalid URL 'nan': No scheme supplied. Perhaps you meant https://nan?,
2024-08-01,株式会社ＡＩプランニング,食品・GMS・ディスカウントストア,求人なし,兵庫県南あわじ市志知中島1004-1,2010,代表取締役 住山 みつ子,10 百万円,,,Error accessing nan: Invalid URL 'nan': No scheme supplied. Perhaps you meant https://nan?,
2024-08-01,エフディーフード株式会社,専門店・その他小売,求人なし,兵庫県神戸市中央区布引町2-1-7ソーラービル 3Ｆ,1972,代表取締役 馬場 謙太郎,10 百万円,,,Error accessing nan: Invalid URL 'nan': No scheme supplied. Perhaps you meant https://nan?,
2024-08-01,株式会社ＫＭＦ企画,コンビニエンスストア,無,埼玉県加須市花崎北2-9-14,2010,代表取締役 渡邉 和弘,1 百万円,,,Error accessing nan: Invalid URL 'nan': No scheme supplied. Perhaps you meant https://nan?,
2024-08-01,ｏｎｄｅ株式会社,専門店・その他小売,求人なし,愛知県名古屋市中区錦2-9-25ｏｎｄｅビル 4Ｆ,1987,代表取締役 松波 正晃,20 百万円,,,Error accessing nan: Invalid URL 'nan': No scheme supplied. Perhaps you meant https://nan?,
2024-08-01,株式会社ケアネス,通信販売・ネット販売,無,大阪府枚方市茄子作南町1312,1977,代表取締役 北本 明,20 百万円,,,Error accessing nan: Invalid URL 'nan': No scheme supplied. Perhaps you meant https://nan?,情報が古い可能性があります。最新の情報を確認する場合はHP等をご覧ください。 ■美容各種サロンの経営■美容業■オリジナル化粧品の開発・製造・販売■美容器具、美容機器、美容用品、美容サプリメントの輸出入並び販売業■訪問美容、出張美容のサービス業■美容に関するコンサルタント業■カルチャースクールの経営■飲食店業 2023年4月doda掲載求人より引用
2024-08-01,株式会社ＥＬＩＭＩＮＡＴＯＲ,専門店（アパレル・アクセサリー）,求人なし,東京都渋谷区猿楽町26-13,2007,代表取締役 原田 理恵子,8 百万円,,,Error accessing nan: Invalid URL 'nan': No scheme supplied. Perhaps you meant https://nan?,
2024-08-01,株式会社ＯＲＩＧＯ,専門店・その他小売,無,埼玉県さいたま市南区白幡4-18-2,2010,代表取締役 青木 仁,1 百万円,,,Error accessing nan: Invalid URL 'nan': No scheme supplied. Perhaps you meant https://nan?,
2024-08-01,株式会社Ｖ２,自動車ディーラー,無,神奈川県横浜市都筑区大丸24-7,2010,代表取締役 野田 浩平,,,,Error accessing nan: Invalid URL 'nan': No scheme supplied. Perhaps you meant https://nan?,情報が古い可能性があります。最新の情報を確認する場合はHP等をご覧ください。 ■中古車販売・買取■車検・一般整備・修理・ 鈑金塗装■自動車部品・用品の輸入・販売・取付■損害保険業務■その他自動車業務全般 2022年12月doda掲載求人より引用
2024-08-01,株式会社ＴＯＭＭＹ,自動車ディーラー,求人なし,北海道札幌市清田区美しが丘三条7-1-30,2006,代表取締役 上村 明寿,50 百万円,,,Error accessing nan: Invalid URL 'nan': No scheme supplied. Perhaps you meant https://nan?,
2024-08-01,株式会社イノマタ,専門店・その他小売,求人なし,宮城県仙台市泉区八乙女3-8-1406,1993,代表取締役 猪股 孝之,5 百万円,,,Error accessing nan: Invalid URL 'nan': No scheme supplied. Perhaps you meant https://nan?,
2024-08-01,株式会社ウィングタイヤサービス,専門店・その他小売,求人なし,神奈川県藤沢市菖蒲沢710,2005,代表取締役 十鳥 之伸,10 百万円,,,Error accessing nan: Invalid URL 'nan': No scheme supplied. Perhaps you meant https://nan?,
2024-08-01,株式会社ＷＯＲＴＨ　ＪＡＰＡＮ,通信販売・ネット販売,求人なし,北海道札幌市西区八軒四条西4-1-6,2009,代表取締役 八鍬 佳王留,10 百万円,,,Error accessing nan: Invalid URL 'nan': No scheme supplied. Perhaps you meant https://nan?,
2024-08-01,株式会社ビリーフメイト,専門店・その他小売,求人なし,埼玉県川越市仲町10-3仲町ビル,2008,代表取締役 太田 正,10 百万円,,,Error accessing nan: Invalid URL 'nan': No scheme supplied. Perhaps you meant https://nan?,
2024-08-01,京南オートサービス株式会社,自動車ディーラー,求人なし,東京都多摩市諏訪6-3-1,2004,代表取締役 田澤 孝雄,10 百万円,,,Error accessing nan: Invalid URL 'nan': No scheme supplied. Perhaps you meant https://nan?,
2024-08-01,有限会社ジーテック,通信販売・ネット販売,求人なし,大阪府富田林市錦織東3-5-16,2002,代表取締役 武川 真一郎,3 百万円,,,Error accessing nan: Invalid URL 'nan': No scheme supplied. Perhaps you meant https://nan?,
2024-08-01,株式会社丸八ダイレクト,専門店・その他小売,無,神奈川県横浜市港北区新横浜3-8-12,1982,代表取締役 對間稔,20 百万円,,,Error accessing nan: Invalid URL 'nan': No scheme supplied. Perhaps you meant https://nan?,情報が古い可能性があります。最新の情報を確認する場合はHP等をご覧ください。 【名証メイン上場の丸八グループ】■寝具・リビング用品事業（羽毛ふとん・敷きふとん・ベッド・カーテン等の製造・販売・関連サービス）■不動産賃貸事業【グループ会社】株式会社丸八ホールデイングス株式会社丸八真綿株式会社オクトシステムサービス株式会社丸八真綿販売株式会社丸八アセット 2022年9月doda掲載求人より引用
2024-08-01,心幸ホールディングス株式会社,コンビニエンスストア,無,兵庫県尼崎市潮江1-2-6ＪＲＥ尼崎フロントビル 2Ｆ,2013,代表取締役 山﨑 忠,10 百万円,,,Error accessing nan: Invalid URL 'nan': No scheme supplied. Perhaps you meant https://nan?,■企業内福利厚生に含まれる企業内ショップ・カフェテリア等への総合商品卸売業■企業内店舗へ向けたコンサルティング■直営店の経営（全国200店舗）および総合店舗管理運営 2024年3月doda掲載求人より引用
2024-08-01,株式会社ｅコード,専門店（家電量販店）,求人なし,静岡県浜松市中央区安松町30-1ｅコードみなみ2Ｆ,2013,代表取締役 山田 謙,6 百万円,,,Error accessing nan: Invalid URL 'nan': No scheme supplied. Perhaps you meant https://nan?,
2024-08-01,株式会社ディスプランコーポレーション,専門店・その他小売,求人なし,富山県富山市西荒屋91-3,2013,代表取締役 倉本 茂一,2 百万円,,,Error accessing nan: Invalid URL 'nan': No scheme supplied. Perhaps you meant https://nan?,
2024-08-01,株式会社ハローランチサービス,食品・GMS・ディスカウントストア,求人なし,福島県福島市南矢野目字新田3-9,2013,代表取締役 高橋 智恵子,2 百万円,,,Error accessing nan: Invalid URL 'nan': No scheme supplied. Perhaps you meant https://nan?,
2024-08-01,健康科学研究所株式会社,専門店・その他小売,求人なし,東京都豊島区巣鴨1-21-5コスモ第三ビル 4Ｆ,2013,代表取締役 木戸 太守,3 百万円,,,Error accessing nan: Invalid URL 'nan': No scheme supplied. Perhaps you meant https://nan?,
2024-08-01,株式会社バリュートレード,専門店・その他小売,求人なし,愛知県名古屋市港区築三町1-8-2Ｆ,2013,代表取締役 日比野 優,11 百万円,,,Error accessing nan: Invalid URL 'nan': No scheme supplied. Perhaps you meant https://nan?,
2024-08-01,株式会社ミュウ,専門店・その他小売,求人なし,京都府京都市中京区東洞院通三条下る三文字町201,2013,代表取締役 武居 美佳,1 百万円,,,Error accessing nan: Invalid URL 'nan': No scheme supplied. Perhaps you meant https://nan?,
2024-08-01,オーロラカーセールス株式会社,自動車ディーラー,求人なし,香川県高松市香西南町577-2,2013,代表取締役 灘波 順一,30 百万円,,,Error accessing nan: Invalid URL 'nan': No scheme supplied. Perhaps you meant https://nan?,
2024-08-01,株式会社メガネパートナー,専門店・その他小売,求人なし,滋賀県草津市東矢倉2-36-74Ｆ,2013,代表取締役 中澤 計,5 百万円,,,Error accessing nan: Invalid URL 'nan': No scheme supplied. Perhaps you meant https://nan?,
2024-08-01,株式会社トランザム,自動車ディーラー,求人なし,鹿児島県鹿児島市谷山中央7-42-211Ｆ,2013,代表取締役 山下 裕之,10 百万円,,,Error accessing nan: Invalid URL 'nan': No scheme supplied. Perhaps you meant https://nan?,
2024-08-01,株式会社タイヤ村,専門店・その他小売,求人なし,愛知県半田市新居町5-113,2013,代表取締役 髙井良 隆男,,,,Error accessing nan: Invalid URL 'nan': No scheme supplied. Perhaps you meant https://nan?,
2024-08-01,株式会社ａ－ＦＲＯＮＴＥ,専門店・その他小売,求人なし,東京都足立区竹の塚3-10-1竹の塚ビル3ＦＢ,2013,代表取締役 上遠野 靖司,1 百万円,,,Error accessing nan: Invalid URL 'nan': No scheme supplied. Perhaps you meant https://nan?,
2024-08-01,株式会社ｌｉｍＡｒｔ,専門店・その他小売,求人なし,東京都渋谷区恵比寿南2-10-3,2013,代表取締役 中島 佑介,5 百万円,,,Error accessing nan: Invalid URL 'nan': No scheme supplied. Perhaps you meant https://nan?,
2024-08-01,株式会社京浜さえき,食品・GMS・ディスカウントストア,求人なし,神奈川県川崎市幸区小向町7-13,2013,代表取締役 桑原 孝太,50 百万円,,,Error accessing nan: Invalid URL 'nan': No scheme supplied. Perhaps you meant https://nan?,
2024-08-01,株式会社カーサービスシンワ,自動車ディーラー,求人なし,大阪府泉佐野市南中安松811,2013,代表取締役 鎌倉 眞一,5 百万円,,,Error accessing nan: Invalid URL 'nan': No scheme supplied. Perhaps you meant https://nan?,
2024-08-01,株式会社ｒｏｃｋ,専門店・その他小売,求人なし,滋賀県近江八幡市千僧供町591-3,2011,代表取締役 松村 浩介,1 百万円,,,Error accessing nan: Invalid URL 'nan': No scheme supplied. Perhaps you meant https://nan?,
2024-08-01,株式会社フロイント,専門店・その他小売,求人なし,東京都葛飾区白鳥4-1-12白崎ビル 1Ｆ,1989,代表取締役 白崎 将,10 百万円,,,Error accessing nan: Invalid URL 'nan': No scheme supplied. Perhaps you meant https://nan?,
2024-08-01,株式会社酒井開発センター,専門店・その他小売,求人なし,東京都港区新橋4-27-10酒井ビル 2Ｆ,1985,代表取締役 酒井 良衞,10 百万円,,,Error accessing nan: Invalid URL 'nan': No scheme supplied. Perhaps you meant https://nan?,
2024-08-01,有限会社石渡薬局,ドラッグストア・調剤薬局,求人なし,神奈川県逗子市逗子2-6-23,2003,代表取締役 石渡 聡一郎,10 百万円,,,Error accessing nan: Invalid URL 'nan': No scheme supplied. Perhaps you meant https://nan?,
2024-08-01,株式会社メイク,専門店（アパレル・アクセサリー）,求人なし,東京都青梅市長淵4-236,1990,代表取締役 久保 安宏,10 百万円,,,Error accessing nan: Invalid URL 'nan': No scheme supplied. Perhaps you meant https://nan?,
2024-08-01,株式会社Ｓｕｒｐｒｉｓｅ,専門店・その他小売,求人なし,愛知県名古屋市東区泉1-21-27,2010,代表取締役 向橋 信一,5 百万円,,,Error accessing nan: Invalid URL 'nan': No scheme supplied. Perhaps you meant https://nan?,
2024-08-01,株式会社ジュナック,自動車ディーラー,求人なし,東京都三鷹市新川2-15-20,2006,代表取締役 荒井 直行,10 百万円,,,Error accessing nan: Invalid URL 'nan': No scheme supplied. Perhaps you meant https://nan?,
2024-08-01,株式会社ホンダカーズ瑞浪,自動車ディーラー,求人なし,岐阜県瑞浪市穂並1-65,1969,代表取締役 三宅 勝博,10 百万円,,,Error accessing nan: Invalid URL 'nan': No scheme supplied. Perhaps you meant https://nan?,
2024-08-01,株式会社リブロ,専門店・その他小売,求人なし,神奈川県中郡大磯町国府本郷1805-2,1971,代表取締役 宮澤 哲夫,10 百万円,,,Error accessing nan: Invalid URL 'nan': No scheme supplied. Perhaps you meant https://nan?,
2024-08-01,株式会社スパディコ,専門店・その他小売,求人なし,兵庫県西宮市門前町1-6,2011,代表取締役 宮崎 佳子,3 百万円,,,Error accessing nan: Invalid URL 'nan': No scheme supplied. Perhaps you meant https://nan?,
2024-08-01,株式会社ホンダプリモ中津川,自動車ディーラー,求人なし,岐阜県中津川市駒場町4-18,1977,代表取締役 垂見 明志,12 百万円,,,Error accessing nan: Invalid URL 'nan': No scheme supplied. Perhaps you meant https://nan?,
2024-08-01,株式会社ニュー・ディメンジョン・リサーチ,食品・GMS・ディスカウントストア,求人なし,東京都武蔵野市吉祥寺本町1-20-1410,1993,代表取締役 藤本 賢二,10 百万円,,,Error accessing nan: Invalid URL 'nan': No scheme supplied. Perhaps you meant https://nan?,
2024-08-01,株式会社ジンマーニ,通信販売・ネット販売,求人なし,大阪府大阪市北区天満4-11-1口ビル 2Ｆ,2009,代表取締役 西村 仁,15 百万円,,,Error accessing nan: Invalid URL 'nan': No scheme supplied. Perhaps you meant https://nan?,
2024-08-01,株式会社ホンダカーズ美濃,自動車ディーラー,求人なし,岐阜県美濃市極楽寺322-7,1985,代表取締役 堀端 和志,10 百万円,,,Error accessing nan: Invalid URL 'nan': No scheme supplied. Perhaps you meant https://nan?,
