更新日,名称,業界(小分類),求人有無,所在地,設立,代表者,資本金,平均年齢,従業員数,企業URL,事業内容
2024-08-01,株式会社トータス・イレブン,専門店・その他小売,求人なし,東京都墨田区両国4-9-7,1989,代表取締役 木村 宏,20 百万円,,,Error accessing nan: Invalid URL 'nan': No scheme supplied. Perhaps you meant https://nan?,
2024-08-01,株式会社ブラザー・オートサービス,専門店・その他小売,求人なし,神奈川県横浜市都筑区東方町93-1,1989,代表取締役 小林 勇一,50 百万円,,,Error accessing nan: Invalid URL 'nan': No scheme supplied. Perhaps you meant https://nan?,
2024-08-01,株式会社看板市場,専門店・その他小売,求人なし,神奈川県横浜市都筑区佐江戸町220菱光倉庫,1996,代表取締役 堀田 久史,10 百万円,,,Error accessing nan: Invalid URL 'nan': No scheme supplied. Perhaps you meant https://nan?,
2024-08-01,有限会社エッチ・アール・ビー,自動車ディーラー,求人なし,京都府長岡京市勝竜寺西川原田16-12,1997,代表取締役 弘部 則昌,3 百万円,,,Error accessing nan: Invalid URL 'nan': No scheme supplied. Perhaps you meant https://nan?,
2024-08-01,株式会社ヨコハマタイヤガーデン関東,ホームセンター,求人なし,埼玉県さいたま市大宮区三橋2-727,1993,代表取締役 繁田 英生,80 百万円,,,Error accessing nan: Invalid URL 'nan': No scheme supplied. Perhaps you meant https://nan?,
2024-08-01,有限会社ハヤシ,食品・GMS・ディスカウントストア,求人なし,長野県南佐久郡川上村大字秋山7,1988,代表取締役 林 長一,3 百万円,,,Error accessing nan: Invalid URL 'nan': No scheme supplied. Perhaps you meant https://nan?,
2024-08-01,オヤマ株式会社,専門店・その他小売,求人なし,岩手県一関市室根町折壁1-7-5,1989,代表取締役 小山 拓士,20 百万円,,,Error accessing nan: Invalid URL 'nan': No scheme supplied. Perhaps you meant https://nan?,
2024-08-01,ＬＵＦＬＯＳ株式会社,専門店・その他小売,求人なし,東京都千代田区有楽町2-9-18,1980,代表取締役 中原 正成,50 百万円,,,Error accessing nan: Invalid URL 'nan': No scheme supplied. Perhaps you meant https://nan?,
2024-08-01,有限会社ザ・スタイルカンパニー,小売業界,求人なし,東京都世田谷区鎌田4-7-35,2000,代表取締役 川手 孝則,6 百万円,,,Error accessing nan: Invalid URL 'nan': No scheme supplied. Perhaps you meant https://nan?,
2024-08-01,株式会社三恵ホンダ販売,自動車ディーラー,求人なし,東京都練馬区谷原1-1-3,1978,代表取締役 長谷川 彰宏,30 百万円,,,Error accessing nan: Invalid URL 'nan': No scheme supplied. Perhaps you meant https://nan?,
2024-08-01,株式会社ビジューワタナベ,専門店・その他小売,求人なし,東京都港区白金台3-17-5間中ビル 1Ｆ,1989,代表取締役 渡邉 裕夫,10 百万円,,,Error accessing nan: Invalid URL 'nan': No scheme supplied. Perhaps you meant https://nan?,
2024-08-01,株式会社ＢＩＳＡＢＩＳ,専門店（アパレル・アクセサリー）,求人なし,東京都杉並区阿佐谷北4-10-7,1971,代表取締役 高橋 健一,10 百万円,,,Error accessing nan: Invalid URL 'nan': No scheme supplied. Perhaps you meant https://nan?,
2024-08-01,株式会社藤田美術,専門店・その他小売,求人なし,東京都千代田区内神田1-12-10,1993,代表取締役 藤田 裕介,10 百万円,,,Error accessing nan: Invalid URL 'nan': No scheme supplied. Perhaps you meant https://nan?,
2024-08-01,太豊商事株式会社,食品・GMS・ディスカウントストア,求人なし,滋賀県大津市藤尾奥町17-1,1974,代表取締役 太田 豊彦,8 百万円,,,Error accessing nan: Invalid URL 'nan': No scheme supplied. Perhaps you meant https://nan?,
2024-08-01,株式会社ＦＡＬＥＣＯ,専門店（アパレル・アクセサリー）,無,東京都渋谷区恵比寿4-6-1恵比寿ＭＦビル 203,1999,代表取締役 岡田 和子,10 百万円,,,Error accessing nan: Invalid URL 'nan': No scheme supplied. Perhaps you meant https://nan?,情報が古い可能性があります。最新の情報を確認する場合はHP等をご覧ください。 ■衣装レンタル事業レディース衣装、パーティードレスのレンタル■衣装製作・販売事業衣装のオーダーメイド、販売■スタイリング事業衣装スタイリング■コントラクト事業企業受付、事務請負 2023年6月doda掲載求人より引用
2024-08-01,株式会社諏訪,専門店・その他小売,求人なし,埼玉県戸田市笹目4-13-1,2001,代表取締役 鈴木 崇,10 百万円,,,Error accessing nan: Invalid URL 'nan': No scheme supplied. Perhaps you meant https://nan?,
2024-08-01,株式会社ダイチ,専門店・その他小売,求人なし,福岡県遠賀郡遠賀町大字老良366-1,1976,代表取締役 木村 公,15 百万円,,,Error accessing nan: Invalid URL 'nan': No scheme supplied. Perhaps you meant https://nan?,
2024-08-01,株式会社ビー・アズ,専門店・その他小売,求人なし,福岡県福岡市東区香椎駅前3-19-10,1984,代表取締役 安田 樹生,10 百万円,,,Error accessing nan: Invalid URL 'nan': No scheme supplied. Perhaps you meant https://nan?,
2024-08-01,株式会社池田紙器工業,専門店・その他小売,求人なし,熊本県熊本市南区富合町釈迦堂474-7,1969,代表取締役 池田 和隆,10 百万円,,,Error accessing nan: Invalid URL 'nan': No scheme supplied. Perhaps you meant https://nan?,
2024-08-01,株式会社キクチ,専門店・その他小売,求人なし,熊本県宇土市善道寺町95,1990,代表取締役 菊池 百合,5 百万円,,,Error accessing nan: Invalid URL 'nan': No scheme supplied. Perhaps you meant https://nan?,
2024-08-01,有限会社綿久,専門店・その他小売,求人なし,新潟県燕市吉田3493-3,2006,代表取締役 美内 信介,3 百万円,,,Error accessing nan: Invalid URL 'nan': No scheme supplied. Perhaps you meant https://nan?,
2024-08-01,ロイヤルモーター株式会社,自動車ディーラー,求人なし,秋田県秋田市寺内字蛭根85-70,2005,代表取締役 辻 良之,60 百万円,,,Error accessing nan: Invalid URL 'nan': No scheme supplied. Perhaps you meant https://nan?,
2024-08-01,イエナ商事株式会社,専門店・その他小売,求人なし,東京都渋谷区恵比寿南3-10-12402,1996,代表取締役 佐々木 秀明,20 百万円,,,Error accessing nan: Invalid URL 'nan': No scheme supplied. Perhaps you meant https://nan?,
2024-08-01,有限会社胡麻油の関根,食品・GMS・ディスカウントストア,無,東京都新宿区新宿2-2-10サニープラザ新宿御苑ビル 105,1999,代表取締役 関根 大悟,3 百万円,,,Error accessing nan: Invalid URL 'nan': No scheme supplied. Perhaps you meant https://nan?,
2024-08-01,株式会社バーディット,自動車ディーラー,無,東京都江戸川区東葛西5-20-9,2004,代表取締役 望月 悠生,10 百万円,,,Error accessing nan: Invalid URL 'nan': No scheme supplied. Perhaps you meant https://nan?,情報が古い可能性があります。最新の情報を確認する場合はHP等をご覧ください。 ★各社共通★輸入車の新車および中古車の販売国産車、輸入車の買い取り自動車オークション出品車検・点検・修理などのメンテナンス自動車保険代理店(東京海上日動火災)自動車部品の販売・取り付け 2022年10月doda掲載求人より引用
2024-08-01,株式会社アイズカンパニー,専門店・その他小売,求人なし,大阪府寝屋川市寿町61-8ニシリク香里ビル 2Ｆ,2003,代表取締役 今駒 則博,,,,Error accessing nan: Invalid URL 'nan': No scheme supplied. Perhaps you meant https://nan?,
2024-08-01,ベースメント株式会社,専門店（アパレル・アクセサリー）,求人なし,福岡県福岡市中央区舞鶴1-6-12904,1992,代表取締役 重 孝義,10 百万円,,,Error accessing nan: Invalid URL 'nan': No scheme supplied. Perhaps you meant https://nan?,
2024-08-01,株式会社エアリッシュ,専門店・その他小売,求人なし,香川県高松市太田上町282-3,1998,代表取締役 谷展幸,10 百万円,,,Error accessing nan: Invalid URL 'nan': No scheme supplied. Perhaps you meant https://nan?,
2024-08-01,有限会社二神石油ガス,専門店・その他小売,求人なし,熊本県熊本市南区田井島2-1-14,1968,代表取締役 二神 嗣雄,10 百万円,,,Error accessing nan: Invalid URL 'nan': No scheme supplied. Perhaps you meant https://nan?,
2024-08-01,福井スズキ自動車販売株式会社,自動車ディーラー,求人なし,福井県福井市米松1-16-35,2005,代表取締役 池田 和之,30 百万円,,,Error accessing nan: Invalid URL 'nan': No scheme supplied. Perhaps you meant https://nan?,
2024-08-01,株式会社ギヤル,専門店（アパレル・アクセサリー）,求人なし,兵庫県神戸市灘区中郷町2-3-11,1973,代表取締役 竹谷 憲仁,10 百万円,,,Error accessing nan: Invalid URL 'nan': No scheme supplied. Perhaps you meant https://nan?,
2024-08-01,株式会社八代目儀兵衛,専門店・その他小売,求人なし,京都府京都市下京区西七条北衣田町10,2006,代表取締役 橋本 隆志,8 百万円,,,Error accessing nan: Invalid URL 'nan': No scheme supplied. Perhaps you meant https://nan?,
2024-08-01,周南ビルド株式会社,専門店・その他小売,求人なし,山口県周南市相生町1-20,2006,代表取締役 濱本 由佳,3 百万円,,,Error accessing nan: Invalid URL 'nan': No scheme supplied. Perhaps you meant https://nan?,
2024-08-01,株式会社野上神仏具店,専門店・その他小売,求人なし,福岡県北九州市小倉北区魚町2-2-11,1966,代表取締役 野上 哲平,11 百万円,,,Error accessing nan: Invalid URL 'nan': No scheme supplied. Perhaps you meant https://nan?,
2024-08-01,九州アサヒ飲料販売株式会社,専門店・その他小売,無,福岡県糟屋郡志免町別府3-14-1,2009,代表取締役 笹木 等,40 百万円,,,Error accessing nan: Invalid URL 'nan': No scheme supplied. Perhaps you meant https://nan?,■自動販売機による清涼飲料水の販売 2024年5月doda掲載求人より引用
2024-08-01,株式会社ナカムラコーポレーション,専門店・その他小売,求人なし,東京都中央区新川1-7-8中村ビル,2004,代表取締役 中村 真吾,10 百万円,,,Error accessing nan: Invalid URL 'nan': No scheme supplied. Perhaps you meant https://nan?,
2024-08-01,有限会社ストックス,通信販売・ネット販売,求人なし,東京都目黒区青葉台2-21-9紫弘ビル 4Ｆ,1995,取締役 菅谷 全博,5 百万円,,,Error accessing nan: Invalid URL 'nan': No scheme supplied. Perhaps you meant https://nan?,
2024-08-01,株式会社ＡＣＤＣ,専門店（アパレル・アクセサリー）,無,神奈川県横浜市青葉区しらとり台50-1東急南しらとり台ドエリング 1Ｆ,1980,代表取締役 土居 麟馬,10 百万円,,,Error accessing nan: Invalid URL 'nan': No scheme supplied. Perhaps you meant https://nan?,■衣料品、宝石、貴金属、アクセサリー等の製造、及び販売■『ACDC RAG』の運営（原宿竹下通りに1店舗展開）■ECサイト販売チャネルを展開 2024年3月doda掲載求人より引用
2024-08-01,株式会社オートボーイ,自動車ディーラー,求人なし,埼玉県八潮市大字八條1495-1,2001,代表取締役 赤松 俊之,20 百万円,,,Error accessing nan: Invalid URL 'nan': No scheme supplied. Perhaps you meant https://nan?,
2024-08-01,スリースティックス株式会社,専門店・その他小売,求人なし,東京都渋谷区恵比寿西1-8-7見須ビル 603,1989,,10 百万円,,,Error accessing nan: Invalid URL 'nan': No scheme supplied. Perhaps you meant https://nan?,
2024-08-01,株式会社石の花,専門店・その他小売,求人なし,神奈川県横浜市西区岡野2-8-19パストラル横濱 1Ｆ,1997,代表取締役 佐藤 拓也,10 百万円,,,Error accessing nan: Invalid URL 'nan': No scheme supplied. Perhaps you meant https://nan?,
2024-08-01,株式会社ダイサン青果,専門店・その他小売,求人なし,長野県長野市市場3-22（株）長野地方卸売市場青果仲卸売棟 6,1982,代表取締役 兒島 茂利,14 百万円,,,Error accessing nan: Invalid URL 'nan': No scheme supplied. Perhaps you meant https://nan?,
2024-08-01,エスピービー株式会社,専門店（アパレル・アクセサリー）,無,愛知県名古屋市中区栄3-27-18源吉兆庵名古屋栄ビル 8Ｆ,2000,代表取締役 後藤 裕次,10 百万円,,,Error accessing nan: Invalid URL 'nan': No scheme supplied. Perhaps you meant https://nan?,情報が古い可能性があります。最新の情報を確認する場合はHP等をご覧ください。 ■腕時計・雑貨関連商品の輸出入および卸売り■腕時計専門店『時計倉庫TOKIA』の運営■バッグからアパレル関連を取り扱うお店『雑貨倉庫TOKIA』の運営■時計修理およびカスタマーサポート■海外のデザイナー文具やギフト用品を集めたお店『Spot Write』の運営 2022年6月doda掲載求人より引用
2024-08-01,株式会社ナカムラヤ,専門店（アパレル・アクセサリー）,求人なし,大阪府大東市三住町3-22,1962,代表取締役 深田 有未,20 百万円,,,Error accessing nan: Invalid URL 'nan': No scheme supplied. Perhaps you meant https://nan?,
2024-08-01,株式会社雀おどり總本店,専門店・その他小売,求人なし,愛知県名古屋市中区栄3-27-15,1949,代表取締役 古橋 孝太,10 百万円,,,Error accessing nan: Invalid URL 'nan': No scheme supplied. Perhaps you meant https://nan?,
2024-08-01,株式会社かねこライス,食品・GMS・ディスカウントストア,求人なし,埼玉県川越市中台3-3-13,1996,代表取締役 金子 厚,10 百万円,,,Error accessing nan: Invalid URL 'nan': No scheme supplied. Perhaps you meant https://nan?,
2024-08-01,株式会社ソルーナ,専門店・その他小売,求人なし,静岡県焼津市高新田1416,1987,代表取締役 伊藤 貢,37 百万円,,,Error accessing nan: Invalid URL 'nan': No scheme supplied. Perhaps you meant https://nan?,
2024-08-01,株式会社ミタニ,専門店（アパレル・アクセサリー）,求人なし,兵庫県西宮市相生町7-9相生ビル 1Ｆ,1995,代表取締役 三谷 克彦,10 百万円,,,Error accessing nan: Invalid URL 'nan': No scheme supplied. Perhaps you meant https://nan?,
2024-08-01,有限会社ティス,自動車ディーラー,求人なし,大阪府堺市東区草尾580-2,1999,代表取締役 寺本 卓也,3 百万円,,,Error accessing nan: Invalid URL 'nan': No scheme supplied. Perhaps you meant https://nan?,
2024-08-01,株式会社ぷりず夢,専門店・その他小売,求人なし,愛知県春日井市東野町5-1-5,1989,代表取締役 森下 真介,10 百万円,,,Error accessing nan: Invalid URL 'nan': No scheme supplied. Perhaps you meant https://nan?,
2024-08-01,株式会社ルーシー,専門店（アパレル・アクセサリー）,求人なし,大阪府大阪市北区豊崎3-9-7ＩＺＵＭＩビル 5Ｆ,1989,代表取締役 西東 哲二,10 百万円,,,Error accessing nan: Invalid URL 'nan': No scheme supplied. Perhaps you meant https://nan?,
2024-08-01,株式会社エス・コーポレーション,通信販売・ネット販売,求人なし,大阪府大阪市中央区南本町4-5-7,2001,代表取締役 櫻井祥司,10 百万円,,,Error accessing nan: Invalid URL 'nan': No scheme supplied. Perhaps you meant https://nan?,
2024-08-01,株式会社阪神フラワーサポート,専門店・その他小売,求人なし,東京都大田区東海2-2-1大田市場花き棟東側,1990,代表取締役 山本 真司,20 百万円,,,Error accessing nan: Invalid URL 'nan': No scheme supplied. Perhaps you meant https://nan?,
2024-08-01,株式会社マークス,自動車ディーラー,求人なし,北海道函館市西桔梗町838-6,1992,代表取締役 河村隆平,45 百万円,,,Error accessing nan: Invalid URL 'nan': No scheme supplied. Perhaps you meant https://nan?,
2024-08-01,株式会社藤商事,専門店・その他小売,求人なし,宮城県宮城郡利府町菅谷台3-3-1,1994,代表取締役 菊池 千春,10 百万円,,,Error accessing nan: Invalid URL 'nan': No scheme supplied. Perhaps you meant https://nan?,
2024-08-01,株式会社さがみや,食品・GMS・ディスカウントストア,求人なし,栃木県日光市木和田島3025,1987,代表取締役 原田 聡,50 百万円,,,Error accessing nan: Invalid URL 'nan': No scheme supplied. Perhaps you meant https://nan?,
2024-08-01,電波システム販売株式会社,専門店・その他小売,求人なし,茨城県つくば市春日4-1-12第二芳村ビル 3Ｆ,1988,代表取締役 石井 伴邦,31 百万円,,,Error accessing nan: Invalid URL 'nan': No scheme supplied. Perhaps you meant https://nan?,
2024-08-01,リツメー株式会社,通信販売・ネット販売,求人なし,東京都渋谷区恵比寿西1-20-8コンド恵比寿 501,2000,代表取締役 真鍋 代央子,10 百万円,,,Error accessing nan: Invalid URL 'nan': No scheme supplied. Perhaps you meant https://nan?,
2024-08-01,リジェンティス株式会社,通信販売・ネット販売,求人なし,長野県岡谷市川岸西1-4-1,1998,代表取締役 柴 肇一,46 百万円,,,Error accessing nan: Invalid URL 'nan': No scheme supplied. Perhaps you meant https://nan?,
2024-08-01,株式会社ベーネユナイテッド,通信販売・ネット販売,求人なし,山梨県甲府市下鍛冶屋町469-1,1970,代表取締役 寳福秀樹,10 百万円,,,Error accessing nan: Invalid URL 'nan': No scheme supplied. Perhaps you meant https://nan?,
2024-08-01,有限会社ホズミ,コンビニエンスストア,求人なし,神奈川県三浦市三崎町六合278-12,1984,代表取締役 保住 久雄,3 百万円,,,Error accessing nan: Invalid URL 'nan': No scheme supplied. Perhaps you meant https://nan?,
2024-08-01,株式会社永幸マテリアル,専門店・その他小売,求人なし,神奈川県横浜市港北区新横浜3-16-14三協ビル 7Ｆ,2003,代表取締役 飯島 勘太郎,9 百万円,,,Error accessing nan: Invalid URL 'nan': No scheme supplied. Perhaps you meant https://nan?,
2024-08-01,株式会社セレクトプラス,通信販売・ネット販売,求人なし,神奈川県横浜市中区尾上町5-77-2馬車道ウエストビル 6Ｆ Ｃ号,2001,代表取締役 今井 隆,7 百万円,,,Error accessing nan: Invalid URL 'nan': No scheme supplied. Perhaps you meant https://nan?,
2024-08-01,有限会社リューズプラン,通信販売・ネット販売,求人なし,京都府京都市中京区御池通西洞院東入橋之町741-3イトーピア上田御池ビル 401,2003,代表取締役 鶴城 隆成,5 百万円,,,Error accessing nan: Invalid URL 'nan': No scheme supplied. Perhaps you meant https://nan?,
2024-08-01,株式会社アースワークス,食品・GMS・ディスカウントストア,求人なし,岩手県盛岡市仙北2-2-25,1995,代表取締役 荒川 聡,10 百万円,,,Error accessing nan: Invalid URL 'nan': No scheme supplied. Perhaps you meant https://nan?,
2024-08-01,株式会社キャピタルエステート,自動車ディーラー,求人なし,福岡県福岡市南区長丘4-14-13,1990,代表取締役 井内 広太郎,30 百万円,,,Error accessing nan: Invalid URL 'nan': No scheme supplied. Perhaps you meant https://nan?,
2024-08-01,株式会社備後鈑金,自動車ディーラー,求人なし,広島県福山市神辺町大字川南1564-1,1988,代表取締役 小林 秀教,10 百万円,,,Error accessing nan: Invalid URL 'nan': No scheme supplied. Perhaps you meant https://nan?,
2024-08-01,株式会社花のギフト社,通信販売・ネット販売,求人なし,栃木県小山市乙女2-20-23,2000,代表取締役社長 益子 博美,10 百万円,,,Error accessing nan: Invalid URL 'nan': No scheme supplied. Perhaps you meant https://nan?,
2024-08-01,有限会社春日井自動車,専門店・その他小売,求人なし,愛知県春日井市梅ケ坪町2,1966,代表取締役 近藤 丈裕,3 百万円,,,Error accessing nan: Invalid URL 'nan': No scheme supplied. Perhaps you meant https://nan?,
2024-08-01,有限会社金口家具,専門店・その他小売,無,広島県広島市佐伯区八幡5-17-5,1990,,5 百万円,,,Error accessing nan: Invalid URL 'nan': No scheme supplied. Perhaps you meant https://nan?,
2024-08-01,有限会社ツエンテイーナイン,専門店（アパレル・アクセサリー）,求人なし,高知県高知市相模町10-14,1987,代表取締役 西山 学,5 百万円,,,Error accessing nan: Invalid URL 'nan': No scheme supplied. Perhaps you meant https://nan?,
2024-08-01,有限会社岩商,専門店・その他小売,求人なし,福岡県糟屋郡篠栗町大字津波黒394-63,1990,代表取締役 岩坂 洋,58 百万円,,,Error accessing nan: Invalid URL 'nan': No scheme supplied. Perhaps you meant https://nan?,
2024-08-01,株式会社ジャクスタポーズ,専門店・その他小売,求人なし,東京都中央区銀座6-7-16,1978,代表取締役 酒井 美佐夫,10 百万円,,,Error accessing nan: Invalid URL 'nan': No scheme supplied. Perhaps you meant https://nan?,
2024-08-01,熊本合同制服有限会社,専門店（アパレル・アクセサリー）,求人なし,熊本県宇土市本町1-52,2006,取締役 中村 伸拡,3 百万円,,,Error accessing nan: Invalid URL 'nan': No scheme supplied. Perhaps you meant https://nan?,
2024-08-01,株式会社ラザフォードインターナショナル,専門店・その他小売,求人なし,東京都品川区西五反田7-22-17ＴＯＣビル本館 Ｂ1－117,1995,代表取締役 岩﨑 潤,20 百万円,,,Error accessing nan: Invalid URL 'nan': No scheme supplied. Perhaps you meant https://nan?,
2024-08-01,株式会社やしま,専門店（アパレル・アクセサリー）,求人なし,広島県広島市中区国泰寺町1-3-15やしまビル,2001,代表取締役 中須賀 賢一,10 百万円,,,Error accessing nan: Invalid URL 'nan': No scheme supplied. Perhaps you meant https://nan?,
2024-08-01,株式会社醐醍,専門店（アパレル・アクセサリー）,求人なし,兵庫県芦屋市大原町2-6,1989,代表取締役 河原 俊幸,10 百万円,,,Error accessing nan: Invalid URL 'nan': No scheme supplied. Perhaps you meant https://nan?,
2024-08-01,有限会社協栄プランニング,専門店・その他小売,求人なし,愛知県名古屋市天白区原2-508リバーサイドヒルズ 1Ｆ,1999,代表取締役 城戸 達也,3 百万円,,,Error accessing nan: Invalid URL 'nan': No scheme supplied. Perhaps you meant https://nan?,
2024-08-01,株式会社天龍コーポレーション,自動車ディーラー,求人なし,静岡県磐田市小立野528,1968,代表取締役 安達 士朗,15 百万円,,,Error accessing nan: Invalid URL 'nan': No scheme supplied. Perhaps you meant https://nan?,
2024-08-01,株式会社オパールコーポレーション,専門店・その他小売,求人なし,神奈川県横浜市中区伊勢佐木町3-98ニューオデオン 4Ｆ,1994,代表取締役 星野 和義,10 百万円,,,Error accessing nan: Invalid URL 'nan': No scheme supplied. Perhaps you meant https://nan?,
2024-08-01,株式会社惣兵衛,食品・GMS・ディスカウントストア,求人なし,岩手県花巻市山の神578-4,2006,代表取締役 髙橋 さゆり,10 百万円,,,Error accessing nan: Invalid URL 'nan': No scheme supplied. Perhaps you meant https://nan?,
2024-08-01,株式会社ライフニホンギャラリー,専門店・その他小売,求人なし,東京都練馬区関町北1-26-7,1975,代表取締役 三輪 昭,10 百万円,,,Error accessing nan: Invalid URL 'nan': No scheme supplied. Perhaps you meant https://nan?,
2024-08-01,株式会社ＰＥＴＮＥＸＴ,専門店・その他小売,求人なし,東京都中央区勝どき6-3-1,2004,代表取締役 首藤 慶一郎,44 百万円,,,Error accessing nan: Invalid URL 'nan': No scheme supplied. Perhaps you meant https://nan?,
2024-08-01,株式会社フジケン,ホームセンター,求人なし,兵庫県神戸市長田区苅藻島町2-2-22,1953,代表取締役 清水 哲,12 百万円,,,Error accessing nan: Invalid URL 'nan': No scheme supplied. Perhaps you meant https://nan?,
2024-08-01,株式会社花織部,専門店・その他小売,求人なし,熊本県熊本市東区湖東3-5-5,1989,代表取締役 石岡 重人,10 百万円,,,Error accessing nan: Invalid URL 'nan': No scheme supplied. Perhaps you meant https://nan?,
2024-08-01,株式会社ダイナミック・コーポレーション,専門店・その他小売,無,福岡県福岡市南区高宮1-1-10,1996,代表取締役 安陪 雅子,10 百万円,,,Error accessing nan: Invalid URL 'nan': No scheme supplied. Perhaps you meant https://nan?,
2024-08-01,株式会社フォルム,専門店（アパレル・アクセサリー）,求人なし,富山県射水市一条4-5,1999,代表取締役 中村 芳昭,10 百万円,,,Error accessing nan: Invalid URL 'nan': No scheme supplied. Perhaps you meant https://nan?,
