更新日,名称,業界(小分類),求人有無,所在地,設立,代表者,資本金,平均年齢,従業員数,企業URL,事業内容
2024-08-01,株式会社シートレード,自動車ディーラー,求人なし,北海道北見市並木町180-1,2007,代表取締役 丸山 大地,10 百万円,,,Error accessing nan: Invalid URL 'nan': No scheme supplied. Perhaps you meant https://nan?,
2024-08-01,株式会社ストリートライフ,専門店・その他小売,求人なし,宮城県仙台市泉区大沢3-1-2,2014,代表取締役 伊藤 淳哉,5 百万円,,,Error accessing nan: Invalid URL 'nan': No scheme supplied. Perhaps you meant https://nan?,
2024-08-01,株式会社ｂｅａｕｔｙ　ｂｉｒｔｈ　ｃｒｅａｔｅ,専門店・その他小売,求人なし,東京都中央区銀座7-12-4友野本社ビル 8Ｆ,2010,代表取締役 岩月 輝行,,,,Error accessing nan: Invalid URL 'nan': No scheme supplied. Perhaps you meant https://nan?,
2024-08-01,株式会社エコスタイル,自動車ディーラー,無,千葉県千葉市花見川区犢橋町1416-1,2003,代表取締役 小倉 孝真,10 百万円,,,Error accessing nan: Invalid URL 'nan': No scheme supplied. Perhaps you meant https://nan?,情報が古い可能性があります。最新の情報を確認する場合はHP等をご覧ください。 ・全メーカーの新車・中古車販売・全メーカーの車検・整備・板金・塗装・カー用品・自動車部品販売及び取り付け・クレジット業務 2023年4月doda掲載求人より引用
2024-08-01,株式会社恵那川上屋,専門店・その他小売,無,岐阜県恵那市大井町2632-105,2008,代表取締役 鎌田 真悟,80 百万円,,,Error accessing nan: Invalid URL 'nan': No scheme supplied. Perhaps you meant https://nan?,
2024-08-01,京都日産自動車株式会社,自動車ディーラー,求人なし,京都府京都市南区西九条高畠町45,2006,代表取締役 中村 正人,95 百万円,,,Error accessing nan: Invalid URL 'nan': No scheme supplied. Perhaps you meant https://nan?,
2024-08-01,日産神奈川販売株式会社,自動車ディーラー,求人なし,神奈川県横浜市神奈川区東神奈川2-47-7,2006,代表取締役 髙木 恵一,90 百万円,,,Error accessing nan: Invalid URL 'nan': No scheme supplied. Perhaps you meant https://nan?,
2024-08-01,株式会社リピーク,専門店・その他小売,求人なし,東京都品川区上大崎3-1-13,2010,代表取締役 伊集院 弘岳,11 百万円,,,Error accessing nan: Invalid URL 'nan': No scheme supplied. Perhaps you meant https://nan?,
2024-08-01,株式会社ガトーよこはま,食品・GMS・ディスカウントストア,求人なし,神奈川県横浜市神奈川区栄町89-19,1992,代表取締役 小山 正武,44 百万円,,,Error accessing nan: Invalid URL 'nan': No scheme supplied. Perhaps you meant https://nan?,
2024-08-01,有限会社アキヤマ,通信販売・ネット販売,求人なし,京都府福知山市荒河東町90,1972,代表取締役 秋山 保憲,10 百万円,,,Error accessing nan: Invalid URL 'nan': No scheme supplied. Perhaps you meant https://nan?,
2024-08-01,株式会社夢楽染,専門店（アパレル・アクセサリー）,求人なし,京都府京都市中京区六角通室町西入玉蔵町121美濃利ビル 2Ｆ,2010,代表取締役 丸山 伸一,9 百万円,,,Error accessing nan: Invalid URL 'nan': No scheme supplied. Perhaps you meant https://nan?,
2024-08-01,株式会社花のオカダ,専門店・その他小売,求人なし,滋賀県野洲市比留田702,2008,代表取締役 岡田 祥,5 百万円,,,Error accessing nan: Invalid URL 'nan': No scheme supplied. Perhaps you meant https://nan?,
2024-08-01,株式会社ビューフォート,通信販売・ネット販売,求人なし,兵庫県神戸市長田区御蔵通7-43,2001,代表取締役 野村 修一,10 百万円,,,Error accessing nan: Invalid URL 'nan': No scheme supplied. Perhaps you meant https://nan?,
2024-08-01,株式会社アンデ,食品・GMS・ディスカウントストア,無,京都府京都市伏見区下鳥羽北ノ口町58,2010,代表取締役 矢澤 孝樹,7 百万円,,,Error accessing nan: Invalid URL 'nan': No scheme supplied. Perhaps you meant https://nan?,情報が古い可能性があります。最新の情報を確認する場合はHP等をご覧ください。 事業内容：デニッシュ食パン・菓子パン製造、販売 卸・小売店での委託販売京都生まれのデニッシュパン専門店として、こだわりの素材と丁寧な製法をモットーに、デパートの催事やスーパーなど、様々なお客様よりご好評をいただいています。当社の営業職の魅力は、商品企画にも携われること。お客様から頂戴した意見や、販売の現場での感触などをもとに、新たな商品を提案しています！お得意様へ販売する営業職です。 2023年3月doda掲載求人より引用
2024-08-01,株式会社ゼロプラス,専門店・その他小売,求人なし,東京都杉並区清水3-31-9,1999,代表取締役 吉木 謙介,31 百万円,,,Error accessing nan: Invalid URL 'nan': No scheme supplied. Perhaps you meant https://nan?,
2024-08-01,奄美サウスシー＆マベパール株式会社,専門店（アパレル・アクセサリー）,求人なし,鹿児島県大島郡瀬戸内町大字古仁屋字船津26-2,2009,代表取締役 野村 嘉嗣,9 百万円,,,Error accessing nan: Invalid URL 'nan': No scheme supplied. Perhaps you meant https://nan?,
2024-08-01,同志社生活協同組合,専門店・その他小売,求人なし,京都府京都市上京区今出川通烏丸東入玄武町601,1958,代表理事 青木 眞美,,,,Error accessing nan: Invalid URL 'nan': No scheme supplied. Perhaps you meant https://nan?,
2024-08-01,生活協同組合パルシステム群馬,食品・GMS・ディスカウントストア,無,群馬県高崎市中大類町120-11,2002,理事長 反町 幸代,626 百万円,,,Error accessing nan: Invalid URL 'nan': No scheme supplied. Perhaps you meant https://nan?,
2024-08-01,生活協同組合コープ自然派おおさか,通信販売・ネット販売,求人なし,大阪府茨木市島1-12-37,1998,代表理事 西村 明彦,674 百万円,,,Error accessing nan: Invalid URL 'nan': No scheme supplied. Perhaps you meant https://nan?,
2024-08-01,株式会社ＩＺｏｎｅ　Ｊａｐａｎ,専門店（アパレル・アクセサリー）,無,大阪府大阪市阿倍野区阿倍野筋1-5-1あべのルシアス 12Ｆ,2004,代表取締役 内田 賢,10 百万円,,,Error accessing nan: Invalid URL 'nan': No scheme supplied. Perhaps you meant https://nan?,
2024-08-01,日進自動車株式会社,自動車ディーラー,無,島根県松江市東朝日町233-2,1965,代表取締役 岩原 隆,40 百万円,,,Error accessing nan: Invalid URL 'nan': No scheme supplied. Perhaps you meant https://nan?,情報が古い可能性があります。最新の情報を確認する場合はHP等をご覧ください。 ■新車販売（全メーカー取扱い）■残高据え置きローン■マイカーリース■中古車販売（全メーカー取扱い）■車両整備■車検、法定点検■鈑金、塗装■自動車部品販売■自動車損害保険その他 2023年1月doda掲載求人より引用
2024-08-01,株式会社アライジング,コンビニエンスストア,求人なし,愛知県名古屋市中村区椿町1-16,2010,代表取締役 中尾 通夫,2 百万円,,,Error accessing nan: Invalid URL 'nan': No scheme supplied. Perhaps you meant https://nan?,
2024-08-01,株式会社ワイズ,自動車ディーラー,求人なし,愛知県名古屋市中川区中郷5-251,2010,代表取締役 山川 洋平,3 百万円,,,Error accessing nan: Invalid URL 'nan': No scheme supplied. Perhaps you meant https://nan?,
2024-08-01,株式会社リベリヴォーチェ,専門店（アパレル・アクセサリー）,求人なし,京都府京都市中京区西ノ京円町27-1藤和シティホームズ 803,2010,代表取締役 清水 重秀,2 百万円,,,Error accessing nan: Invalid URL 'nan': No scheme supplied. Perhaps you meant https://nan?,
2024-08-01,株式会社ネットショップ総研,通信販売・ネット販売,求人なし,東京都中野区本町1-32-2ハーモニータワー 17Ｆ,2010,代表取締役 藤原 央行,3 百万円,,,Error accessing nan: Invalid URL 'nan': No scheme supplied. Perhaps you meant https://nan?,
2024-08-01,アイランドジャパン株式会社,専門店・その他小売,求人なし,東京都渋谷区神宮前6-12-9ＢＬＯＣＫＨＯＵＳＥ,2010,代表取締役 小野 寺悠（伊藤悠）,5 百万円,,,Error accessing nan: Invalid URL 'nan': No scheme supplied. Perhaps you meant https://nan?,
2024-08-01,フーデリコ株式会社,食品・GMS・ディスカウントストア,求人なし,京都府京都市上京区新烏丸通丸太町上る信富町298,2008,代表取締役 ヴァインマイヤー 文絵,3 百万円,,,Error accessing nan: Invalid URL 'nan': No scheme supplied. Perhaps you meant https://nan?,
2024-08-01,株式会社ウーマンジャパン,通信販売・ネット販売,求人なし,東京都千代田区神田淡路町2-4-4,2010,代表取締役 越野 英一,8 百万円,,,Error accessing nan: Invalid URL 'nan': No scheme supplied. Perhaps you meant https://nan?,
2024-08-01,株式会社築地ばんや,通信販売・ネット販売,求人なし,香川県坂出市林田町4285-323,2010,代表取締役 宮池 厚伸,3 百万円,,,Error accessing nan: Invalid URL 'nan': No scheme supplied. Perhaps you meant https://nan?,
2024-08-01,株式会社すぎうらベーカリー,食品・GMS・ディスカウントストア,求人なし,北海道美唄市字美唄1192-5,2006,代表取締役 杉浦 忍,4 百万円,,,Error accessing nan: Invalid URL 'nan': No scheme supplied. Perhaps you meant https://nan?,
2024-08-01,株式会社徳友,専門店（アパレル・アクセサリー）,求人なし,東京都渋谷区神宮前4-13-10,2009,代表取締役 井田 哲郎,10 百万円,,,Error accessing nan: Invalid URL 'nan': No scheme supplied. Perhaps you meant https://nan?,
2024-08-01,にっしんれん事業所株式会社,通信販売・ネット販売,求人なし,東京都渋谷区代々木5-57-6佐藤代々木ビル,2010,代表取締役 佐藤 太亮,5 百万円,,,Error accessing nan: Invalid URL 'nan': No scheme supplied. Perhaps you meant https://nan?,
2024-08-01,株式会社ブロードエッジ・ファクトリー,食品・GMS・ディスカウントストア,無,東京都渋谷区代官山町20-9,2006,代表取締役 丸岡 栄之,85 百万円,,,Error accessing nan: Invalid URL 'nan': No scheme supplied. Perhaps you meant https://nan?,
2024-08-01,ＯＭＧ株式会社,コンビニエンスストア,無,東京都江東区住吉2-6-16,2010,代表取締役 小川 賢司,3 百万円,,,Error accessing nan: Invalid URL 'nan': No scheme supplied. Perhaps you meant https://nan?,
2024-08-01,株式会社えん,通信販売・ネット販売,求人なし,東京都世田谷区千歳台3-3-16ＨＮ千歳台ビル6Ｆ,2010,代表取締役 中西 健,1 百万円,,,Error accessing nan: Invalid URL 'nan': No scheme supplied. Perhaps you meant https://nan?,
2024-08-01,木村技研販売株式会社,専門店・その他小売,求人なし,東京都世田谷区上用賀4-9-19,2010,代表取締役 木村 朝映,10 百万円,,,Error accessing nan: Invalid URL 'nan': No scheme supplied. Perhaps you meant https://nan?,
2024-08-01,株式会社ＳＨデザインワークス,専門店（アパレル・アクセサリー）,求人なし,大阪府大阪市中央区安土町1-5-7ｅーＦＩＴビル,2010,代表取締役 菅 拓喜,3 百万円,,,Error accessing nan: Invalid URL 'nan': No scheme supplied. Perhaps you meant https://nan?,
2024-08-01,株式会社和クリエイト,食品・GMS・ディスカウントストア,求人なし,東京都港区新橋4-24-3,2010,代表取締役 田口 彰宏,9 百万円,,,Error accessing nan: Invalid URL 'nan': No scheme supplied. Perhaps you meant https://nan?,
2024-08-01,株式会社ラ・ルール,専門店・その他小売,求人なし,東京都港区南青山2-27-28グラン青山 802,2010,代表取締役 元谷 光雄,5 百万円,,,Error accessing nan: Invalid URL 'nan': No scheme supplied. Perhaps you meant https://nan?,
2024-08-01,株式会社モッピーアンドナナ,専門店・その他小売,求人なし,東京都港区芝公園2-6-15黒龍芝公園ビル 1Ｆ,2000,代表取締役 宮崎 修平,75 百万円,,,Error accessing nan: Invalid URL 'nan': No scheme supplied. Perhaps you meant https://nan?,
2024-08-01,株式会社グランドバンクス,自動車ディーラー,求人なし,愛知県春日井市廻間町656-1,1995,代表取締役 青山 峰久,10 百万円,,,Error accessing nan: Invalid URL 'nan': No scheme supplied. Perhaps you meant https://nan?,
2024-08-01,そば道場有限会社,百貨店,求人なし,茨城県常陸大宮市盛金1112,1987,代表取締役 瀧澤 俊輔,10 百万円,,,Error accessing nan: Invalid URL 'nan': No scheme supplied. Perhaps you meant https://nan?,
2024-08-01,株式会社玉光堂,通信販売・ネット販売,無,東京都墨田区石原3-2-3両国鈴木ビル 1Ｆ、3Ｆ、4Ｆ,2002,代表取締役 鈴木 伸也,50 百万円,,,Error accessing nan: Invalid URL 'nan': No scheme supplied. Perhaps you meant https://nan?,
2024-08-01,株式会社ＲＯＳＥ,専門店・その他小売,求人なし,千葉県浦安市日の出1-4Ｅ1104 ベイシティ浦安,2008,代表取締役 小林 光子,9 百万円,,,Error accessing nan: Invalid URL 'nan': No scheme supplied. Perhaps you meant https://nan?,
2024-08-01,ホームファッション株式会社,専門店・その他小売,求人なし,大阪府枚方市茄子作3-35-48,1998,代表取締役 細川 英樹,10 百万円,,,Error accessing nan: Invalid URL 'nan': No scheme supplied. Perhaps you meant https://nan?,
2024-08-01,ステラ漢方株式会社,通信販売・ネット販売,求人なし,福岡県福岡市博多区博多駅前2-17-14ライオンズマンション博多駅前 1001,2010,代表取締役 佐々木 拓道,6 百万円,,,Error accessing nan: Invalid URL 'nan': No scheme supplied. Perhaps you meant https://nan?,
2024-08-01,ジェイケミカル株式会社,専門店・その他小売,求人なし,東京都文京区本郷3-31-1盛和ビル 3Ｆ,2004,代表取締役 石山 啓二郎,36 百万円,,,Error accessing nan: Invalid URL 'nan': No scheme supplied. Perhaps you meant https://nan?,
2024-08-01,株式会社カンパネラ,通信販売・ネット販売,求人なし,福井県坂井市春江町針原20-29,2009,代表取締役 平岡 和彦,10 百万円,,,Error accessing nan: Invalid URL 'nan': No scheme supplied. Perhaps you meant https://nan?,
2024-08-01,株式会社パッション,専門店（アパレル・アクセサリー）,求人なし,東京都千代田区麹町2-14-1麹町ホームズ 6Ｆ,1996,代表取締役 守部 忍,3 百万円,,,Error accessing nan: Invalid URL 'nan': No scheme supplied. Perhaps you meant https://nan?,
2024-08-01,株式会社メロディー,専門店（アパレル・アクセサリー）,無,愛知県名古屋市緑区梅里2-92-6,2010,代表取締役 山田 大也,3 百万円,,,Error accessing nan: Invalid URL 'nan': No scheme supplied. Perhaps you meant https://nan?,情報が古い可能性があります。最新の情報を確認する場合はHP等をご覧ください。 ■自社オリジナル製品「melody」の企画・製造・販売 2022年4月doda掲載求人より引用
2024-08-01,株式会社ＪａｐａｎｅｓｅＣｕｌｔｕｒｅ,専門店・その他小売,求人なし,長野県伊那市平沢8679イ,2010,代表取締役 河野 純之助,10 百万円,,,Error accessing nan: Invalid URL 'nan': No scheme supplied. Perhaps you meant https://nan?,
2024-08-01,ローゼス・ジャパン株式会社,通信販売・ネット販売,求人なし,東京都新宿区新宿4-3-15,2010,代表取締役 沖野 凌也,8 百万円,,,Error accessing nan: Invalid URL 'nan': No scheme supplied. Perhaps you meant https://nan?,
2024-08-01,株式会社コスモ,専門店・その他小売,求人なし,神奈川県横浜市都筑区佐江戸町662,2010,代表取締役 佐藤 陽介,1 百万円,,,Error accessing nan: Invalid URL 'nan': No scheme supplied. Perhaps you meant https://nan?,
2024-08-01,株式会社新生オート飯能,自動車ディーラー,求人なし,埼玉県飯能市大字中居62-2,2004,代表取締役 淺原 直,19 百万円,,,Error accessing nan: Invalid URL 'nan': No scheme supplied. Perhaps you meant https://nan?,
2024-08-01,株式会社総美,専門店・その他小売,求人なし,埼玉県さいたま市岩槻区大字裏慈恩寺230-4,2007,代表取締役 小川 喜功,3 百万円,,,Error accessing nan: Invalid URL 'nan': No scheme supplied. Perhaps you meant https://nan?,
2024-08-01,株式会社エスタイムコーポレーション,自動車ディーラー,無,埼玉県春日部市梅田本町1-2-13,2000,代表取締役 大渕 信嗣,10 百万円,,,Error accessing nan: Invalid URL 'nan': No scheme supplied. Perhaps you meant https://nan?,
2024-08-01,株式会社ハッピースパイラル,通信販売・ネット販売,求人なし,埼玉県久喜市八甫2730-7,2010,代表取締役 吉羽 康祐,1 百万円,,,Error accessing nan: Invalid URL 'nan': No scheme supplied. Perhaps you meant https://nan?,
2024-08-01,株式会社エコトピア,専門店・その他小売,求人なし,埼玉県越谷市大字南荻島1049-6,1996,代表取締役 野見山 哲二,10 百万円,,,Error accessing nan: Invalid URL 'nan': No scheme supplied. Perhaps you meant https://nan?,
2024-08-01,株式会社オートスピリット,自動車ディーラー,無,大阪府守口市大日東町15-11,2007,代表取締役 西垣 文正,9 百万円,,,Error accessing nan: Invalid URL 'nan': No scheme supplied. Perhaps you meant https://nan?,
2024-08-01,株式会社メディアトラスト,自動車ディーラー,求人なし,愛知県名古屋市名東区高針台1-110,2001,代表取締役 鬼頭 宏彰,60 百万円,,,Error accessing nan: Invalid URL 'nan': No scheme supplied. Perhaps you meant https://nan?,
2024-08-01,株式会社イカイトランスポート,専門店・その他小売,求人なし,静岡県沼津市大諏訪867-1,1997,代表取締役 土佐谷 等,20 百万円,,,Error accessing nan: Invalid URL 'nan': No scheme supplied. Perhaps you meant https://nan?,
2024-08-01,有限会社インタープレイ,専門店・その他小売,求人なし,北海道札幌市中央区南二条東2-12-1Ｄ’クラディア大通東 505,2005,代表取締役 佐々木 祐人,,,,Error accessing nan: Invalid URL 'nan': No scheme supplied. Perhaps you meant https://nan?,
2024-08-01,有限会社佃商事,専門店・その他小売,無,東京都町田市原町田3-7-11,1980,代表取締役 渡部 勝利,3 百万円,,,Error accessing nan: Invalid URL 'nan': No scheme supplied. Perhaps you meant https://nan?,
2024-08-01,有限会社Ａ＆ＭＥ,専門店・その他小売,求人なし,大阪府大阪市旭区高殿4-9-17,2006,代表取締役 中野 真由美,3 百万円,,,Error accessing nan: Invalid URL 'nan': No scheme supplied. Perhaps you meant https://nan?,
2024-08-01,株式会社アトレスティル,百貨店,求人なし,東京都千代田区神田佐久間町1-25秋葉原鴻池ビル 8Ｆ,2011,代表取締役 圓井 宏政,98 百万円,,,Error accessing nan: Invalid URL 'nan': No scheme supplied. Perhaps you meant https://nan?,
2024-08-01,株式会社インターズー・クリニッククラブ,通信販売・ネット販売,無,静岡県富士宮市小泉16-2,2007,代表取締役 白石 和浩,15 百万円,,,Error accessing nan: Invalid URL 'nan': No scheme supplied. Perhaps you meant https://nan?,
2024-08-01,株式会社クレフ,専門店・その他小売,無,神奈川県横浜市都筑区池辺町4705,1997,代表取締役 水島 文恭,10 百万円,,,Error accessing nan: Invalid URL 'nan': No scheme supplied. Perhaps you meant https://nan?,
2024-08-01,株式会社クローバーランド,自動車ディーラー,無,埼玉県越谷市花田4-12-9,2006,代表取締役 新戸 薫,10 百万円,,,Error accessing nan: Invalid URL 'nan': No scheme supplied. Perhaps you meant https://nan?,
2024-08-01,株式会社サンドリア札幌,専門店・その他小売,求人なし,北海道札幌市中央区南八条西9-758-14,2010,代表取締役 津田 哲平,,,,Error accessing nan: Invalid URL 'nan': No scheme supplied. Perhaps you meant https://nan?,
2024-08-01,株式会社ネクサス・コーポレーション,コンビニエンスストア,求人なし,神奈川県厚木市愛甲1-10-11愛甲ビル 3Ｆ,2003,代表取締役 上野 泰弘,3 百万円,,,Error accessing nan: Invalid URL 'nan': No scheme supplied. Perhaps you meant https://nan?,
2024-08-01,株式会社ソニックギア,専門店・その他小売,求人なし,高知県高知市春野町西分2678-1,2010,代表取締役 小島 英敬,2 百万円,,,Error accessing nan: Invalid URL 'nan': No scheme supplied. Perhaps you meant https://nan?,
2024-08-01,株式会社プラチナバンク,専門店・その他小売,求人なし,宮城県仙台市宮城野区榴岡2-2-10,2010,代表取締役 髙橋 祐司,8 百万円,,,Error accessing nan: Invalid URL 'nan': No scheme supplied. Perhaps you meant https://nan?,
2024-08-01,株式会社ナイスサポート,専門店・その他小売,無,栃木県宇都宮市双葉2-9-35ニュー双葉マンション1号 1Ｆ,2010,代表取締役 鈴木 雅彦,5 百万円,,,Error accessing nan: Invalid URL 'nan': No scheme supplied. Perhaps you meant https://nan?,情報が古い可能性があります。最新の情報を確認する場合はHP等をご覧ください。 販売促進業 2022年7月doda掲載求人より引用
2024-08-01,株式会社大西新聞舗,専門店・その他小売,求人なし,兵庫県加古川市加古川町木村745-5河本ビル 1Ｆ,2010,代表取締役 大西 毅彦,3 百万円,,,Error accessing nan: Invalid URL 'nan': No scheme supplied. Perhaps you meant https://nan?,
2024-08-01,株式会社エムエスツー,コンビニエンスストア,求人なし,東京都中央区新川1-16-7恒陽サンクレスト茅場町 304,1997,代表取締役 沢田 あゆみ,3 百万円,,,Error accessing nan: Invalid URL 'nan': No scheme supplied. Perhaps you meant https://nan?,
2024-08-01,株式会社あんしん壱番,通信販売・ネット販売,求人なし,大阪府大阪市港区南市岡2-1-21,2010,代表取締役 宮原 啓,5 百万円,,,Error accessing nan: Invalid URL 'nan': No scheme supplied. Perhaps you meant https://nan?,
2024-08-01,株式会社ソルティアーツ,通信販売・ネット販売,求人なし,東京都港区虎ノ門4-3-1城山トラストタワー 31Ｆ,2010,代表取締役 松波 宏紀,9 百万円,,,Error accessing nan: Invalid URL 'nan': No scheme supplied. Perhaps you meant https://nan?,
2024-08-01,株式会社渡辺修繕,専門店・その他小売,求人なし,大阪府吹田市広芝町7-10,2007,代表取締役 渡辺 裕次,1 百万円,,,Error accessing nan: Invalid URL 'nan': No scheme supplied. Perhaps you meant https://nan?,
2024-08-01,株式会社レティシアン,通信販売・ネット販売,無,東京都中央区京橋2-2-1京橋エドグラン 20Ｆ,2007,代表取締役 四方 祥樹,1 百万円,,,Error accessing nan: Invalid URL 'nan': No scheme supplied. Perhaps you meant https://nan?,プレミアムペットフードを中心としたペット関連商品の輸入・通信販売事業その他、コーヒーや化粧品の販売事業＜関連会社＞■株式会社オーダーチーズフランスやイタリアなど世界のナチュラルチーズや各種高級食材の輸入・販売ECサイト「世界のチーズ専門店 オーダーチーズ」の運営不動産事業■株式会社アルディスヴィンテージワインの輸入・通信販売事業ECサイト「オールドビンテージ・ドットコム」の運営 2024年2月doda掲載求人より引用
2024-08-01,株式会社ボンズコネクト,通信販売・ネット販売,無,大阪府大阪市中央区農人橋1-1-7谷町エクセルビル 3Ｆ,2007,代表取締役 谷田 敏男,5 百万円,,,Error accessing nan: Invalid URL 'nan': No scheme supplied. Perhaps you meant https://nan?,
2024-08-01,株式会社桃樹・コーポレーション,食品・GMS・ディスカウントストア,求人なし,東京都江戸川区西葛西2-17-13ポーターハイツ 101,1946,代表取締役 礒田 紀子,11 百万円,,,Error accessing nan: Invalid URL 'nan': No scheme supplied. Perhaps you meant https://nan?,
2024-08-01,株式会社ヤローズ,専門店・その他小売,求人なし,千葉県流山市東初石2-78-1ダイアパレスコータ・コート 438,2003,代表取締役 玄 柄哲,10 百万円,,,Error accessing nan: Invalid URL 'nan': No scheme supplied. Perhaps you meant https://nan?,
2024-08-01,株式会社Ｍｏｎｇ　Ｔｅｎｇ,食品・GMS・ディスカウントストア,求人なし,千葉県千葉市美浜区打瀬2-8パティオス14番街 222,2010,代表取締役 国井 孝嗣,13 百万円,,,Error accessing nan: Invalid URL 'nan': No scheme supplied. Perhaps you meant https://nan?,
2024-08-01,株式会社ホンダカーズ長野東,自動車ディーラー,求人なし,長野県長野市大字北尾張部732,2010,代表取締役 五代 洋史,150 百万円,,,Error accessing nan: Invalid URL 'nan': No scheme supplied. Perhaps you meant https://nan?,
